job_posting_url,vacancies,job_posting_number,salary,start_publication_date,end_publication_date,required_experience,educational_background,specialization,required_knowledge,skills,job_title,public_institution,ubication
https://sistemas.oefa.gob.pe/oefa-convocatoria-web/,1,D.Leg 1057 - Determinado (Necesidad Transitoria)-044,"S/. 8,000.00",10/03/2025,21/03/2025,"EXPERIENCIA GENERAL NO MENOR DE CUATRO (4) AÑOS EN EL SECTOR PÚBLICO Y/O PRIVADO.
EXPERIENCIA ESPECÍFICA NO MENOR DE TRES (3) AÑOS, EN EL NIVEL DE PUESTO DE ESPECIALISTA O EQUIVALENTES, EN FUNCIONES AFINES AL PUESTO A DESEMPEÑAR.","TÍTULO UNIVERSITARIO EN INGENIERÍA DE PETRÓLEO, INGENIERÍA PESQUERA, INGENIERÍA QUÍMICA, INGENIERÍA AMBIENTAL, BIÓLOGÍA O CARRERAS AFINES COLEGIATURA Y HABILITACIÓN PROFESIONAL VIGENTE","PROGRAMA DE ESPECIALIZACIÓN EN FISCALIZACIÓN AMBIENTAL Y/O EVALUACIÓN DE IMPACTO AMBIENTAL Y/O GESTIÓN AMBIENTAL Y/O MONITOREO AMBIENTAL, EVALUACIÓN AMBIENTAL Y/O SUPERVISIÓN AMBIENTAL Y/O AFINES A LAS COMPETENCIAS DE LA ENTIDAD.","PROCESADOR DE TEXTOS (WORD, OPEN OFFICE WRITE, ETC) A NIVEL BÁSICO. HOJA DE CÁLCULO (EXCEL, OPECALC, ETC) A NIVEL BÁSICO PROGRAMA DE PRESENTACIONES (POWER POINT, PREZI, ETC) A NIVEL BÁSICO","COMPETENCIAS: TRABAJO EN EQUIPO, VOCACIÓN DE SERVICIO, ORIENTACIÓN A RESULTADOS. HABILIDADES: ADAPTABILIDAD, ANÁLISIS Y PLANIFICACIÓN.",ESPECIALISTA AMBIENTAL,Organismo De Evaluacion Y Fiscalizacion Ambiental - Oefa,LAMBAYEQUE - CHICLAYO
https://portal.indeci.gob.pe/oportunidades/,1,D.Leg 1057 - Determinado (Necesidad Transitoria)-051,"S/. 3,000.00",10/03/2025,21/03/2025,"•	EXPERIENCIA LABORAL GENERAL 
EXPERIENCIA GENERAL NO MENOR DE UN (01) AÑO EN EL SECTOR PÚBLICO Y/O PRIVADO.
•	EXPERIENCIA LABORAL ESPECIFICA
UN (01) AÑO DE EXPERIENCIA EN LA FUNCIÓN O MATERIA. 
UN (01) AÑO DE EXPERIENCIA EN EL NIVEL MÍNIMO DE PUESTO COMO AUXILIAR Y/O SU EQUIVALENTE.",•	SECUNDARIA COMPLETA,•	CURSO EN GESTIÓN DE ALMACENES Y/O GESTIÓN DE ABASTECIMIENTO,"•	CONOCIMIENTOS EN ALMACÉN •	CONOCIMIENTO EN OFIMÁTICA (WORD, EXCEL Y/O POWERPOINT) A NIVEL BÁSICO",COMPETENCIA COGNOSCITIVA O INTELECTUAL •	COMPETENCIA PROFESIONAL •	PLANEAMIENTO COMPETENCIA DE EFICACIA PERSONAL.  •	RELACIONES DE TRABAJO •	COMUNICACIÓN. COMPETENCIA DE LOGRO Y ACCIÓN •	INICIATIVA,ALMACENERO,Instituto Nacional De Defensa Civil,LAMBAYEQUE - CHICLAYO
https://www.naylamp.gob.pe/convocatoriacasue.php,1,D.Leg 1057 - Determinado (Suplencia)-6,"S/. 6,264.17",07/03/2025,20/03/2025,"EXPERIENCIA GENERAL DE TRES (03) AÑOS EN EL SECTOR PÚBLICO Y/O PRIVADO, CON UNA EXPERIENCIA ESPECÍFICA DE DOS (02) AÑOS DE EXPERIENCIA EN LA FUNCIÓN Y/O MATERIA EN EL SECTOR PÚBLICO O PRIVADO COMO ESPECIALISTA, SUPERVISOR/COORDINADOR, JEFE DE ÁREA O DEPARTAMENTO, GERENTE O  DIRECTOR DE LOS CUALES SE REQUIERE EXPERIENCIA EN EL SECTOR PÚBLICO DE UN (01) AÑO  EN LA FUNCIÓN Y/O MATERIA.","TITULADO EN LAS CARRERAS DE ARQUITECTURA, INGENIERÍA CIVIL,  INGENIERÍA AGRÍCOLA, ARQUEOLOGÍA O CARRERAS AFINES POR LA  FORMACIÓN. COLEGIADO Y HABILITADO. ADJUNTAR DOCUMENTOS","PROGRAMA DE ESPECIALIZACIÓN EN PROYECTOS DE INVERSIÓN  PÚBLICA U OTROS SIMILARES (MÍNIMO 90 HORAS ACUMULADAS, O DE  CORRESPONDER CUANDO ES DICTADO POR UN ENTE RECTOR, MÍNIMO  80 HORAS ACUMULADAS) . CURSO EN AUTOCAD O PRESUPUESTO S10 O SIMILAR (MÍNIMO 12  HORAS ACUMULADAS)","CONOCIMIENTOS EN PROYECTOS DE INVERSIÓN, Y/O SUPERVISIÓN  Y/O RESIDENCIA DE OBRAS.  CONOCIMIENTOS EN LIQUIDACIÓN Y/O VALORIZACIONES DE OBRAS.",ORIENTACIÓN A RESULTADOS.  TRABAJO EN EQUIPO. PLANIFICACIÓN Y ORGANIZACIÓN.  VOCACIÓN DE SERVICIO.,ESPECIALISTA ESTUDIOS Y PROYECTOS,Unidad Ejecutora 005 Naylamp-Lambayeque,LAMBAYEQUE - CHICLAYO
https://www.gob.pe/institucion/regionlambayeque-gre/campa%c3%b1as/96943-convocatoria-para-la-contratacion-de-personal-administrativo-en-iest-iesp-eesp,1,276-1,"S/. 1,166.00",06/03/2025,19/03/2025,"EXPERIENCIA GENERAL : MINIMO 2 AÑOS 

EXPERIENCIA ESPECIFICA: MINIMO 1 AÑO EN EL PUESTO SIMILAR EN EL SECTOR PUBLICO O PRIVADO.",NIVEL EDUCATIVO SUPERIOR : BÁSICO REGULAR  GRADO / SITUACIÓN ACADÉMICA : SECUNDARIA COMPLETA,"CAPACITACIÓN MÍNIMA , EN LOS ULTIMOS 10 AÑOS, DE 10 HORAS RELACIONADAS A LAS FUNCIONES A DESEMPEÑAR","A) RECIBIR Y DISTRIBUIR DOCUMENTOS Y MATERIALES EN GENERAL, TRASLADAR Y ACOMODAR MUEBLES, EMPACAR MERCADERÍA Y OTROS B) APOYAR EN EL TRASLADO DE BIENES O DOCUMENTACIÓN DENTRO D ELA INSTITUCIÓN Y LAS UNIDADES ORGÁNICAS C) REALIZAR FUNCIONES DE APOYO ADMINISTRATIVO, EN COORDINACIÓN CON LA SECRETARÍA DE LA DEPENDENCIA, PARA AGILIZAR EL TRÁMITE DOCUMENTARIO  D)  OTRAS FUNCIONES ASIGNADAS POR SU JEFE INMEDIATO, DE ACUERDO AL AMBITO DE SU COMPETENCIA.","TRABAJO EN EQUIPO , VOCACIÓN DE SERVICIO , COMPROMISO, INICIATIVA , SER ÉTICO, PROACTIVO EN EL DESARROLLO DE ACTIVIDADES DEL GRUPO OCUPACIONAL Y COMUNICATIVO",TRABAJADOR DE SERVICIO,Unidad Ejecutora 304 - Gerencia Regional De Educacion Lambayeque,LAMBAYEQUE - FERREÑAFE
https://www.gob.pe/institucion/regionlambayeque-gre/campa%c3%b1as/96943-convocatoria-para-la-contratacion-de-personal-administrativo-en-iest-iesp-eesp,1,276-1,"S/. 1,203.00",06/03/2025,19/03/2025,"EXPERIENCIA GENERAL : MINIMO 2 AÑOS 

EXPERIENCIA ESPECIFICA: MINIMO 1 AÑO EN EL PUESTO SIMILAR EN EL SECTOR PUBLICO O PRIVADO.",NIVEL EDUCATIVO SUPERIOR : SUPERIOR NO UNIVERSITARIO GRADO / SITUACIÓN ACADÉMICA :TITULO TÉCNICO EN UN ARÉA DE GESTIÓN  ADMINISTRATIVO,NIVEL EDUCATIVO SUPERIOR : SUPERIOR NO UNIVERSITARIO GRADO / SITUACIÓN ACADÉMICA :TITULO TÉCNICO EN UN ARÉA DE GESTIÓN  ADMINISTRATIVO,"A) EJECUTAR ACTIVIDADES DE RECEPCIÓN , CLASIFICACIÓN,  REGISTRO, DISTRIBUCIÓN Y ARCHIVO DE DOCUMENTOS TÉCNICOS  B) EJECUTAR Y VERIFICAR LA ACTUALIZACIÓN DE REGISTROS , FICHAS Y DOCUMENTOS TÉCNICOS EN EL SISTEMA ADMINISTRATIVO DE SU COMPETENCIA C) COORDINAR ACTIVIDADES ADMINISTRATIVAS DE SU COMPETENCIA   D) ESTUDIAR EXPEDIENTES TÉCNICOS SENCILLOS Y EMITIR INFORMES PRELIMINARES . E)  RECOPILAR Y PREPARAR INFORMACIÓN PARA ESTUDIOS E INVESTIGACIONES. F) COLABORAR EL LA PROGRAMACIÓN DE ACTIVIDADES TÉCNICO ADMINISTRATIVAS Y EN REUNIONES DE TRABAJO. G) APOYAR EN ACCIONES DE COMUNICACIÓN , INFORMACION Y RELACIONES PÚBLICAS H) OTRAS FUNCIONES ASIGNADAS POR SU JEFE INMEDIATO, DE ACUERDO AL AMBITO DE SU COMPETENCIA.","TRABAJO EN EQUIPO , VOCACIÓN DE SERVICIO , COMPROMISO, INICIATIVA.SER ÉTICO Y COMUNICATIVO",TECNICO ADMINISTRATIVO I,Unidad Ejecutora 304 - Gerencia Regional De Educacion Lambayeque,LAMBAYEQUE - FERREÑAFE
https://www.gob.pe/institucion/regionlambayeque-gre/campa%c3%b1as/96943-convocatoria-para-la-contratacion-de-personal-administrativo-en-iest-iesp-eesp,1,276-1,"S/. 1,203.00",06/03/2025,19/03/2025,"EXPERIENCIA GENERAL : MINIMO 2 AÑOS 

EXPERIENCIA ESPECIFICA: MINIMO 1 AÑO EN EL PUESTO SIMILAR EN EL SECTOR PUBLICO O PRIVADO.",NIVEL EDUCATIVO SUPERIOR : SUPERIOR NO UNIVERSITARIO GRADO / SITUACIÓN ACADÉMICA :TITULO TÉCNICO EN UN ARÉA DE GESTIÓN  ADMINISTRATIVO,NIVEL EDUCATIVO SUPERIOR : SUPERIOR NO UNIVERSITARIO GRADO / SITUACIÓN ACADÉMICA :TITULO TÉCNICO EN UN ARÉA DE GESTIÓN  ADMINISTRATIVO,"A) EJECUTAR ACTIVIDADES DE RECEPCIÓN , CLASIFICACIÓN,  REGISTRO, DISTRIBUCIÓN Y ARCHIVO DE DOCUMENTOS TÉCNICOS  B) EJECUTAR Y VERIFICAR LA ACTUALIZACIÓN DE REGISTROS , FICHAS Y DOCUMENTOS TÉCNICOS EN EL SISTEMA ADMINISTRATIVO DE SU COMPETENCIA C) COORDINAR ACTIVIDADES ADMINISTRATIVAS DE SU COMPETENCIA   D) ESTUDIAR EXPEDIENTES TÉCNICOS SENCILLOS Y EMITIR INFORMES PRELIMINARES . E)  RECOPILAR Y PREPARAR INFORMACIÓN PARA ESTUDIOS E INVESTIGACIONES. F) COLABORAR EL LA PROGRAMACIÓN DE ACTIVIDADES TÉCNICO ADMINISTRATIVAS Y EN REUNIONES DE TRABAJO. G) APOYAR EN ACCIONES DE COMUNICACIÓN , INFORMACION Y RELACIONES PÚBLICAS H) OTRAS FUNCIONES ASIGNADAS POR SU JEFE INMEDIATO, DE ACUERDO AL AMBITO DE SU COMPETENCIA.","TRABAJO EN EQUIPO , VOCACIÓN DE SERVICIO , COMPROMISO, INICIATIVA.SER ÉTICO Y COMUNICATIVO",TECNICO ADMINISTRATIVO I,Unidad Ejecutora 304 - Gerencia Regional De Educacion Lambayeque,LAMBAYEQUE - JOSE LEONARDO ORTIZ
https://www.gob.pe/institucion/regionlambayeque-gre/campa%c3%b1as/96943-convocatoria-para-la-contratacion-de-personal-administrativo-en-iest-iesp-eesp,1,276-1,"S/. 1,203.00",06/03/2025,19/03/2025,"EXPERIENCIA GENERAL : MINIMO 2 AÑOS 

EXPERIENCIA ESPECIFICA: MINIMO 1 AÑO EN EL PUESTO SIMILAR EN EL SECTOR PUBLICO O PRIVADO.","NIVEL EDUCATIVO SUPERIOR : SUPERIOR NO UNIVERSITARIO O CETPRO/TITULO EN SECRETARIADO EJECUTIVO, SECRETARIADO DE GERENCIA O SISTENTE DE GERENCIA","CAPACITACIÓN MÍNIMA , EN LOS ULTIMOS 05 AÑOS, DE 10 HORAS RELACIONADAS A LAS FUNCIONES A DESEMPEÑAR","A)	RECEPCIONAR ,CLASIFICAR, DERIVAR Y ARCHIVAR SEGÚN SEA EL CASO, DE TODA DOCUMENTACIÓN TRAMITADA A LA UNIDAD. B)	REDACTAR DOCUMENTOS DE ACUERDO A INSTRUCCIONES ESPECIFICAS C)	VELAR POR LA SEGURIDAD Y CONSERVACIÓN DE DOCUMENTOS FÍSICOS  D)	ORIENTAR AL PÚBLICO EN GENERAL SOBRE GESTIONES A REALIZAR EN LA UNIDAD O INSTITUCIÓN E)	OTRAS FUNCIONES ASIGNADAS POR SU JEFE INMEDIATO, DE ACUERDO AL ÁMBITO DE SUS COMPETENCIAS","TRABAJO EN EQUIPO , VOCACIÓN DE SERVICIO , COMPROMISO, INICIATIVA.SER ÉTICO Y COMUNICATIVO",SECRETARIA,Unidad Ejecutora 304 - Gerencia Regional De Educacion Lambayeque,LAMBAYEQUE - LAMBAYEQUE
https://www.regionlambayeque.gob.pe/,1,D.Leg 1057 - Determinado (Necesidad Transitoria)-15,"S/. 1,414.19",06/03/2025,19/03/2025,"EXPERIENCIA GENERAL: 02 AÑOS YA SEA EN EL SECTOR PÚBLICO O PRIVADO. 
EXPERIENCIA ESPECÍFICA: 01 AÑO EN LABORES DE SEGURIDAD Y VIGILANCIA.EN LA FUNCIÓN O LA MATERIA.",SECUNDARIA COMPLETA,DE PREFERENCIA FORMACIÓN EN MEDIDAS DE SEGURIDAD Y/O RESGUARDO,CONOCIMIENTO DE PLANES DE CONTINGENCIA EN SITUACIONES DE EMERGENCIA. CONOCIMIENTO SOBRE ACCIONES DE SEGURIDAD. CONOCIMIENTOS SOBRE EL FUNCIONAMIENTO DE LAS IIEE JEC.,"ORDEN, CONTROL/AUTOCONTROL, ANÁLISIS, FUERZA FÍSICA.",PERSONAL DE VIGILANCIA JEC,Ugel Lambayeque,LAMBAYEQUE - LAMBAYEQUE
https://www.migraciones.gob.pe/oportunidades_laborales_2025/,1,D.Leg 1057 - Determinado (Necesidad Transitoria)-090,"S/. 2,000.00",06/03/2025,19/03/2025,"""• EXPERIENCIA GENERAL: MÍNIMA DE DOS (02) AÑOS EN EL SECTOR PÚBLICO Y/O PRIVADO.
• EXPERIENCIA ESPECÍFICA: UN (01) AÑO EN PUESTO Y/O FUNCIONES Y/O LABORANDO EN ÁREAS DE ATENCIÓN AL PÚBLICO U ORIENTACIÓN AL CIUDADANO O MESA DE PARTES.""","""EGRESADO TÉCNICO PROFESIONAL (CARRERA TÉCNICO PROFESIONAL DE 3 AÑOS) EN SECRETARIADO, COMPUTACIÓN E INFORMÁTICA, CONTABILIDAD, ADMINISTRACIÓN, MARKETING, CIENCIAS DE LA COMUNICACIÓN O TURISMO; O, EGRESADO UNIVERSITARIO EN LAS CARRERAS DE INGENIERÍA INDUSTRIAL, INGENIERÍA DE SISTEMAS, CONTABILIDAD, ADMINISTRACIÓN, MARKETING, ECONOMÍA, DERECHO, CIENCIAS DE LA COMUNICACIÓN O TURISMO.""",NO APLICA,"""- ATENCIÓN AL USUARIO O ATENCIÓN AL CLIENTE. - OFIMÁTICA A NIVEL BÁSICO. - INGLÉS NIVEL BÁSICO""","ATENCIÓN, EMPATÍA, AUTOCONTROL Y COMUNICACIÓN ORAL.",ASISTENTE(A) DE REGISTRO,Superintendencia Nacional De Migraciones - Migraciones,LAMBAYEQUE - CHICLAYO
https://www.gob.pe/institucion/regionlambayeque-gre/campa%c3%b1as/96943-convocatoria-para-la-contratacion-de-personal-administrativo-en-iest-iesp-eesp,1,276-1,"S/. 1,203.00",06/03/2025,19/03/2025,"EXPERIENCIA GENERAL : MINIMO 2 AÑOS 

EXPERIENCIA ESPECIFICA: MINIMO 1 AÑO EN EL PUESTO SIMILAR EN EL SECTOR PUBLICO O PRIVADO.",NIVEL EDUCATIVO SUPERIOR : SUPERIOR UNIVERSITARIO Y/O NO UNIVERSITARIO GRADO / SITUACIÓN ACADÉMICA :TITULO ADMINISTRADOR O TÉCNICO EN ADMINISTRACIÓN.,"CAPACITACIÓN MÍNIMA , EN LOS ULTIMOS 10 AÑOS, DE 10 HORAS RELACIONADAS A LAS FUNCIONES A DESEMPEÑAR","A) CAPACIDAD DE COORDINACIÓN, ORGANIZACIÓN Y CONTROL DE LOS RECURSOS ASIGNADOS. B) PRESTAR ASISTENCIA EN LA PREPARACIÓN DE PRESUPUESTO, LA SUPERVISIÓN DE LOS GASTOS , LA REDACIÓN D ECONTRATOS Y DE ÓRDENES DE COMPRA O ADQUISICIÓN  C) SUPERVISAR LA LABOR DE LOS EMPEADOS DE APOYO ADMINISTRATIVO","TRABAJO EN EQUIPO , VOCACIÓN DE SERVICIO , COMPROMISO, INICIATIVA.SER ÉTICO Y COMUNICATIVO",TECNICO EN LABORATORIO,Unidad Ejecutora 304 - Gerencia Regional De Educacion Lambayeque,LAMBAYEQUE - JOSE LEONARDO ORTIZ
https://www.gob.pe/institucion/regionlambayeque-gre/campa%c3%b1as/96943-convocatoria-para-la-contratacion-de-personal-administrativo-en-iest-iesp-eesp,1,276-1,"S/. 1,203.00",06/03/2025,19/03/2025,"EXPERIENCIA GENERAL : MINIMO 2 AÑOS 

EXPERIENCIA ESPECIFICA: MINIMO 1 AÑO EN EL PUESTO SIMILAR EN EL SECTOR PUBLICO O PRIVADO.",NIVEL EDUCATIVO SUPERIOR : SUPERIOR UNIVERSITARIO Y/O NO UNIVERSITARIO GRADO / SITUACIÓN ACADÉMICA :TITULO INGENIERO DE SISTEMA O TÉCNICO EN MANEJO DE SISTEMA,"CAPACITACIÓN MÍNIMA , EN LOS ULTIMOS 10 AÑOS, DE 10 HORAS RELACIONADAS A LAS FUNCIONES A DESEMPEÑAR","A) RESPONSABLE DE INSTALAR Y CONFIGURAR EQUIPOS (HARDWARE Y SOFTWARE), YA SEAN INFORMÁTICOS O DE TELECOMUNICACIONES E INTEGRARLOS EN UN SITEMA DE REDES  B) APOYAR EN LA INSTALACIÓN DEL SISTEMA COMPLETO, CON TODOS SUS COMPONENTES  (ORDENADORES , PERIFÉRICOS , SERVIDORES, ETC)","TRABAJO EN EQUIPO , VOCACIÓN DE SERVICIO , COMPROMISO, INICIATIVA.SER ÉTICO Y COMUNICATIVO",TECNICO ADMINISTRATIVO I,Unidad Ejecutora 304 - Gerencia Regional De Educacion Lambayeque,LAMBAYEQUE - FERREÑAFE
https://www.gob.pe/institucion/regionlambayeque-gre/campa%c3%b1as/96943-convocatoria-para-la-contratacion-de-personal-administrativo-en-iest-iesp-eesp,1,276-1,"S/. 1,203.00",06/03/2025,19/03/2025,"EXPERIENCIA GENERAL : MINIMO 2 AÑOS 

EXPERIENCIA ESPECIFICA: MINIMO 1 AÑO EN EL PUESTO SIMILAR EN EL SECTOR PUBLICO O PRIVADO.",NIVEL EDUCATIVO SUPERIOR : SUPERIOR UNIVERSITARIO Y/O NO UNIVERSITARIO GRADO / SITUACIÓN ACADÉMICA :TITULO INGENIERO DE SISTEMA O TÉCNICO EN MANEJO DE SISTEMA,"CAPACITACIÓN MÍNIMA , EN LOS ULTIMOS 10 AÑOS, DE 10 HORAS RELACIONADAS A LAS FUNCIONES A DESEMPEÑAR","A) RESPONSABLE DE INSTALAR Y CONFIGURAR EQUIPOS (HARDWARE Y SOFTWARE), YA SEAN INFORMÁTICOS O DE TELECOMUNICACIONES E INTEGRARLOS EN UN SITEMA DE REDES  B) APOYAR EN LA INSTALACIÓN DEL SISTEMA COMPLETO, CON TODOS SUS COMPONENTES  (ORDENADORES , PERIFÉRICOS , SERVIDORES, ETC)","TRABAJO EN EQUIPO , VOCACIÓN DE SERVICIO , COMPROMISO, INICIATIVA.SER ÉTICO Y COMUNICATIVO",TECNICO ADMINISTRATIVO I,Unidad Ejecutora 304 - Gerencia Regional De Educacion Lambayeque,LAMBAYEQUE - JOSE LEONARDO ORTIZ
https://app-grh.saludpol.gob.pe:32097/convocatorias/principal,1,D.Leg 1057 - Determinado (Necesidad Transitoria)-019,"S/. 7,000.00",05/03/2025,18/03/2025,"-	EXPERIENCIA GENERAL MÍNIMA DE TRES (03) AÑOS.
-	EXPERIENCIA ESPECIFICA REQUERIDA DE UN (01) AÑO EN LA FUNCIÓN O MATERIA.
-	EXPERIENCIA ESPECIFICA REQUERIDA DE UN (01) AÑO COMO ANALISTA O ASISTENTE.","BACHILLER UNIVERSITARIO EN CIENCIAS ADMINISTRATIVAS, CIENCIAS SOCIALES, CIENCIAS DE LA SALUD Y/O AFINES.","-  DIPLOMADO Y/O ESPECIALIZACIÓN Y/O CURSOS EN ADMINISTRACIÓN DE PROYECTOS, PROCESOS Y/O AFINES","- CONOCIMIENTOS EN NORMAS ISO 9001, 14001, 37001, 27001, 45001, ADMINISTRACION Y/O PROCESOS . - PROCESADOR DE TEXTOS (BÁSICO), HOJAS DE CÁLCULO (BÁSICO), PROGRAMA DE PRESENTACIONES (BÁSICO).","TRABAJO EN EQUIPO, VOCACIÓN DE SERVICIO, PROACTIVIDAD, CONFIDENCIALIDAD.",ANALISTA DE LA UNIDAD TERRITORIAL DE LAMBAYEQUE,Fondo De Salud Para La Policia Nacional,LAMBAYEQUE - CHICLAYO
https://www.gob.pe/institucion/regionlambayeque-gre/campa%c3%b1as/96188-implementacion-de-acciones-e-intervenciones-pedagogicas-gred-lambayeque,1,D.Leg 1057 - Determinado (Necesidad Transitoria)-1,"S/. 4,064.19",03/03/2025,14/03/2025,"GENERAL: EXPERIENCIA PROFESIONAL ACREDITADA EN EL EJERCICIO DE SU PROFESIÓN EN EL SECTOR PÚBLICO Y/O PRIVADO DE CUATRO (4) AÑOS CONTADOS A PARTIR DE LA OBTENCIÓN DE BACHILLERATO. 
ESPECÍFICA: DOS (02) AÑOS DE EXPERIENCIA REQUERIDA PARA EL PUESTO EN LA FUNCIÓN O LA MATERIA). (DE LOS CUALES UN AÑO (1) DE EXPERIENCIA EN EL SECTOR PÚBLICO).EL NIVEL MÍNIMO DE PUESTO QUE SE REQUIERE COMO EXPERIENCIA; YA SEA EN EL SECTOR PÚBLICO O PRIVADO: ESPECIALISTA",LICENCIADO EN PSICOLOGÍA O TRABAJO SOCIAL,"¿	CURSOS RELACIONADOS A: GESTIÓN O PROMOCIÓN DE LA CONVI-VENCIA ESCOLAR Y/O TUTORÍA Y ORIENTACIÓN EDUCATIVA; O PRO-TECCIÓN Y DERECHOS DE NIÑOS, NIÑAS Y ADOLESCENTES O ATENCIÓN DE LA VIOLENCIA; O DISEÑO, GESTIÓN O MONITOREO DE PROYECTOS EDUCATIVOS, SOCIALES O COMUNITARIOS ¿	HOJA DE CÁLCULO NIVEL BÁSICO (EXCEL, OPEN CALC, ETC.)  ¿	PROCESADOR DE TEXTOS NIVEL BÁSICO (WORD; OPEN OFFICE, WRITE, ETC.) ¿	PROGRAMA DE PRESENTACIONES NIVEL BÁSICO (POWER POINT, PREZI, ETC.)","¿	GESTIÓN DE LA CONVIVENCIA ESCOLAR, PAUTAS PARA LA PREVEN-CIÓN Y ATENCIÓN DE LA VIOLENCIA EN LAS INSTITUCIONES EDUCA-TIVAS.","•	EMPATÍA, ANÁLISIS, COMUNICACIÓN ORAL, ORGANIZACIÓN DE LA INFORMACIÓN.",ESPECIALISTA DE CONVIVENCIA ESCOLAR REGIONAL,Unidad Ejecutora 304 - Gerencia Regional De Educacion Lambayeque,LAMBAYEQUE - CHICLAYO
https://www.gob.pe/institucion/regionlambayeque-gre/campa%c3%b1as/96188-implementacion-de-acciones-e-intervenciones-pedagogicas-gred-lambayeque,1,D.Leg 1057 - Determinado (Necesidad Transitoria)-3,"S/. 4,764.19",03/03/2025,14/03/2025,"GENERAL: EXPERIENCIA PROFESIONAL ACREDITADA EN EL EJERCICIO DE SU PROFESIÓN EN EL SECTOR PÚBLICO Y/O PRIVADO DE TRES (3) AÑOS CONTADOS A PARTIR DE LA OBTENCIÓN DEL BACHILLERATO.
ESPECÍFICA: DOS (02) AÑOS DE EXPERIENCIA EN SUPERVISIÓN Y/O PROCEDIMIENTOS ADMINISTRATIVOS Y/O DE PROCEDIMIENTOS ADMINISTRATIVOS SANCIONA-DORES. (DE LOS CUALES UN AÑO (1) DE EXPERIENCIA EN EL SECTOR PÚBLI-CO).
EL NIVEL MÍNIMO DE PUESTO QUE SE REQUIERE COMO EXPERIENCIA; YA SEA EN EL SECTOR PÚBLICO O PRIVADO: ANALISTA.",TITULADO/LICENCIADO EN DERECHO,"¿	DIPLOMADO Y/O CURSO O SIMILARES EN DERECHO ADMINISTRATI-VO Y/O DE PROCEDIMIENTO ADMINISTRATIVO SANCIONADOR. ¿	PROCESADOR DE TEXTOS NIVEL BÁSICO (WORD; OPEN OFFICE, WRITE, ETC) ¿	PROGRAMA DE PRESENTACIONES NIVEL BÁSICO (POWER POINT, PREZI, ETC). ¿	HOJAS DE CÁLCULO NIVEL BÁSICO (EXCEL, OPENCALC, ETC).","¿	CONOCIMIENTO DE LA LEY N° 28044, LEY GENERAL DE EDUCA-CIÓN; LEY N° 26549, LEY DE LOS CENTROS EDUCATIVOS PRIVA-DOS; Y OTRAS NORMAS APLICABLES A INSTITUCIONES EDUCATIVAS PRIVADAS DE EDUCACIÓN BÁSICA.  ¿	CONOCIMIENTO DE LA LEY N° 27444, LEY DEL PROCEDIMIENTO ADMINISTRATIVO GENERAL.  ¿	MONITOREO Y/O SEGUIMIENTO Y/O ARTICULACIÓN Y/O ASISTENCIA TÉCNICA RELACIONADOS A INICIATIVAS Y/O PROYECTOS Y/O PRO-GRAMAS",•	PLANIFICACIÓN •	ADAPTABILIDAD •	ANÁLISIS  •	ORIENTACIÓN A RESULTADOS,ESPECIALISTA DRE/GRE - LEGAL,Unidad Ejecutora 304 - Gerencia Regional De Educacion Lambayeque,LAMBAYEQUE - CHICLAYO
https://www.gob.pe/institucion/regionlambayeque-gre/campa%c3%b1as/96188-implementacion-de-acciones-e-intervenciones-pedagogicas-gred-lambayeque,1,D.Leg 1057 - Determinado (Necesidad Transitoria)-2,"S/. 3,164.19",03/03/2025,14/03/2025,"GENERAL: EXPERIENCIA PROFESIONAL ACREDITADA EN EL EJERCICIO DE SU PROFESIÓN EN EL SECTOR PÚBLICO Y/O PRIVADO DE CUATRO (4) AÑOS CONTADOS A PARTIR DE LA OBTENCIÓN DE BACHILLERATO.
ESPECÍFICA: DOS (02) AÑOS DE EXPERIENCIA EN ACTIVIDADES VINCULADAS A PLANIFI-CACIÓN Y PRESUPUESTO Y/O SISTEMA DE ABASTECIMIENTOS, GESTIÓN PÚBLICA ORIENTADA A RESULTADOS Y/O MODERNIZACIÓN DEL ESTADO. (DE LOS CUALES DOS AÑOS (2) DE EXPERIENCIA EN EL SECTOR PÚBLICO).

EL NIVEL MÍNIMO DE PUESTO QUE SE REQUIERE COMO EXPERIENCIA; YA SEA EN EL SECTOR PÚBLICO O PRIVADO: ESPECIALISTA. (DE PREFERENCIA EN EDUCACIÓN SUPERIOR).",BACHILLER EN CONTADOR Y/O ADMINISTRADOR Y/O ECONOMISTA.,"¿	PRESUPUESTO PÚBLICO/GESTIÓN POR RESULTADOS Y/O GESTIÓN PÚBLICA Y/O GESTIÓN POR PROCESOS Y/O GESTIÓN EDUCATIVA ¿	CONOCIMIENTO HOJA DE CÁLCULO NIVEL INTERMEDIO (EXCEL, OPEN CALC, ETC.)  ¿	PROCESADOR DE TEXTOS NIVEL INTERMEDIO (WORD; OPEN OFFI-CE, WRITE, ETC.) ¿	PROGRAMA DE PRESENTACIONES NIVEL INTERMEDIO (POWER POINT, PREZI, ETC.)","¿	MODERNIZACIÓN DEL ESTADO Y/O SISTEMAS ADMINISTRATIVOS DEL ESTADO (PRINCIPALMENTE DE PRESUPUESTO, ABASTECIMIEN-TO Y CONTRATACIONES DEL ESTADO). GESTIÓN PÚBLICA Y/O GES-TIÓN POR PROCESOS Y/O SEGUIMIENTO O EVALUACIÓN DE PRO-YECTOS O PROGRAMAS. LEY N° 30512 Y SUS DISPOSITIVOS NORMATIVOS COMO LAS CBC DEL PROCESO DE LICENCIAMIENTO.","•	CAPACIDAD DE ANÁLISIS, TRABAJO EN EQUIPO, RELACIONES INTERPERSONALES, CAPACIDAD DE SÍNTESIS, COMUNICACIÓN EFECTIVA, HABILIDAD DE ORGANIZACIÓN, ORIENTACIÓN A RESULTADOS.",ESPECIALISTA DE CALIDAD DEL SERVICIO EDUCATIVO SUPERIOR TECNOLÓGICO,Unidad Ejecutora 304 - Gerencia Regional De Educacion Lambayeque,LAMBAYEQUE - CHICLAYO
https://aplicativo.pj.gob.pe/psep/wfrmconvocatoriasv.aspx?tcon=c,1,D.Leg 1057 - Determinado (Necesidad Transitoria)-009,"S/. 4,750.00",28/02/2025,13/03/2025,"OBLIGATORIO: EXPERIENCIA LABORAL GENERAL MÍNIMA DE DOS (2) AÑOS EN ENTIDADES PÚBLICAS Y/O PRIVADAS. EXPERIENCIA ESPECIFICA EN LA FUNCIÓN O MATERIA: NO MENOR DE UN (01) AÑO EN LABORES SIMILARES O EN EL EJERCICIO DE LA PROFESIÓN, EN EL SECTOR PÚBLICO. EXPERIENCIA ESPECÍFICA REQUERIDA EN EL CARGO: NO MENOR DE UN (01) AÑO COMO SECRETARIO JUDICIAL.",TITULADO EN LA CARRERA DE DERECHO. COLEGIATURA Y HABILITACIÓN VIGENTE.,EGRESADO DE MAESTRÍA EN DERECHO DE FAMILIA O DERECHO PROCESAL GENERAL.,"CURSO DE ESPECIALIZACIÓN Y/O DIPLOMADOS EN DERECHO FAMILIA, CIVIL O PROCESAL CIVIL (SEGÚN LA CANTIDAD DE HORAS MÍNIMAS ESTABLECIDAS EN LAS BASES). CONOCIMIENTO EN DERECHO FAMILIA, CIVIL, PROCESAL CIVIL. CONOCIMIENTO Y MANEJO EN OFIMÁTICA A NIVEL USUARIO.","COMPRESIÓN LECTORA, ORGANIZACIÓN DE LA INFORMACIÓN, RAZONAMIENTO LÓGICO, ADAPTABILIDAD, REDACCIÓN DE DOCUMENTOS.",SECRETARIO JUDICIAL,Corte Superior De Justicia De Lambayeque,LAMBAYEQUE - FERREÑAFE
https://www.gob.pe/institucion/hrlambayeque/informes-publicaciones/tipos/80-convocatorias-de-trabajo,1,D.Leg 1057 - Determinado (Necesidad Transitoria)-01,"S/. 3,164.19",28/02/2025,13/03/2025,"¿	EXPERIENCIA GENERAL DE DOS (02) AÑOS EN EL SECTOR PÚBLICO Y/O PRIVADO.
¿	EXPERIENCIA ESPECÍFICA DE UN (01) AÑO EN EL SECTOR PÚBLICO",¿	TÍTULO DE TECNÓLOGO MÉDICO - RADIOLOGÍA (ACREDITAR).  ¿	RESOLUCIÓN DE TÉRMINO DE SERUMS (ACREDITAR). ¿	COLEGIATURA (ACREDITAR). ¿	HABILIDAD PROFESIONAL (ACREDITAR).,"¿	ACREDITAR COMO MÍNIMO DE 90 HORAS DE CAPACITACIÓN AFINES AL CARGO, A PARTIR DEL AÑO 2020 A LA FECHA.","¿	MODELO DE CUIDADO INTEGRAL DE SALUD. ¿	PROTECCIÓN RADIOLÓGICA. ¿	MEDIDA DE BIOSEGURIDAD. ¿	CONOCIMIENTO EN REALIZACIÓN DE RESONANCIA MAGNÉTICA AVANZADA, CARDIORM, RESONANCIA MAGNÉTICA FUNCIONAL, NEURORESONANCIA MAGNÉTICA, RESONANCIA MAGNÉTICA MAMARIA, BIOSEGURIDAD EN RESONANCIA MAGNÉTICA. ¿	MANEJO DE EQUIPOS RADIOLÓGICOS. ¿	OFIMÁTICA BÁSICO (ACREDITAR). ¿	INGLÉS BÁSICO (ACREDITAR).",¿	TRABAJO EN EQUIPO. ¿	COMPORTAMIENTO ÉTICO. ¿	ORIENTACIÓN DE SERVICIO AL CIUDADANO ¿	COMUNICACIÓN ASERTIVA Y RESOLUCIÓN DE PROBLEMAS. ¿	VOCACIÓN DE SERVICIO.,TECNÓLOGO MÉDICO IMAGENOLOGÍA,Region Lambayeque - Hospital Regional Lambayeque,LAMBAYEQUE - CHICLAYO
https://aplicativo.pj.gob.pe/psep/wfrmconvocatoriasv.aspx?tcon=c,1,D.Leg 1057 - Determinado (Necesidad Transitoria)-007,"S/. 2,572.00",28/02/2025,13/03/2025,EXPERIENCIA LABORAL ESPECÍFICA MÍNIMA DE UN (01) AÑO EN LABORES SIMILARES.,UNIVERSITARIA INCOMPLETA – 8VO CICLO DE DERECHO,NO INDISPENSABLE.,CONOCIMIENTO EN MATERIA RELACIONADA CON EL ÁMBITO DE SU COMPETENCIA (PENAL Y CONSTITUCIONAL) Y CONOCIMIENTO Y MANEJO DE OFIMÁTICA.,"ADAPTABILIDAD, DINAMISMO, INICIATIVA, COMUNICACIÓN ORAL, COMPRENSIÓN LECTORA",ASISTENTE JURISDICCIONAL,Corte Superior De Justicia De Lambayeque,LAMBAYEQUE - CHICLAYO
https://www.gob.pe/institucion/hrlambayeque/informes-publicaciones/tipos/80-convocatorias-de-trabajo,2,D.Leg 1057 - Determinado (Necesidad Transitoria)-010,"S/. 6,888.19",28/02/2025,13/03/2025,"¿	EXPERIENCIA GENERAL DE TRES (03) AÑOS EN EL SECTOR PÚBLICO Y/O PRIVADO.
¿	EXPERIENCIA ESPECÍFICA DE UN (01) AÑO EN FUNCIONES DE ACUERDO AL PUESTO QUE POSTULA.",¿	TÍTULO DE MÉDICO CIRUJANO (ACREDITAR). ¿	TÍTULO DE MÉDICO ESPECIALISTA EN ANESTESIOLOGÍA (ACREDITAR). ¿	SERUMS (ACREDITAR). ¿	COLEGIATURA Y HABILIDAD VIGENTE (ACREDITAR).,¿	CURSOS DE CAPACITACIÓN  EN RCP (ACREDITAR). ¿	CURSOS DE CAPACITACIÓN EN BLOQUEOS REGIONALES GUIADOS POR ECOGRAFÍA (ACREDITAR). ¿	CURSOS DE CAPACITACIÓN EN  MANEJO DEL DOLOR (ACREDITAR). ¿	CAPACITACIONES RELACIONADAS CON LA ESPECIALIDAD. (ACREDITAR). ¿	ACREDITAR COMO MÍNIMO DE 90 HORAS DE CAPACITACIÓN AFINES AL CARGO,"¿	ATENCIÓN DE ANESTESIA EN CIRUGÍAS REALIZADAS EN SALA DE OPERACIONES, PARA CIRUGÍAS DE EMERGENCIA Y ELECTIVAS, ATENCIÓN EN RECUPERACIÓN POSTANESTESICA, CONSULTORIO EXTERNO, HOSPITALIZACIÓN Y EN SALA DE PROCEDIMIENTOS. ¿	ATENCIÓN DE SEDONALGESIA EN SALA DE OPERACIONES Y PROCEDIMIENTOS FUERA DE QUIRÓFANO. ¿	OFIMÁTICA BÁSICO (ACREDITAR). ¿	INGLÉS BÁSICO (ACREDITAR).","¿	ACTITUD DE SERVICIO, ÉTICA E INTEGRIDAD. ¿	COMPROMISO Y RESPONSABILIDAD. ¿	ACTITUD PROACTIVA Y ORIENTACIÓN A RESULTADOS. ¿	CAPACIDAD DE COORDINACIÓN, ORGANIZACIÓN Y CONTROL DE LOS RECURSOS ASIGNADOS. ¿	CAPACIDAD DE LIDERAZGO ORIENTADO AL LOGRO DE OBJETIVOS INSTITUCIONALES. ¿	CAPACIDAD PARA TRABAJAR EN EQUIPO Y BAJO PRESIÓN. ¿	ACTITUD DE ATENCIÓN Y SERVICIO AL USUARIO INTERNO Y EXTERNO.",MEDICO ESPECIALISTA EN ANESTESIOLOGIA,Region Lambayeque - Hospital Regional Lambayeque,LAMBAYEQUE - CHICLAYO
