job_posting_url,vacancies,job_posting_number,salary,start_publication_date,end_publication_date,required_experience,educational_background,specialization,required_knowledge,skills,job_title,public_institution,ubication
https://www.gob.pe/munisanluisdeshuaro,1,D.Leg 1057 - Determinado (Suplencia)-002,"S/. 1,600.00",25/02/2025,10/03/2025,-EXPERIENCIA GENERAL: 01 AÑO EN SECTOR PÚBLICO Y/O PRIVADO.,-ESTUDIOS TÉCNICOS CON CONOCIMIENTOS BÁSICOS EN EQUIPOS DE MOVIMIENTO DE TIERRA MOTONIVELADORA. -OPERACIÓN DE MOTONIVELADORA.,-,-CONOCIMIENTOS BÁSICOS DE MECÁNICA.,-POSEER LICENCIA DE CONDUCIR CATEGORÍA A1. -DISPOSICIÓN PARA TRABAJO EN TERRENO TANTO AL INTERIOR COMO FUERA DEL DISTRITO.,OPERADOR DE MOTONIVELADORA,Municipalidad Dist San Luis De Shuaro,JUNIN - SAN LUIS DE SHUARO
https://www.gob.pe/munisanluisdeshuaro,1,D.Leg 1057 - Determinado (Necesidad Transitoria)-002,"S/. 1,300.00",25/02/2025,10/03/2025,-EXPERIENCIA MÍNIMA  06 MESES EN EMPRESAS PÚBLICAS Y/O PRIVADAS.,"-BACHILLER, EGRESADO  Y/ O TÉCNICO EN  COMPUTACIÓN, INFORMÁTICA Y SISTEMAS.",-,"-HABILIDAD PARA INTERRELACIONARSE A TODO NIVEL. -MANEJO DE OFFICE, SIGA, SIAF, RELACIONES PÚBLICAS Y HUMANAS.",-,ENCARGADO DE INFORMATICA,Municipalidad Dist San Luis De Shuaro,JUNIN - SAN LUIS DE SHUARO
https://www.gob.pe/munisanluisdeshuaro,1,D.Leg 1057 - Determinado (Necesidad Transitoria)-002,"S/. 1,800.00",25/02/2025,10/03/2025,"- EXPERIENCIA GENERAL: 02 AÑOS EN EL SECTOR PÚBLICO Y/O PRIVADO.
- EXPERIENCIA ESPECÍFICA: 01 AÑO EN EL SECTOR PÚBLICO EN CARGOS SIMILARES.","- ESTUDIOS: TITULADO Y/O BACHILLER EN CONTABILIDAD, ECONOMÍA, ADMINISTRACIÓN Y/O CARRERA AFINES.",-,"-CONOCIMIENTO DE OFFICE: (WORD, EXCEL, POWER POINT) SIAF, SIGA, INTERNET, TRIBUTACIÓN, SISTEMA NACIONAL DE TESORERÍA, ABASTECIMIENTOS Y CONTABILIDAD.",-,"JEFE DE LA OFICINA DE PLANEAMIENTO, PRESUPUESTO Y DESARROLLO INSTITUCIONAL",Municipalidad Dist San Luis De Shuaro,JUNIN - SAN LUIS DE SHUARO
https://www.gob.pe/munisanluisdeshuaro,1,D.Leg 1057 - Determinado (Necesidad Transitoria)-002,"S/. 1,600.00",25/02/2025,10/03/2025,-EXPERIENCIA GENERAL 01 AÑO EN SECTOR PÚBLICO Y/O PRIVADO.,- ESTUDIOS TÉCNICOS CON CONOCIMIENTOS BÁSICOS EN EQUIPOS DE MOVIMIENTO DE TIERRA TRACTOR ORUGA.  - OPERACIÓN DE TRACTOR ORUGA.,-,-CONOCIMIENTOS BÁSICOS DE MECÁNICA,-ACREDITAR CON CONSTANCIAS O CERTIFICADOS SER OPERADOR DE MAQUINARIA PESADA.  -POSEER LICENCIA DE CONDUCIR CATEGORÍA A1.  -DISPOSICIÓN PARA TRABAJO EN TERRENO TANTO AL INTERIOR COMO FUERA DEL DISTRITO.,OPERADOR DE TRACTOR ORUGA,Municipalidad Dist San Luis De Shuaro,JUNIN - SAN LUIS DE SHUARO
https://www.gob.pe/munisanluisdeshuaro,1,D.Leg 1057 - Determinado (Necesidad Transitoria)-002,"S/. 1,500.00",25/02/2025,10/03/2025,"-EXPERIENCIA GENERAL: 01 AÑO EN EL SECTOR PÚBLICO O PRIVADO.
-EXPERIENCIA ESPECÍFICA: 06 MESES EN EL SECTOR PÚBLICO O PRIVADO.","-ESTUDIOS: TITULADO Y/O BACH. ING. CIVIL, SANITARIA, AMBIENTAL O CARRERAS AFINES.",-,-CONOCIMIENTO EN RELACIONES PÚBLICAS Y HUMANAS.,- CAPACITACIÓN EN MANEJO DE OFFICE BÁSICO.,RESPONSABLE DE ATM,Municipalidad Dist San Luis De Shuaro,JUNIN - SAN LUIS DE SHUARO
https://www.gob.pe/munisanluisdeshuaro,1,D.Leg 1057 - Determinado (Necesidad Transitoria)-002,"S/. 1,500.00",25/02/2025,10/03/2025,-EXPERIENCIA LABORAL NO MENOR DE UN (01) AÑO EN EL SECTOR PÚBLICO Y/O PRIVADO.,"-BACHILLER Y/O EGRESADO EN CIENCIAS DE LA COMUNICACIÓN, PERIODISMO, PUBLICIDAD Y/O AFINES.",-,"-CONOCIMIENTO BÁSICO DE COMPUTACIÓN CON NIVEL USUARIO DE PROGRAMA DE DOMINIO: (OFFICE, EXCEL, WORD, POWER POINT, INTERNET, CORREO ELECTRÓNICO Y OTROS NECESARIOS PARA EDITAR). -EXPERIENCIA MÍNIMA EN COORDINACIONES CON LAS ORGANIZACIONES DE BASE.  -TENER NIVEL ADECUADO DE COMPRENSIÓN.  -FACILIDAD DE ESTABLECER COMUNICACIÓN CON LAS PERSONAS EN TODO NIVEL.",-CAPACITACIONES RELACIONADAS Y/O AFINES AL CARGO QUE POSTULA.,RESPONSABLE DE IMAGEN INSTITUCIONAL,Municipalidad Dist San Luis De Shuaro,JUNIN - SAN LUIS DE SHUARO
https://app.servir.gob.pe/difusionofertasexterno/faces/consultas/ofertas_laborales.xhtml,1,D.Leg 1057 - Determinado (Necesidad Transitoria)-003,"S/. 1,300.00",25/02/2025,10/03/2025,"TENER EXPERIENCIA MINIMA DE UN AÑO EN EL SECTOR PUBLICO O PRIVADO, TENER EXPERIENCIA ESPECIFICA DE 6 MESES EN EL AREA",SER BACHILLER Y/O TECNICO EN LA ESPECIALIDAD DE INGENERIA CIVIL O ARQUITECTURA,CURSO Y/O PROGRAMAS DE ESPECIALIZACIÓN AFINES AL CARGO,"TENER CONOCIMIENTOS EN EL SIGA, SIAF, SEACE, GESTION PUBLICA Y OTROS","•	TRABAJO EN EQUIPO •	DEDICACIÓN Y ESFUERZO PARA LOGRAR OBJETIVOS •	TOLERANCIA, RESPONSABILIDAD Y CUMPLIMIENTO •	CAPACIDAD DE ANÁLISIS Y SOLUCIÓN DE PROBLEMAS •	ADAPTABILIDAD",ASISTENTE TECNICO DE OBRAS E INFRAESTRUCTURA,Municipalidad Distrital De Palca,JUNIN - PALCA
https://www.ugelchanchamayo@edu.pe,1,D.Leg 1057 - Determinado (Necesidad Transitoria)-18,"S/. 2,900.00",25/02/2025,10/03/2025,2,TITULADOS DE UNIVERSIDAD Y TECNOLOGICOS,"GESTION PUBLICA, CEPLAN, SIAF, SIGA, PEI, POI","PLANEAMIENTO ESTRATEGICO, PRTESUPUESTO PUBLICO","ANALISIS, AUTOCONTROL, ORGANIZACION DE LA INFORMACION Y EMPATIA",PLANIFICADOR,Unidad Ejecutora Educacion Chanchamayo,JUNIN - CHANCHAMAYO
https://aplicativo.pj.gob.pe/psep/wfrmconvocatoriasv.aspx?tcon=e,1,728-003,"S/. 4,710.00",25/02/2025,10/03/2025,¿	(OBLIGATORIO) EXPERIENCIA DE UN (01) AÑO EN LABORES SIMILARES.,¿	(OBLIGATORIO) ESTUDIOS UNIVERSITARIOS EN DERECHO (8VO CICLO),"¿	CURSOS, DIPLOMADOS Y/O ESPECIALIZACIÓN EN MATERIA DE DERECHO CIVIL, PROCESAL CIVIL, DERECHO DE FAMILIA. (ESPECIALIZACIÓN O DIPLOMADO, DEBEN TENER NO MENOS DE 90 HORAS DE CAPACITACIÓN. LOS PROGRAMAS DE ESPECIALIZACIÓN PUEDEN SER DESDE 80 HORAS SI SON ORGANIZADOS POR UN ENTE RECTOR, EN EL MARCO DE SUS ATRIBUCIONES NORMATIVAS). (PARA EL CASO DE LOS CURSOS, DEBEN TENER NO MENOS DE 30 HORAS, PUEDE SER EL ACUMULADO DE DOS O MÁS CURSOS DE CAPACITACIÓN (SUMAR HORAS), HASTA ALCANZAR EL TOTAL DE HORAS REQUERIDAS, NO PUDIENDO SER UTILIZADO CURSOS APROBADOS DE MAESTRÍAS O DOCTORADOS). ¿	CONTAR CON CURSO DE OFIMÁTICA BÁSICA, DIFERENTE A LA INCLUIDA EN LA CARRERA UNIVERSITARIA.",¿	CONOCIMIENTO Y MANEJO DE OFIMÁTICA.,"¿	COMPRENSIÓN LECTORA, REDACCIÓN, PLANIFICACIÓN, CREATIVIDAD/INNOVACIÓN, DINAMISMO.",ASISTENTE JUDICIAL,Poder Judicial,JUNIN - EL TAMBO
https://aplicativo.pj.gob.pe/psep/wfrmconvocatoriasv.aspx?tcon=e,1,728-003,"S/. 5,670.00",25/02/2025,10/03/2025,¿	(OBLIGATORIO) EXPERIENCIA DE DOS (02) AÑOS EN LABORES SIMILARES.,"¿	(OBLIGATORIO) TÍTULO PROFESIONAL EN DERECHO, COLEGIADO(A) Y HABILITADO(A).","¿	CURSOS, DIPLOMADOS Y/O ESPECIALIZACIÓN EN MATERIA DE DERECHO CIVIL, PROCESAL CIVIL, DERECHO DE FAMILIA (ESPECIALIZACIÓN O DIPLOMADO, DEBEN TENER NO MENOS DE 90 HORAS DE CAPACITACIÓN. LOS PROGRAMAS DE ESPECIALIZACIÓN PUEDEN SER DESDE 80 HORAS SI SON ORGANIZADOS POR UN ENTE RECTOR, EN EL MARCO DE SUS ATRIBUCIONES NORMATIVAS). (PARA EL CASO DE LOS CURSOS, DEBEN TENER NO MENOS DE 30 HORAS, PUEDE SER EL ACUMULADO DE DOS O MÁS CURSOS DE CAPACITACIÓN (SUMAR HORAS), HASTA ALCANZAR EL TOTAL DE HORAS REQUERIDAS, NO PUDIENDO SER UTILIZADO CURSOS APROBADOS DE MAESTRÍAS O DOCTORADOS). ¿	CONTAR CON CURSO DE OFIMÁTICA BÁSICA, DIFERENTE A LA INCLUIDA EN LA CARRERA UNIVERSITARIA.",¿	CONOCIMIENTO Y MANEJO DE OFIMÁTICA. ¿	CONOCIMIENTO EN MATERIA RELACIONADA CON EL ÁMBITO DE SU COMPETENCIA.,"¿	ANÁLISIS, COMPRENSIÓN LECTORA, ORGANIZACIÓN DE INFORMACIÓN, REDACCIÓN Y SÍNTESIS, PLANIFICACIÓN.",SECRETARIO JUDICIAL,Poder Judicial,JUNIN - EL TAMBO
https://www.facebook.com/ugelsatipo.oficial,1,D.Leg 1057 - Determinado (Necesidad Transitoria)-6,"S/. 2,764.19",24/02/2025,07/03/2025,2 AÑOS 01 AÑO DE LABORES EN AULA,LICENCIADO EN EDUCACION CON ESPECIALIDAD EN CIENCIAS SOCIALES O AFINES,CURSO O ESPECIALIZACIÓN EN PEDAGOGÍA. NOTA: CADA CURSO DEBE TENER NO MENOS DE 12 HORAS DE CAPACITACIÓN Y LOS PROGRAMAS DE ESPECIALIZACIÓN NO MENOS DE 90 HORAS,"MANEJO DE ESTRATEGIAS PARA LA GENERACIÓN DE UN CLIMA INSTITUCIONAL FAVORABLE PARA UNA CONVIVENCIA DEMOCRÁTICA E INTERCULTURAL. CONOCIMIENTOS EN TEMAS DE GESTIÓN PEDAGÓGICA. MANEJO DE ESTRATEGIAS EN ACCIONES DE ACOMPAÑAMIENTO Y CONSEJERÍA ESTUDIANTIL. CONOCIMIENTOS EN TEMAS DE GESTIÓN, PLANIFICACIÓN ESTRATÉGICA Y/O ADMINISTRACIÓN","PLANIFICACIÓN, AUTOCONTROL, CREATIVIDAD E INNOVACIÓN, EMPATÍA Y COMUNICACIÓN ORAL",CAS JEC DOCENTE TUTORIAL DE CIENCIAS SOCIALES,Unidad De Gestion Educativa Satipo Chanchamayo,JUNIN - SATIPO
https://www.facebook.com/ugelsatipo.oficial,1,D.Leg 1057 - Determinado (Necesidad Transitoria)-3,"S/. 2,764.19",24/02/2025,07/03/2025,"GENERAL 2 AÑOS SEA SECTOR PUBLICO O PRIVADO, ESPECIFICO 01 AÑO DE LABORES EN AULA",TITULO/LICENCIATURA EDUCACION CON ESPECIALIDAD DE COMUNICACION O AFINES,CURSO O ESPECIALIZACION EN PEDAGOGIA,CURSO DE EPSECIALIZACION EN PEDAGOGIA,"PLANIFICACION, AUTOCONTROL, CREATIVIDAD E INNOVACION, EMPATIA Y COMUNICACION ORAL",CAS JEC DOCENTE TUTORIAL DE COMUNICACIÓN,Unidad De Gestion Educativa Satipo Chanchamayo,JUNIN - SATIPO
https://www.facebook.com/ugelsatipo.oficial,1,D.Leg 1057 - Determinado (Necesidad Transitoria)-4,"S/. 2,764.19",24/02/2025,07/03/2025,GENERAL: 2 AÑOS ESPECIFICA 01 AÑO DE LABORES EN AULA,LICENCIADO EN EDUCACION CON ESPECIALIDAD EN MATEMATICA O AFINES,CURSO O ESPECIALIZACIÓN EN PEDAGOGÍA. NOTA: CADA CURSO DEBE TENER NO MENOS DE 12 HORAS DE CAPACITACIÓN Y LOS PROGRAMAS DE ESPECIALIZACIÓN NO MENOS DE 90 HORAS,"MANEJO DE ESTRATEGIAS PARA LA GENERACIÓN DE UN CLIMA INSTITUCIONAL FAVORABLE PARA UNA CONVIVENCIA DEMOCRÁTICA E INTERCULTURAL. CONOCIMIENTOS EN TEMAS DE GESTIÓN PEDAGÓGICA. MANEJO DE ESTRATEGIAS EN ACCIONES DE ACOMPAÑAMIENTO Y CONSEJERÍA ESTUDIANTIL. CONOCIMIENTOS EN TEMAS DE GESTIÓN, PLANIFICACIÓN ESTRATÉGICA Y/O ADMINISTRACIÓN","PLANIFICACIÓN, AUTOCONTROL, CREATIVIDAD E INNOVACIÓN, EMPATÍA, CAPACIDAD DE RESOLUCIÓN DE CONFLICTOS Y COMUNICACIÓN ORAL",CAS JEC DOCENTE TUTORIAL DE MATEMÁTICA,Unidad De Gestion Educativa Satipo Chanchamayo,JUNIN - SATIPO
https://www.facebook.com/ugelsatipo.oficial,1,D.Leg 1057 - Determinado (Necesidad Transitoria)-1,"S/. 4,264.19",24/02/2025,07/03/2025,"3 AÑOS DE EXPERIENCIA GENERAL, 2 AÑOS DE EXPERIENCIA EN TUTORIA Y/O CONVIVENCIA ESCOLAR, DE PREFERENCIA EN INTERVENCIONES EDUCATIVAS Y/O SOCIALES AFINES A LA FUNCION",TITULO/LICENCIATURA PSICOLOGIA O EDUCACION O TRABAJO SOCIAL,CURSO RELACIONADOS AL ABORDAJE PARA LA PREVENCION Y ATENCION DE TODO TIPO DE VIOLENCIA Y/O DESARROLLO DE HABILIDADES SOCIOECOEMOCIONALES Y/O TUTORIA Y ORIENTACION EDUCATIVA Y/O PSICOPEDAGOGIA Y/O CONVIVENCIA ESCOLAR 12 HORAS DE CAPACITACION Y 90 HORAS DE ESPECIALIZACION,"CONOCIMIENTO DEL MARCO NORMATIVO Y DEL ABORDAJE PARA LA PREVENCION Y ATENCION DE TODO TIPO VIOLENCIA, EL DESARROLLO DE HABILIDADES SOCIOEMOCIONALES. IMPLEMENTACION DE LA TUTORIA Y ORIENTACION EDUCATIVA Y/O PSICOPEDAGOGIA Y/O CONVIVENCIA ESCOLAR","EMPATIA, ASERTIVIDAD, CAPACIDAD DE ANALISIS, TRABAJO EN EQUIPO, BUENA COMUNICACION ORAL Y ESCRITA, ORGANIZACION DE LA INFORMACION",CAS JEC ESPECIALISTA DE PREVENCIÓN DE LA VIOLENCIA Y PROMOCIÓN DEL BIENESTAR.,Unidad De Gestion Educativa Satipo Chanchamayo,JUNIN - SATIPO
https://www.facebook.com/ugelsatipo.oficial,1,D.Leg 1057 - Determinado (Necesidad Transitoria)-12,"S/. 2,864.19",24/02/2025,07/03/2025,"EXPERIENCIA GENERAL: 03 AÑOS PUBLICO Y PRIVADO, EXPERIENCIA ESPECÍFICA: 02 AÑOS DE EXPERIENCIA EN EL DESARROLLO DE PROYECTOS SOCIALES Y/O INTERVENCIONES RELACIONADAS A PREVENCIÓN Y/O ATENCIÓN DE URGENCIAS MEDICAS Y/O DESARROLLO INTEGRAL DE ADOLESCENTES.",BACHILLER EN ENFERMERÍA Y/O EN CIENCIAS DE LA SALUD,"CAPACITACIÓN Y/O ESPECIALIZACIÓN ACREDITADA SOBRE PROMOCIÓN DE LA SALUD CON ÉNFASIS EN EL ÁMBITO RURAL Y PUEBLOS INDÍGENAS Y/O AMAZÓNICOS Y/O INTERVENCIONES COMUNITARIAS, SALUD ADOLESCENTE, CONSEJERÍA SOBRE SALUD SEXUAL REPRODUCTIVA, ENTRE OTROS","CONOCIMIENTO DE ESTRATEGIAS DE INTERVENCIONES COMUNITARIAS Y/O MULTISECTORIALES EN EL ÁMBITO RURAL ANDINO, AMAZÓNICO O COSTA REFERIDOS A TEMAS DE PROMOCIÓN DE LA SALUD, CONOCIMIENTO DE NORMATIVAS EN EL MARCO DE DERECHOS HUMANOS, ACCESO A SERVICIOS DE SALUD, DERECHOS SEXUALES Y REPRODUCTIVOS, PROMOCIÓN DE VIDAS SALUDABLES Y AFINES.","HABILIDAD DE TRATO INTERPERSONAL, BUENA CAPACIDAD DE COMUNICACIÓN ASERTIVA Y DE ESTABLECER EL DIÁLOGO PARA EL TRABAJO EN EQUIPO MULTIDISCIPLINARIO. HABILIDAD EN EL MANEJO DE METODOLOGÍAS PARTICIPATIVAS, CUMPLIMIENTO DE LA TAREA, COMPORTAMIENTO ÉTICO, EMPATÍA, SENSIBILIDAD EN EL ABORDAJE DE LAS PROBLEMÁTICAS DEL ÁMBITO RURA",CAS JEC GESTOR(A) DE VIDA SALUDABLE SRE,Unidad De Gestion Educativa Satipo Chanchamayo,JUNIN - SATIPO
https://www.facebook.com/ugelsatipo.oficial,2,D.Leg 1057 - Determinado (Necesidad Transitoria)-10,"S/. 1,289.19",24/02/2025,07/03/2025,"EXPERIENCIA GENERAL: UN (01) AÑO EN EL SECTOR PÚBLICO O PRIVADO, EXPERIENCIA ESPECÍFICA SEIS (06) MESES DE EXPERIENCIA COMO RESPONSABLE DE COCINA, AYUDANTE DE COCINA O ACTIVIDADES LIGADAS AL CARGO",PRIMARIA INCOMPLETA,NO APLICA,CONOCIMIENTO Y PRACTICAS SOBRE PREPARACIÓN DE ALIMENTACIÓN SALUDABLE. HABILIDADES PARA PREPARACIÓN DE MENÚ. MANEJO HIGIÉNICO EN EL PROCESO DE ELABORACIÓN DE LOS ALIMENTOS,"ADAPTABILIDAD, PLANIFICACIÓN, DINAMISMO, ORDEN.",CAS JEC PERSONAL DE COCINA,Unidad De Gestion Educativa Satipo Chanchamayo,JUNIN - SATIPO
https://www.facebook.com/ugelsatipo.oficial,6,D.Leg 1057 - Determinado (Necesidad Transitoria)-19,"S/. 1,414.19",24/02/2025,07/03/2025,1 AÑO YA SEA EN EL SECTOR PÚBLICO O PRIVADO. 06 MESES EN MANTENIMIENTO O LIMPIEZA,SECUNDARIA COMPLETA,NO APLICA,"MANEJO DE INSUMOS Y RECURSOS DE LIMPIEZA Y MANTENIMIENTO. MANEJO DE PROCEDIMIENTOS PARA LA DESINFECCIÓN DE AMBIENTES, EQUIPOS Y MATERIALES DE LA IE. CONOCIMIENTOS SOBRE EL FUNCIONAMIENTO DE LAS IIEE JEC","ORDEN, INICIATIVA, COMPROBACIÓN DE OBJETOS, ATENCIÓN",CAS JEC PERSONAL DE LIMPIEZA Y MANTENIMIENTO,Unidad De Gestion Educativa Satipo Chanchamayo,JUNIN - SATIPO
https://www.facebook.com/ugelsatipo.oficial,10,D.Leg 1057 - Determinado (Necesidad Transitoria)-15,"S/. 1,414.19",24/02/2025,07/03/2025,1 AÑO YA SEA EN EL SECTOR PÚBLICO O PRIVADO. 06 MESES EN MANTENIMIENTO O LIMPIEZA,SECUNDARIA COMPLETA,NO APLICA,"MANEJO DE INSUMOS Y RECURSOS DE LIMPIEZA Y MANTENIMIENTO. MANEJO DE PROCEDIMIENTOS PARA LA DESINFECCIÓN DE AMBIENTES, EQUIPOS Y MATERIALES DE LA IE. CONOCIMIENTOS SOBRE EL FUNCIONAMIENTO DE LAS IIEE JEC","ORDEN, INICIATIVA, COMPROBACIÓN DE OBJETOS, ATENCIÓN",CAS JEC PERSONAL DE MANTENIMIENTO,Unidad De Gestion Educativa Satipo Chanchamayo,JUNIN - SATIPO
https://www.facebook.com/ugelsatipo.oficial,2,D.Leg 1057 - Determinado (Necesidad Transitoria)-11,"S/. 1,289.19",24/02/2025,07/03/2025,UN (01) AÑO EN LABORES DE SEGUIRDAD DE ESPACIOS PUBLICOS Y PRIVADOS. SEIS (06) MESES DE ESPERIENCIA LABORAL DE CUIDADO Y SEGURIDAD EN OFICINAS O INSTITUCIONES DEL SECTOR PUBLICO O PRIVADO.,SECUNDARIA INCOMPLETA,NO APLICA,NO APLICA,"ADAPTABILIDAD, PLANIFICACIÓN, DINAMISMO, ORDEN.",CAS JEC PERSONAL DE SEGURIDAD,Unidad De Gestion Educativa Satipo Chanchamayo,JUNIN - SATIPO
https://www.facebook.com/ugelsatipo.oficial,8,D.Leg 1057 - Determinado (Necesidad Transitoria)-16,"S/. 1,414.19",24/02/2025,07/03/2025,EXPERIENCIA GENERAL 02 AÑOS Y 01 AÑO EN LABORES DE SEGURIDAD Y VIGILANCIA.,SECUNDARIA COMPLETA,DE PREFERENCIA FORMACION EN MEDIDAS DE SEGUIRDAD Y/O RESGUARDO (CADA CURSO DEBE TENER NO MENOS DE 12 HORAS Y PROGRAMAS DE ESPECIALIZACION NO MENOS DE 90 HORAS,CONOCIMIENTO DE PLANES DE CONTINGENCIA EN SITUACION DE EMERGENCIA. CONOCIMIENTO SOBRE ACCIONES DE SEGURIDAD. CONOCIMIENTO SOBRE EL FUNCIONAMIENTO DE LAS IIEE JEC.,"ORDEN, CONTROL/AUTOCONTROL, ANALISIS, FUERZA FISICA.",CAS JEC PERSONAL DE VIGILANCIA,Unidad De Gestion Educativa Satipo Chanchamayo,JUNIN - SATIPO
https://www.facebook.com/ugelsatipo.oficial,1,D.Leg 1057 - Determinado (Necesidad Transitoria)-20,"S/. 3,064.19",24/02/2025,07/03/2025,03 AÑOS EXPERIENCIA ESPECÍFICA 01 AÑO. TIEMPO DE EXPERIENCIA REQUERIDA,LICENCIADO EN PSICOLOGÍA O SOCIOLOGÍA. COLEGIATURA Y HABILITADO,"CURSO RELACIONADO A: CONVIVENCIA ESCOLAR, TUTORIA Y ORIENTACION EDUCATIVA; O PROTECCION Y DERECHO DE NIÑOS, NIÑAS Y ADOLESCENTES O ATENCIÓN DE VICTIMAS DE VIOLENCIA; O GESTIÓN DE PROYECTOS EDUCATIVOS, SOCIALES O COMUNITARIOS.","GESTIÓN DE LA CONVIVENCIA ESCOLAR, PAUTAS PARA LA PREVENCIÓN Y ATENCIÓN DE LA VIOLENCIA EN LAS INSTITUCIONES EDUCATIVAS","EMPATÍA, ASERTIVIDAD, ANÁLISIS, BUENA COMUNICACIÓN ORAL Y ESCRITA, ORGANIZACIÓN DE LA INFORMACIÓN.",CAS JEC PROFESIONAL I PARA EQUIPO ITINERANTE DE CONVIVENCIA ESCOLAR,Unidad De Gestion Educativa Satipo Chanchamayo,JUNIN - SATIPO
https://www.facebook.com/ugelsatipo.oficial,1,D.Leg 1057 - Determinado (Necesidad Transitoria)-21,"S/. 3,064.19",24/02/2025,07/03/2025,EXPERIENCIA LABORAL GENERAL DE UN (01) AÑO EN GESTIÓN PÚBLICA Y/O PRIVADO. 6 MESES DE EXPERIENCIA EN EL SECTOR PÚBLICO EN FUNCIONES AFINES.,TÍTULO/LICENCIATURA LICENCIADO PROFESOR O DOCENTE,CAPACITACION PROTECCION Y DERECHOS DEL NIÑO,"GESTION DE CONVIVENCIA, PAUTAS PARA LA PREVENCION",- MEJORA CONTINUA – BÚSQUEDA DE INFORMACIÓN CONSTANTE - CONOCIMIENTO ORGANIZACIONAL – ORIENTACIÓN AL LOGRO PERSONAL Y GRUPAL - PENSAMIENTO ANALÍTICO Y CRÍTICO – IMPACTO E INFLUENCIA - TRABAJO EN EQUIPO Y COOPERACIÓN,CAS JEC PROFESIONAL II PARA EQUIPO ITINERANTE DE CONVIVENCIA ESCOLAR,Unidad De Gestion Educativa Satipo Chanchamayo,JUNIN - SATIPO
https://www.facebook.com/ugelsatipo.oficial,1,D.Leg 1057 - Determinado (Necesidad Transitoria)-18,"S/. 2,714.19",24/02/2025,07/03/2025,EXPERIENCIA GENERAL 03 AÑOS Y 02 AÑO EN SECTOR EDUCACION,TÍTULO/LICENCIATURA LICENCIADO EN EDUCACION,ESTUDIIOS DE POSGRADO O DIPLOMADO EN EDUCACION INCLUSIVA,MARCO DE ENFOQUE INCLUSIVO,HABILIDAD COMUNITATIVA ORIENTACION A LOGROS,CAS JEC PROFESIONAL NO DOCENTE PARA EL SOPORTE Y ASESORAMIENTO A IIEE INCLUSIVAS,Unidad De Gestion Educativa Satipo Chanchamayo,JUNIN - SATIPO
https://www.facebook.com/ugelsatipo.oficial,2,D.Leg 1057 - Determinado (Necesidad Transitoria)-9,"S/. 1,289.19",24/02/2025,07/03/2025,1 AÑO YA SEA EN EL SECTOR PÚBLICO O PRIVADO. 06 MESES EN MANTENIMIENTO O LIMPIEZA,SECUNDARIA COMPLETA,NO APLICA,"MANEJO DE INSUMOS Y RECURSOS DE LIMPIEZA Y MANTENIMIENTO. MANEJO DE PROCEDIMIENTOS PARA LA DESINFECCIÓN DE AMBIENTES, EQUIPOS Y MATERIALES DE LA IE. CONOCIMIENTOS SOBRE EL FUNCIONAMIENTO DE LAS IIEE JEC","ORDEN, INICIATIVA, COMPROBACIÓN DE OBJETOS, ATENCIÓN",CAS JEC PERSONAL DE LIMPIEZA Y MANTENIMIENTO,Unidad De Gestion Educativa Satipo Chanchamayo,JUNIN - SATIPO
https://www.facebook.com/ugelsatipo.oficial,8,D.Leg 1057 - Determinado (Necesidad Transitoria)-14,"S/. 2,764.19",24/02/2025,07/03/2025,02 AÑOS YA SEA EN EL SECTOR PÚBLICO O PRIVADO. 01 AÑO EN INSTITUCIONES EDUCATIVAS O PROYECTOS EDUCATIVOS O PROGRAMAS SOCIALES.,TÍTULO/LICENCIATURA LICENCIADO EN PSICOLOGÍA (COLEGIADO Y HABILITADO),CAPACITACIÓN EN HABILIDADES SOCIALES Y/O ACTIVIDADES CON ADOLESCENTES. CURSO DEBE TENER NO MENOS DE 12 HORAS DE CAPACITACIÓN Y LOS PROGRAMAS DE ESPECIALIZACIÓN NO MENOS DE 90 HORAS,"CONOCIMIENTO SOBRE GESTIÓN: PLANIFICACIÓN, ORGANIZACIÓN Y PROMOCIÓN DE LA CONVIVENCIA DEMOCRÁTICA E INTERCULTURAL EN LA IE. CONOCIMIENTO EN ESTRATEGIAS DE PREVENCIÓN EN ASPECTOS SOCIOEMOCIONALES. CONOCIMIENTO GENERAL DE LA NORMATIVIDAD Y PROCESOS EDUCATIVOS. CONOCIMIENTO DE ENFOQUES DE DERECHO Y GÉNERO. CONOCIMIENTO EN ARTICULACIÓN CON INSTITUCIONES PÚBLICAS Y PRIVADAS. CONOCIMIENTOS SOBRE GESTIÓN ESCOLAR Y FUNCIONAMIENTO DE LAS IIEE JEC.","INICIATIVA, ANÁLISIS, CONTROL, PLANIFICACIÓN",CAS JEC PSICÓLOGO (A),Unidad De Gestion Educativa Satipo Chanchamayo,JUNIN - SATIPO
https://www.facebook.com/ugelsatipo.oficial,1,D.Leg 1057 - Determinado (Necesidad Transitoria)-8,"S/. 2,764.19",24/02/2025,07/03/2025,"GENERAL: 03 AÑOS , ESPECIFICA 02 AÑOS DESARROLLO DE PROYECTOS SOCIALES","EGRESADO TRABAJO SOCIAL, ANTROPOLOGIA","CURSO EN TUTORIA, CONVENCI ESCOLAR",CONOCIMIENTO EN AL INTERVENCION EN CASOS DE VIOLENCIA CONTRA NIÑAS Y NIÑOS EN LOS ENFOQUES TRANSVERSALES DEL CNEB,"PLANIFICACION, AUTOCONTROL, CREATIVIDAD E INNOVACION, EMPATIA Y COMUNICACION ORAL",CAS JEC RESPONSABLE DE BIENESTAR SRE,Unidad De Gestion Educativa Satipo Chanchamayo,JUNIN - SATIPO
https://www.facebook.com/ugelsatipo.oficial,2,D.Leg 1057 - Determinado (Necesidad Transitoria)-17,"S/. 2,964.19",24/02/2025,07/03/2025,GENERAL 1 Y 6 MESES ESPECIFICA 01 AÑO TRABAJO CON PERSONAL CON DISCAPACIDAD,TÍTULO/LICENCIATURA TECNOLOGO MEDICO EN AREAS MENCION ESPECIALIDAD TERAPIA FISICA O TERAPIA FISICA Y REHABILITACION O TERAPIA OCUAPCIONAL,NO APLICA,ATENCION DE PERSONAS CON DISCAPACIDAD TRABAJO CON FAMILIA DESARROLLO EVOLUTIVO,COMUNICACION ORAL COOPERACION INICIATIVA EMPATIA Y TRABAJO EN EQUIPO,"PROFESIONAL EN TECNOLOGÍA MÉDICA CON MENCIÓN EN TERAPIA FÍSICA, OCUPACIONAL O DE LENGUAJE PARA CEBE",Unidad De Gestion Educativa Satipo Chanchamayo,JUNIN - SATIPO
https://www.ugelhuancayo.gop.pe,1,D.Leg 1057 - Determinado (Necesidad Transitoria)-010,"S/. 2,500.00",24/02/2025,07/03/2025,"EXPERIENCIA GENERAL
-	TRES (03) AÑOS DE EXPERIENCIA GENERAL EN EL SECTOR PÚBLICO Y/O PRIVADO.
EXPERIENCIA ESPECIFICA
-	UN (01) AÑO DE EXPERIENCIA EN EL SECTOR PUBLICO Y/O PRIVADO EN PRESUPUESTO Y FNANZAS(DESDE LA EXPEDICIÓN DEL TITULO).","TÍTULO PROFESIONAL UNIVERSITARIO EN CONTABILIDAD, ADMINISTRACIÓN, ECONOMÍA O INGENIERÍA INDUSTRIAL CON COLEGIATURA Y HABILITACIÓN VIGENTE.","CURSOS Y/O CAPACITACIONES Y/O PROGRAMAS DE ESPECIALIZACIÓN Y/O DIPLOMADOS EN GESTIÓN PÚBLICA, PLANIFICACIÓN ESTRATÉGICA, GERENCIA PUBLICA, CONTABILIDAD PÚBLICA O PRESUPUESTO PÚBLICO","GESTIÓN PÚBLICA, CONTABILIDAD PÚBLICA Y GUBERNAMENTAL, SISTEMA ADMINISTRATIVO DEL ESTADO, SIAF-SP, SIGA, GESTIÓN DE PROCESOS PLANIFICACIÓN, SISTEMA NACIONAL DE PRESUPUESTO, OFIMÁTICA Y OTRAS HERRAMIENTAS DE ADMINISTRACIÓN FINANCIERA.",•	CAPACIDAD ANALÍTICA •	PLANIFICACIÓN Y ORGANIZACIÓN DE INFORMACIÓN •	TRABAJO DE EN EQUIPO BAJO PRESIÓN  •	FACILIDAD DE COMUNICACIÓN •	ORIENTACIÓN A RESULTADOS •	HABILIDADES INNOVADORAS,ESPECIALISTA ADMINISTRATIVO- PRESUPUESTO Y FINANZAS,Unidad Ejecutora Educacion Huancayo,JUNIN - EL TAMBO
https://www.ugelyauli.edu.pe,1,276-02,"S/. 2,200.00",21/02/2025,06/03/2025,EXPERIENCIA GENERAL Y ESPECÍFICA DE ACUERDO AL PERFIL DE LA RVM-287-2019-MINEDU,QUINTO DE SECUNDARIA,RELACIONADOS AL PUESTO,RELACIONADOS AL PUESTO,"COMUNICACIÓN ACERTIVA, TRABAJO EN EQUIPO, EMPATIA RESOLUCIÓN DE CONFLICTOS",TRABAJADOR DE SERVICIO,Unidad Ejecutora: Educación Yauli - La Oroya,JUNIN - SANTA ROSA DE SACCO
https://app.qaliwarma.gob.pe/website/,1,D.Leg 1057 - Determinado (Necesidad Transitoria)-012,"S/. 2,500.00",21/02/2025,06/03/2025,"EXPERIENCIA GENERAL: EXPERIENCIA LABORAL MÍNIMA DE DOS (02) AÑOS EN EL SECTOR PÚBLICO Y/O PRIVADO. EXPERIENCIA ESPECÍFICA: EXPERIENCIA LABORAL MÍNIMA DE UN (01) AÑO EN PROGRAMAS Y/O PROYECTOS SOCIALES DE ALIMENTACIÓN O EDUCACIÓN O SALUD, Y/O EN SUPERVISIÓN DE PLANTAS DE PROCESAMIENTO DE ALIMENTOS Y/O EN ACTIVIDADES DE CONTROL DE CALIDAD O PRODUCCIÓN DE ALIMENTOS, EN EL SECTOR PÚBLICO Y/O PRIVADO.","PROFESIONAL CON GRADO ACADÉMICO DE BACHILLER O TITULO TÉCNICO SUPERIOR EN LAS CARRERAS DE EDUCACIÓN, NUTRICIÓN, ENFERMERÍA, MEDICINA HUMANA, TRABAJO SOCIAL, SOCIOLOGÍA, ANTROPOLOGÍA, BIOLOGÍA, GASTRONOMÍA, INGENIERÍA ALIMENTARIA, INGENIERÍA EN INDUSTRIAS ALIMENTARIAS, INGENIERÍA DE ALIMENTOS, INGENIERÍA PESQUERA, INGENIERÍA INDUSTRIAL, INGENIERÍA AGROINDUSTRIAL, INGENIERÍA QUÍMICA, INGENIERÍA AMBIENTAL, INGENIERÍA AGRÓNOMA, INGENIERÍA ZOOTECNISTA O AFINES.",CURSO EN BUENAS PRÁCTICAS DE HIGIENE Y/O MANIPULACIÓN DE ALIMENTOS (BPM) Y/O SISTEMAS HACCP Y PRE-REQUISITOS Y/O SISTEMAS DE GESTION DE LA CALIDAD E INOCUIDAD ALIMENTARIA O SIMILARES (MÍNIMO 12 HORAS ACUMULADAS)..,"CONOCIMIENTO EN LEGISLACIÓN ALIMENTARIA O NORMATIVA SANITARIA. CONOCIMIENTO EN PROMOCIÓN SOCIAL. CONOCIMIENTO DE OFIMÁTICA A NIVEL BÁSICO. DE PREFERENCIA: RESIDIR EN LA PROVINCIA A LA CUAL POSTULA. DE PREFERENCIA: DOMINIO DE ALGÚN IDIOMA O DIALECTO DE LA ZONA DE INTERVENCIÓN (QUECHUA, AYMARA O DE LA ZONA RESPECTIVA).","COMPETENCIAS GENÉRICAS: VOCACIÓN DE SERVICIO, TRABAJO EN EQUIPO Y ORIENTACION A RESULTADOS. COMPETENCIAS ESPECÍFICAS: PENSAMIENTO ANALÍTICO, COMUNICACIÓN EFECTIVA, SENTIDO DE URGENCIA E INTEGRIDAD Y COMPORTAMIENTO ÉTICO.",MONITOR DE GESTIÓN LOCAL,Programa Nacional De Alimentación Escolar Qali Warma,JUNIN - SATIPO
https://www.diresajunin.gob.pe/main.php/ver_documento/id/cvd161249badb6a651b7a63a72d009a5b5fb39d64.pdf,1,276-002,"S/. 2,659.00",21/02/2025,06/03/2025,EXPERIENCIA LABORAL MINIMA DE UN (01) AÑO CONTINUO EN EL SECTOR PUBLICO (MINSA),TITULADOS EN LAS CARRERAS UNIVERSITARIAS DE CIENCIAS ADMINISTRATIVAS O CARRERAS A FINES.,NIVEL BASICO DE CERTIFICACION OSCE,CONOCIMIENTO EN GESTION PUBLICA Y MANEJOS DE SISTEMAS ADMINISTRATIVOS.,ANÁLISIS; FACILIDAD DE COMUNICACIÓN; SÍNTESIS; TOMA DE DECISIONES; TRABAJO EN EQUIPO,ESPECIALISTA ADMINISTRATIVO II - AIRHSP N° 000036,Unidad Ejecutora: Red De Salud Pichanaki,JUNIN - PICHANAQUI
https://www.diresajunin.gob.pe/main.php/ver_documento/id/cvd161249badb6a651b7a63a72d009a5b5fb39d64.pdf,1,276-002,"S/. 2,572.00",21/02/2025,06/03/2025,EXPERIENCIA MININA DE UN (01) AÑO EN EL SECTOR PUBLICO (MINSA),TITULADOS TECNICO ADMINISTRATIVO O BACHILLER EN ESTUDIOS UNIVERSITARIOS EN ADMINISTRACION Y OTRO FINES.,CAPACITACIONES SEGUN PROFESION.,CONOCIMIENTO EN GESTION PUBLICA Y MANEJOS DE SISTEMAS ADMINISTRATIVOS.,ANÁLISIS; FACILIDAD DE COMUNICACIÓN; SÍNTESIS; TOMA DE DECISIONES; TRABAJO EN EQUIPO,TECNICO ADMINISTRATIVO II,Unidad Ejecutora: Red De Salud Pichanaki,JUNIN - PICHANAQUI
