job_posting_url,vacancies,job_posting_number,salary,start_publication_date,end_publication_date,required_experience,educational_background,specialization,required_knowledge,skills,job_title,public_institution,ubication
https://www.facebook.com/profile.php?id=100063500589390,1,D.Leg 1057 - Determinado (Necesidad Transitoria)-6,"S/. 3,500.00",05/03/2025,18/03/2025,"EXPERIENCIA GENERAL:
•	EXPERIENCIA GENERAL DE DOS (02) AÑOS EN EL SECTOR PÚBLICO O PRIVADO.
EXPERIENCIA ESPECÍFICA:
•	EXPERIENCIA ESPECÍFICA DE UN (01) AÑO EN LA MATERIA DEL PUESTO O PUESTOS SIMILARES.","TÍTULO PROFESIONAL UNIVERSITARIO EN ADMINISTRACIÓN, CONTADOR PÚBLICO, ECONOMISTA O PROFESIÓN QUE INCLUYA ESTUDIOS RELACIONADOS CON LA ESPECIALIDAD.",EXPERIENCIA GENERAL: •	EXPERIENCIA GENERAL DE DOS (02) AÑOS EN EL SECTOR PÚBLICO O PRIVADO. EXPERIENCIA ESPECÍFICA: •	EXPERIENCIA ESPECÍFICA DE UN (01) AÑO EN LA MATERIA DEL PUESTO O PUESTOS SIMILARES.,"•	OFIMÁTICA EN NIVEL INTERMEDIO: PROCESADOR DE TEXTOS (WORD; OPEN OFFICE WRITE, ETC.) / HOJAS DE CÁLCULO (EXCEL; OPEN CALC, ETC.) /                                                                                                                                                                                                                PROGRAMA DE PRESENTACIONES (POWER POINT; PREZI; ETC.).",•	ORIENTACIÓN A RESULTADOS •	TRABAJO EN EQUIPO •	VOCACIÓN DE SERVICIO •	LIDERAZGO,PROFESIONAL ESPECIALISTA EN PRESUPUESTO/RACIONALIZACIÓN CAS SEDE 2025 JURISDICCIÓN DE UGEL AYABACA,Unidad De Gestion Educativa Local De Ayabaca,PIURA - AYABACA
https://www.facebook.com/profile.php?id=100063500589390,1,D.Leg 1057 - Determinado (Necesidad Transitoria)-4,"S/. 3,600.00",05/03/2025,18/03/2025,"EXPERIENCIA GENERAL:
•	EXPERIENCIA GENERAL DE DOS (02) AÑOS EN EL SECTOR PÚBLICO Y/O PRIVADO.
EXPERIENCIA ESPECÍFICA:
•	EXPERIENCIA ESPECÍFICA DE UN (01) AÑOS EN LA FUNCIÓN O LA MATERIA DEL PUESTO.
NIVEL MÍNIMO REQUERIDO
•	EXPERIENCIA EN EL ÁREA DE CONTABILIDAD PUBLICA",•	TÍTULO PROFESIONAL UNIVERSITARIO EN LAS CARRERAS DE CONTABILIDAD •	COLEGIADO Y HABILITADO,"•	CURSO O ESPECIALIZACIÓN EN CONTABILIDAD  •	CAPACITACIÓN EN CONTABILIDAD PÚBLICA •	CURSO DE SIAF, SIGA, PLAME, PDT","ETC.) / HOJAS DE CÁLCULO (EXCEL; OPEN CALC, ETC.) / PROGRAMA DE PRESENTACIONES (POWER POINT; PREZI; ETC.). •	CAPACITACIÓN EN PLAME Y PDT •	SIGA-SIAF",•	ORIENTACIÓN A RESULTADOS •	TRABAJO EN EQUIPO •	VOCACIÓN DE SERVICIO •	LIDERAZGO,PROFESIONAL RESPONSABLE DE LA OFICINA DE CONTABILIDAD CAS SEDE 2025 JURISDICCIÓN DE UGEL AYABACA,Unidad De Gestion Educativa Local De Ayabaca,PIURA - AYABACA
https://www.facebook.com/profile.php?id=100063500589390,1,D.Leg 1057 - Determinado (Necesidad Transitoria)-3,"S/. 3,500.00",05/03/2025,18/03/2025,"EXPERIENCIA GENERAL:
•	EXPERIENCIA GENERAL DE DOS (03) AÑOS EN EL SECTOR PÚBLICO.
EXPERIENCIA ESPECÍFICA:
•	EXPERIENCIA ESPECÍFICA DE UN (02) EN LA FUNCIÓN O MATERIA DEL PUESTO:
NIVEL MÍNIMO REQUERIDO
•	EXPERIENCIA EN LABORES TESORERÍA",•	TÍTULO PROFESIONAL UNIVERSITARIO EN CONTABILIDAD. •	COLEGIADO Y HABILITADO,"•	CURSO O ESPECIALIZACIÓN EN TESORERÍA •	CURSO DE SIAF, SIGA","•	OFIMÁTICA EN NIVEL INTERMEDIO: PROCESADOR DE TEXTOS (WORD; OPEN OFFICE WRITE, ETC.) / HOJAS DE CÁLCULO (EXCEL; OPEN CALC, ETC.) / PROGRAMA DE PRESENTACIONES (POWER POINT; PREZI; ETC.). •	SIGA  •	SIAF",•	ORIENTACIÓN A RESULTADOS •	TRABAJO EN EQUIPO •	VOCACIÓN DE SERVICIO •	LIDERAZGO,PROFESIONAL RESPONSABLE DE LA OFICINA DE TESORERIA  CAS SEDE 2025 JURISDICCIÓN DE UGEL AYABACA,Unidad De Gestion Educativa Local De Ayabaca,PIURA - AYABACA
https://www.facebook.com/profile.php?id=100063500589390,1,D.Leg 1057 - Determinado (Necesidad Transitoria)-1,"S/. 3,000.00",05/03/2025,18/03/2025,"EXPERIENCIA GENERAL:
•	 EXPERIENCIA GENERAL DE TRES (02) AÑOS EN EL SECTOR PÚBLICO Y/O PRIVADO.
EXPERIENCIA ESPECÍFICA:
•	 EXPERIENCIA ESPECÍFICA DE UN (01) AÑOS EN LA FUNCIÓN O LA MATERIA DEL PUESTO","•	TÍTULO TÉCNICO, TÍTULO PROFESIONAL EN EDUCACIÓN, CONTABILIDAD, ADMINISTRACIÓN RELACIONADO CON LA ESPECIALIDAD.","•	ESPECIALIZACIÓN EN GESTIÓN PÚBLICA,  COMPUTACIÓN E INFORMÁTICA,  •	CAPACITACIÓN EN SECRETARIADO EJECUTIVO","•	OFIMÁTICA EN NIVEL INTERMEDIO: PROCESADOR DE TEXTOS (WORD; OPEN OFFICE WRITE, ETC.) / HOJAS DE CÁLCULO (EXCEL; OPEN CALC, ETC.) / PROGRAMA DE PRESENTACIONES (POWER POINT; PREZI; ETC.). •	CAPACITACIÓN EN GESTIÓN PÚBLICA Y SECRETARIADO EJECUTIVO",•	ORIENTACIÓN A RESULTADOS •	TRABAJO EN EQUIPO •	VOCACIÓN DE SERVICIO •	LIDERAZGO,TECNICO ADMINISTRATIVO DE DIRECCION CAS SEDE 2025  JURISDICCIÓN DE UGEL AYABACA,Unidad De Gestion Educativa Local De Ayabaca,PIURA - AYABACA
https://www.facebook.com/profile.php?id=100063500589390,1,D.Leg 1057 - Determinado (Necesidad Transitoria)-5,"S/. 3,500.00",05/03/2025,18/03/2025,"EXPERIENCIA GENERAL:
•	EXPERIENCIA GENERAL DE DOS (02) AÑOS EN EL SECTOR PÚBLICO O PRIVADO.
EXPERIENCIA ESPECÍFICA:
•	EXPERIENCIA ESPECÍFICA DE DOS (01) AÑOS EN LA FUNCIÓN O LA MATERIA DEL PUESTO.","•	TÍTULO PROFESIONAL UNIVERSITARIO EN ADMINISTRACIÓN, CONTABILIDAD Y ECONOMÍA. •	COLEGIADO Y HABILITADO  •	CERTIFICACIÓN OFICIAL OSCE","•	CURSO O ESPECIALIZACIÓN EN CONTRATACIONES DEL ESTADO •	CURSO DE SIAF, SIGA, SEACE","•	OFIMÁTICA EN NIVEL INTERMEDIO: PROCESADOR DE TEXTOS (WORD; OPEN OFFICE WRITE, ETC.) / HOJAS DE CÁLCULO (EXCEL; OPEN CALC, ETC.) /                                                                                                                                                                                                                PROGRAMA DE PRESENTACIONES (POWER POINT; PREZI; ETC.).",•	ORIENTACIÓN A RESULTADOS •	TRABAJO EN EQUIPO •	VOCACIÓN DE SERVICIO •	LIDERAZGO,PROFESIONAL ESPECIALISTA EN LA OFICINA DE ABASTECIMIENTOS CAS SEDE 2025 JURISDICCIÓN DE UGEL AYABACA,Unidad De Gestion Educativa Local De Ayabaca,PIURA - AYABACA
https://convocatorias.regionpiura.gob.pe/dra,17,D.Leg 1057 - Determinado (Necesidad Transitoria)-01,"S/. 4,350.00",04/03/2025,17/03/2025,05 AÑOS,INGENIERO FORESTAL/INGENIERO AGRONOMO/MEDICO VETERINARIO/BIOLOGO,CURSO Y/O CAPACITACIÓN EN MANEJO DE LOS RECURSOS NATURALES Y DE FAUNA SILVESTRE O AFINES.,NORMATIVIDAD EN LEGISLACIÓN FORESTAL Y DE FAUNA SILVESTRE. ¿ GESTIÓN SOSTENIBLE DE RECURSOS FORESTALES Y DE FAUNA SILVESTRE. ¿ CONTROL FORESTAL Y DE FAUNA SILVESTRE.,-,ESPECIALISTA EN FORESTAL Y  FAUNA SILVESTRE,Direccion Regional Agraria Piura,PIURA - CASTILLA
https://convocatorias.regionpiura.gob.pe/dra,1,D.Leg 1057 - Determinado (Necesidad Transitoria)-01,"S/. 3,500.00",04/03/2025,17/03/2025,05 AÑOS,CONTADOR P+UBLICO,"CURSO Y/O CAPACITACIÓN ESPECIALIZADA EN EL ÁREA, REALIZADO EN LOS ÚLTIMOS CINCO (05) AÑOS, CON UNA DURACIÓN  MÍNIMA DE DOCE (12) HORAS.","REDACCIÓN, ORTOGRAFÍA, GESTIÓN ADMINISTRATIVA Y/O MANEJO DE INFORMACIÓN. • GESTIÓN PÚBLICA. • SISTEMAS ADMINISTRATIVOS.",-,ESPECIALISTA EN GESTION  ADMINISTRATIVA,Direccion Regional Agraria Piura,PIURA - CASTILLA
https://convocatorias.regionpiura.gob.pe/dra,2,D.Leg 1057 - Determinado (Necesidad Transitoria)-01,"S/. 4,350.00",04/03/2025,17/03/2025,05 AÑOS,ECONOMISTA,CURSO Y/O CAPACITACIÓN EN MANEJO DE LOS RECURSOS NATURALES Y DE FAUNA SILVESTRE O AFINES.,ELABORACION DE DOCUMENTOS DE GESTION. ¿ ELABORACION DE PROYECTOS DE INVERSION PUBLICA ¿ ELABORACION DE DIAGNOSTICOS. ¿ NORMATIVIDAD EN LEGISLACIÓN FORESTAL Y DE FAUNA SILVESTRE. ¿ GESTIÓN SOSTENIBLE DE RECURSOS FORESTALES Y DE FAUNA SILVESTRE. ¿ CONTROL FORESTAL Y DE FAUNA SILVESTRE.,-,ESPECIALISTA EN PLANIFICACIÓN Y  DE INVERSION PUBLICA,Direccion Regional Agraria Piura,PIURA - CASTILLA
https://convocatorias.regionpiura.gob.pe/dra,1,276-02,"S/. 2,622.00",04/03/2025,17/03/2025,"•	EXPERIENCIA LABORAL GENERAL, MÍNIMA DE TRES (03) AÑOS EN EL SECTOR PÚBLICO Y/O PRIVADO.
•	EXPERIENCIA LABORAL ESPECÍFICA, NO MENOR DE DOS (02) AÑOS EN LABORES CON ORGANIZACIONES AGRARIAS Y/O EN FUNCIONES RELACIONADAS AL PUESTO EN EL SECTOR PÚBLICO O PRIVADO.",•	TITULO EMITIDO POR UN INSTITUTO TECNOLÓGICO AGROPECUARIO RECONOCIDO O ESTUDIOS UNIVERSITARIOS CONCLUIDOS DE UN PROGRAMA ACADÉMICO DE CIENCIAS AGROPECUARIAS.,"•	CURSO EN OFIMÁTICA REALIZADO EN LOS ÚLTIMOS CINCO (05) AÑOS, CON UNA DURACIÓN MÍNIMA DE DOCE (12) HORAS.",-,-,TECNICO AGROPECUARIO III,Direccion Regional Agraria Piura,PIURA - HUANCABAMBA
https://convocatorias.regionpiura.gob.pe/uchulucanas,1,D.Leg 1057 - Determinado (Necesidad Transitoria)-002,"S/. 1,414.19",04/03/2025,17/03/2025,1 AÑO,5TO DE SECUNDARIA,NO APLICA,"MANEJO EFICIENTE Y ORGANIZADO DE LOS INSUMOS Y RECURSOS DE MANTENIMIENTO Y DESINFECCIÓN, DE PROCEDIMIENTOS, TÉCNICAS, INSUMOS Y HERRAMIENTAS DE MANTENIMIENTO Y DESINFECCIÓN","ORIENTACIÓN AL SERVICIO, ORDEN, TRABAJO EN EQUIPO, PROACTIVIDAD, RESPONSABILIDAD Y PUNTUALIDAD",PERSONAL DE LIMPIEZA Y MANTENIMIENTO,Unidad De Gestion Educativa Local De Chulucanas,PIURA - CHULUCANAS
https://convocatorias.regionpiura.gob.pe/uchulucanas,2,D.Leg 1057 - Determinado (Necesidad Transitoria)-002,"S/. 2,764.19",04/03/2025,17/03/2025,02 AÑOS,PSICÓLOGO,NO APLICA,"CONOCIMIENTO SOBRE GESTIÓN: PLANIFICACIÓN, ORGANIZACIÓN Y PROMOCIÓN DE LA CONVIVENCIA DEMOCRÁTICA E INTERCULTURAL EN LA IE. CONOCIMIENTO EN ESTRATEGIAS DE PREVENCIÓN EN ASPECTOS SOCIOEMOCIONALES. CONOCIMIENTO GENERAL DE LA NORMATIVIDAD Y PROCESOS EDUCATIVOS. CONOCIMIENTO DE ENFOQUES DE DERECHO Y GÉNERO. CONOCIMIENTO EN ARTICULACIÓN CON INSTITUCIONES PÚBLICAS Y PRIVADAS. CONOCIMIENTOS SOBRE GESTIÓN ESCOLAR Y FUNCIONAMIENTO DE LAS IIEE JEC.",CAPACITACIÓN EN HABILIDADES SOCIALES Y/O ACTIVIDADES CON ADOLESCENTES.,PSICÓLOGOS,Unidad De Gestion Educativa Local De Chulucanas,PIURA - CHULUCANAS
https://www.gob.pe/municolan,1,D.Leg 1057 - Determinado (Necesidad Transitoria)-002,"S/. 4,000.00",04/03/2025,17/03/2025,". EXPERIENCIA GENERAL NO MENOR DE (2 ) AÑOS EN EL SECTOR PÚBLICO Y/O PRIVADO.
.  EXPERIENCIA ESPECIFICA  NO MENOR DE (6) MESES EN EL SECTOR PÚBLICO EN CARGOS SIMILARES.",TITULADO EN CIENCIAS MILITARES O AFINES POR LA FORMACIÓN.,NO REQUIERE,"TÉCNICOS REQUERIDOS PARA EL PUESTO: (NO REQUIERE SUSTENTACIÓN) • CURSOS, FORUMS, TALLERES Y/O SEMINARIOS RELACIONADOS A LA SEGURIDAD CIUDADANA.",". CAPACIDAD PARA TRABAJAR EN EQUIPO Y BAJO PRESIÓN . CONDUCTA RESPONSABLE, HONESTA Y POR ACTIVA.",COORDINADOR DE SEGURIDAD CIUDADANA,Municipalidad Distrital De Colan,PIURA - COLAN
https://www.gob.pe/municolan,1,D.Leg 1057 - Determinado (Necesidad Transitoria)-002,"S/. 4,000.00",04/03/2025,17/03/2025,"- EXPERIENCIA GENERAL NO MENOR DE (03) AÑOS EN EL SECTOR PÚBLICO Y/O PRIVADO.
- EXPERIENCIA ESPECIFICA NO MENOR DE (02) AÑOS EN EL SECTOR PÚBLICO EN CARGOS SIMILARES DE COORDINADOR O DE JEFATURA DE PLANEAMIENTO URBANO Y CATASTRO .","TITULADO EN ARQUITECTURA Y/O INGENIERIA CIVIL , COLEGIADO Y HABILITADO.",-,"- CONOCIMIENTO EN SOFTWARE, AUTOCAD Y CARTOGRAFIA.","- CAPACIDAD PARA TRABAJAR EN EQUIPO Y BAJO PRESIÓN. - CONDUCTA RESPONSABLE, HONESTA Y POR ACTIVA",COORDINADOR DE PLANEAMIENTO URBANO Y CATASTRO,Municipalidad Distrital De Colan,PIURA - COLAN
https://www.gob.pe/municolan,1,D.Leg 1057 - Determinado (Necesidad Transitoria)-002,"S/. 2,800.00",04/03/2025,17/03/2025,"EXPERIENCIA GENERAL NO MENOR DE (1) AÑO EN EL SECTOR PÚBLICO Y/O PRIVADO
.  EXPERIENCIA ESPECIFICA  NO MENOR DE (6 ) MESES EN EL SECTOR PÚBLICO EN CARGOS SIMILARES.",. EDUCACION SUPERIOR COMPLETA.,NO REQUIERE,CURSOS Y/ O DIPLOMADOS EN TEMAS PARA EL CARGO.,". CAPACIDAD PARA TRABAJAR EN EQUIPO Y BAJO PRESIÓN . CONDUCTA RESPONSABLE, HONESTA Y POR ACTIVA",FISCALIZADOR,Municipalidad Distrital De Colan,PIURA - COLAN
https://www.gob.pe/municolan,1,D.Leg 1057 - Determinado (Necesidad Transitoria)-002,"S/. 4,500.00",04/03/2025,17/03/2025,". EXPERIENCIA GENERAL NO MENOR DE (4 ) AÑOS EN EL SECTOR PÚBLICO Y/O PRIVADO.
.  EXPERIENCIA ESPECIFICA  NO MENOR DE (3) AÑOS EN CARGOS Y / O FUNCIONES SIMILARES EN EL SECTOR PÚBLICO.","TITULADO EN ADMNINISTRACIÓN, ECONOMÍA, INGENIERÍAS O AFINES POR LA FORMACIÓN. . COLEGIADO Y HABILITADO.",NO REQUIERE,"ESTUDIOS DE ESPECIALIZACION, DIPLOMADOS Y/O CAPACITACIONES EN TEMAS RELACIONADOS AL CARGO.",". CAPACIDAD PARA TRABAJAR EN EQUIPO Y BAJO PRESIÓN . CONDUCTA RESPONSABLE, HONESTA Y POR ACTIVA.",GERENTE DE DESARROLLO ECONÓMICO,Municipalidad Distrital De Colan,PIURA - COLAN
https://convocatorias.regionpiura.gob.pe/uchulucanas,3,D.Leg 1057 - Determinado (Necesidad Transitoria)-002,"S/. 1,614.19",04/03/2025,17/03/2025,18 MESES,EGRESADO SUPERIOR TÉCNICA COMPUTACIÓN E INFORMÁTICA O EN COMPUTACIÓN O INFORMÁTICA O EN EDUCACIÓN CON ESPECIALIDAD DE COMPUTACIÓN O INFORMÁTICA,NO APLICA,"MANEJO DE ESTRATEGIAS Y HERRAMIENTAS DE USO DE TECNOLOGÍAS DE LA INFORMACIÓN Y COMUNICACIÓN CONOCIMIENTO Y MANEJO DE APLICACIONES Y SOLUCIONES TECNOLÓGICAS (PLATAFORMAS, APLICATIVOS, ENTRE OTROS). CONOCIMIENTO SOBRE GESTIÓN, PLANIFICACIÓN, ORGANIZACIÓN Y LIDERAZGO PARA LA ADMINISTRACIÓN DE RECURSOS TECNOLÓGICOS EN EL AULA. DE PREFERENCIA CON CONOCIMIENTOS EN ADMINISTRACIÓN DE SERVIDORES EN PLATAFORMA WINDOWS Y/O LINUX. CONOCIMIENTO DE NORMATIVIDAD VIGENTE VINCULADA A PROCESOS E INSTRUMENTOS DE GESTIÓN ESCOLAR Y DEL MODELO DE SERVICIO EDUCATIVO JEC CONOCIMIENTO EN REPARACIÓN O MANTENIMIENTO DE COMPUTADORAS.",CURSOS DE OFIMÁTICA COMO MÍNIMO DE 90 HORAS O CURSO DE REPARACIÓN O MANTENIMIENTO DE COMPUTADORAS. CURSO O DIPLOMADO O CAPACITACIÓN DE INTEGRACIÓN DE LAS TIC EN EL PROCESO DE ENSEÑANZA- APRENDIZAJE O AFINES COMO MÍNIMO DE 90 HORAS.,COORDINADOR DE INNOVACIÓN Y SOPORTE TECNOLÓGICO,Unidad De Gestion Educativa Local De Chulucanas,PIURA - CHULUCANAS
https://aplicativo.pj.gob.pe/psep/wfrmconvocatoriasv.aspx?tcon=c,1,D.Leg 1057 - Determinado (Suplencia)-004,"S/. 2,972.00",28/02/2025,13/03/2025,"EXPERIENCIA LABORAL MÍNIMA DE DOS (02) AÑOS, DE LAS CUALES UN (01) AÑO EN LA ESPECIALIDAD PENAL (ACREDITADO CON CERTIFICADO O CONSTANCIA DE TRABAJO).","TÍTULO PROFESIONAL DE ABOGADO(A), CON COLEGIATURA Y HABILITACIÓN PROFESIONAL VIGENTE.",DIPLOMADO Y/O PROGRAMA DE ESPECIALIZACIÓN EN EL NUEVO CÓDIGO PROCESAL PENAL O EN DERECHO PENAL (ACREDITADO). CURSO EN NUEVO CÓDIGO PROCESAL PENAL O EN DERECHO PENAL (ACREDITADO).,CONOCIMIENTO DEL TRÁMITE DEL NUEVO CÓDIGO PROCESAL PENAL. CONOCIMIENTO EN OFIMÁTICA,"ADAPTABILIDAD, ANÁLISIS, AUTOCONTROL, DINAMISMO, COOPERACIÓN",ESPECIALISTA JUDICIAL DE JUZGADO,Poder Judicial,PIURA - PARIÑAS
https://www.facebook.com/ugeltalara306,1,D.Leg 1057 - Determinado (Suplencia)-11,"S/. 3,064.19",26/02/2025,11/03/2025,2 AÑOS DE EXPERIENCIA GENERAL,"TÍTULO EN : DERECHO, ADMINISTRACIÓN, EDUCACIÓN , INGENIERÍA CIVIL, CONTABILIDAD, INGENIERÍA INDUSTRIAL, ECONOMÍA, INGENIERÍA DE SISTEMAS",NO APLICA.,"GESTIÓN PÚBLICA, LEGISLACIÓN LABORAL, LEY N° 30057 - LEY DEL SERVICIO CIVIL Y SISTEMA ADMINISTRATIVO DE GESTIÓN DE RECURSOS HUMANOS","•	ANÁLISIS, •	ORGANIZACIÓN DE INFORMACIÓN, •	COOPERACIÓN, •	COMUNICACIÓN ORAL Y •	ORDEN",ESPECIALISTA DE RECURSOS HUMANOS,Unidad De Gestion Educativa Local De Talara,PIURA - PARIÑAS
https://aplicativo.pj.gob.pe/psep/wfrmconvocatoriasv.aspx?tcon=c,1,D.Leg 1057 - Determinado (Necesidad Transitoria)-006,"S/. 4,000.00",26/02/2025,11/03/2025,"OBLIGATORIO: EXPERIENCIA LABORAL GENERAL NO MENOR DE DOS (02) AÑOS EN ENTIDADES PÚBLICAS Y/O PRIVADAS.
OBLIGATORIO: EXPERIENCIA ESPECIFICA NO MENOR DE UN (01) AÑO EN EL SECTOR PÚBLICO, EN EL PUESTO O LABORES SIMILARES.",OBLIGATORIO: TÍTULO PROFESIONAL EN DERECHO CON COLEGIATURA Y HABILIDAD VIGENTE,"DESEABLE: DIPLOMADOS, PROGRAMAS DE ESPECIALIZACIÓN Y/O CURSOS EN MATERIA DE DERECHO ADMINISTRATIVO, DERECHO PROCESAL ADMINISTRATIVO Y/O DERECHO LABORAL.","CONOCIMIENTO EN EL SISTEMA ADMINISTRATIVO DE GESTIÓN DE RECURSOS HUMANOS.  CONOCIMIENTO DE LOS REGÍMENES LABORALES CONTENIDOS EN LOS DECRETOS LEGISLATIVOS NROS. 276, 1057 Y 728.  CONOCIMIENTO Y MANEJO DE OFIMÁTICA.","REDACCIÓN, ANÁLISIS, ORGANIZACIÓN DE INFORMACIÓN, RAZONAMIENTO LÓGICO Y COMPRENSIÓN LECTORA.",PROFESIONAL EN DERECHO PARA LA OFICINA DE RR. HH,Corte Superior De Justicia De Piura,PIURA - PIURA
https://convocatorias.regionpiura.gob.pe/saludmorropon,1,D.Leg 1057 - Determinado (Necesidad Transitoria)-001,"S/. 2,900.00",26/02/2025,11/03/2025,EXPERIENCIA GENERAL MINIMA DE DOS (02) AÑOS EN EL SECTOR PUBLICO O PRIVADO EXPERIENCIA ESPECIFICA MINIMA DE DOS (02) AÑOS EN FUNCIONES SIMILARES EN SECTOR PUBLICO Y RESOLUCION DE SERUMS.,A) NIVEL EDUCATIVO:  UNIVERSITARIA COMPLETA B) GRADO/SITUACION ACADEMICA Y CARRERA/ESPECIALIDAD REQUERIDA: TITULO/LICENCIATURA (ENFERMERIA) C) COLEGIATURA: SI D) HABILIDAD PROFESIONAL: SI,CURSO EN GESTION DE SERVICIOS DE SALUD O SALUD PÚBLICA.,NORMAS TÉCNICAS EN MODELO DE ATENCIÓN INTEGRAL EN SALUD.  NORMA TÉCNICA DE SALUD  PARA EL CONTROL DEL CRECIMIENTO Y DESARROLLO DE LA NIÑA Y EL NIÑO. NORMA TÉCNICA DE SALUD ESQUEMA NACIONAL DE VACUNACION. NORMA TÉCNICA DE SALUD PARA EL MANEJO DE LA CADENA DE FRÍO EN LAS INMUNIZACIONES.  NORMA TÉCNICA DE REFERENCIA Y CONTRARREFERENCIA DE LOS ESTABLECIMIENTOS. DIRECTIVA SANITARIA SUPLEMENTACIÓN CON MULTIMICRONUTRIENTES Y HIERRO PARA LA PREVENCIÓN DE ANEMIA EN NIÑAS Y NIÑOS. NORMA TÉCNICA DE SALUD PARA LA GESTIÓN DE LA  HISTORIA CLÍNICA.,"TRABAJO EN EQUIPO, EMPATÍA, COOPERACIÓN  Y ORGANIZACIÓN.",ENFERMERA/O,Unidad Ejecutora 403 Salud Morropon - Chulucanas,PIURA - PACAIPAMPA
https://www.facebook.com/ugeldehuarmaca,7,D.Leg 1057 - Determinado (Necesidad Transitoria)-02,"S/. 1,414.19",25/02/2025,10/03/2025,01 AÑO,SECUNDARIA,NO REQUIERE,"MANEJO DE INSUMOS Y RECURSOS DE LIMPIEZA Y MANTENIMIENTO MANEJO DE PROCEDIMIENTOS PARA LA DESINFECCIÓN DE AMBIENTES, EQUIPOS Y MATERIALES DE LA INSTITUCIÓN EDUCATIVA CONOCIMIENTOS SOBRE EL FUNCIONAMIENTO DE LAS IIEE JEC.","CONTRIBUIR A BRINDAR UN MEJOR SERVICIO EDUCATIVO A TRAVÉS DEL MANTENIMIENTO Y LIMPIEZA PERMANENTE DE LOS ESPACIOS DE LA INSTITUCIÓN EDUCATIVA, AMBIENTES DE APRENDIZAJE, EQUIPOS Y MATERIALES EDUCATIVOS.",PERSONAL DE MANTENIMIENTO,Unidad De Gestion Educativa Local- Ugel Huarmaca,PIURA - HUARMACA
https://www.facebook.com/ugeldehuarmaca,15,D.Leg 1057 - Determinado (Necesidad Transitoria)-01,"S/. 1,414.19",25/02/2025,10/03/2025,01 AÑOS EN EL SECTOR PÚBLICO Y/O PRIVADO.,SECUNDARIA,NO REQUIERE,"CONOCIMIENTOS DE INSUMOS Y RECURSOS DE LIMPIEZA Y MANTENIMIENTO MANEJO DE PROCEDIMIENTOS PARA LA DESINFECCIÓN DE AMBIENTES, EQUIPOS Y MATERIALES DE LA INSTITUCIÓN EDUCATIVA CONOCIMIENTOS SOBRE EL FUNCIONAMIENTO DE LAS IIEE JER.","CONTRIBUIR A BRINDAR UN MEJOR SERVICIO EDUCATIVO A TRAVÉS DEL MANTENIMIENTO Y LIMPIEZA PERMANENTE DE LOS ESPACIOS DE LA INSTITUCIÓN EDUCATIVA, AMBIENTES DE APRENDIZAJE, EQUIPOS Y MATERIALES EDUCATIVOS.",PERSONAL DE MANTENIMIENTO,Unidad De Gestion Educativa Local- Ugel Huarmaca,PIURA - HUARMACA
https://www.facebook.com/ugeldehuarmaca,5,D.Leg 1057 - Determinado (Necesidad Transitoria)-02,"S/. 1,614.19",25/02/2025,10/03/2025,12 MESES EN EL SECTOR PÚBLICO.,TECNICO SUPERIOR,NO REQUIERE,"MANEJO DE ESTRATEGIAS Y HERRAMIENTAS DE USO DE TECNOLOGÍAS DE LA INFORMACIÓN Y COMUNICACIÓN. CONOCIMIENTO Y MANEJO DE APLICACIONES Y SOLUCIONES TECNOLÓGICAS (PLATAFORMAS, APLICATIVOS, ENTRE OTROS). CONOCIMIENTO SOBRE GESTIÓN. PLANIFICACIÓN, ORGANIZACIÓN Y LIDERAZGO PARA LA ADMINISTRACIÓN DE RECURSES TECNOLÓGICOS EN EL AULA. DE PREFERENCIA CON CONOCIMIENTOS EN ADMINISTRACIÓN DE SERVIDORES EN PLATAFORMA WINDOWS Y/O LINUX. CONOCIMIENTO DE NORMATIVIDAD VIGENTE VINCULADA A PROCESOS E INSTRUMENTOS DE GESTIÓN ESCOLAR Y DEL MODELO DE SERVICIO EDUCATIVO JEC CONOCIMIENTO EN REPARACIÓN O MANTENIMIENTO DE COMPUTADORAS.","BRINDAR SOPORTE A LOS DIRECTIVOS, COORDINADORES. DOCENTES, ENTRE OTROS. EN LA EJECUCIÓN DE ACTIVIDADES PEDAGÓGICAS QUE INTEGREN LAS TIC, MEDIANTE LA ASISTENCIA TÉCNICA, REALIZANDO ALFABETIZACIÓN DIGITAL A LOS DOCENTES Y PROMOVIENDO EL USO EFICIENTE DE LOS RECURSOS EDUCATIVOS. EQUIPOS TECNOLÓGICOS Y AMBIENTES DE APRENDIZAJE, DE MANERA PRESENCIAL Y/O REMOTA.",COORDINADOR DE INNOVACION Y SOPORTE TECNOLOGICO,Unidad De Gestion Educativa Local- Ugel Huarmaca,PIURA - HUARMACA
https://www.facebook.com/ugeldehuarmaca,7,D.Leg 1057 - Determinado (Necesidad Transitoria)-02,"S/. 2,764.19",25/02/2025,10/03/2025,01 AÑO,TITULADO/LICENCIATURA.,"CURSOS, DIPLOMADOS, Y/O PROGRAMAS DE ESPECIALIZACIÓN EN  PSICOLOGIA.","CONOCIMIENTO SOBRE GESTIÓN. PLANIFICACIÓN, ORGANIZACIÓN Y PROMOCIÓN DE LA CONVIVENCIA DEMOCRÁTICA E INTERCULTURAL EN LA IE. CONOCIMIENTO EN ESTRATEGIAS DE PREVENCIÓN EN ASPECTOS SOCIOEMOCIONALES. CONOCIMIENTO GENERAL DE LA NORMATIVIDAD Y PROCESOS EDUCATIVOS. CONOCIMIENTO DE ENFOQUES DE DERECHO Y GÉNERO. CONOCIMIENTO EN ARTICULACI6N CON INSTITUCIONES PÚBLICAS Y PRIVADAS. CONOCIMIENTOS SOBRE GESTIÓN ESCOLAR Y FUNCIONAMIENTO DE LAS IIEE JEC.","ORIENTAR LA LABOR DE DOCENTES, DIRECTIVOS Y OTROS MIEMBROS DE LA COMUNIDAD EDUCATIVA PARA BRINDAR SOPORTE SOCIOEMOCIONAL A LOS ESTUDIANTES Y SUS FAMILIAS PROMOVIENDO UNA SANA CONVIVENCIA, BASADA EN EL RESPETO PER EL OTRO, LA GESTIÓN Y RESOLUCIÓN DE CONFLICTOS, EL RECONOCIMIENTO DE LA DIVERSIDAD Y LA PRORNOCI6N DE LA PARTICIPACIÓN ESTUDIANTIL QUE PERMITA EL DESARROLLO INTEGRAL DE CADA ESTUDIANTE, A TRAVÉS DEL DESARROLLO DE LAS ACCIONES DE TUTORÍA Y ORIENTACI6N EDUCATIVA.",PSICOLOGO,Unidad De Gestion Educativa Local- Ugel Huarmaca,PIURA - HUARMACA
https://www.migraciones.gob.pe/oportunidades_laborales_2025/,2,D.Leg 1057 - Determinado (Necesidad Transitoria)-080,"S/. 3,000.00",25/02/2025,10/03/2025,"""• EXPERIENCIA GENERAL: TRES (03) AÑOS EN EL SECTOR PÚBLICO Y/O PRIVADO.
• EXPERIENCIA ESPECÍFICA: DOS (02) AÑOS EN PUESTO Y/O FUNCIÓN Y/O MATERIA.""",BACHILLER UNIVERSITARIO EN LA CARRERA DE DERECHO O CIENCIAS POLÍTICAS Y/O A FINES.,- PROGRAMA DE ESPECIALIZACIÓN Y/O DIPLOMADO EN DERECHO ADMINISTRATIVO O DERECHO CIVIL O PROCEDIMIENTO ADMINISTRATIVO SANCIONADOR.,"""LEY DEL PROCEDIMIENTO ADMINISTRATIVO GENERAL, DECRETO LEGISLATIVO 1350 SU REGLAMENTO Y MODIFICATORIAS. OFIMÁTICA A NIVEL BÁSICO.""","ANÁLISIS, SÍNTESIS, REDACCIÓN, COMUNICACIÓN ORAL, TRABAJO EN EQUIPO.",EVALUADOR (A),Superintendencia Nacional De Migraciones - Migraciones,PIURA - PIURA
https://www.gob.pe/munilahuaca,1,D.Leg 1057 - Determinado (Necesidad Transitoria)-001,"S/. 3,500.00",24/02/2025,07/03/2025,EXPERIENCIA GENERAL: UN (01) AÑO EN INSTITUCIONES PÚBLICAS Y/O PRIVADAS.,"TÍTULO PROFESIONAL DE INGENIERÍA CIVIL, ARQUITECTO Y/O CARRERAS AFINES, COLEGIADO.","A)ESPECIALIZACIÓN EN RESIDENCIA, SUPERVISIÓN, LIQUIDACIÓN Y  SEGURIDAD DE OBRAS. B)ESPECIALIZACIÓN EN CATASTRO MUNICIPAL, REGIONAL, URBANO Y RURAL. C)SEMINARIOS DE ESPECIALIZACIÓN EN CATASTRO.","A)CONOCIMIENTO DE DISEÑO DIGITAL B)CONOCIMIENTO DE WORD, EXCEL, POWER POINT C)CONOCIMIENTO DE LA LEY 27444, LEY DE PROCEDIMIENTO ADMINISTRATIVO GENERAL.",-	COMPROMISO -RESPONSABILIDAD -VOCACIÓN DE SERVICIO -COMUNICACIÓN -ORIENTACIÓN A RESULTADOS -ANÁLISIS Y SÍNTESIS -REDACCIÓN -PROACTIVIDAD -	MEJORA CONTINUA  -TRABAJO BAJO PRESIÓN,PROFESIONAL,Municipalidad Distrital De La Huaca,PIURA - LA HUACA
https://aplicativo.pj.gob.pe/psep/wfrmconvocatoriasv.aspx?tcon=c,1,D.Leg 1057 - Determinado (Necesidad Transitoria)-001,"S/. 2,572.00",24/02/2025,07/03/2025,"OBLIGATORIO: EXPERIENCIA NO MENOR DE UN (01) AÑO EN LABORES SIMILARES, DE PREFERENCIA.",OBLIGATORIO: ESTUDIOS UNIVERSITARIOS EN DERECHO (8VO CICLO).,"DESEABLE: DIPLOMADOS, PROGRAMAS DE ESPECIALIZACIÓN Y/O CURSOS EN DERECHO CONSTITUCIONAL, PENAL Y PROCESAL PENAL.",CONOCIMIENTOS Y MANEJO DE OFIMÁTICA.  	CONOCIMIENTO EN MATERIA RELACIONADA CON EL ÁMBITO DE SU COMPETENCIA.,"ORGANIZACIÓN, ADAPTABILIDAD, DINAMISMO, INICIATIVA",ASISTENTE JURISDICCIONAL,Corte Superior De Justicia De Piura,PIURA - PIURA
https://www.gob.pe/munilahuaca,1,D.Leg 1057 - Determinado (Necesidad Transitoria)-001,"S/. 3,950.00",24/02/2025,07/03/2025,"EXPERIENCIA GENERAL: 
CUATRO (04) AÑOS EN INSTITUCIONES PÚBLICAS Y/O PRIVADAS.",TÍTULO PROFESIONAL DE INGENIERÍA AMBIENTAL Y/O CARRERAS AFINES.,A)	CURSO DE FISCALIZACIÓN AMBIENTAL B)CURSO DE ESTUDIO DE IMPACTO AMBIENTAL. C)	CURSO DE MONITOREO Y EVOLUCIÓN DE LA CALIDAD AMBIENTAL D)	ESTUDIOS DE IMPACTO AMBIENTAL. E)	CURSO DE GESTIÓN Y MANEJO INTEGRAL DE LOS RESIDUOS SOLIDOS  F)	CURSO EN GESTIÓN PUBLICA,"A)CONOCIMIENTO DE DISEÑO DIGITAL  B)CONOCIMIENTO DE WORD, EXCEL, POWER POINT C)CONOCIMIENTO DE LA LEY 27444, LEY DE PROCEDIMIENTO ADMINISTRATIVO GENERAL.",-COMPROMISO -RESPONSABILIDAD -VOCACIÓN DE SERVICIO -COMUNICACIÓN -ORIENTACIÓN A RESULTADOS -ANÁLISIS Y SÍNTESIS -REDACCIÓN -PROACTIVIDAD -	MEJORA CONTINUA  -TRABAJO BAJO PRESIÓN,PROFESIONAL,Municipalidad Distrital De La Huaca,PIURA - LA HUACA
https://satsullana.site/,2,D.Leg 1057 - Determinado (Necesidad Transitoria)-001,"S/. 4,500.00",24/02/2025,07/03/2025,"GENERAL: 02 AÑOS
ESPECIFICA: 01 AÑO","BACHILLER EN DERECHO, CONTABILIDAD, ECONOMIA O ADMINISTRACION",LEY 26979 LEY DE PROCEDIMIENTO DE EJECUCION COACTIVA; LEY DE TRIBUTACION MUNICIPAL; CODIGO TRIBUTARIO. TOTAL 90 HORAS,LEY 26979 LEY DE PROCEDIMIENTO DE EJECUCION COACTIVA; LEY DE TRIBUTACION MUNICIPAL; CODIGO TRIBUTARIO,"COMUNICACION EFECTIVA, NEGOCIACION, ATENCION AL PUBLICO",AUXILIAR COACTIVO,Servicio De Administracion Tributaria De Sullana- Sat Sullana,PIURA - SULLANA
