job_posting_url,vacancies,job_posting_number,salary,start_publication_date,end_publication_date,required_experience,educational_background,specialization,required_knowledge,skills,job_title,public_institution,ubication
https://aplicativosweb2.sunafil.gob.pe/si.convocatoria/convocatoria,1,D.Leg 1057 - Determinado (Suplencia)-012,"S/. 8,000.00",28/01/2025,10/02/2025,"- EXPERIENCIA GENERAL MÍNIMA DE CINCO (05) AÑOS EN EL SECTOR PÚBLICO Y/O PRIVADO.
- EXPERIENCIA ESPECÍFICA MÍNIMA DE TRES (03) AÑOS EN CARGOS DE GESTIÓN EJECUTIVA (SUPERVISOR, COORDINADOR, ASESOR, JEFE O EN CARGOS EQUIVALENTES AL NIVEL MÍNIMO DE COORDINADOR); Y/O, REALIZANDO FUNCIONES EN MATERIA DE SEGURIDAD Y SALUD EN EL TRABAJO, DERECHO LABORAL,
FISCALIZACIÓN LABORAL O DERECHO ADMINISTRATIVO, EN PUESTOS CON EL NIVEL MÍNIMO DE ESPECIALISTA EN EL SECTOR PÚBLICO O PRIVADO.","- TÍTULO PROFESIONAL UNIVERSITARIO DE LAS CARRERAS DE DERECHO, ADMINISTRACIÓN, RELACIONES INDUSTRIALES, RECURSOS HUMANOS, ECONOMÍA, CONTABILIDAD, GESTIÓN PÚBLICA, INGENIERÍA INDUSTRIAL, INGENIERÍA AMBIENTAL, INGENIERÍA DE MINAS, INGENIERÍA DE SEGURIDAD Y SALUD EN EL TRABAJO. - CON COLEGIATURA Y HABILITACIÓN VIGENTE.","- DIPLOMADO O PROGRAMA DE ESPECIALIZACIÓN EN DERECHO LABORAL, SEGURIDAD Y SALUD EN EL TRABAJO, DERECHO ADMINISTRATIVO, DERECHO CONSTITUCIONAL, DERECHOS FUNDAMENTALES, DERECHOS HUMANOS, FISCALIZACIÓN LABORAL, O GESTIÓN PÚBLICA. (*) (*) PROGRAMA DE ESPECIALIZACIÓN CON UN MÍNIMO DE 90 HORAS.","CONOCIMIENTOS TÉCNICOS: - CONOCIMIENTO DE LA NORMATIVA SOCIO LABORAL, DE SEGURIDAD Y SALUD EN EL TRABAJO, DEL SISTEMA DE INSPECCIÓN DEL TRABAJO. - CONOCIMIENTO EN GESTIÓN PÚBLICA. - CONOCIMIENTO DEL DERECHO ADMINISTRATIVO O PROCEDIMIENTO ADMINISTRATIVO SANCIONADOR. - CONOCIMIENTO EN COMPUTACIÓN Y HERRAMIENTAS DE INTERNET. CONOCIMIENTO DE OFIMÁTICA: - WORD, EXCEL Y POWER POINT A NIVEL BÁSICO.",- PLANIFICACIÓN. - ORIENTACIÓN A RESULTADOS. - COOPERACIÓN. - ANÁLISIS. - LIDERAZGO. - VOCACIÓN DE SERVICIO.,SUBINTENDENTE/A DE FISCALIZACIÓN E INSTRUCCIÓN,Superintendencia Nacional De Fiscalizacion Laboral - Sunafil,AMAZONAS - CHACHAPOYAS
https://app.munichachapoyas.gob.pe/servicios/convocatorias/app/convocatorias.php,1,D.Leg 1057 - Determinado (Suplencia)-01,"S/. 3,500.00",28/01/2025,10/02/2025,NO MENOR A CUATRO (04) AÑOS,"UNIVERSIDAD COMPLETA - TITULADO EN ADMINISTRACIÓN, CONTABILIDAD, ECONOMIA, INGENIERIA INDUSTRIAL Y AFINES",NO REQUIERE,"GESTIÓN PUBLICA, SISTEMAS ADMINISTRATIVOS DEL ESTADO, RELACIONADOS A LA MATERIA, CONTRATACIONES DEL ESTADO, ABASTECIMIENTO, EJECUCIÓN DE PROCESOS DE SELECCION, ELABORACIÓN DE TDR, LEY DE PROCEDIMIENTO ADMINISTRATIVO, GESTIÓN PUBLICA ENTRE OTROS","COMPRENSIÓN LECTORA, CONTROL, ORGANIZACIÓN DE INFORMACIÓN, PLANIFICACIÓN, REDACCIÓN, COOPERACIÓN, DINAMISMO, EMPATIA, INICIATIVA, ORDEN",ESPECIALISTA EN CONTRATACIONES DEL ESTADO - SUPLENCIA,Municipalidad Provincial Chachapoyas,AMAZONAS - CHACHAPOYAS
https://app.munichachapoyas.gob.pe/servicios/convocatorias/app/convocatorias.php,1,D.Leg 1057 - Determinado (Necesidad Transitoria)-01,"S/. 1,500.00",28/01/2025,10/02/2025,NO MENOR A UN (01) AÑO,"TECNICA SUPERIOR COMPLETA - ADMINISTRACIÓN, CONTABILIDAD, COMPUTACIÓN O AFINES A LA FORMACIÓN PROFESIONAL",NO REQUIERE,CONOCIMIENTO EN NORMAS DE TRANSITO O SIMILARES AL PUESTO REQUERIDO,CAPACIDAD DE COORDINACIÓN Y ORGANIZACIÓN; ACTITUD PROACTIVA CON ORIENTACIÓN A RESULTADOS Y CAPACIDAD PARA TRABAJAR EN EQUIPO,SUPERVISOR DE TRANSPORTES,Municipalidad Provincial Chachapoyas,AMAZONAS - CHACHAPOYAS
https://app.munichachapoyas.gob.pe/servicios/convocatorias/app/convocatorias.php,10,D.Leg 1057 - Determinado (Necesidad Transitoria)-01,"S/. 1,500.00",28/01/2025,10/02/2025,NO APLICA PARA EL PUESTO REQUERIDO,PRIMARIA INCOMPLETA,NO REQUIERE,CONOCIMIENTOS TECNICOS EN LAS ACTIVIDADES OPERATIVAS A SU CARGO U AFINES AL PUESTO REQUERIDO,"AGILIDAD FISICA, FUERZA FISICA Y RESISTENCIA FISICA",RECOLECTOR DE RESIDUOS SOLIDOS,Municipalidad Provincial Chachapoyas,AMAZONAS - CHACHAPOYAS
https://app.munichachapoyas.gob.pe/servicios/convocatorias/app/convocatorias.php,1,D.Leg 1057 - Determinado (Necesidad Transitoria)-001,"S/. 3,000.00",28/01/2025,10/02/2025,NO MENOR DE CUATRO AÑOS,"INGENIERO DE SISTEMAS, INGENIERO INFORMATICO, INGENIERO DE COMPUTACION Y/O A FINES A LA FORMACION",NO APLICA,"ADMINISTRACION DE RECURSOS INFORMATICOS, ADMINISTRACION DE SISTEMAS DE INFORMACION SIGA - SIAF Y OTROS.","ANALISIS, CONTROL, ORGANIZACION DE INFORMACION, PLANIFICACION, REDACCION, COOPERACION, DINAMISMO, EMPATIA, INICIATIVA, ORDEN, LIDERAZGO.",PROFESIONAL EN TECNOLOGIAS DE LA INFORMACION,Municipalidad Provincial Chachapoyas,AMAZONAS - CHACHAPOYAS
https://app.munichachapoyas.gob.pe/servicios/convocatorias/app/convocatorias.php,12,D.Leg 1057 - Determinado (Necesidad Transitoria)-001,"S/. 1,200.00",28/01/2025,10/02/2025,NO MENOS DE SEIS (06) MESES.,SECUNDARIA COMPLETA,NO APLICA,CONOCIMIENTOS EN NORMAS DE TRANSITO O SIMILARES PARA EL PUESTO.,"CAPACIDAD DE COORDINACION, ACTIVIDAD PROACTIVA CON ORIENTACION A RESULTADOS, CAPACIDAD PARA TRABAJAR EN EQUIPO",PARQUEADOR VEHICULAR,Municipalidad Provincial Chachapoyas,AMAZONAS - CHACHAPOYAS
https://app.munichachapoyas.gob.pe/servicios/convocatorias/app/convocatorias.php,4,D.Leg 1057 - Determinado (Necesidad Transitoria)-01,"S/. 1,500.00",28/01/2025,10/02/2025,NO MENOR A UN (01) AÑO,SECUNDARIA COMPLETA,NO REQUIERE,CONOCIMIENTO TECNICO EN ACTIVIDADES OPERATIVAS RELACIONADAS AL PUESTO REQUERIDO,"COOPERACIÓN, AGILIDAD, EMPATIA, FUERZA Y RESISTENCIA FISICA",OPERADOR DE VIGILANCIA,Municipalidad Provincial Chachapoyas,AMAZONAS - CHACHAPOYAS
https://app.munichachapoyas.gob.pe/servicios/convocatorias/app/convocatorias.php,9,D.Leg 1057 - Determinado (Necesidad Transitoria)-01,"S/. 1,500.00",28/01/2025,10/02/2025,1,TECNICA SUPERIOR,NO REQUIERE,"LEY 2933 Y SU REGLAMENTO, NORMAS BASICAS, EN SEGURIDAD, OFIMATICA A NIVEL BASICO, HARDWARE Y SOFTWARE DE COMPUTADORAS, TENER UNA BUENA CAPACIDAD DE OBSERVACION Y AENCIÓN AL DETALLE PARA IDENTIFICAR COMPORTAMIENTOS SOSPECHOSOS O SITUACIONES INUSUALES EN LAS IMAGENES","VOCACION DE SERVICIO, COMUNICACIÓN ORAL, COOPERACION, DINAMISMO, EMPATIA, INICIATIVA, AGILIDAD FISICA, RESISTENCIA FISICA",OPERADOR DE CAMARAS DE VIDEO VIGILANCIA,Municipalidad Provincial Chachapoyas,AMAZONAS - CHACHAPOYAS
https://app.munichachapoyas.gob.pe/servicios/convocatorias/app/convocatorias.php,1,D.Leg 1057 - Determinado (Necesidad Transitoria)-01,"S/. 1,200.00",28/01/2025,10/02/2025,UN (01) AÑO DE EXPERIENCIA,SECUNDARIA COMPLETA,NO REQUIERE,PROCEDIMIENTO ADMINISTRATIVO GENERAL,"PROACTIVO, ORIENTADO A RESULTADOS, COMPRENSIÓN LECTORA, COMUNICACIÓN ORAL, VISIÓN ESTRATEGICA, TRABAJO EN EQUIPO Y CAPACIDAD DE GESTIÓN",NOTIFICADOR DE DOCUMENTOS,Municipalidad Provincial Chachapoyas,AMAZONAS - CHACHAPOYAS
https://app.munichachapoyas.gob.pe/servicios/convocatorias/app/convocatorias.php,1,D.Leg 1057 - Determinado (Necesidad Transitoria)-01,"S/. 1,200.00",28/01/2025,10/02/2025,SEIS (06) MESES DE EXPERIENCIA,SECUNDARIA COMPLETA,NO REQUIERE,PROCEDIMIENTO ADMINISTRATIVO GENERAL - LEY 27444,"PROACTIVO, ORIENTADO A RESULTADOS, COMPRENSIÓN LECTORA, COMUNICACIÓN ORAL, VISIÓN ESTRATEGICA, TRABAJO EN EQUIPO Y CAPACIDAD DE GESTIÓN",NOTIFICADOR,Municipalidad Provincial Chachapoyas,AMAZONAS - CHACHAPOYAS
https://app.munichachapoyas.gob.pe/servicios/convocatorias/app/convocatorias.php,2,D.Leg 1057 - Determinado (Necesidad Transitoria)-01,"S/. 1,200.00",28/01/2025,10/02/2025,UN (01) AÑO,SECUNDARIA COMPLETA,NO REQUIERE,PROCEDIMIENTO ADMINISTRATIVO GENERAL,"PROACTIVIDAD ORIENTADA A RESULTADOS CON CONOCIMIENTO Y UBICACIÓN DEL PLANO CATASTRAL, TRABAJO EN EQUIPO Y CAPACIDAD DE GESTIÓN",NOTIFICADOR,Municipalidad Provincial Chachapoyas,AMAZONAS - CHACHAPOYAS
https://app.munichachapoyas.gob.pe/servicios/convocatorias/app/convocatorias.php,1,D.Leg 1057 - Determinado (Necesidad Transitoria)-01,"S/. 4,000.00",28/01/2025,10/02/2025,NO MENOR A CUATRO (04) AÑOS,UNIVERSIDAD COMPLETA -  INGENIERIA CIVIL O ARQUITECTURA O ING. DE TRANSPORTES O ING. AMBIENTAL,NO REQUIERE,"CONOCIMIENTOS EN AUTOCAD, EN S10, MSPROJECT, CIVIL 3D","TRABAJO EN EQUIPO, PUNTUALIDAD, RESPONSABILIDAD, ORGANIZACIÓN, MANEJO DE GRUPOS DE TRABAJO, RESOLUCION DE PROBLEMAS",JEFE DE OPERACIONES DEL IVP,Municipalidad Provincial Chachapoyas,AMAZONAS - CHACHAPOYAS
https://app.munichachapoyas.gob.pe/servicios/convocatorias/app/convocatorias.php,4,D.Leg 1057 - Determinado (Necesidad Transitoria)-001,"S/. 1,800.00",28/01/2025,10/02/2025,NO MENOR DE DOS (02) AÑOS,EGRESADO,NO APLICA,CONOCIMIENTO EN NORMAS DE TRANSITOO SIMILARES PARA EL PUESTO.,"CAPACIDAD DE COORDINACION, ACTITUD PROACTIVA CON ORIENTACION A RESULTADOS, CAPACIDAD PARA TRABAJAR EN EQUIPO",INSPECTOR DE TRANSPORTES,Municipalidad Provincial Chachapoyas,AMAZONAS - CHACHAPOYAS
https://app.munichachapoyas.gob.pe/servicios/convocatorias/app/convocatorias.php,1,D.Leg 1057 - Determinado (Necesidad Transitoria)-01,"S/. 3,000.00",28/01/2025,10/02/2025,DOS (02) AÑOS,UNIVERSITARIA COMPLETA - TITULADO EN INGENIERIA CIVIL,MAESTRIA EN GESTIÓN PUBLICA O AFINES A LAS FUNCIONES DEL PUESTO,"CONOCIMIENTO DE LA LEY 29090, LEY DE REGULACIÓN DE HABILITACIONES URBANAS Y DE EDIFICACIONES Y SUS MODIFICATORIAS, LEY N° 27157, LEY DE REGULARIZACIÓN DE EDIFICACIONES, CONOCIMIENTO DE LA LEY N° 27444, LEY DE PROCEDIMIENTO ADMINISTRATIVO GENERAL Y SUS MODIFICATORIAS, NORMAS URBANISTICAS","PROFESIONAL PROACTIVO, ORIENTADO A RESULTADOS, ARTICULACIÓN CON EL ENTORNO POLITICO, VISIÓN ESTRATEGICA, TRABAJO EN EQUIPO Y CAPACIDAD DE GESTIÓN",INGENIERO REVISOR,Municipalidad Provincial Chachapoyas,AMAZONAS - CHACHAPOYAS
https://app.munichachapoyas.gob.pe/servicios/convocatorias/app/convocatorias.php,1,D.Leg 1057 - Determinado (Necesidad Transitoria)-001,"S/. 3,000.00",28/01/2025,10/02/2025,NO MENOR DE CUATRO (4) AÑOS,"TITULO EN INGENIERIA INDUSTRIAL, INGENIERO FORESTAL, INGENIERO AMBIENTALO A FINES.",NO APLICA,CONOCIMIENTO EN NORMATIVAS Y ORDENANZAS MUNICIPALES DE CONTROL DE ESTABLECIMIENTOS COMERCIALES Y PROCEDIMIENTO ADMINISTRATIVO SANCIONADOR O AFINES,"HONESTIDAD, VOCACION DE SERVICIO, ANALISIS, CONTROL, COMUNICACION ORAL, ORAL,ORGANIZACION DE INFORMACION, PLANIFICACION, REDACCION, REDACCION, COOPERACION DINAMISMO, EMPATIA, INICIATIVA, ORDEN, LIDERAZGO",FISCALIZADOR II,Municipalidad Provincial Chachapoyas,AMAZONAS - CHACHAPOYAS
https://app.munichachapoyas.gob.pe/servicios/convocatorias/app/convocatorias.php,1,D.Leg 1057 - Determinado (Necesidad Transitoria)-001,"S/. 2,000.00",28/01/2025,10/02/2025,NO MENOR DE UN (01) AÑO,"BACHILLER EN LAS CARRERAS DE INGENIERIAS, DERECHO, ECONOMIA, ADMINISTRACION, Y/O AFINES",NO APLICA,GESTION PUBLICA,"HONESTIDAD, VOCACION DE SERVICIOS, ANALISIS, CONTROL, COMUNICACION ORAL, ORGANIZACION DE INFORMACION, PLANIFICACION, REDACCION, COOPERACION, DINAMISMO, EMPATIA, INICIATIVA, ORDEN, LIDERAZGO.",FISCALIZADOR I,Municipalidad Provincial Chachapoyas,AMAZONAS - CHACHAPOYAS
https://app.munichachapoyas.gob.pe/servicios/convocatorias/app/convocatorias.php,1,D.Leg 1057 - Determinado (Necesidad Transitoria)-001,"S/. 2,500.00",28/01/2025,10/02/2025,NO MENOR DE DOS (02) AÑOS,BACHILLER,NO APLICA,"CONOCIMIENTO EN NORMATIVAS Y ORDENANZAS MUNICIPALES DE CONTROL DE ESTABLECIMIENTOS COMERCIALES PUBLICOS Y PRIVADOS, PROCEDIMIENTO ADMINISTRATIVO SANCIONADOR U OTROS A FINES AL PUESTO REQUERIDO","HONESTIDAD, VOCACION DE SERVICIO, ANALISIS, CONTROL, COMUNICACION ORAL, ORAL,ORGANIZACION DE INFORMACION, PLANIFICACION, REDACCION, REDACCION, COOPERACION DINAMISMO, EMPATIA, INICIATIVA, ORDEN, LIDERAZGO.",FISCALIZADOR I,Municipalidad Provincial Chachapoyas,AMAZONAS - CHACHAPOYAS
https://app.munichachapoyas.gob.pe/servicios/convocatorias/app/convocatorias.php,1,D.Leg 1057 - Determinado (Necesidad Transitoria)-001,"S/. 2,500.00",28/01/2025,10/02/2025,NO MENOR A UN (01) AÑO.,"TECNICO ELECTRICISTA INDUSTRIAL, INGENIERIA ELECTRICA, INGENIERIA MECANICA, Y AFINES A LA FORMACION",NO APLICA,"CONOCIMIENTO EN GESTION PUBLICA, AHORRO DE ENERGIA, INSTALACIONES ELECTRICAS RESIDENCIALES Y COMERCIALES","HONESTIDAD, VOCACION DE SERVICIO, ANALISIS, CONTROL, COMUNICACION ORAL, ORAL,ORGANIZACION DE INFORMACION, PLANIFICACION, REDACCION, REDACCION, COOPERACION DINAMISMO, EMPATIA, INICIATIVA",FISCALIZADOR EN TELECOMUNICACIONES,Municipalidad Provincial Chachapoyas,AMAZONAS - CHACHAPOYAS
https://app.munichachapoyas.gob.pe/servicios/convocatorias/app/convocatorias.php,1,D.Leg 1057 - Determinado (Necesidad Transitoria)-01,"S/. 1,800.00",28/01/2025,10/02/2025,1,"BACHILLER EN ING. AMBIENTAL, AGRONOMA, FORESTAL, BIOLOGIA, DERECHO, CIENCIAS POLITICAS, MEDICINA VETERINARIA Y AFINES",NO REQUIERE,"INTEREPRESTACIÓN DE LEYES EN MATERIA AMBIENTAL, PROCEDIMIENTO ADMINISTRATIVO SANCIONADOR Y TODO LO RELACIONADO CON LA LEY 27444","TRABAJO EN EQUIPO, LIDERAZGO Y TRABAJO SOBRE PRESIÓN",FISCALIZADOR (A) AMBIENTAL,Municipalidad Provincial Chachapoyas,AMAZONAS - CHACHAPOYAS
https://app.munichachapoyas.gob.pe/servicios/convocatorias/app/convocatorias.php,1,D.Leg 1057 - Determinado (Necesidad Transitoria)-1,"S/. 3,000.00",28/01/2025,10/02/2025,NO MENOR A CUATRO (04) AÑOS,"UNIVERSITARIA COMPLETA - TITULADO EN ADMINISTRACIÓN, CONTABILIDAD, ECONOMIA, INGENIERIA INDUSTRIAL O AFINES",NO REQUIERE,"CONOCIMIENTOS EN GESTIÓN PUBLICA, EJECUCIÓN PUBLICA, EJECUCIÓN FINANCIERA DE INGRESOS Y GASTOS, SISTEMA INTEGRADO DE ADMINISTRACIÓN FINANCIERA (SIAF) SISTEMA INTEGRADO DE GESTIÓN ADMINISTRATIVA (SIGA)","COMPRENSIÓN LECTORA, CONTROL, ORGANIZACIÓN DE INFORMACIÓN, PLANIFICACIÓN, REDACCIÓN, COOPERACIÓN, DINAMISMO, EMPATIA, INICIATIVA, ORDEN",ESPECIALISTA ADMINISTRATIVO,Municipalidad Provincial Chachapoyas,AMAZONAS - CHACHAPOYAS
https://app.munichachapoyas.gob.pe/servicios/convocatorias/app/convocatorias.php,1,D.Leg 1057 - Determinado (Necesidad Transitoria)-01,"S/. 3,000.00",28/01/2025,10/02/2025,NO MENOR A CINCO (05) AÑOS,"UNIVERSITARIA COMPLETA - TITULADO EN ADMINISTRACIÓN, ADMINISTRACIÓN Y TURISMO, CONTABILIDAD, ECONOMIA O AFINES",NO REQUIERE,"GESTIÓN PUBLICA, SIGA, CONTRATACIONES DEL ESTADO, EJECUCIÓN DE PROCESOS DE SELECCIÓN, ELABORACIÓN DE TDR, PRESUPUESTO PUBLICO, LEY DE PROCEDIMIENTO ADMINISTRATIVO, ENTRE OTROS","ANALISIS, CONTROL, ORGANIZACIÓN, PLANIFICACIÓN, REDACCIÓN, COOPERACIÓN, DINAMISMO, EMPATIA, INICIATIVA, ORDEN Y LIDERAZGO, TRABAJO EN EQUIPO, VISIÓN ESTRATEGICA",ESPECIALISTA ADMINISTRATIVO,Municipalidad Provincial Chachapoyas,AMAZONAS - CHACHAPOYAS
https://app.munichachapoyas.gob.pe/servicios/convocatorias/app/convocatorias.php,1,D.Leg 1057 - Determinado (Necesidad Transitoria)-001,"S/. 4,000.00",28/01/2025,10/02/2025,NO MENOR DE DOS (02) AÑOS,INGENIERO CIVIL,"COSTOS, PRESUPUESTO Y PROGRAMACION DE OBRAS Y/O OBRAS PUBLICAS Y/O ELABORACION DE EXPEDIENTES TECNICOS U OTROS A FINES DEL PUESTO REQUERIDO.",CONOCIMIENTO EN MANEJO DE MAQUINARIA Y AFINES AL PUESTO,"ANALISIS, CONTROL, ORGANIZACION DE INFORMACION, PLANIFICACION, REDACCION, COOPERACION, DINAMISMO, EMPATIA, INICIATIVA, ORDEN Y LIDERAZGO.",COORDINADOR(A) DE OPERACION Y MANTENIMIENTO,Municipalidad Provincial Chachapoyas,AMAZONAS - CHACHAPOYAS
https://app.munichachapoyas.gob.pe/servicios/convocatorias/app/convocatorias.php,1,D.Leg 1057 - Determinado (Necesidad Transitoria)-001,"S/. 3,500.00",28/01/2025,10/02/2025,NO MENOR DE TRES (03) AÑOS,ABOGADO,NO APLICA,GESTION PUBLICA O SISTEMA ADMINISTRATIVO DE GESTION DE RECURSOS HUMANOS OLEGISLACION LABORAL O LEY N° 30057 - LEY DEL SERVICIO CIVIL -SERVIR,"PROBIDAD Y CONDUCTA INTACHABLE, VOCACION DE SERVICIO AL PUBLICO, LEALTAD INSTITUCIONAL",COORDINADOR LEGAL EN RECURSOS HUMANOS,Municipalidad Provincial Chachapoyas,AMAZONAS - CHACHAPOYAS
https://app.munichachapoyas.gob.pe/servicios/convocatorias/app/convocatorias.php,1,D.Leg 1057 - Determinado (Necesidad Transitoria)-001,"S/. 4,000.00",28/01/2025,10/02/2025,NO MENOR DE CUATRO (5) AÑOS,INGENIERO CIVIL,NO APLICA,"CONOCIMIENTO EN SISTEMA ADMINISTRATIVO DE INVERSION PUBLICA, GESTION PUBLICA","ANALISIS, CONTROL, ORGANIZACION DE INFORMACION, PLANIFICACION, REDACCION, COOPERACION, DINAMISMO, EMPATIA, INICIATIVA, INICIATIVA, ORDEN, LIDERAZGO.",COORDINADOR EN FORMULACION DE PROYECTOS,Municipalidad Provincial Chachapoyas,AMAZONAS - CHACHAPOYAS
https://app.munichachapoyas.gob.pe/servicios/convocatorias/app/convocatorias.php,1,D.Leg 1057 - Determinado (Necesidad Transitoria)-001,"S/. 3,200.00",28/01/2025,10/02/2025,NO MENOR DE TRES (3) AÑOS,"LICENCIADO EN ADMINISTRACION DE EMPRESAS, CONTABILIDAD, ECONOMIA U OTRAS CARRERAS A FINES AL PUESTO REQUERIDO",NO APLICA,"CONOCIMIENTO EN CONTRATACIONES DEL ESTADO, SIGA, SIAF Y SEACE","PROACTIVO, ORIENTADO A RESULTADOS, ARTICULACION CON EL ENTORNO POLITICO, VISION ESTRATEGICA, TRABAJO EN EQUIPO Y CAPACITACION DE GESTION.",COORDINADOR EN CONTRATACIONES DEL ESTADO,Municipalidad Provincial Chachapoyas,AMAZONAS - CHACHAPOYAS
https://app.munichachapoyas.gob.pe/servicios/convocatorias/app/convocatorias.php,1,D.Leg 1057 - Determinado (Necesidad Transitoria)-001,"S/. 3,000.00",28/01/2025,10/02/2025,NO MENOR DE CUATRO (4) AÑOS,"TITULO PROFESIONAL DE CONTADOR, ECONOMISTA Y ADMINISTRACION",NO APLICA,"SISTEMA NACIONAL DE CONTABILIDAD, TESORERIA, ABASTECIMIENTO, PRESUPUESTO Y GESTION PUBLICA","RESPONSABLE, CRITERIO, VOCACION DE SERVICIO AL PUBLICO, TRABAJO EN EQUIPO Y LEALTAD INSTITUCIONAL",COORDINADOR CONTABLE,Municipalidad Provincial Chachapoyas,AMAZONAS - CHACHAPOYAS
https://app.munichachapoyas.gob.pe/servicios/convocatorias/app/convocatorias.php,9,D.Leg 1057 - Determinado (Necesidad Transitoria)-01,"S/. 1,500.00",28/01/2025,10/02/2025,1,SECUNDARIA COMPLETA,NO REQUIERE,"CONOCIMIENTO EN CONDUCCIÓN, MANEJO DEFENSIVO (NO ES OBLIGATORIO), MECANICA BASICA, LEY DE TRANSITO VEHICULAR","VOCACION DE SERVICIO, COMUNICACIÓN ORAL, COOPERACION, DINAMISMO, EMPATIA, INICIATIVA, AGILIDAD FISICA, RESISTENCIA FISICA",CONDUCTOR VEHICULAR,Municipalidad Provincial Chachapoyas,AMAZONAS - CHACHAPOYAS
https://app.munichachapoyas.gob.pe/servicios/convocatorias/app/convocatorias.php,2,D.Leg 1057 - Determinado (Necesidad Transitoria)-01,"S/. 2,500.00",28/01/2025,10/02/2025,NO MENOR A 01 AÑO,SECUNDARIA COMPLETA,NO REQUIERE,"REGLAMENTO NACIONAL DE TRANSITO, MECANICO O AUTOMOTRIZ Y MANEJO DEFENSIVO","VOCACION DE SERVICIO, COMUNICACIÓN ORAL, COOPERACIÓN, DINAMISMO, EMPATIA, INICIATIVA, COORDINACIÓN OJO-MANO-PIE",CONDUCTOR DE VEHICULO,Municipalidad Provincial Chachapoyas,AMAZONAS - CHACHAPOYAS
https://app.munichachapoyas.gob.pe/servicios/convocatorias/app/convocatorias.php,12,D.Leg 1057 - Determinado (Necesidad Transitoria)-01,"S/. 1,500.00",28/01/2025,10/02/2025,NO APLICA PARA EL PUESTO REQUERIDO,PRIMARIA INCOMPLETA,NO REQUIERE,CONOCIMIENTOS BASICOS SOBRE LIMPIEZA Y DESINFECCIÓN DE ESPACIOS PUBLICOS,"AGILIDAD FISICA, FUERZA FISICA Y RESISTENCIA FISICA",AUXILIAR DE LIMPIEZA Y BARRIDO DE CALLES,Municipalidad Provincial Chachapoyas,AMAZONAS - CHACHAPOYAS
https://app.munichachapoyas.gob.pe/servicios/convocatorias/app/convocatorias.php,1,D.Leg 1057 - Determinado (Necesidad Transitoria)-01,"S/. 2,000.00",28/01/2025,10/02/2025,NO MENOR DE DOS (02) AÑOS,"UNIVERSITARIA COMPLETA - EGRESADO EN DERECHO, ADMINISTRACIÓN, CONTABILIDAD O ECONOMIA",NO REQUIERE,"CONOCIMIENTO D ELA LEY DEL PROCEDIMIENTO COACTIVO Y SU REGLAMENTO, DERECHO ADMINISTRATIVO, CODIGO TRIBUTARIO Y EL TEXTO UNICO ORDENADO DEL REGLAMENTO NACIONAL DE TRANSITO","PROFESIONAL PROACTIVO, ORIENTADO A RESULTADOS Y CON SOLIDOS CONOCIMIENTO EN LA LEY N° 26979 LEY DE PROCEDIMIENTO DE EJECUCIÓN COACTIVA Y SU REGLAMENTO, DERECHO ADMINISTRATIVO Y/O TRIBUTARIO",AUXILIAR COACTIVO I,Municipalidad Provincial Chachapoyas,AMAZONAS - CHACHAPOYAS
https://app.munichachapoyas.gob.pe/servicios/convocatorias/app/convocatorias.php,1,D.Leg 1057 - Determinado (Necesidad Transitoria)-01,"S/. 2,000.00",28/01/2025,10/02/2025,UN (01) AÑO,UNIVERSITARIA COMPLETA - TITULADO EN ARQUITECTURA,MAESTRIA EN GESTIÓN PUBLICA O AFINES A LAS FUNCIONES DEL PUESTO,"PROCEDIMIENTO DE LA LEY N° 29090, LEY DE REGULACIÓN DE HABILITACIONES URBANAS Y DE EDIFIACIONES Y SUS MODIFICATORIAS, LEY N° 27157, LEY DE REGULARIZACIÓN DE EDIFICACIONES, DECRETO SUPREMO N° 012-2022-VIVIENDA, REGLAMENTO DE ACONDICIONAMIENTO TERRITORIAL Y PLANIFICACIÓN URBANA DEL DESARROLLO URBANO SOSTENIBLE Y LEY N° 27444 LEY DE PROCEDIMIENTO ADMINISTRATIVO GENERAL Y SUS MODIFICATORIAS. NORMAS URBANISTICAS","PROFESIONAL PROACTIVO, ORIENTADO A RESULTADOS, ARTICULACIÓN CON EL ENBTORNO POLITICO, VISIÓN ESTRATEGICA, TRABAJO EN EQUIPO Y CAPACIDAD DE GESTIÓN",ARQUITECTO,Municipalidad Provincial Chachapoyas,AMAZONAS - CHACHAPOYAS
https://app.munichachapoyas.gob.pe/servicios/convocatorias/app/convocatorias.php,1,D.Leg 1057 - Determinado (Necesidad Transitoria)-001,"S/. 3,000.00",28/01/2025,10/02/2025,EXPERIENCIA MINIMA DE CINCO (5) AÑOS,"TITULO PROFESIONAL DE CONTABILIDAD, ADMINISTRACION, INGENIERIA DE SISTEMAS O INGENIERIA INDUSTRIAL.",NO APLICA,"CONOCIMIENTO EN LEGISLACION LABORAL, CONOCIMIENTO EN GESTIOS DE COMPENSACIONES, CONOCIMIENTO EN GESTION DE RECURSOS HUMANOS.","ORIENTACION A RESULTADOS, VOCACION DE SERVICIOS Y TRABAJO EN EQUIPO.",ANALISTA I,Municipalidad Provincial Chachapoyas,AMAZONAS - CHACHAPOYAS
https://app.munichachapoyas.gob.pe/servicios/convocatorias/app/convocatorias.php,1,D.Leg 1057 - Determinado (Necesidad Transitoria)-001,"S/. 3,000.00",28/01/2025,10/02/2025,NO MENOR A UN AÑO Y SEIS MESES,ABOGADO,NO APLICA,"NORMATIVA RELACIONADA AL DERECHO ADMINISTRATIVO, GESTION PUBLICA Y GESTION MUNICIPAL","ANALISIS, CONTROL, ORGANIZACION DE INFORMACION, PLANIFICACION, REDACCION, COOPERACION, DINAMISMO, EMPATIA, INICIATIVA, ORDEN Y LIDERAZGO.",ANALISTA EN FISCALIZACION,Municipalidad Provincial Chachapoyas,AMAZONAS - CHACHAPOYAS
https://www.ugelcondorcanqui.gob.pe,1,D.Leg 1057 - Determinado (Necesidad Transitoria)-009,"S/. 3,364.19",27/01/2025,07/02/2025,"EXPERIENCIA GENERAL: 03 AÑOS DE EXPERIENCIA GENERAL
EXPERIENCIA ESPECÍFICA: 03 AÑOS EN EL DESARROLLO DE LA FUNCIÓN DOCENTE DE EDUCACIÓN FISICA O EN LABORES DE FORMACIÓN DEPORTIVA A ESTUDIANTES; 02 AÑOS EN EL SECTOR PÚBLICO DE EXPERIENCIA EN GESTIÓN DEPORTIVA Y/O GESTIÓN DE PROYECTOS EN EDUCACIÓN .Y/O EXPERIENCIA EN FORMACIÓN DEPORTIVA CON ESTUDIANTES MENORES A 17 AÑOS","TÉCNICA SUPERIOR (3 O 4 AÑOS) COMPLETA, TÍTULO/LICENCIA TURA EN LICENCIADO O PROFESOR DE EDUCACIÒN FISICA O TÉCNICO DEPORTIVO (AGENTE DEPORTIVO)",CURSO Y/O DIPLOMADO EN EDUCACIÓN FÍSICA Y/O CURSOS DE ESPECIALIZACIÓN DEPORTIVA Y/O GESTIÓN PÚBLICA,"GESTIÓN DEPORTIVA, GESTIÓN PÚBLICA, ORGANIZACIÓN DEPORTIVA Y RECREATIVA","PLANIFICACIÓN, ORGANIZACIÓN DE LA INFORMACIÓN, TRABAJO EN EQUIPO, RELACIONES INTERPERSONALES Y COMUNICACIÓN ORAL.",TECNICO DEPORTIVO CAS DE NÚCLEO DE LA INICIATIVA PEDAGÓGICA WIÑAQ,Unid.Gest.Educ.Local.Condorcanqui,AMAZONAS - NIEVA
https://www.ugelcondorcanqui.gob.pe,3,D.Leg 1057 - Determinado (Necesidad Transitoria)-006,"S/. 1,614.19",27/01/2025,07/02/2025,"EXPERIENCIA GENERAL: 12 MESES
EXPERIENCIA ESPECÍFICA: 10 MESES COMO COORDINADOR O ASISTENTE DE SOPORTE TÉCNICO DE LOS RECURSOS TECNOLÓGICOS EN IIEE O ENTIDAD PÚBLICA O PRIVADA. EN EL CASO DE PROFESOR EN
COMPUTACIÓN E INFORMÁTICA O BACHILLER EN EDUCACIÓN: 10 MESES COMO DOCENTE A CARGO DEL AULA DE INNOVACIÓN O LA QUE HAGA SUS VECES.","TÉCNICA SUPERIOR (3 O 4 AÑOS) COMPLETA, EGRESADO EN COMPUTACIÓN E INFORMÁTICA O COMPUTACIÓN O INFORMÁTICA O EN EDUCACIÓN CON ESPECIALIDAD DE COMPUTACIÓN O INFORMÁTICA.",CURSOS DE OFIMÁTICA COMO MÍNIMO DE 90 HORAS O CURSO DE REPARACIÓN O MANTENIMIENTO DE COMPUTADORAS. CURSO O DIPLOMADO O CAPACITACIÓN DE INTEGRACIÓN DE LAS TIC EN EL PROCESO DE ENSEÑANZA-APRENDIZAJE O AFINES COMO MÍNIMO DE 90 HORAS.,"MANEJO DE ESTRATEGIAS Y HERRAMIENTAS DE USO DE TECNOLOGÍAS DE LA INFORMACIÓN Y COMUNICACIÓN. CONOCIMIENTO Y MANEJO DE APLICACIONES Y SOLUCIONES TECNOLÓGICAS (PLATAFORMAS, APLICATIVOS, ENTRE OTROS). CONOCIMIENTO SOBRE GESTIÓN, PLANIFICACIÓN, ORGANIZACIÓN Y LIDERAZGO PARA LA ADMINISTRACIÓN DE RECURSOS TECNOLÓGICOS EN EL AULA. DE PREFERENCIA CON CONOCIMIENTOS EN ADMINISTRACIÓN DE SERVIDORES EN PLATAFORMA WINDOWS Y/O LINUX. CONOCIMIENTO DE NORMATIVIDAD VIGENTE VINCULADA A PROCESOS E INSTRUMENTOS DE GESTIÓN ESCOLAR Y DEL MODELO DE SERVICIO EDUCATIVO JEC CONOCIMIENTO EN REPARACIÓN O MANTENIMIENTO DE COMPUTADORAS.","INICIATIVA, ANÁLISIS, CONTROL, PLANIFICACIÓN.",COORDINADOR (A) DE INNOVACIÓN Y SOPORTE TECNOLÓGICO - JEC,Unid.Gest.Educ.Local.Condorcanqui,AMAZONAS - NIEVA
https://www.ugelcondorcanqui.gob.pe,28,D.Leg 1057 - Determinado (Necesidad Transitoria)-004,"S/. 1,664.19",27/01/2025,07/02/2025,"EXPERIENCIA GENERAL: UN (01) AÑO.
EXPERIENCIA ESPECÍFICA: DIEZ (10) MESES DE EXPERIENCIA EN LABORES COMO DOCENTE/EDUCADOR/TUTOR COMUNITARIO/AUXILIAR/PROMOTOR DE BIENESTAR/PROMOTOR COMUNITARIO/PROMOTOR DE SALUD O PROMOTOR SOCIAL","TÉCNICA BÁSICA (1 O 2 AÑOS) COMPLETA, EGRESADO",NO APLICA,MANEJO DE ESTRATEGIAS PARA LA GENERACIÓN DE UN CLIMA INSTITUCIONAL FAVORABLE PARA UNA CONVIVENCIA DEMOCRÁTICA E INTERCULTURAL.,"COMUNICACIÓN ORAL, DINAMISMO, EMPATÍA, INICIATIVA.",PROMOTOR(A) DE BIENESTAR,Unid.Gest.Educ.Local.Condorcanqui,AMAZONAS - NIEVA
