job_posting_url,vacancies,job_posting_number,salary,start_publication_date,end_publication_date,required_experience,educational_background,specialization,required_knowledge,skills,job_title,public_institution,ubication
https://ugel01ep.gob.pe - https://www.facebook.com/ugel01ep,1,D.Leg 1057 - Determinado (Necesidad Transitoria)-6,"S/. 4,264.19",07/02/2025,20/02/2025,"EXPERIENCIA GENERAL : 03 AÑOS (SECTOR PUBLICO O PRIVADO) EXPERIENCIA ESPECIFICA: 02 AÑOS DE EXPERIENCIA RELACIONADA A LA EDUCACIÓN INCLUSIVA Y/O DISCAPACIDAD Y/O TRASTORNOS DEL NEURODESARROLLO (TEA, TDAH, TRASTORNOS DE APRENDIZAJE) Y/O TALENTO Y SUPERDOTACIÓN Y/O TRABAJO EN IIEE ENSEÑANDO A ESTUDIANTES QUE ENFRENTAN BARRERAS EDUCATIVAS.(*) Y/O TUTORÍA Y/O CONVIVENCIA",BACHILLER EN EDUCACIÓN  (TECNICO Y/O UNIVERSITARIO) Y/O PSICOLOGÍA,"EDUCACIÓN INCLUSIVA Y/O DISEÑO UNIVERSAL PARA EL APRENDIZAJE Y/O DISCAPACIDAD Y/O TRASTORNOS DEL NEURODESARROLLO (TEA, TDAH, TRASTORNOS DE APRENDIZAJE) Y/O ESTRATEGIAS PARA ATENDER A LA DIVERSIDAD Y/O CNEB  Y/O TUTORÍA Y/O CONVIVENCIA Y/O ATENCIÓN A POBLACIONES VULNERABLES","CON  CONOCIMIENTOS SOBRE EL CNEB,  EDUCACIÓN INCLUSIVA Y/O ATENCIÓN A LA DIVERSIDAD Y/O DISEÑO UNIVERSAL PARA EL APRENDIZAJE Y/O ESTRATEGIAS DE ACOMPAÑAMIENTO A LA COMUNIDAD EDUCATIVA.","COMUNICACIÓN ASERTIVA, INICIATIVA, ANÁLISIS, CONTROL, PLANIFICACIÓN, EMPATÍA, LIDERAZGO Y TRABAJO EN EQUIPO.",PROFESIONAL DE APOYO SAEI,Unidad De Gestion Educativa Local 01- El Porvenir,LA LIBERTAD - EL PORVENIR
https://ugel01ep.gob.pe - https://www.facebook.com/ugel01ep,1,D.Leg 1057 - Determinado (Necesidad Transitoria)-5,"S/. 5,264.19",07/02/2025,20/02/2025,EXPERIENCIA GENERAL: 04 AÑOS ( PUBLICO Y/O PRIVADO). EXPERIENCIA ESPECÍFICA:  02 AÑOS DE EXPERIENCIA EN EDUCACIÓN INCLUSIVA Y/O ATENCIÓN A LA DIVERSIDAD Y/O DUA Y/O MONITOREO EN INSTITUCIONES EDUCATIVAS Y/O GESTIÓN EDUCATIVA*. Y/O TUTORÍA Y/O CONVIVENCIA.,BCHILLER EN EDUCACION  (TECNICO O LICENCIADO),"EDUCACIÓN INCLUSIVA Y/O DISEÑO UNIVERSAL PARA EL APRENDIZAJE Y/O DISCAPACIDAD Y/O TRASTORNOS DEL NEURODESARROLLO (TEA, TDAH, TRASTORNOS DE APRENDIZAJE) Y/O ESTRATEGIAS PARA ATENDER A LA DIVERSIDAD Y/O CNEB  Y/O TUTORÍA Y/O CONVIVENCIA Y/O ATENCIÓN A POBLACIONES VULNERABLES","CON  CONOCIMIENTOS SOBRE EL CNEB,  EDUCACIÓN INCLUSIVA Y/O ATENCIÓN A LA DIVERSIDAD Y/O DISEÑO UNIVERSAL PARA EL APRENDIZAJE Y/O ESTRATEGIAS DE ACOMPAÑAMIENTO A LA COMUNIDAD EDUCATIVA.","INICIATIVA, ANÁLISIS, ORGANIZACIÓN, PLANIFICACIÓN, LIDERAZGO, EMPATÍA, COMUNICACIÓN ASERTIVA Y TRABAJO EN EQUIPO.",COORDINADOR UGEL SAEE,Unidad De Gestion Educativa Local 01- El Porvenir,LA LIBERTAD - EL PORVENIR
"https://www.grell.gob.pe,https://www.facebook.com/profile.php?id=100016677391832",1,276-2,S/. 971.65,07/02/2025,20/02/2025,"EXPERIENCIA GENERAL MÍNIMA Y ESPECÍFICA
RELACIONADA EN EL CARGO AL QUE POSTULA O AFINES
EN EL SECTOR PÚBLICO Y/O PRIVADO REQUERIDO PARA
EVALUACIÓN ANEXO 6-C GRUPO
OCUPACIONAL AUXILIAR DE LA RVM Nº 287-2029-MINEDU",SECUNDARIA COMPLETA,CAPACITACIONES RELACIONADAS CON EL CARGO REALIZADAS EN LOS ÚLTIMOS 5 (CINCO) AÑOS CON UNA DURACIÓN MÍNIMA DE 24 HORAS,RELACIONADAS CON EL CARGO,"TOLERANTE, PROACTIVIDAD, RESPONSABILIDAD, TRABAJO EN EQUIPO, TOLERANCIA BAJO PRESIÓN, ORIENTACIÓN AL SERVIDOR Y PÚBLICO EN GENERAL",TRABAJA DOR DE SERVICIO I,Gerencia Regional De Educacion La Libertad,LA LIBERTAD - MOCHE
"https://www.gob.pe/regionlalibertad-gre,https://www.facebook.com/profile.php?id=100009038283806",1,276-2,"S/. 2,573.00",07/02/2025,20/02/2025,EXPERIENCIA EN LABORES TÉCNICAS DE LA ESPECIALIDAD,TÍTULO DE EDUCACIÓN SUPERIOR NO UNIVERSITARIA     RELACIONADO CON LA ESPECIALIDAD/ ANEXO 01 DE LA RVM N° 287-2019-MINEDU,MANEJO DE COMPUTADORA A NIVEL USUARIO Y DE APLICATIVOS     INFORMÁTICOS RELACIONADOS CON SU ACTIVIDAD,RELACIONADAS AL CARGO,"TOLERANTE, PROACTIVIDAD, RESPONSABILIDAD, TRABAJO EN EQUIPO, TOLERANCIA BAJO PRESIÓN, ORIENTACIÓN AL SERVIDOR Y PÚBLICO EN GENERAL",TECNICO ADMINISTRATIVO II,Gerencia Regional De Educacion La Libertad,LA LIBERTAD - TRUJILLO
"https://www.gob.pe/regionlalibertad-gre,https://www.facebook.com/profile.php?id=100009038283806",1,276-2,"S/. 2,573.00",07/02/2025,20/02/2025,EXPERIENCIA EN LABORES TÉCNICAS DE LA ESPECIALIDAD,TÍTULO DE EDUCACIÓN SUPERIOR NO UNIVERSITARIA     RELACIONADO CON LA ESPECIALIDAD/ ANEXO 01 DE LA RVM N° 287-2019-MINEDU,MANEJO DE COMPUTADORA A NIVEL USUARIO Y DE APLICATIVOS     INFORMÁTICOS RELACIONADOS CON SU ACTIVIDAD,RELACIONADAS AL CARGO,"TOLERANTE, PROACTIVIDAD, RESPONSABILIDAD, TRABAJO EN EQUIPO, TOLERANCIA BAJO PRESIÓN, ORIENTACIÓN AL SERVIDOR Y PÚBLICO EN GENERAL",TECNICO ADMINISTRATIVO II,Gerencia Regional De Educacion La Libertad,LA LIBERTAD - ASCOPE
https://www.grell.gob.pe - facebook institucional del iespp jose faustino sanchez carrio,1,276-1,"S/. 2,186.00",07/02/2025,20/02/2025,"ALGUNA EXPERIENCIA EN LABORES SIMILARES, POSEER UNA COMBINACIÓN EQUIVALENTE DE FORMACIÓN Y EXPERIENCIA",EDUCACIÓN SECUNDARIA COMPLETA,MANEJO DE COMPUTADORA A NIVEL DE USUARIO,RELACIONADAS CON EL CARGO,"OLERANTE, PROACTIVIDAD, RESPONSABILIDAD, TRABAJO EN EQUIPO, TOLERANCIA BAJO PRESIÓN, ORIENTACIÓN AL SERVIDOR Y PÚBLICO EN GENERAL",AUXILIAR DE LABORATORIO I,Gerencia Regional De Educacion La Libertad,LA LIBERTAD - HUAMACHUCO
https://unca.edu.pe/portalweb/,1,Docentes Universitarios Ley 30220-01,"S/. 8,469.82",07/02/2025,20/02/2025,"HABER EJERCIDO PREVIAMENTE LA DOCENCIA UNIVERSITARIA EN LA CATEGORÍA DE PROFESOR ASOCIADO POR LO MENOS CINCO (5) AÑOS, CONTABILIZADOS HASTA EL MOMENTO DE SU POSTULACIÓN. POR EXCEPCIÓN PODRÁN POSTULAR SIN HABER SIDO DOCENTE ASOCIADO. PROFESIONALES CON RECONOCIDA LABOR DE INVESTIGACIÓN CIENTÍFICA Y TRAYECTORIA ACADÉMICA, CON MÁS DE QUINCE (15) AÑOS DE EJERCICIO PROFESIONAL.",TÍTULO PROFESIONAL DE INGENIERO CIVIL O ARQUITECTO.,"CON GRADO ACADÉMICO DE DOCTOR, EL MISMO QUE DEBE HABER SIDO OBTENIDO CON ESTUDIOS PRESENCIALES.","DISEÑO ARQUITECTÓNICO, DIBUJO DE INGENIERÍA Y DIBUJO EN 2D ASISTIDO POR COMPUTADORA","COMUNICACIÓN EFECTIVA, ORGANIZACIÓN, TRABAJO EN EQUIPO, PENSAMIENTO CRÍTICO, LIDERAZGO, GESTIÓN DEL TIEMPO",PROFESOR PRINCIPAL A TIEMPO COMPLETO,Universidad Nacional Ciro Alegria - Unca,LA LIBERTAD - HUAMACHUCO
https://unca.edu.pe/portalweb/,1,Docentes Universitarios Ley 30220-01,"S/. 8,469.82",07/02/2025,20/02/2025,"HABER EJERCIDO PREVIAMENTE LA DOCENCIA UNIVERSITARIA EN LA CATEGORÍA DE PROFESOR ASOCIADO POR LO MENOS CINCO (5) AÑOS, CONTABILIZADOS HASTA EL MOMENTO DE SU POSTULACIÓN. POR EXCEPCIÓN PODRÁN POSTULAR SIN HABER SIDO DOCENTE ASOCIADO. PROFESIONALES CON RECONOCIDA LABOR DE INVESTIGACIÓN CIENTÍFICA Y TRAYECTORIA ACADÉMICA, CON MÁS DE QUINCE (15) AÑOS DE EJERCICIO PROFESIONAL.",TÍTULO PROFESIONAL DE INGENIERO CIVIL O ARQUITECTO.,"CON GRADO ACADÉMICO DE DOCTOR, EL MISMO QUE DEBE HABER SIDO OBTENIDO CON ESTUDIOS PRESENCIALES.","DISEÑO ARQUITECTÓNICO, DIBUJO DE INGENIERÍA Y DIBUJO EN 2D ASISTIDO POR COMPUTADORA","COMUNICACIÓN EFECTIVA, ORGANIZACIÓN, TRABAJO EN EQUIPO, PENSAMIENTO CRÍTICO, LIDERAZGO, GESTIÓN DEL TIEMPO",PROFESOR PRINCIPAL A TIEMPO COMPLETO,Universidad Nacional Ciro Alegria - Unca,LA LIBERTAD - HUAMACHUCO
https://unca.edu.pe/portalweb/,1,Docentes Universitarios Ley 30220-01,"S/. 8,469.82",07/02/2025,20/02/2025,"HABER EJERCIDO PREVIAMENTE LA DOCENCIA UNIVERSITARIA EN LA CATEGORÍA DE PROFESOR ASOCIADO, POR LO MENOS DE CINCO (5) AÑOS CONTABILIZADOS HASTA EL MOMENTO DE SU POSTULACIÓN.
• POR EXCEPCIÓN, PODRÁN POSTULAR SIN HABER SIDO DOCENTE ASOCIADO. PROFESIONALES CON RECONOCIDA LABOR DE INVESTIGACIÓN CIENTÍFICA Y TRAYECTORIA ACADÉMICA, CON MÁS DE QUINCE (15) AÑOS DE EJERCICIO PROFESIONAL.",TÍTULO PROFESIONAL DE INGENIERO AGRÍCOLA O INGENIERO FORESTAL O INGENIERO AMBIENTAL.,"CON GRADO ACADÉMICO DE DOCTOR, EL MISMO QUE DEBE HABER SIDO OBTENIDO CON ESTUDIOS PRESENCIALES.","CONOCIMIENTO EN BOTÁNICA FORESTAL, ECOLOGÍA Y SILVICULTURA FORESTAL Y DENDROLOGÍA FORESTAL","COMUNICACIÓN CIENTIFICA, TRABAJO EL EQUIPO, LIDERAZGO Y COMPETENCIAS METODOLOGIAS, TECNOLOGICAS, EPISTEMOLOGICAS, ETICAS, SOCIOCULTURALES",PROFESOR PRINCIPAL A TIEMPO COMPLETO,Universidad Nacional Ciro Alegria - Unca,LA LIBERTAD - HUAMACHUCO
https://unca.edu.pe/portalweb/,1,Docentes Universitarios Ley 30220-01,"S/. 8,469.82",07/02/2025,20/02/2025,"HABER EJERCIDO PREVIAMENTE LA DOCENCIA UNIVERSITARIA EN LA CATEGORÍA DE PROFESOR ASOCIADO, POR LO MENOS DE CINCO (5) AÑOS CONTABILIZADOS HASTA EL MOMENTO DE SU POSTULACIÓN.
• POR EXCEPCIÓN, PODRÁN POSTULAR SIN HABER SIDO DOCENTE ASOCIADO. PROFESIONALES CON RECONOCIDA LABOR DE INVESTIGACIÓN CIENTÍFICA Y TRAYECTORIA ACADÉMICA, CON MÁS DE QUINCE (15) AÑOS DE EJERCICIO PROFESIONAL.",TÍTULO PROFESIONAL DE INGENIERO AGRÍCOLA O INGENIERO FORESTAL O INGENIERO AMBIENTAL.,"CON GRADO ACADÉMICO DE DOCTOR, EL MISMO QUE DEBE HABER SIDO OBTENIDO CON ESTUDIOS PRESENCIALES.","CONOCIMIENTO EN BOTÁNICA FORESTAL, ECOLOGÍA Y SILVICULTURA FORESTAL Y DENDROLOGÍA FORESTAL","COMUNICACIÓN CIENTIFICA, TRABAJO EL EQUIPO, LIDERAZGO Y COMPETENCIAS METODOLOGIAS, TECNOLOGICAS, EPISTEMOLOGICAS, ETICAS, SOCIOCULTURALES",PROFESOR PRINCIPAL A TIEMPO COMPLETO,Universidad Nacional Ciro Alegria - Unca,LA LIBERTAD - HUAMACHUCO
https://unca.edu.pe/portalweb/,1,Docentes Universitarios Ley 30220-01,"S/. 4,958.00",07/02/2025,20/02/2025,PARA SER PROFESOR AUXILIAR SE REQUIERE TENER COMO MÍNIMO CINCO (5) AÑOS EN EL EJERCICIO PROFESIONAL.,TÍTULO PROFESIONAL DE LICENCIADO EN MATEMÁTICA O INGENIERO ESTADÍSTICO.,"CON GRADO ACADÉMICO DE MAESTRO, EL MISMO QUE DEBE HABER SIDO OBTENIDO CON ESTUDIOS PRESENCIALES.","CONOCIMIENTO EN MATEMÁTICA BÁSICA, GESTIÓN DE LA INFORMACIÓN Y ESTADÍSTICAS GENERAL","COMUNICACIÓN EFECTIVA, ORGANIZACIÓN, TRABAJO EN EQUIPO, PENSAMIENTO CRÍTICO, LIDERAZGO, GESTIÓN DEL TIEMPO",PROFESOR AUXILIAR A TIEMPO COMPLETO,Universidad Nacional Ciro Alegria - Unca,LA LIBERTAD - HUAMACHUCO
https://unca.edu.pe/portalweb/,1,Docentes Universitarios Ley 30220-01,"S/. 5,495.50",07/02/2025,20/02/2025,"HABER EJERCIDO PREVIAMENTE LA DOCENCIA UNIVERSITARIA EN LA CATEGORÍA DE PROFESOR AUXILIAR POR LO MENOS DE TRES (3) AÑOS, CONTABILIZADOS HASTA EL MOMENTO DE SU POSTULACIÓN.
 • POR EXCEPCIÓN PODRÁN POSTULAR SIN HABER SIDO DOCENTE AUXILIAR. PROFESIONALES CON RECONOCIDA LABOR DE INVESTIGACIÓN CIENTÍFICA Y TRAYECTORIA ACADÉMICA, CON MÁS DE DIEZ (10) AÑOS DE EJERCICIO PROFESIONAL.",TÍTULO PROFESIONAL DE INGENIERO CIVIL,"CON GRADO ACADÉMICO DE MAESTRO, EL MISMO QUE DEBE HABER SIDO OBTENIDO CON ESTUDIOS PRESENCIALES","CONOCIMIENTO EN TECNOLOGÍA DE LOS MATERIALES, TOPOGRAFÍA BÁSICA Y PROCESOS CONSTRUCTIVOS","COMUNICACIÓN EFECTIVA, ORGANIZACIÓN, TRABAJO EN EQUIPO, PENSAMIENTO CRÍTICO, LIDERAZGO, GESTIÓN DEL TIEMPO.",PROFESOR ASOCIADO A TIEMPO COMPLETO,Universidad Nacional Ciro Alegria - Unca,LA LIBERTAD - HUAMACHUCO
https://unca.edu.pe/portalweb/,1,Docentes Universitarios Ley 30220-01,"S/. 5,495.50",07/02/2025,20/02/2025,"HABER EJERCIDO PREVIAMENTE LA DOCENCIA UNIVERSITARIA EN LA CATEGORÍA DE PROFESOR AUXILIAR POR LO MENOS DE TRES (3) AÑOS, CONTABILIZADOS HASTA EL MOMENTO DE SU POSTULACIÓN.
 • POR EXCEPCIÓN PODRÁN POSTULAR SIN HABER SIDO DOCENTE AUXILIAR. PROFESIONALES CON RECONOCIDA LABOR DE INVESTIGACIÓN CIENTÍFICA Y TRAYECTORIA ACADÉMICA, CON MÁS DE DIEZ (10) AÑOS DE EJERCICIO PROFESIONAL.",TÍTULO PROFESIONAL DE INGENIERO CIVIL,"CON GRADO ACADÉMICO DE MAESTRO, EL MISMO QUE DEBE HABER SIDO OBTENIDO CON ESTUDIOS PRESENCIALES","CONOCIMIENTO EN TECNOLOGÍA DE LOS MATERIALES, TOPOGRAFÍA BÁSICA Y PROCESOS CONSTRUCTIVOS","COMUNICACIÓN EFECTIVA, ORGANIZACIÓN, TRABAJO EN EQUIPO, PENSAMIENTO CRÍTICO, LIDERAZGO, GESTIÓN DEL TIEMPO.",PROFESOR ASOCIADO A TIEMPO COMPLETO,Universidad Nacional Ciro Alegria - Unca,LA LIBERTAD - HUAMACHUCO
https://unca.edu.pe/portalweb/,1,Docentes Universitarios Ley 30220-01,"S/. 5,495.50",07/02/2025,20/02/2025,"TRES (3) AÑOS DE EXPERIENCIA DE DOCENTE AUXILIAR.
• POR EXCEPCIÓN, PODRÁN CONCURSAR A ESTA CATEGORÍA, PROFESIONALES CON RECONOCIDA LABOR DE INVESTIGACIÓN CIENTÍFICA Y TRAYECTORIA ACADÉMICA, CON MÁS DE QUINCE (10) AÑOS DE EJERCICIO PROFESIONAL.","LIC. EN EDUCACIÓN, LENGUA Y LITERATURA,",CONTAR CON CON GRADO ACADÉMICO DE MAESTRO,"CONOCIMIENTO EN COMUNICACIÓN ORAL Y ESCRITA, Y CONOCIMIENTO EN METODOLOGÍA DEL TRABAJO UNIVERSITARIO","COMUNICACIÓN EFECTIVA, ORGANIZACIÓN, TRABAJO EN EQUIPO, PENSAMIENTO CRÍTICO, LIDERAZGO, GESTIÓN DEL TIEMPO",PROFESOR ASOCIADO A TIEMPO COMPLETO,Universidad Nacional Ciro Alegria - Unca,LA LIBERTAD - HUAMACHUCO
https://unca.edu.pe/portalweb/,1,Docentes Universitarios Ley 30220-01,"S/. 5,495.50",07/02/2025,20/02/2025,"TRES (3) AÑOS DE EXPERIENCIA DE DOCENTE AUXILIAR.
• POR EXCEPCIÓN, PODRÁN CONCURSAR A ESTA CATEGORÍA, PROFESIONALES CON RECONOCIDA LABOR DE INVESTIGACIÓN CIENTÍFICA Y TRAYECTORIA ACADÉMICA, CON MÁS DE QUINCE (10) AÑOS DE EJERCICIO PROFESIONAL.","LIC. EN EDUCACIÓN, LENGUA Y LITERATURA,",CONTAR CON CON GRADO ACADÉMICO DE MAESTRO,"CONOCIMIENTO EN COMUNICACIÓN ORAL Y ESCRITA, Y CONOCIMIENTO EN METODOLOGÍA DEL TRABAJO UNIVERSITARIO","COMUNICACIÓN EFECTIVA, ORGANIZACIÓN, TRABAJO EN EQUIPO, PENSAMIENTO CRÍTICO, LIDERAZGO, GESTIÓN DEL TIEMPO",PROFESOR ASOCIADO A TIEMPO COMPLETO,Universidad Nacional Ciro Alegria - Unca,LA LIBERTAD - HUAMACHUCO
https://www.facebook.com/ugelsantiagodechuco,1,276-02,"S/. 2,516.00",07/02/2025,20/02/2025,"EXPERIENCIA LABORAL GENERAL MÍNIMA DE SEIS (06) MESES EN EL CARGO O SIMILAR ACUMULADA EN EL SECTOR PÚBLICO O PRIVADO (NO EXCLUYENTE).
EXPERIENCIA ESPECÍFICA MÍNIMA DE SEIS (06) MESES EN LABORES DE LIMPIEZA Y/O MANTENIMIENTO (NO EXCLUYENTE).",SECUNDARIA COMPLETA.,NO APLICA.,NO APLICA.,"ORIENTACIÓN AL SERVICIO, ORDEN, TRABAJO EN EQUIPO, PROACTIVIDAD, RESPONSABILIDAD Y PUNTUALIDAD.",TRABAJADOR DE SERVICIO,Unidad De Gestion Educativa Local Santiago De Chuco,LA LIBERTAD - MOLLEBAMBA
https://aplicativo.pj.gob.pe/psep/,1,D.Leg 1057 - Determinado (Suplencia)-007,"S/. 1,300.00",06/02/2025,19/02/2025,OBLIGATORIO: SEIS (06) MESES COMO AGENTE DE SEGURIDAD EN ENTIDADES PÚBLICAS O EN EMPRESAS DE SEGURIDAD DEL SECTOR PRIVADO; O LICENCIADO DE LAS FUERZAS ARMADAS. DESEABLE: EXPERIENCIA LABORAL ADICIONAL COMO AGENTE DE SEGURIDAD EN ENTIDADES PÚBLICAS O EN EMPRESAS DE SEGURIDAD DEL SECTOR PRIVADO; O COMO LICENCIADO DE LAS FUERZAS ARMADAS.,OBLIGATORIO: SECUNDARIA COMPLETA,"DESEABLE: CURSOS EN TEMAS DE SEGURIDAD INTEGRAL, LUCHA CONTRA INCENDIO, PRIMEROS AUXILIOS, GESTIÓN DEL RIESGO DE DESASTRES.","CONOCIMIENTO EN TEMAS DE SEGURIDAD INTEGRAL, LUCHA CONTRA INCENDIO, PRIMEROS AUXILIOS, GESTIÓN DEL RIESGO DE DESASTRES. CONOCIMIENTO DE LAS NORMAS ASOCIADAS A SU FUNCIÓN","ADAPTABILIDAD, ANÁLISIS, COMPRENSIÓN LECTORA, AUTOCONTROL, ORDEN, EMPATÍA Y LIDERAZGO","RESGUARDO, CUSTODIA Y VIGILANCIA",Poder Judicial,LA LIBERTAD - VIRU
https://ugel01ep.gob.pe - https://www.facebook.com/ugel01ep,17,D.Leg 1057 - Determinado (Necesidad Transitoria)-3,"S/. 1,414.19",06/02/2025,19/02/2025,EXPERIENCIA GENERAL LABORAL MÍNIMA DE UN (01) AÑO EN EL SECTOR PÚBLICO Y/O PRIVADO. EXPERIENCIA ESPECIFICA REQUERIDA PARA EL PUESTO DE 06 MESES EN LABORES DE LIMPIEZA Y/O MANTENIMIENTO,SECUNDARIA COMPLETA,NO APLICA,"CONOCIMIENTOS BÁSICOS DE ELECTRICIDAD, GASFITERÍA Y/O CARPINTERÍA (DESEABLE, NO EXCLUYENTE PARA LA CONTRATACIÓN). CADA CURSO DEBE TENER NO MENOS DE 12 HORAS DE CAPACITACIÓN Y LOS PROGRAMAS DE ESPECIALIZACIÓN NO MENOS DE 90 HORAS","ORDEN, CONTROL/AUTOCONTROL, ANÁLISIS, FUERZA FÍSICA.",PERSONAL DE LIMPIEZA Y MANTENIMIENTO PARA NIVEL INICIAL Y PRIMARIA DE LAS II.EE DE LA JURISDICCION DE LA UGEL 01 EP,Unidad De Gestion Educativa Local 01- El Porvenir,LA LIBERTAD - EL PORVENIR
https://aplicativo.pj.gob.pe/psep/,1,D.Leg 1057 - Determinado (Suplencia)-006,"S/. 1,300.00",06/02/2025,19/02/2025,OBLIGATORIO: EXPERIENCIA NO MENOR DE (01) AÑO EN TRÁMITE DOCUMENTARIO O LABORES AFINES. DESEABLE: EXPERIENCIA LABORAL ADICIONAL EN TRÁMITE DOCUMENTARIO O LABORES AFINES.,"OBLIGATORIO: ESTUDIOS TÉCNICOS EN ARCHIVO, SECRETARIADO EJECUTIVO, COMPUTACIÓN, ADMINISTRACIÓN O AFINES, MÍNIMO TRES (03) MESES.","DESEABLE: LICENCIA PARA CONDUCIR MOTOCICLETA. DESEABLE: CURSO DE OFIMÁTICA (PROCESADOR DE TEXTOS, HOJA DE CÁLCULO, PRESENTACIÓN DE DIAPOSITIVAS).",CONOCIMIENTO DE TRÁMITES JUDICIALES. CONOCIMIENTOS Y MANEJO DE OFIMÁTICA.,"ORGANIZACIÓN DE INFORMACIÓN, RAZONAMIENTO LÓGICO, AUTOCONTROL, ORDEN, DINAMISMO.",APOYO ADMINISTRATIVO EN LAS AREAS DE NOTIFICACIONES,Poder Judicial,LA LIBERTAD - TRUJILLO
https://aplicativo.pj.gob.pe/psep/,1,D.Leg 1057 - Determinado (Necesidad Transitoria)-008,"S/. 2,572.00",06/02/2025,19/02/2025,"OBLIGATORIO: PARA EL PROFESIONAL TÉCNICO, TRES (03) AÑOS DE EXPERIENCIA GENERAL Y UN (01) AÑO DE EXPERIENCIA DESARROLLANDO LABORES AFINES AL PUESTO EN EL SECTOR PÚBLICO. OBLIGATORIO: PARA EL ESTUDIANTE UNIVERSITARIO, UN (01) AÑO DE EXPERIENCIA DESARROLLANDO LABORES AFINES AL PUESTO EN EL SECTOR PÚBLICO. DESEABLE: EXPERIENCIA LABORAL ADICIONAL DESARROLLANDO LABORES AFINES AL PUESTO EN EL SECTOR PÚBLICO.","OBLIGATORIO: TÍTULO PROFESIONAL TÉCNICO (CARRERA DE 3 AÑOS) EN CONTABILIDAD, COMPUTACIÓN, SECRETARIADO EJECUTIVO, O ESTUDIOS UNIVERSITARIOS (8VO. CICLO) DE ECONOMÍA, CONTABILIDAD, ADMINISTRACIÓN O CARRERAS AFINES.","DESEABLE: CURSO DE OFIMÁTICA (PROCESADOR DE TEXTOS, HOJA DE CÁLCULO, PRESENTACIÓN DE DIAPOSITIVAS).",CONOCIMIENTO DE TRÁMITES ADMINISTRATIVOS EN EL SECTOR PÚBLICO. CONOCIMIENTOS EN OFIMÁTICA A NIVEL USUARIO.,"COMPRESIÓN LECTORA, MEMORIA, DINAMISMO, ORGANIZACIÓN DE LA INFORMACIÓN, RAZONAMIENTO LÓGICO.",ASISTENTE ADMINISTRATIVO,Poder Judicial,LA LIBERTAD - TRUJILLO
https://aplicativo.pj.gob.pe/psep/,1,D.Leg 1057 - Determinado (Necesidad Transitoria)-005,"S/. 4,000.00",05/02/2025,18/02/2025,"OBLIGATORIO: EXPERIENCIA LABORAL DE DOS (02) AÑOS DESARROLLANDO LABORES AFINES AL PUESTO.
DESEABLE: EXPERIENCIA LABORAL ADICIONAL DESARROLLANDO LABORES AFINES AL PUESTO.","OBLIGATORIO: TITULO DE ESTUDIOS TÉCNICOS SUPERIORES (3 AÑOS) EN COMPUTACIÓN E INFORMÁTICA, O ESTUDIOS UNIVERSITARIOS (SEXTO CICLO) EN INGENIERÍA INFORMÁTICA O INGENIERÍA DE SISTEMAS O SIMILAR.","DESEABLE: CURSOS DE ESPECIALIZACIÓN O DIPLOMADOS EN COMPUTACIÓN E INFORMÁTICA (SEGÚN LA CANTIDAD DE HORAS MÍNIMAS ESTABLECIDAS EN LAS BASES). DESEABLE: CURSO DE OFIMÁTICA (PROCESADOR DE TEXTOS, HOJA DE CÁLCULO, PRESENTACIÓN DE DIAPOSITIVAS).",CONOCIMIENTOS EN EL MANEJO DE EQUIPOS DE AUDIO Y/O VIDEO. CONOCIMIENTOS EN OFIMÁTICA A NIVEL USUARIO.,"COMPRENSIÓN LECTORA, REDACCIÓN, AUTOCONTROL, ORDEN, DINAMISMO.",ASISTENTE DE SISTEMAS,Poder Judicial,LA LIBERTAD - TRUJILLO
https://aplicativo.pj.gob.pe/psep/,1,D.Leg 1057 - Determinado (Necesidad Transitoria)-005,"S/. 2,572.00",05/02/2025,18/02/2025,"OBLIGATORIO: EXPERIENCIA LABORAL DE UN (01) AÑO DESARROLLANDO LABORES AFINES AL PUESTO.
DESEABLE: EXPERIENCIA LABORAL EN EL ÁREA LEGAL COMO ASISTENTE EN EL SECTOR PÚBLICO.",OBLIGATORIO: OCTAVO CICLO DE DERECHO (CULMINADO).,"DESEABLE: CURSOS DE ESPECIALIZACIÓN O DIPLOMADOS EN DERECHO LABORAL O LEY N° 29497 NUEVA LEY PROCESAL DEL TRABAJO (SEGÚN LA CANTIDAD DE HORAS MÍNIMAS ESTABLECIDAS EN LAS BASES). DESEABLE: CURSO DE OFIMÁTICA (PROCESADOR DE TEXTOS, HOJA DE CÁLCULO, PRESENTACIÓN DE DIAPOSITIVAS).",CONOCIMIENTOS EN DERECHO LABORAL O LEY N° 29497 NUEVA LEY PROCESAL DEL TRABAJO.   CONOCIMIENTOS EN OFIMÁTICA A NIVEL USUARIO.,"ADAPTABILIDAD, ANÁLISIS, REDACCIÓN, COMPRENSIÓN LECTORA, AUTOCONTROL.",ASISTENTE JUDICIAL,Poder Judicial,LA LIBERTAD - TRUJILLO
https://www.facebook.com/ugel02laesperanza/?locale=es_la,1,D.Leg 1057 - Determinado (Necesidad Transitoria)-003,"S/. 2,264.19",05/02/2025,18/02/2025,"EXPERIENCIA GENERAL: EXPERIENCIA MÍNIMA DE DOS (02) AÑOS EN EL SECTOR PÚBLICO Y/O PRIVADO. EXPERIENCIA ESPECÍFICA: EXPERIENCIA MÍNIMA DE UN (01) AÑO EN EL CARGO, RELACIONADAS AL CARGO O AFINES AL CARGO; CON FUNCIONES INHERENTES EN EL PROCESO DE EJECUCIÓN DEL GASTO EN EL SECTOR PÚBLICO.","TÍTULO PROFESIONAL UNIVERSITARIO EN ECONOMÍA, CONTABILIDAD, ADMINISTRACIÓN, COLEGIADO Y HABILITADO.","-	CAPACITACIÓN EN GESTIÓN PÚBLICA. -	PLANIFICACIÓN Y PROGRAMACIÓN PRESUPUESTAL. -	SISTEMA NACIONAL DE PRESUPUESTO PÚBLICO. -	CAPACITACIÓN EN SIAF-SP, SIAF-WEB -	CAPACITACIÓN EN TEMAS RELACIONADOS CON EL PUESTO A DESEMPEÑAR.","-	NORMATIVIDAD DEL SECTOR EDUCACIÓN Y PROCEDIMIENTOS DEL SISTEMA NACIONAL DE PRESUPUESTO PÚBLICO. -	MANEJO DEL SISTEMA INTEGRADO DE ADMINISTRACIÓN FINANCIERA-SIAF- SP -	MANEJO DE LA WEB SIAF, MÓDULO DE PROGRAMACIÓN PRESUPUESTAL -	CONOCIMIENTOS DE OFIMÁTICA.",-	ORIENTACIÓN HACIA EL LOGRO DE OBJETIVOS -	COMUNICACIÓN ASERTIVA -	RESPONSABILIDAD EN EL DESEMPEÑO DE SUS FUNCIONES. -	CONOCIMIENTO ORGANIZACIONAL. -	TRABAJO EN EQUIPO Y COOPERACIÓN. -	PROACTIVIDAD. -	PREDISPOSICIÓN A LABORES BAJO PRESIÓN -	SER TOLERANTE PARA CON EL PÚBLICO USUARIO. -	INTERÉS POR EL ORDEN Y LA CLARIDAD. -	BÚSQUEDA DE LA INFORMACIÓN. -	INICIATIVA. -	CAPACIDAD DE ANÁLISIS Y SOLUCIÓN DE PROBLEMAS. -	ACTUAR BAJO LOS PRINCIPIOS DE LA FUNCIÓN PÚBLICA Y EL CÓDIGO DE ÉTICA.,ESPECIALISTA EN FINANZAS,Unidad Ejecutora Educacion 314 - La Esperanza,LA LIBERTAD - LA ESPERANZA
https://satt.gob.pe/servicios/bolsa-de-trabajo,1,D.Leg 1057 - Determinado (Suplencia)-1,"S/. 2,064.19",05/02/2025,18/02/2025,"EXPERIENCIA LABORAL GENERAL: NO MENOR DE DOS  (02)  AÑOS.
EXPERIENCIA LABORAL ESPECIFICA: NO MENOR DE DOS  (02)  AÑOS, DE PREFERENCIA EN ADMINISTRACIÓN TRIBUTARIA. EXPERIENCIA EN TEMAS DE RESOLUCION EN MATERIA TRIBUTARIA.
EXPERIENCIA LABORAL ESPECIFICA EN EL SECTOR PUBLICO: NO MENOR DE DOS  (02)  AÑOS.",BACHILLER EN DERECHO.,DERECHO TRIBUTARIO Y DERECHO ADMINISTRATIVO.,MANEJO DE PROCEDIMIENTO CONTENCIOSO TRIBUTARIO. MANEJO DE DERECHO TRIBUTARIO. MANEJO DE DERECHO TRIBUTARIO MUNICIPAL. MANEJO DE DERECHO ADMINISTRATIVO.	MANEJO DE HERRAMIENTAS Y APLICATIVOS INFORMÁTICOS.,"TRABAJO EN EQUIPO, RAZONAMIENTO ANALÍTICO, PROACTIVO, CAPACIDAD DE SOLUCIÓN DE PROBLEMAS, ORGANIZADO, INNOVADOR, PROACTIVO, RESPONSABLE.",APOYO PARA LA OFICINA DE RECLAMOS Y DEVOLUCIONES,Serv.De Administracion Tributaria-Trujil,LA LIBERTAD - TRUJILLO
https://aplicativo.pj.gob.pe/psep/,1,D.Leg 1057 - Determinado (Necesidad Transitoria)-010,"S/. 7,800.00",05/02/2025,18/02/2025,"OBLIGATORIO: CUATRO (4) AÑOS DE EXPERIENCIA, CONTADA A PARTIR DE LA COLEGIATURA, EN EL SECTOR PÚBLICO Y/O PRIVADO.
OBLIGATORIO: DOS (02) AÑOS DE EXPERIENCIA EN LABORES EQUIVALENTES AL CARGO QUE POSTULA EN EL SECTOR PÚBLICO
DESEABLE: EXPERIENCIA LABORAL ADICIONAL EN LABORES EQUIVALENTES AL CARGO QUE POSTULA EN EL SECTOR PÚBLICO.","OBLIGATORIO: TITULADO EN DERECHO O ADMINISTRACIÓN; CON COLEGIATURA Y HABILITACIÓN PROFESIONAL VIGENTE. OBLIGATORIO: GRADO DE MAESTRO EN GESTIÓN PÚBLICA, DERECHO PENAL O DERECHO PROCESAL PENAL.","OBLIGATORIO: CURSO DE ESPECIALIZACIÓN Y/O DIPLOMADO EN CONTRATACIONES DEL ESTADO (MÍNIMO 90 HORAS). DESEABLE: CURSO DE OFIMÁTICA (PROCESADOR DE TEXTOS, HOJA DE CÁLCULO, PRESENTACIÓN DE DIAPOSITIVAS).  ¿	DESEABLE: CURSO DE ESPECIALIZACIÓN Y/O DIPLOMADO EN GESTIÓN PÚBLICA, DERECHO PENAL O PROCESAL PENAL (MÍNIMO 90 HORAS).","CONOCIMIENTOS EN GESTIÓN PÚBLICA, DERECHO PENAL O PROCESAL PENAL Y/O CONTRATACIONES DEL ESTADO. CONOCIMIENTOS EN OFIMÁTICA A NIVEL USUARIO.","ANÁLISIS, MEMORIA, REDACCIÓN, COMPRENSIÓN LECTORA, AUTOCONTROL Y ADAPTABILIDAD.",ADMINISTRADOR,Poder Judicial,LA LIBERTAD - TRUJILLO
https://www.facebook.com/ugelascopeoficial/?locale=es_la,9,D.Leg 1057 - Determinado (Necesidad Transitoria)-002,"S/. 2,964.19",04/02/2025,17/02/2025,01 AÑO Y 06 MESES EN EL SECTOR PUBLICO O PRIVADO. EXPERIENCIA REQUERIDA 01 AÑO DE EXPERIENCIA EN EL TRABAJO CON PERSONAS CON DISCAPACIDAD.,LICENCIADO TECNÓLOGO MÉDICO EN/  ÁREA/MENCIÓN/ESPECIALIDAD  TERAPIA FÏSICA O TERAPIA  FISICA Y REHABILITACIÓN O  TERAPIA OCUPACIONAL O  TERAPIA DE LENGUAJE,NO APLICA,COMPETENCIAS OCUPACIONALES PARA LA ATENCIÓN DE PERSONAS EN CONDICIÓN DE DISCAPACIDAD. TRABAJO CON FAMILIAS. DESARROLLO EVOLUTIVO,"COMUNICACIÓN ORAL, COOPERACIÓN, INICIATIVA, EMPATÍA Y TRABAJO EN EQUIPO.","PROFESIONAL EN TECNOLOGÍA MÉDICA   CON MENCIÓN EN TERAPIA FÍSICA,  OCUPACIONAL O DE LENGUAJE PARA  CEBE",Unidad De Gestion Educativa Local De Ascope,LA LIBERTAD - ASCOPE
https://www.facebook.com/ugelascopeoficial/?locale=es_la,1,D.Leg 1057 - Determinado (Necesidad Transitoria)-001,"S/. 1,289.19",04/02/2025,17/02/2025,2 AÑOS DE EXPERIENCIA LABORAL; YA SEA EN EL SECTOR PÚBLICO O PRIVADO,"TÍTULO/LICENCIATURA EN: CONTABILIDAD, ECONOMÍA, ADMINISTRACIÓN Y/O AFINES.","DIPLOMADO, CURSO O TALLER EN SISTEMA DE TESORERÍA","SISTEMA DE CONTABILIDAD Y TESORERÍA, ARQUEO DE CAJA, CONCILIACIÓN DE ESTADOS DE CUENTA, DOCUMENTOS VALORADOS","ANÁLISIS, ORGANIZACIÓN DE LA INFORMACIÓN, PREDISPOSICIÓN, PLANIFICACIÓN Y CONTROL",RESPONSABLE DE CAJA,Unidad De Gestion Educativa Local De Ascope,LA LIBERTAD - ASCOPE
https://www.facebook.com/ugelascopeoficial/?locale=es_la,1,D.Leg 1057 - Determinado (Necesidad Transitoria)-001,"S/. 2,264.19",04/02/2025,17/02/2025,2 AÑOS DE EXPERIENCIA LABORAL; YA SEA EN EL SECTOR PÚBLICO O PRIVADO,TÍTULO/LICENCIATURA EN: INGENIERÍA DE COMPUTACIÓN Y SISTEMAS O PROFESIONAL TÉCNICO EN COMPUTACIÓN E INFORMÁTICA,NO APLICA,"GESTIÓN PÚBLICA, LEGISLACIÓN LABORAL, LEY N°30057- LEY DEL SERVICIO CIVIL Y DEL SECTOR PUBLICO Y/O PRIVADO","ANÁLISIS, ORGANIZACIÓN DE LA INFORMACIÓN, PREDISPOSICIÓN, PLANIFICACIÓN Y CONTROL",RESPONSABLE DE IMAGEN INSTITUCIONAL Y TECNOLOGÍAS DE LA INFORMACIÓN,Unidad De Gestion Educativa Local De Ascope,LA LIBERTAD - ASCOPE
