job_posting_url,vacancies,job_posting_number,salary,start_publication_date,end_publication_date,required_experience,educational_background,specialization,required_knowledge,skills,job_title,public_institution,ubication
https://www.gob.pe/institucion/indecopi/informes-publicaciones/5423777-incorporacion-del-capital,1,D.Leg 1057 - Determinado (Necesidad Transitoria)-53,"S/. 2,000.00",04/02/2025,17/02/2025,EXPERIENCIA LABORAL GENERAL: UN (01) AÑO.,EGRESADO EN DERECHO,NO APLICA.,"DERECHO ADMINISTRATIVO O PROTECCIÓN AL CONSUMIDOR O COMPETENCIA DESLEAL O ELIMINACIÓN DE BARRERAS BUROCRÁTICAS. CONOCIMIENTOS DE OFIMÁTICA (PROCESADOR DE TEXTOS, HOJAS DE CÁLCULO Y PROGRAMA DE PRESENTACIONES) A NIVEL BÁSICO.","ORIENTACIÓN A RESULTADOS, VOCACIÓN DE SERVICIO Y TRABAJO EN EQUIPO.",ASISTENTE LEGAL,Indecopi,LA LIBERTAD - TRUJILLO
https://www.facebook.com/ugel-viru-1522402974747239/?fb_dtsg_ag=adyzbpwx9ojhihlw_dg-scl3im0af8fa-1zh013rk2byow%3aadwnhrzxjocx3xufpd_f4zetcge80hzi07wtfhsvgzfpla,1,D.Leg 1057 - Determinado (Suplencia)-0001,"S/. 1,990.19",04/02/2025,17/02/2025,UN (01) AÑO EXPERIENCIA GENERAL EN EL SECTOR PÚBLICO Y /O PRIVADO,UN (01) AÑO EXPERIENCIA ESPECIFICA EN PUESTOS SIMILARES EN EL SECTOR PÚBLICO Y /O PRIVADO,-,"CERTIFICADO EN GESTIÓN PÚBLICA Y MODERNIZACIÓN DEL ESTADO CURSO DE GESTIÓN DEL AIRHSP, MCAR Y MCPP WEB CURSO EN INGRESO DE PERSONAL Y/O COMPENSACIÓN LABORAL EN EL SECTOR PÚBLICO CERTIFICADO EN ARTICULACIÓN DE INSTRUMENTOS DEL ESTADO","LÍDER, GESTOR CON CAPACIDAD PARA TRABAJAR EN EQUIPO Y BAJO PRESIÓN, CONCERTADOR Y GRAN CAPACIDAD PARA APRENDER Y GESTIONAR SITUACIONES CAMBIANTES.",ESPECIALISTA ADMINISTRATIVO I - SUP,Unidad De Gestion Educativa Local De Viru,LA LIBERTAD - VIRU
https://aplicativo.pj.gob.pe/psep/wfrmconvocatoriasv.aspx?tcon=c,1,D.Leg 1057 - Determinado (Necesidad Transitoria)-009,"S/. 2,572.00",04/02/2025,17/02/2025,OBLIGATORIO: EXPERIENCIA LABORAL DE UN (01) AÑO DESARROLLANDO LABORES AFINES AL PUESTO. DESEABLE: EXPERIENCIA LABORAL EN EL ÁREA LEGAL COMO ASISTENTE EN EL SECTOR PÚBLICO.,OBLIGATORIO: OCTAVO CICLO DE DERECHO (CULMINADO).,"DESEABLE: CURSOS DE ESPECIALIZACIÓN O DIPLOMADOS EN DERECHO DE FAMILIA (SEGÚN LA CANTIDAD DE HORAS MÍNIMAS ESTABLECIDAS EN LAS BASES).  DESEABLE: CURSO DE OFIMÁTICA (PROCESADOR DE TEXTOS, HOJA DE CÁLCULO, PRESENTACIÓN DE DIAPOSITIVAS).",CONOCIMIENTOS EN DERECHO DE FAMILIA. CONOCIMIENTOS EN OFIMÁTICA A NIVEL USUARIO.,"ADAPTABILIDAD, ANÁLISIS, REDACCIÓN, COMPRENSIÓN LECTORA, AUTOCONTROL.",ASISTENTE JUDICIAL,Poder Judicial,LA LIBERTAD - TRUJILLO
https://www.facebook.com/ugelascopeoficial/?locale=es_la,6,D.Leg 1057 - Determinado (Necesidad Transitoria)-002,"S/. 1,414.19",04/02/2025,17/02/2025,01 AÑO EN EXPERIENCIA SECTOR PUBLICO O PRIVADO. EXPERIENCIA REQUERIDA 06 MESES EN MANTENIMIENTO O LIMPIEZA,EDUCACION SECUNDARIA,NO APLICA,"MANEJO DE INSUMOS Y RECURSOS DE LIMPIEZA Y MANTENIMIENTO.  MANEJO DE PROCEDIMIENTOS PARA LA DESINFECCIÓN DE AMBIENTES, EQUIPOS Y MATERIALES DE LA IE.  CONOCIMIENTOS SOBRE EL FUNCIONAMIENTO DE LAS IIEE JEC.","ORDEN, INICIATIVA, COMPROBACIÓN DE OBJETOS, ATENCIÓN.",PERSONAL DE MANTENIMIENTO,Unidad De Gestion Educativa Local De Ascope,LA LIBERTAD - ASCOPE
https://www.facebook.com/ugelascopeoficial/?locale=es_la,8,D.Leg 1057 - Determinado (Necesidad Transitoria)-002,"S/. 1,614.19",04/02/2025,17/02/2025,"-12 MESES EN EL SECTOR PUBLICO O PRIVADO. EXP. REQUERIDA: 0 MESES COMO COORDINADOR O ASISTENTE DE SOPORTE TÉCNICO DE LOS RECURSOS TECNOLÓGICOS EN IIEE O ENTIDAD PÚBLICA O PRIVADA. EN EL CASO DE PROFESOR EN 
COMPUTACIÓN E INFORMÁTICA O BACHILLER EN EDUCACIÓN: 10 MESES COMO DOCENTE A CARGO DEL AULA DE INNOVACIÓN O LA QUE HAGA SUS VECES.",TECNICA SUPERIOR (3 O 4 AÑOS). COMPUTACIÓN E INFORMÁTICA O  COMPUTACIÓN O INFORMÁTICA O EN  EDUCACIÓN CON ESPECIALIDAD DE  COMPUTACIÓN O INFORMÁTICA.,CURSOS DE OFIMÁTICA COMO MÍNIMO DE 90 HORAS O CURSO DE REPARACIÓN O MANTENIMIENTO DE COMPUTADORAS.  CURSO O DIPLOMADO O CAPACITACIÓN DE INTEGRACIÓN DE LAS TIC EN EL PROCESO DE ENSEÑANZA-APRENDIZAJE O AFINES COMO MÍNIMO DE 90 HORAS.,"MANEJO DE ESTRATEGIAS Y HERRAMIENTAS DE USO DE TECNOLOGÍAS DE LA INFORMACIÓN Y COMUNICACIÓN.  CONOCIMIENTO Y MANEJO DE APLICACIONES Y SOLUCIONES TECNOLÓGICAS (PLATAFORMAS, APLICATIVOS, ENTRE OTROS).","INICIATIVA, ANÁLISIS, CONTROL, PLANIFICACIÓN.",COORDINADOR(A) DE INNOVACIÓN Y  SOPORTE TECNOLÓGICO,Unidad De Gestion Educativa Local De Ascope,LA LIBERTAD - ASCOPE
https://www.facebook.com/ugelascopeoficial/?locale=es_la,3,D.Leg 1057 - Determinado (Necesidad Transitoria)-002,"S/. 2,764.19",04/02/2025,17/02/2025,01 AÑO EN EL SECTOR PUBLICO O PRIVADO. EXPERIENCIA REQUERIDA: 06 MESES EN INSTITUCIÓN EDUCATIVA O PROYECTOS EDUCATIVOS,LICENCIADO EN PSICOLOGIA,"CURSOS RELACIONADOS A:  CONVIVENCIA ESCOLAR, TUTORÍA Y ORIENTACIÓN EDUCATIVA; O  PROTECCIÓN Y DERECHOS DE NIÑOS, NIÑAS Y ADOLESCENTES O ATENCIÓN DE LA VIOLENCIA; O  DISEÑO, GESTIÓN O MONITOREO DE PROYECTOS EDUCATIVOS, SOCIALES O COMUNITARIOS.  NO  APLICA AVANZADO IDIOMAS NO APLICA","GESTIÓN DE LA CONVIVENCIA ESCOLAR, PAUTAS PARA LA PREVENCIÓN Y ATENCIÓN DE LA VIOLENCIA EN LAS INSTITUCIONES EDUCATIVAS.","EMPATÍA, ASERTIVIDAD, ANÁLISIS, BUENA COMUNICACIÓN ORAL Y ESCRITA, ORGANIZACIÓN DE LA INFORMACIÓN",PROFESIONAL EN PSICOLOGÍA,Unidad De Gestion Educativa Local De Ascope,LA LIBERTAD - ASCOPE
https://www.facebook.com/ugelascopeoficial/?locale=es_la,1,D.Leg 1057 - Determinado (Necesidad Transitoria)-002,"S/. 3,064.19",04/02/2025,17/02/2025,01 AÑO SECTOR PUBLICO O PRIVADO. EXPERIENCIA REQUERIDA: 06 MESES,LICENCIADO PROFESOR O DOCENTE.,"CURSOS RELACIONADOS A:  CONVIVENCIA ESCOLAR, TUTORÍA Y ORIENTACIÓN EDUCATIVA; O  PROTECCIÓN Y DERECHOS DE NIÑOS, NIÑAS Y ADOLESCENTES O ATENCIÓN DE VÍCTIMAS DE VIOLENCIA; O  GESTIÓN DE PROYECTOS EDUCATIVOS, SOCIALES O COMUNITARIOS","GESTIÓN DE LA CONVIVENCIA ESCOLAR, PAUTAS PARA LA PREVENCIÓN Y ATENCIÓN DE LA VIOLENCIA EN LAS INSTITUCIONES EDUCATIVAS","EMPATÍA, ASERTIVIDAD, ANÁLISIS, BUENA COMUNICACIÓN ORAL Y ESCRITA, ORGANIZACIÓN DE LA INFORMACIÓN.",PROFESIONAL II PARA EQUIPO ITINERANTE DE CONVIVENCIA ESCOLAR,Unidad De Gestion Educativa Local De Ascope,LA LIBERTAD - ASCOPE
https://http://postulacioncas.minedu.gob.pe/postulacioncas/home,1,D.Leg 1057 - Determinado (Necesidad Transitoria)-094,"S/. 2,500.00",31/01/2025,13/02/2025,"EXPERIENCIA GENERAL: 3.00 AÑO(S), EXPERIENCIA ESPECIFICA:  1.00 AÑOS ES ACTIVIDADES RELACIONADAS A LA ASISTENCIA DE LABORATORIOS, DE LOS CUALES 0.00 AÑO(S) EN EL SECTOR PÚBLICO.",TITULADO DE CARRERA TÉCNICA EN  EDUCACIÓN EN LA ESPECIALIDAD DE BIOLOGÍA Y QUÍMICA Y/O CIENCIA Y TECNOLOGIA; TÉCNICO EN LABORATORIO Y/O BACHILLER EN BIOLOGÍA Y/O QUÍMICA Y/O FARMACIA,NO APLICA,"CONOCIMIENTO DE CALIBRACIÓN DE SENSORES, CONOCIMIENTO DE NORMAS DE BIOSEGURIDAD EN LABORATORIO; CONOCIMIENTO EN MANEJO DE INSUMOS,MATERIALES,INSTRUMENTOS EQUIPOS DE LABORATORIOS Y SUSTANCIAS QUÍMICAS; CONOCIMIENTO EN MANEJO DE PLATAFORMAS VIRTUALES",ADAPTABILIDAD; CALIBRACIÓN / REGULACIÓN DE OBJETOS; PROACTIVIDAD; TRABAJO EN EQUIPO,CONTRATACIÓN ADMINISTRATIVA DE SERVICIOS DE UN(A) AUXILIAR DE LABORATORIO PARA EL COLEGIO DE ALTO RENDIMIENTO DE LA REGIÓN LA LIBERTAD - PLAZO DETERMINADO (007564),Ministerio De Educacion,LA LIBERTAD - VIRU
https://www.facebook.com/redsaludsch/,2,276-1,"S/. 2,755.00",31/01/2025,13/02/2025,EXPERIENCIA LABORAL MÍNIMA DE 04 AÑOS (POSTERIOR AL TÍTULO).,TÍTULO DE TECNICO EN ENFERMERIA,-,•	CONOCIMIENTOS EN NORMAS TÉCNICAS VIGENTES DEL MINSA Y ACREDITAR CAPACITACIÓN Y/O ACTIVIDADES DE ACTUALIZACIÓN PROFESIONAL AFINES AL PUESTO.,"•	ORIENTACIÓN AL SERVICIO.				 •	ORIENTACIÓN AL RESULTADO						 •	ACTITUD DE SERVICIO						 •	AMPLIO CRITERIO, ORGANIZACIÓN, INICIATIVA Y RESPONSABILIDAD EN EL DESEMPEÑO DE SUS LABORES						 •	COMPROMISO						 •	RESPONSABILIDAD						 •	ADAPTABILIDAD – FLEXIBILIDAD					 •	TRABAJO EN EQUIPO					 •	MANEJO ADECUADO DE LAS RELACIONES INTERPERSONALES	 •	CUMPLIMIENTO DE METAS ESTABLECIDAS POR RED			 •	PROACTIVO •	CAPACIDAD ANALÍTICA Y ORGANIZADA",TECNICO EN ENFERMERIA,Red De Salud Santiago De Chuco,LA LIBERTAD - SANTIAGO DE CHUCO
https://www.facebook.com/redsaludsch/,3,276-1,"S/. 2,755.00",31/01/2025,13/02/2025,EXPERIENCIA LABORAL MÍNIMA DE 05 AÑOS (POSTERIOR AL TÍTULO).,TÍTULO DE TECNICO EN ENFERMERIA,-,•	CONOCIMIENTOS EN NORMAS TÉCNICAS VIGENTES DEL MINSA Y ACREDITAR CAPACITACIÓN Y/O ACTIVIDADES DE ACTUALIZACIÓN PROFESIONAL AFINES AL PUESTO.,"•	ORIENTACIÓN AL SERVICIO.				 •	ORIENTACIÓN AL RESULTADO						 •	ACTITUD DE SERVICIO						 •	AMPLIO CRITERIO, ORGANIZACIÓN, INICIATIVA Y RESPONSABILIDAD EN EL DESEMPEÑO DE SUS LABORES						 •	COMPROMISO						 •	RESPONSABILIDAD						 •	ADAPTABILIDAD – FLEXIBILIDAD					 •	TRABAJO EN EQUIPO					 •	MANEJO ADECUADO DE LAS RELACIONES INTERPERSONALES	 •	CUMPLIMIENTO DE METAS ESTABLECIDAS POR RED			 •	PROACTIVO •	CAPACIDAD ANALÍTICA Y ORGANIZADA",TECNICO EN ENFERMERIA,Red De Salud Santiago De Chuco,LA LIBERTAD - SANTIAGO DE CHUCO
https://www.facebook.com/redsaludsch/,3,276-1,"S/. 6,624.00",31/01/2025,13/02/2025,"EXPERIENCIA LABORAL MÍNIMA DE 05 AÑOS EN EL DESEMPEÑO DE FUNCIONES DE LA PROFESIÓN, INCLUIDO SERUMS.",TITULO PROFESIONAL DE MEDICO CIRUJANO,-,(1)	MANEJO DE URGENCIA Y EMERGENCIA (2)	ORIENTACIÓN Y CONSEJERÍA FAMILIAR (3)	MEDIDAS DE BIOSEGURIDAD (4)	ENTREVISTA CLÍNICA CENTRADA EN EL PACIENTE (5)	MANEJO DE PATOLOGÍAS FRECUENTES (6)	MODELO DE CUIDADO INTEGRAL DE SALUD (7)	GUÍAS DE PRÁCTICA CLÍNICA DE LAS PATOLOGÍAS DEL MINSA MÁS FRECUENTES,"•	ORIENTACIÓN AL SERVICIO.				 •	ORIENTACIÓN AL RESULTADO						 •	ACTITUD DE SERVICIO						 •	AMPLIO CRITERIO, ORGANIZACIÓN, INICIATIVA Y RESPONSABILIDAD EN EL DESEMPEÑO DE SUS LABORES						 •	COMPROMISO						 •	RESPONSABILIDAD						 •	ADAPTABILIDAD – FLEXIBILIDAD					 •	TRABAJO EN EQUIPO					 •	MANEJO ADECUADO DE LAS RELACIONES INTERPERSONALES	 •	CUMPLIMIENTO DE METAS ESTABLECIDAS POR RED			 •	PROACTIVO •	CAPACIDAD ANALÍTICA Y ORGANIZADA",MEDICO CIRUJANO,Red De Salud Santiago De Chuco,LA LIBERTAD - SANTIAGO DE CHUCO
https://www.facebook.com/redsaludsch/,1,276-1,"S/. 6,624.00",31/01/2025,13/02/2025,"EXPERIENCIA LABORAL MÍNIMA DE 04 AÑOS EN EL DESEMPEÑO DE FUNCIONES DE LA PROFESIÓN, INCLUIDO SERUMS.",TITULO PROFESIONAL DE MEDICO CIRUJANO,-,(1)	MANEJO DE URGENCIA Y EMERGENCIA (2)	ORIENTACIÓN Y CONSEJERÍA FAMILIAR (3)	MEDIDAS DE BIOSEGURIDAD (4)	ENTREVISTA CLÍNICA CENTRADA EN EL PACIENTE (5)	MANEJO DE PATOLOGÍAS FRECUENTES (6)	MODELO DE CUIDADO INTEGRAL DE SALUD (7)	GUÍAS DE PRÁCTICA CLÍNICA DE LAS PATOLOGÍAS DEL MINSA MÁS FRECUENTES,"•	ORIENTACIÓN AL SERVICIO.				 •	ORIENTACIÓN AL RESULTADO						 •	ACTITUD DE SERVICIO						 •	AMPLIO CRITERIO, ORGANIZACIÓN, INICIATIVA Y RESPONSABILIDAD EN EL DESEMPEÑO DE SUS LABORES						 •	COMPROMISO						 •	RESPONSABILIDAD						 •	ADAPTABILIDAD – FLEXIBILIDAD					 •	TRABAJO EN EQUIPO					 •	MANEJO ADECUADO DE LAS RELACIONES INTERPERSONALES	 •	CUMPLIMIENTO DE METAS ESTABLECIDAS POR RED			 •	PROACTIVO •	CAPACIDAD ANALÍTICA Y ORGANIZADA",MEDICO CIRUJANO,Red De Salud Santiago De Chuco,LA LIBERTAD - MOLLEPATA
https://www.gob.pe/ugel03tno,1,276-001,"S/. 2,321.65",31/01/2025,13/02/2025,NO APLICA,SECUNDARIA COMPLETA,NO APLICA,"DESEMPEÑO EN EL TRABAJO EN BENEFICIO DE LOS ESTUDIANTES Y LA COMUNIDAD EDUCATIVA. MANEJO ORGANIZADO DE LOS INSUMOS Y RECURSOS DE MANTENIMIENTO. MANEJO DE PROCEDIMIENTOS, TÉCNICAS, INSUMOS Y HERRAMIENTAS DE MANTENIMIENTO","ORDEN, INICIATIVA, COMPROBACIÓN DE OBJETOS, ATENCIÓN.",TRABAJADOR DE SERVICIO,Unidad De Gestion Educativa Local N° 03  Unidad Ejecutora Educacion 315: Trujillo Nor Oeste,LA LIBERTAD
https://www.gob.pe/ugel03tno,1,276-002,"S/. 2,390.75",31/01/2025,13/02/2025,EXPERIENCIA GENERAL: ALGUNA EXPERIENCIA EN LABORES DE LA ESPECIALIDAD. EXPERIENCIA ESPECIFICA: NO APLICA,SECUNDARIA COMPLETA,"CAPACITACIÓN TÉCNICA EN EL ÁREA, MANEJO DE COMPUTADORA A NIVEL USUARIO.",CONOCIMIENTOS ACORDES AL PUESTO DE TRABAJO,"ANÁLISIS, ORGANIZACIÓN DE INFORMACIÓN, CONTROL",TECNICO ADMINISTRATIVO,Unidad De Gestion Educativa Local N° 03  Unidad Ejecutora Educacion 315: Trujillo Nor Oeste,LA LIBERTAD
https://www.gob.pe/ugel03tno,1,276-003,"S/. 2,321.65",31/01/2025,13/02/2025,EXPERIENCIA GENERAL: EXPERIENCIA EN LABORES AFINES. EXPERIENCIA ESPECIFICA: NO APLICA,SECUNDARIA COMPLETA,"CAPACITACIÓN EN ÁREAS RELACIONADAS CON EL CARGO, MANEJO DE COMPUTADORA A NIVEL DE USUARIO.",CONOCIMIENTOS ACORDE AL PUESTO DE TRABAJO,"ANÁLISIS, ORGANIZACIÓN DE INFORMACIÓN, CONTROL.",AUXILIAR DE BIBLIOTECA,Unidad De Gestion Educativa Local N° 03  Unidad Ejecutora Educacion 315: Trujillo Nor Oeste,LA LIBERTAD
https://www.ugel04tse.gob.pe,1,D.Leg 1057 - Determinado (Necesidad Transitoria)-002,"S/. 2,264.00",31/01/2025,13/02/2025,01,"TÍTULO PROFESIONAL UNIVERSITARIO EN ADMINISTRACIÓN, ECONOMÍA, INGENIERÍA INDUSTRIAL, U OTRA PROFESIÓN QUE INCLUYA ESTUDIOS RELACIONADOS CON LA ESPECIALIDAD, COLEGIADO Y HABILITADO",(06) MESES EN MANEJO DE COMPUTADORA A NIVEL DE USUARIO Y DE APLICATIVOS INFORMÁTICOS RELACIONADOS CON LA ACTIVIDAD (CEPLAN) ENTRE OTROS,NO APLICA,NO APLICA,PLANIFICADOR I,Unidad De Gestion Educativa Local  04 - Trujillo Sur Este,LA LIBERTAD
https://munialtotrujillo.gob.pe/portal/,1,D.Leg 1057 - Determinado (Necesidad Transitoria)-01,"S/. 2,500.00",31/01/2025,13/02/2025,"EXPERIENCIA GENERAL: 02 AÑOS
EXPERIENCIA ESPECIFICA FUNCION O MATERIA: 01 AÑO
EXPERIENCIA ESPECIFICA EN EL PUESTO O CARGO: 01 AÑO
EXPERIENCIA ESPECÍFICA EN EL SECTOR PÚBLICO: 01 AÑO","TITULADO, COLEGIADO Y HABILITADO EN DERECHO","CURSOS, CAPACITACIONES Y/O PROGRAMAS DE ESPECIALIZACIÓN EN LEGISLACION LABORAL, GESTIÓN PÚBLICA, RECURSOS HUMANOS, SEGURIDAD Y SALUD EN EL TRABAJO Y/O PROCESO ADMINISTRATIVO DISCIPLINARIO","LEGISLACIÓN LABORAL, PROCEDIMIENTO ADMINISTRATIVO DISCIPLINARIO","VOCACIÓN DE SERVICIO, TRABAJO EN EQUIPO.",ABOGADO DE RECURSOS HUMANOS,Municipalidad Distrital De Alto Trujillo,LA LIBERTAD - EL PORVENIR
"https://www.facebook.com/redsaludgranchimucascas,",1,D.Leg 1057 - Determinado (Necesidad Transitoria)-03,"S/. 3,164.19",30/01/2025,12/02/2025,"EXPERIENCIA GENERAL
EXPERIENCIA REQUERIDA EN EL SECTOR SALUD PÚBLICO Y/O 
PRIVADO: 02 AÑOS (NO INCLUYE SERUMS)",•	TÍTULO PROFESIONAL DE BIÓLOGO. •	COLEGIATURA Y HABILITACIÓN VIGENTE.,•	DE ACUERDO A LA ESPECIALIDAD.,•	CONOCIMIENTO DEL MODELO DE CUIDADO INTEGRAL DE SALUD. •	CONOCIMIENTOS DE SALUD PÚBLICA. •	CONOCIMIENTOS DE EPIDEMIOLOGIA. •	CONOCIMIENTOS EN SALUD AMBIENTAL.,"•	VOCACIÓN DE SERVICIO, TRABAJO EN EQUIPO, COMPORTAMIENTO ÉTICO, ORIENTACIÓN DE SERVICIO AL CIUDADANO, COMUNICACIÓN EFECTIVA.",BIOLOGO,Unidad Ejecutora De Salud Gran Chimu,LA LIBERTAD - LUCMA
https://extranet.cunamas.gob,1,D.Leg 1057 - Determinado (Necesidad Transitoria)-049,"S/. 2,764.19",30/01/2025,12/02/2025,"•	EXPERIENCIA LABORAL GENERAL DE 01 AÑO.
•	EXPERIENCIA LABORAL ESPECÍFICA DE 01 AÑO EN SERVICIOS O PROGRAMAS O PROYECTOS RELACIONADOS A EQUIPOS TÉCNICOS PARA LA GESTIÓN, ACOMPAÑAMIENTO O ATENCIÓN EN SALUD PÚBLICA O  PRIMERA INFANCIA O NIÑEZ O FAMILIAS O COMUNIDAD EN EL SECTOR PÚBLICO O PRIVADO CON POBLACIONES VULNERABLES.","•	TÍTULO O BACHILLER UNIVERSITARIO EN EDUCACIÓN (INICIAL O PRIMARIA) O CIENCIAS DE LA SALUD HUMANA (ENFERMERÍA, PSICOLOGÍA, OBSTETRICIA O NUTRICIÓN) O CIENCIAS SOCIALES (SOCIOLOGÍA, TRABAJO SOCIAL O ANTROPOLOGÍA) O TÍTULO DE ESCUELA/INSTITUTO DE EDUCACIÓN SUPERIOR PEDAGÓGICO (INICIAL O PRIMARIA)",•	“CURSOS Y/O CAPACITACIÓN EN DESARROLLO INFANTIL TEMPRANO Y/O PRIMERA INFANCIA Y/O TRABAJO CON FAMILIAS Y/O PROYECTOS SOCIALES Y/O DESARROLLO SOCIAL Y/O DESARROLLO HUMANO U OTROS TEMAS AFINES (ÚLTIMOS 5 AÑOS)”,"•	""CONOCIMIENTO EN OFIMÁTICA NIVEL BÁSICO (WORD, EXCEL, POWER POINT). •	LENGUA ORIGINARIA SEGÚN AMBITO DE TRABAJO - NIVEL INTERMEDIO (DE SER EL CASO)"" •	DISPONIBILIDAD PARA VIAJAR DENTRO Y FUERA DEL DEPARTAMENTO CUANDO EL SERVICIO LO AMERITE","•	COMUNICACIÓN ORAL, EMPATÍA, NEGOCIACIÓN Y PLANIFICACIÓN",ACOMPAÑANTE TECNICO PARA EL SERVICIO DE CUIDADO DIURNO,Programa Nacional Cuna Mas,LA LIBERTAD - VIRU
"https://www.facebook.com/redsaludgranchimucascas,",2,D.Leg 1057 - Determinado (Necesidad Transitoria)-03,"S/. 3,164.19",30/01/2025,12/02/2025,"EXPERIENCIA GENERAL
EXPERIENCIA REQUERIDA EN EL SECTOR SALUD PÚBLICO Y/O 
PRIVADO: 02 AÑOS (NO INCLUYE SERUMS)",• TÍTULO PROFESIONAL EN ENFERMERÍA • COLEGIATURA Y HABILITACIÓN VIGENTE,"RELACIONADOS EN INMUNIZACIONES, GUÍAS DE PRÁCTICAS  CLÍNICAS EN EMERGENCIAS Y HOSPITALIZACIONES",• MANEJO DE URGENCIAS Y EMERGENCIAS  • ORIENTACIÓN Y CONSEJERÍA FAMILIAR  • MEDIDAS DE BIOSEGURIDAD.  • INMUNIZACIONES. • CONTROL DE CRECIMIENTO Y DESARROLLO  • PROCESO DE ATENCIÓN DE ENFERMERÍA,"VOCACIÓN DE SERVICIO, TRABAJO EN EQUIPO,  COMPORTAMIENTO ÉTICO, ORIENTACIÓN DE SERVICIO AL  CIUDADANO, COMUNICACIÓN ASERTIVA",ENFERMERA/O,Unidad Ejecutora De Salud Gran Chimu,LA LIBERTAD - CASCAS
"https://www.facebook.com/redsaludgranchimucascas,",1,D.Leg 1057 - Determinado (Necesidad Transitoria)-03,"S/. 1,914.19",30/01/2025,12/02/2025,"•	EXPERIENCIA GENERAL
EXPERIENCIA REQUERIDA EN EL SECTOR SALUD PÚBLICO Y/O PRIVADO: 02 AÑOS",•	CERTIFICADO DE ESTUDIOS - SECUNDARIA COMPLETA,"EN SERVICIOS DE LIMPIEZA, MANTENIMIENTO Y MANEJO DE RESIDUOS SÓLIDOS.","•	CONOCIMIENTO EN SERVICIOS DE LIMPIEZA, MANTENIMIENTO Y MANEJO DE RESIDUOS SÓLIDOS.","•	VOCACIÓN DE SERVICIO, TRABAJO EN EQUIPO, COMPORTAMIENTO ÉTICO, ORIENTACIÓN DE SERVICIO AL CIUDADANO, COMUNICACIÓN ASERTIVA.",TRABAJADOR DE SERVICIOS,Unidad Ejecutora De Salud Gran Chimu,LA LIBERTAD - CASCAS
https://www.facebook.com/@portalugelotuzco/?locale=es_la,1,D.Leg 1057 - Determinado (Necesidad Transitoria)-001,"S/. 2,264.19",29/01/2025,11/02/2025,"•	GENERAL: MÍNIMO DOS (02) AÑOS DE EXPERIENCIA LABORAL EN EL SECTOR PÚBLICO Y/O PRIVADO. 
•	ESPECIFICA: MÍNIMO UN (01) AÑO EN LABORES VARIADAS DE ESTADÍSTICA EN EL SECTOR PÚBLICO.","PROFESIONAL TITULADO EN ESTADÍSTICA, ECONOMÍA, ADMINISTRACIÓN, CONTABILIDAD O INGENIERÍA, COLEGIADO Y HABILITADO.","•	CURSO DE OFFICE (WORD, EXCEL, POWER POINT). •	CURSO O DIPLOMADO EN GESTIÓN PÚBLICA.","•	CONOCIMIENTO Y MANEJO DE ESCALE, SIAMED. •	CONOCIMIENTO EN MONITOREO, EVALUACIÓN Y SEGUIMIENTO DE IMPLEMENTACIÓN DE PROGRAMAS O PROYECTOS EDUCATIVOS O SOCIALES, DISEÑO, RECOLECCIÓN Y ANÁLISIS DE INFORMACIÓN.","PROACTIVIDAD, RESPONSABILIDAD, TRABAJO EN EQUIPO, TOLERANCIA BAJO PRESIÓN, ORIENTACIÓN AL SERVIDOR Y PÚBLICO EN GENERAL.",ESPECIALISTA EN ESTADÍSTICA,Unidad De Gestion Educativa Local De  Otuzco,LA LIBERTAD
https://www.facebook.com/@portalugelotuzco/?locale=es_la,1,D.Leg 1057 - Determinado (Necesidad Transitoria)-001,"S/. 1,964.19",29/01/2025,11/02/2025,"GENERAL: MÍNIMO DOS (02) AÑOS DE EXPERIENCIA LABORAL EN EL SECTOR PÚBLICO Y/O PRIVADO.
ESPECIFICA: MÍNIMO (06) MESES DE EXPERIENCIA LABORAL EN LA FUNCIÓN Y/O SIMILAR.","TÉCNICO, BACHILLER Y/O TÍTULO EN ADMINISTRACIÓN, MARKETING, CIENCIAS DE LA COMUNICACIÓN, RELACIONES PÚBLICAS, PERIODISMO Y/O AFINES POR LA FORMACIÓN.",CURSOS Y/O PROGRAMAS DE ESPECIALIZACIÓN DE PROTOCOLO E IMAGEN INSTITUCIONAL Y/O COMUNICACIÓN CORPORATIVA. CURSO DE DISEÑO DE PÁGINAS WEB Y/O PROGRAMAS DE DISEÑO Y/O ADMINISTRACIÓN DE CUENTAS INSTITUCIONALES EN REDES SOCIALES Y PÁGINAS WEB. GESTIÓN PÚBLICA Y/O ADMINISTRACIÓN PÚBLICA Y/O AFINES Y/O COMMUNITY MANAGER.,GESTIÓN PÚBLICA Y/O ADMINISTRACIÓN PÚBLICA Y/O AFINES Y/O COMMUNITY MANAGER.,"PROACTIVIDAD, RESPONSABILIDAD, TRABAJO EN EQUIPO, TOLERANCIA BAJO PRESIÓN, ORIENTACIÓN AL SERVIDOR Y PÚBLICO EN GENERAL.",ESPECIALISTA EN IMAGEN INSTITUCIONAL,Unidad De Gestion Educativa Local De  Otuzco,LA LIBERTAD
https://www.facebook.com/@portalugelotuzco/?locale=es_la,1,D.Leg 1057 - Determinado (Necesidad Transitoria)-001,"S/. 2,264.19",29/01/2025,11/02/2025,"GENERAL: MÍNIMO DOS (02) AÑOS DE EXPERIENCIA LABORAL EN EL SECTOR PÚBLICO Y/O PRIVADO.
ESPECIFICA: MÍNIMO SEIS (06) MESES DE EXPERIENCIA LABORAL EN EL SECTOR PÚBLICO EN FUNCIONES Y/O MATERIAS SIMILARES.","TÉCNICO, BACHILLER Y/O TÍTULO EN ADMINISTRACIÓN O INGENIERÍA O CARRERAS AFINES POR LA FORMACIÓN.","• CURSO DE OFFICE (WORD, EXCEL). •	CURSO Y/O PROGRAMA DE SIGA MÓDULO PATRIMONIO. •	CURSO Y/O PROGRAMA DEL SISTEMA SINABIP. •	CURSO O DIPLOMADO EN GESTIÓN PÚBLICA. •	CONOCIMIENTOS ACTUALIZADOS EN CONTROL PATRIMONIAL. •	CONOCIMIENTO COMO MÍNIMO DE UN PROGRAMA CONTABLE.  •	DE PREFERENCIA CON CONOCIMIENTOS EN SIAF.","CONOCIMIENTO DE LA LEY Nº 27444, DL. 276, DL 1057 Y LEY Nº 30057.","PROACTIVIDAD, RESPONSABILIDAD, TRABAJO EN EQUIPO, TOLERANCIA BAJO PRESIÓN, ORIENTACIÓN AL SERVIDOR Y PÚBLICO EN GENERAL.",ESPECIALISTA EN CONTROL PATRIMONIAL,Unidad De Gestion Educativa Local De  Otuzco,LA LIBERTAD
https://www.facebook.com/@portalugelotuzco/?locale=es_la,1,276-1,"S/. 2,797.95",29/01/2025,11/02/2025,"UN (01) AÑO EN EL CARGO O SIMILAR, EN EL SECTOR PÚBLICO.","TÍTULO PROFESIONAL DE ABOGADO, COLEGIADO Y HABILITADO.","CAPACITACIÓN ESPECIALIZADA: SEIS (06) MESES DE CAPACITACIÓN ESPECIALIZADA PARA EL SISTEMA, EN DERECHO PÚBLICO Y LEGISLACIÓN EDUCATIVA.",LEGISLACIÓN EDUCATIVA.,"PROACTIVIDAD, RESPONSABILIDAD, TRABAJO EN EQUIPO, TOLERANCIA BAJO PRESIÓN, ORIENTACIÓN AL SERVIDOR Y PÚBLICO EN GENERAL.",ABOGADO I,Unidad De Gestion Educativa Local De  Otuzco,LA LIBERTAD
https://muniangasmarca.gob.pe,1,D.Leg 1057 - Determinado (Necesidad Transitoria)-001,"S/. 1,800.00",28/01/2025,10/02/2025,NO MENOR A 01 AÑO EN EL SECTOR PUBLICO Y/ PRIVADO,"EDUCACIÓN BÁSICA,GRADO/ SITUACIÓN ACADÉMICA : NO APLICA",NO APLICA,NO APLICA,"LICENCIA DE CONDUCIR (AIII-A,AIII-B O AIII-C)",CONDUCTOR DE CAMION COMPACTADOR,Municipalidad Distrital De Angasmarca,LA LIBERTAD - ANGASMARCA
https://muniangasmarca.gob.pe,1,D.Leg 1057 - Determinado (Necesidad Transitoria)-001,"S/. 3,700.00",28/01/2025,10/02/2025,"NO MENOR A 04 AÑOS EN EL SECTOR PUBLICO Y/O PRIVADO.
ESPERIENCIA ESPECIFICA: NO MENOR A 03 AÑOS.",TITULO PROFESIONAL EN INGENIERIA CIVIL Y/O ARQUITECTURA.,"CURSOS Y/O PROGRAMAS DE ESPECIALIZACIÓN POR MÁS DE 50 HORAS LECTIVAS, A FINES A LA FUNCIÓN.",NO APLICA,NO APLICA,SUBGERENTE DE ESTUDIOS Y PROYECTOS,Municipalidad Distrital De Angasmarca,LA LIBERTAD - SANTIAGO DE CHUCO
