job_posting_url,vacancies,job_posting_number,salary,start_publication_date,end_publication_date,required_experience,educational_background,specialization,required_knowledge,skills,job_title,public_institution,ubication
https://www.migraciones.gob.pe/oportunidades_laborales_2025/,3,D.Leg 1057 - Determinado (Necesidad Transitoria)-062,"S/. 3,000.00",19/02/2025,04/03/2025,"""• EXPERIENCIA GENERAL: TRES (03) AÑOS EN EL SECTOR PÚBLICO Y/O PRIVADO.
• EXPERIENCIA ESPECÍFICA: DOS (02) AÑOS EN EL PUESTO Y/O FUNCIÓN Y/O LABORANDO EN ÁREAS RELACIONADAS A INSPECIÓN, VERIFICACIÓN, FISCALIZACIÓN Y/O PROCEDIMIENTO ADMINISTRATIVO EN EL SECTOR PÚBLICO 
Y/O PRIVADO.""","""• BACHILLER UNIVERSITARIO EN LAS CARRERAS DE ADMINISTRACIÓN Y/O  DERECHO Y/O ECONOMÍA Y/O CIENCIAS POLÍTICAS Y/O CONTABILIDAD  Y/O INGENIERÍA Y/O AFINES. """,• CURSO EN LA LEY DE PROCEDIMIENTO ADMINISTRATIVO GENERAL Y/O DERECHO ADMINISTRATIVO Y/O PROCEDIMIENTO ADMINISTRATIVO GENERAL Y/O PROCEDIMIENTO ADMINISTRATIVO SANCIONADOR (24 HORAS CONTINUAS O 40 HORAS ACUMULADAS).,"""• DECRETO LEGISLATIVO 1350, SU REGLAMENTO Y MODIFICATORIAS.        • LEY DE PROCEDIMIENTO ADMINISTRATIVO GENERAL.   • OFIMÁTICA A NIVEL BÁSICO.""","ANÁLISIS, EMPATÍA Y VOCACIÓN DE SERVICIO",ASISTENTE OPERATIVO DE VERIFICACIÓN Y FISCALIZACIÓN MIGRATORIA,Superintendencia Nacional De Migraciones - Migraciones,AREQUIPA - AREQUIPA
https://www.gob.pe/institucion/fap/informes-publicaciones/tipos/107-concurso-publico,1,276-01,"S/. 3,159.30",19/02/2025,04/03/2025,"DOS (02) AÑOS DE EXPERIENCIA GENERAL , UN (01) AÑO DE EXPERIENCIA EN LA FUNCIÓN Y/O MATERIA EN EL SECTOR PÚBLICO O PRIVADO",BACHILLER EN LA CARRERA DE CONTABILIDAD O AFINES POR LA FORMACIÓN(INDISPENSABLE),AFINES A LA ESPECIALIDAD (DESEABLE),AFINES A LA ESPECIALIDAD (DESEABLE),"TRABAJO EN EQUIPO, PUNTUALIDAD Y DESTREZA EN EL CUMPLIMIENTO DE SUS FUNCIONES.",ASISTENTE DE CONTABILIDAD,Fuerza Aerea Del Peru,AREQUIPA - LA JOYA
https://www.gob.pe/institucion/fap/informes-publicaciones/tipos/107-concurso-publico,1,276-01,"S/. 3,072.30",19/02/2025,04/03/2025,"ACREDITAR EXPERIENCIA DE DOS (02) AÑOS EN ENTIDADES PÚBLICAS Y/O PRIVADAS. (INDISPENSABLE)
RECORD DE CONDUCCIÓN - CERO (0) PUNTAJE (NO REGISTRAR INFRACCIONES DE TRÁNSITO), SEGÚN SISTEMA MTC. (INDISPENSABLE)",ACREDITAR SECUNDARIA COMPLETA. (INDISPENSABLE),AFINES A LA ESPECIALIDAD (DESEABLE),CURSO BÁSICO DE MECÁNICA (MECÁNICA AUTOMOTRIZ O MAQUINARIA PESADA).(INDISPENSABLE),"TRABAJO EN EQUIPO, PUNTUALIDAD Y DESTREZA EN EL CUMPLIMIENTO DE SUS FUNCIONES.",OPERADOR(A) DE VEHÍCULOS MOTORIZADOS,Fuerza Aerea Del Peru,AREQUIPA - LA JOYA
https://www.gob.pe/institucion/fap/informes-publicaciones/tipos/107-concurso-publico,1,276-01,"S/. 3,072.30",19/02/2025,04/03/2025,"ACREDITAR (01) AÑO DE EXPERIENCIA ESPECÍFICA EN EL SECTOR PÚBLICO O PRIVADO, RELACIONADAS A LA ESPECIALIDAD. (INDISPENSABLE)",TÍTULO INSTITUTO SUPERIOR RELACSISTEMA NACIONAL DEL PERSONAL COMPETENCIAS           EJEM. ORIENIONADO CON LA ESPECIALIDAD DE ADMINISTRACIÓN DE EMPRESAS EXPEDIDO A NOMBRE DE LA NACIÓN (03) AÑOS. BACHILLER UNIVERSITARIO Y/O ESTUDIOS UNIVERSITARIOS MAYOR AL 6TO CICLO (06 SEMESTRES ACADÉMICOS APROBADOS – CERTIFICADO DE ESTUDIOS EXPEDIDO POR LA UNIVERSIDAD) EN LA CARRERA PROFESIONAL DE ADMINISTRACIÓN DE EMPRESAS Y/O ADMINISTRACIÓN DE NEGOCIOS INTERNACIONALES Y/O INGENIERÍA INDUSTRIAL. (INDISPENSABLE),AFINES A LA ESPECIALIDAD (DESEABLE),"CERTIFICADO DE NIVEL  BÁSICO DE MICROSOFT OFFICE (POWERPOINT, WORD, EXCEL). (DESEABLE), CERTIFICADO DE MANEJO DE RRHH EN EL SECTOR PÚBLICO (OPCIONAL).","TRABAJO EN EQUIPO, PUNTUALIDAD Y DESTREZA EN EL CUMPLIMIENTO DE SUS FUNCIONES.",TÉCNICO(A) ADMINISTRATIVO,Fuerza Aerea Del Peru,AREQUIPA - LA JOYA
https://www.gob.pe/mdsantaisabeldesiguas,1,D.Leg 1057 - Determinado (Necesidad Transitoria)-001,"S/. 2,800.00",18/02/2025,03/03/2025,EXPERIENCIA GENERAL DE  TRES (03) AÑOS EN EL SECTOR PÚBLICO Y/O PRIVADO.,"PROFESIONAL TITULADO COLEGIADO Y HABILITADO DE LA CARRERA DE ABOGADO (A), ADMINISTRACION.","GESTION PUBLICA, DERECHO ADMINISTRATIVO","LEY 27444, LEY DE CONTRATACIONES CON EL ESTADO Y SU REGLAMENTO",BUENAS RELACIONES INTERPERSONALES. TRABAJAR BAJO PRESIÓN. RESPONSABILIDAD. COORDINACIÓN. PROACTIVA. TRABAJO EN EQUIPO.,SECRETARIA(O) GENERAL,Municipalidad Distrital De Santa Isabel De Siguas,AREQUIPA - SANTA ISABEL DE SIGUAS
https://www.gob.pe/51648-servicio-de-agua-potable-y-alcantarillado-de-arequipa-convocatorias-laborales,1,728-001,"S/. 2,923.00",18/02/2025,03/03/2025,"A.GENERAL: DOS AÑOS 
B. ESPECIFICA: NO APLICA",A. NIVEL EDUCATIVO: TECNICO SUPERIOR COMPLETO - B.GRADO/SITUACION ACADEMICA : TITULO EN LA CARRERA TECNICADE MANTENIMIENTO O AFINES A LAS FUNCIONES DEL CARGO,CERTIFICADO DE GASFITERIA O INSTALACIONES SANITARIAS,NO APLICA,DE ACUERDO AL DICCIONARIO DE COMPETENCIAS,821 - OPERARIO DE SERVICIO Y MANTENIMIENTO (INDETERMINADO)  AP-O2,Sedapar S.A.,AREQUIPA - MEJIA
https://www.gob.pe/mdsantaisabeldesiguas,1,D.Leg 1057 - Determinado (Necesidad Transitoria)-001,"S/. 2,400.00",18/02/2025,03/03/2025,EXPERIENCIA GENERAL DE CINCO (05) AÑOS EN EL SECTOR PÚBLICO Y/O PRIVADO.,"PROFESIONAL TITULADO DE LA CARRERA DE TRABAJO SOCIAL, PSICOLOGÍA, DERECHO, CARRERA TÉCNICA Y/O CARRERAS AFINES.",CURSO DE OFIMÁTICA Y/O INFORMÁTICA.GESTIÓN PÚBLICA.,"PROGRAMA SOCIALES, CIAM, DEMUNA, OMAPED",BUENAS RELACIONES INTERPERSONALES. TRABAJAR BAJO PRESIÓN. RESPONSABILIDAD. COORDINACIÓN. PROACTIVA. TRABAJO EN EQUIPO.,RESPONSABLE DE LA UNIDAD DE DESARROLLO SOCIAL Y ECONÓMICO,Municipalidad Distrital De Santa Isabel De Siguas,AREQUIPA - SANTA ISABEL DE SIGUAS
https://www.gob.pe/mdsantaisabeldesiguas,1,D.Leg 1057 - Determinado (Necesidad Transitoria)-001,"S/. 2,500.00",18/02/2025,03/03/2025,EXPERIENCIA GENERAL DE TRES (03) AÑOS EN EL SECTOR PÚBLICO Y/O PRIVADO.,"BACHILLER O PROFESIONAL TITULADO DE LA CARRERA DE CONTABILIDAD, ADMINISTRACIÓN, ECONOMÍA Y/ O CARRERAS FINES.",CURSO DE OFIMÁTICA Y/O INFORMÁTICA. GESTIÓN PÚBLICA. SIAF,SISTEMA NACIONAL DE TESORERIA,BUENAS RELACIONES INTERPERSONALES. TRABAJAR BAJO PRESIÓN. RESPONSABILIDAD. COORDINACIÓN. PROACTIVA. TRABAJO EN EQUIPO.,RESPONSABLE DE LA OFICINA DE TESORERIA,Municipalidad Distrital De Santa Isabel De Siguas,AREQUIPA - SANTA ISABEL DE SIGUAS
https://www.gob.pe/mdsantaisabeldesiguas,1,D.Leg 1057 - Determinado (Necesidad Transitoria)-001,"S/. 2,800.00",18/02/2025,03/03/2025,EXPERIENCIA GENERAL DE TRES (03) AÑOS EN EL SECTOR PÚBLICO Y/O PRIVADO.,"BACHILLER O PROFESIONAL TITULADO DE LA CARRERA DE CONTABILIDAD, ADMINISTRACIÓN, ECONOMÍA Y/ O CARRERAS FINES.",CERTIFICACIÓN OSCE VIGENTE. CURSO DE OFIMÁTICA Y/O INFORMÁTICA. GESTIÓN PÚBLICA. LEY DE CONTRATACIONES CON EL ESTADO Y SU REGLAMENTO. SIAF,SISTEMA INTEGRAL DE GESTION ADMINISTRATIVA,BUENAS RELACIONES INTERPERSONALES. TRABAJAR BAJO PRESIÓN. RESPONSABILIDAD. COORDINACIÓN. PROACTIVA. TRABAJO EN EQUIPO.,RESPONSABLE DE LA OFICINA DE LOGISTICA Y ALMACEN,Municipalidad Distrital De Santa Isabel De Siguas,AREQUIPA - SANTA ISABEL DE SIGUAS
https://www.gob.pe/mdsantaisabeldesiguas,1,D.Leg 1057 - Determinado (Necesidad Transitoria)-001,"S/. 2,200.00",18/02/2025,03/03/2025,EXPERIENCIA GENERAL DE UN (02) AÑOS EN EL SECTOR PÚBLICO Y/O PRIVADO.,"BACHILLER O PROFESIONAL TITULADO DE LA CARRERA DE ING. AMBIENTAL, AGRONOMÍA, CIVIL Y/ O CARRERAS FINES.",CURSO DE OFIMÁTICA Y/O INFORMÁTICA.,"GESTION PUBLICA, LEY 27444.",BUENAS RELACIONES INTERPERSONALES. TRABAJAR BAJO PRESIÓN. RESPONSABILIDAD. COORDINACIÓN. PROACTIVA. TRABAJO EN EQUIPO.,"RESPONSABLE DE LA OFICINA DE GESTIÓN AMBIENTAL, ATM Y SERVICIOS PÚBLICOS",Municipalidad Distrital De Santa Isabel De Siguas,AREQUIPA - SANTA ISABEL DE SIGUAS
https://www.gob.pe/mdsantaisabeldesiguas,1,D.Leg 1057 - Determinado (Necesidad Transitoria)-001,"S/. 4,500.00",18/02/2025,03/03/2025,EXPERIENCIA GENERAL DE CINCO (05) AÑOS EN EL SECTOR PÚBLICO Y/O PRIVADO.,"PROFESIONAL TITULADO COLEGIADO Y HABILITADO DE LA CARRERA DE ING. CIVIL, ARQUITECTURA.","CURSO DE OFIMÁTICA Y/O INFORMÁTICA. GESTIÓN PÚBLICA. AUTOCAD, CIVIL 3D REVIT PROJET, S10.",DIRECTIVA N.° 017-2023-CG,BUENAS RELACIONES INTERPERSONALES. TRABAJAR BAJO PRESIÓN. RESPONSABILIDAD. COORDINACIÓN. PROACTIVA. TRABAJO EN EQUIPO.,JEFE DE LA UNIDAD DE DESARROLLO URBANO Y RURAL,Municipalidad Distrital De Santa Isabel De Siguas,AREQUIPA - SANTA ISABEL DE SIGUAS
https://ugelarequipasur.gob.pe,1,276-001,"S/. 1,166.00",18/02/2025,03/03/2025,EXPERIENCIA DE 01 AÑO EN EL SECTOR PUBLICO O PRIVADO,SECUNDARIA COMPLETA,NO APLICA,MANEJO DE EQUIPOS E INSTRUMENTOS DE LABORATORIO.,"ORDEN, INICIATIVA, COMPROBACION DE OBJETOS, ATENCION",AUXILIAR DE LABORATORIO,Gobierno Regional De Arequipa - Uge Sur,AREQUIPA - JOSE LUIS BUSTAMANTE Y RIVERO
https://www.gob.pe/51648-servicio-de-agua-potable-y-alcantarillado-de-arequipa-convocatorias-laborales,8,728-001,"S/. 2,078.00",18/02/2025,03/03/2025,"A. GENERAL: 01 AÑO
B. ESPECIFICA: NO APLICA",A. NIVEL EDUCATIVO: SECUNDARIA COMPLETA. B. GRADO/SITUACION ACADEMICA: NO APLICA,NO APLICA,NO APLICA,DE ACUERDO AL DICCIONARIO DE COMPETENCIAS.,558-593-594-595-596-597-598-599 OPERARIO LECTOR MEDIDOR (AP-05),Sedapar S.A.,AREQUIPA - AREQUIPA
https://www.gob.pe/51648-servicio-de-agua-potable-y-alcantarillado-de-arequipa-convocatorias-laborales,9,728-001,"S/. 2,078.00",18/02/2025,03/03/2025,"A.GENERAL: UN AÑO
B.EXPECIFICA: NO APLICA",A. NIVEL EDUCATIVO: SECUNDARIA COMPLETA  / B. GRADO-SITUACION: NO APLICA,NO APLICA,NO APLICA,DE ACUERDO AL DICCIONARIO DE COMPETENCIAS,557-561-562-563-566-571-582-583-589 / OPERARIO LECTOR MEDIDOR (SUPLENCIA)  AP-05,Sedapar S.A.,AREQUIPA - AREQUIPA
https://convocatorias.minsa.gob.pe/convocatorias,1,D.Leg 1057 - Determinado (Necesidad Transitoria)-22,"S/. 8,000.00",18/02/2025,03/03/2025,"¿	EXPERIENCIA LABORAL DE CUATRO (04) AÑOS EN EL SECTOR PÚBLICO Y/O PRIVADO.
¿	EXPERIENCIA LABORAL DE DOS (02) AÑOS PARA EL PUESTO EN FUNCIÓN O LA MATERIA, EN EL SECTOR PÚBLICO Y/O PRIVADO.
¿	EXPERIENCIA LABORAL NO MENOR A UN (01) AÑO PARA EL PUESTO EN FUNCIÓN O LA MATERIA, EN EL SECTOR PÚBLICO.","¿	TÍTULO UNIVERSITARIO EN BIOLOGÍA, MEDICINA VETERINARIA, MÉDICO CIRUJANO, INGENIERO QUÍMICO, INGENIERO EN INDUSTRIAS ALIMENTARIAS, INGENIERO EN ALIMENTOS, INGENIERÍA AGROINDUSTRIAL, INGENIERÍA INDUSTRIAL, LICENCIADO(A) EN ENFERMERÍA, LICENCIADO(A) EN QUÍMICA O LICENCIADO(A) EN NUTRICIÓN.   ¿	ACREDITAR HABER REALIZADO SERUMS EN CASO DE PROFESIONALES DE SALUD CUANDO CORRESPONDA. ¿	TENER DISPONIBILIDAD PARA TRASLADARSE AL INTERIOR DEL PAÍS EN CUMPLIMIENTO DE SUS FUNCIONES.",¿	CURSO O DIPLOMADO O ESPECIALIZACIÓN EN BUENAS PRÁCTICAS DE MANUFACTURAS (BPM) Y/O  CURSOS EN SISTEMA HACCP Y/O CURSO EN HIGIENE Y SANEAMIENTO Y/O LEGISLACIÓN ALIMENTARIA O GESTIÓN DE PROCESOS Y/O GESTIÓN DE LA INOCUIDAD ALIMENTARIA Y/O AFINES.,"¿	LEY N° 26842 LEY GENERAL DE SALUD, D. LEG N° 1062 LEY DE INOCUIDAD DE LOS ALIMENTOS, D.S. N° 34-2008-AG, REGLAMENTO DE LA LEY DE INOCUIDAD DE LOS ALIMENTOS, PRINCIPIOS GENERALES DE HIGIENE APROBADO POR D. S. N° 007-98-SA, LEY N° 27444 DE PROCEDIMIENTOS ADMINISTRATIVOS.","¿	TRABAJO EN EQUIPO, COMUNICATIVO, HABILIDAD ANALÍTICA.",UN (01) ESPECIALISTA EN INOCUIDAD ALIMENTARIA Y SALUD AMBIENTAL- REGIÓN AREQUIPA,Ministerio De Salud,AREQUIPA - AREQUIPA
https://www.facebook.com/irensurarequipa,1,D.Leg 1057 - Determinado (Necesidad Transitoria)-1,"S/. 5,289.19",18/02/2025,03/03/2025,EXPERIENCIA GENERAL: 03 AÑOS EN EL SECTOR PUBLICO Y PRIVADO  -  EXPERIENCIA ESPECIFICA :  02 AÑOS EN ONCOLOGIA PEDIATRICA O 03 AÑOS EN LA ESPECIALIDAD DE PEDITRIA,MEDICO CIRUJANO,ESPECIALISTA EN ONCOLOGIA PEDIATRICA O PEDIATRIA,CONOCIMIENTO EN MANEJO MEDICO INTEGRAL PEDIATRICO PARA LA ATENCION DEL PACIENTE ONCOLOGICO PEDIATRICO - CONOCIMIENTO EN RCP BASICO Y/O AVANZADO - CONOCIMIENTO EN MANEJO ONCOLOGICO PEDIATRICO,"COMPORTAMIENTO ETICO - ORIENTACION DE SERVICIO AL PACIENTE - COMUNICACION ASERTIVA - CAPACIDAD DE COORDINACIÓN, ORGANIZACIÓN Y CONTROL DE LOS RECURSOS ASIGNADOS. - CAPACIDAD DE LIDERAZGO ORIENTADO AL LOGRO DE LOS OBJETIVOS INSTITUCIONALES - TRABAJO EN EQUIPO Y BAJO PRESIÓN. -  INNOVACION Y APRENDIZAJE - ACTITUD CRITICA  - ACTITUD PROACTIVA Y CON ORIENTACIÓN A RESULTADOS. - ACTITUD DE ATENCIÓN Y SERVICIO AL PACIENTE Y FAMILIARES.",MEDICO ESPECIALISTA EN ONCOLOGIA PEDIATRICA O PEDIATRIA,Instituto Regional De Enfermedades Neoplasicas Del Sur,AREQUIPA - AREQUIPA
https://www.facebook.com/irensurarequipa,1,D.Leg 1057 - Determinado (Necesidad Transitoria)-1,"S/. 3,164.19",18/02/2025,03/03/2025,EXPERIENCIA GENERAL: 02 AÑOS EN EL SECTOR PUBLICO Y/O PRIVADO,ENFERMERA(O),ESPECIALIDAD EN EMERGENCIA,CONOCIMIENTOS EN CUIDADO DE ENFERMERIA EN LA ATENCION DE PACIENTES ONCOLOGICOS - CONOCIMIENTOS EN NORMAS DE BIOSEGURIDAD - CONOCIMIENTOS EN HIGIENE DE MANOS,"ORIENTACION DE SERVICIO AL PACIENTE Y FAMILIARES - COMUNICACION ASERTIVA - CAPACIDAD DE COORDINACION, ORGANIZACION Y CONTROL DE LOS RECURSOS ASIGNADOS -  CAPACIDAD DE LIDERAZGO ORIENTADO AL LOGRO DE LOS OBJETIVOS INSTITUCIONALES - TRABAJO EN EQUIPO Y BAJO PRESION",ENFERMERA ESPECIALISTA,Instituto Regional De Enfermedades Neoplasicas Del Sur,AREQUIPA - AREQUIPA
https://www.facebook.com/irensurarequipa,1,D.Leg 1057 - Determinado (Necesidad Transitoria)-1,"S/. 3,164.19",18/02/2025,03/03/2025,EXPERIENCIA GENERAL DE 03 AÑOS.EN EL SECTOR PUBLICO Y/O PRIVADO - EXPERIENCIA ESPECIFICA DE 01 AÑO EN EL PUESTO O MATERIA EN GERENCIA Y/O DIRECCIONES O CARGOS SIMILARES EN HOSPITALES Y/O PUESTOS DE SALUD.,ABOGADO TITULADO,-----,"CONOCIMIENTO EN DERECHO LABORAL Y PROCESO ADMINISTRATIVO, CONOCIMIENTO EN CONTRATACIONES CON EL ESTADO.","TRABAJO EN EQUIPO, COMPORTAMIENTO ETICO Y LIDERAZGO",ABOGADO,Instituto Regional De Enfermedades Neoplasicas Del Sur,AREQUIPA - AREQUIPA
https://www.gob.pe/institucion/fap/informes-publicaciones/tipos/107-concurso-publico,1,276-01,"S/. 3,072.30",18/02/2025,03/03/2025,"ACREDITAR (02) AÑOS DE EXPERIENCIA GENERAL. (INDISPENSABLE)
ACREDITAR UN (01) AÑO DE EXPERIENCIA EN LA FUNCIÓN Y/O MATERIA. (INDISPENSABLE)","FORMACIÓN ACADÉMICA, TÉCNICO SUPERIOR COMPLETO 3 AÑOS, TÍTULO TÉCNICO ELECTRICISTA AUTOMOTRIZ Y/O TÍTULO TÉCNICO ELECTROMECÁNICA",AFINES A LA ESPECIALIDAD,AFINES A LA ESPECIALIDAD,"TRABAJO EN EQUIPO, PUNTUALIDAD, RESPONSABILIDAD",TÉCNICO(A) ELECTRICISTA DE VEHÍCULOS MOTORIZADOS,Fuerza Aerea Del Peru,AREQUIPA - LA JOYA
https://www.gob.pe/institucion/fap/informes-publicaciones/tipos/107-concurso-publico,1,276-01,"S/. 3,072.30",18/02/2025,03/03/2025,"ACREDITAR DOS (02) AÑO DE EXPERIENCIA GENERAL EN EL SECTOR PÚBLICO O PRIVADO, RELACIONADAS A LA ESPECIALIDAD. (INDISPENSABLE)
ACREDITAR UN (01) AÑO DE EXPERIENCIA EN LA FUNCIÓN Y/O MATERIA. (INDISPENSABLE)",BACHILLER UNIVERSITARIO Y/O ESTUDIOS UNIVERSITARIOS MAYOR AL 6TO CICLO (06 SEMESTRES ACADÉMICOS APROBADOS – CERTIFICADO DE ESTUDIOS EXPEDIDO POR LA UNIVERSIDAD) EN LA CARRERA PROFESIONAL DE ADMINISTRACIÓN DE EMPRESAS O TITULO TÉCNICO ADMINISTRATIVO,AFINES A LA ESPECIALIDAD,"CERTIFICADO DE NIVEL BÁSICO DE MICROSOFT OFFICE (POWER POINT, WORD, EXCEL). (INDISPENSABLE), CERTIFICADO DE MANEJO DE RRHH EN EL SECTOR PÚBLICO (OPCIONAL).","TRABAJO EN EQUIPO, PUNTUALIDAD.",TÉCNICO(A) ADMINISTRATIVO,Fuerza Aerea Del Peru,AREQUIPA - LA JOYA
https://web.grearequipa.gob.pe/,1,D.Leg 1057 - Determinado (Necesidad Transitoria)-03,"S/. 4,064.19",18/02/2025,03/03/2025,"4 AÑOS EN EL SECTOR PUBLICO O PRIVADO
2 AÑOS DE EXPERIENCIA PARA EL PUESTO
1 AÑO EN EL SECTOR PUBLICO","TITULO UNIVERSITARIO EN PSICOLOGIA O TRABAJO SOCIAL, COLEGIADO Y HABILITADO","RELACIONADOS A GESTION O PROMOCION DE LA CONVIVENCIA ESCOLAR Y/O TUTORIAL Y ORIENTACION EDUCATIVA O PROTECION Y DERECHOS DE NIÑOS, NIÑAS O ATENCION DE LA VIOLENCIA O DISEÑO, GESTION O MONITOREO DE PROYECTOS EDUCATIVOS, SOCIALES O COMUNITARIOS","MANEJO DE COMPUTADORA A NIVEL USUARIO, PROCESADOR DE TEXTOS WORD, EXCEL POWER POINT",TRABAJO EN EQUIPO. CREATIVIDAD E INNOVACIÓN. RESILIENCIA. LIDERAZGO Y AUTOGESTIÓN. PENSAMIENTO CRÍTICO. COMUNICACIÓN ASERTIVA. EMPATÍA. ADAPTABILIDAD.,ESPECIALISTA EN CONVIVENCIA ESCOLAR REGIONAL,Gerencia Regional De Educación,AREQUIPA - YANAHUARA
https://www.gob.pe/51648-servicio-de-agua-potable-y-alcantarillado-de-arequipa-convocatorias-laborales,1,728-001,"S/. 2,078.00",18/02/2025,03/03/2025,"A.GENERAL: UN AÑO
B. ESPECIFICA: NO APLICA",A. NIVEL EDUCATIVO: SECUNDARIA COMPLETA -  B. GRADO / SITUACION ACADEMICA: MO APLICA,NO APLICA,NO APLICA,DE ACUERDO AL DICCIONARIO DE COMPETENCIAS,678 - OPERARIO DE ALMACÉN Y SERVICIOS GENERALES (INDETERMINADO) - AP-05,Sedapar S.A.,AREQUIPA - CAMANA
https://www.gob.pe/51648-servicio-de-agua-potable-y-alcantarillado-de-arequipa-convocatorias-laborales,1,728-001,"S/. 3,577.00",18/02/2025,03/03/2025,"A.GENERAL: DOS AÑOS
B. ESPECIFICA: UN AÑO",A. NIVEL EDUCATIVO: UNIVERSITARIA COMPLETA - B: GRADO/SITUACION ACADEMICA: TITULO UNIVERSITARIO EN AL CARRERA DE INGENIERIA CIVIL O INGENIERIA SANITARIA,NO APLICA,COLEGIADO Y HABILITADO PARA EL EJERCICIO PROFESIONAL - CONOCIMIENTO EN OFIMATICAEN NIVEL BASICO,DE ACUERDO AL DICCIONARIO DE COMPETENCIAS,671 - PROFESIONAL DE OPERACIONES - CAMANA (INDETERMINADO) - ES-P1,Sedapar S.A.,AREQUIPA - CAMANA
https://www.gob.pe/51648-servicio-de-agua-potable-y-alcantarillado-de-arequipa-convocatorias-laborales,1,728-001,"S/. 3,577.00",18/02/2025,03/03/2025,"A. GENERAL: DOS AÑOS
B: ESPECIFICA: UN AÑO","A. NIVEL EDUCATIVO: UNIVERSITARIA COMPLETA -  B. GRADO / SITUACION ACADEMICA: TITULO UNIVERSITARIO EN LA CARRERA DE INGENIERIA QUIMICA, QUIMICA O BIOLOGIA",NO APLICA,COLEGIADO Y HABILITADO PARA EL EJERCICIO PROFESIONAL - CONOCIMIENTOS EN OFIMATICA EN NIVEL BASICO,DE ACUERDO AL DICCIONARIO DE COMPETENCIAS,668 - PROFESIONAL DE LABORATORIO (SUPLENCIA) - ES-P1,Sedapar S.A.,AREQUIPA - CAMANA
https://www.gob.pe/51648-servicio-de-agua-potable-y-alcantarillado-de-arequipa-convocatorias-laborales,1,728-001,"S/. 2,338.00",18/02/2025,03/03/2025,"A. GENERAL: DOS AÑOS
B. ESPECIFICA: NO APLICA","A. NIVEL EDUCATIVO: TECNICO SUPERIOR COMPLETO / B. GRADO/SITUACION ACADEMICA:TITULO EN LA CARRERA TECNICA DE ADMINISTRACION, CONTABILIDAD, INFORMATICA O AFINES A LAS FUNCIONES DEL CARGO",NO APLICA,CONOCIMIENTO EN OFIMATICA EN NIVEL BASICO,DE ACUERDO AL DICCIONARIO DE COMPETENCIAS.,664-AUXILIAR ADMINISTRATIVO COMERCIAL (INDETERMINADO) - AP-A2,Sedapar S.A.,AREQUIPA - CAMANA
https://www.gob.pe/51648-servicio-de-agua-potable-y-alcantarillado-de-arequipa-convocatorias-laborales,2,728-001,"S/. 2,190.00",18/02/2025,03/03/2025,"A. GENERAL: UN AÑO
B: ESPECIFICA: NO APLICA",A. NIVEL EDUCATIVO: TECNICO BASICO COMPLETO - GRADO/SITUACION ACADEMICA : EGRESADO EN LA CARRERA TECNICA DE MANTENIMIENTO O AFINES A LAS FUNCIONES DEL CARGO,NO APLICA,NO APLICA,DE ACUERDO AL DICCIONARIO DE COMPETENCIAS,704-705 - GUARDIAN OPERADOR (INDETERMINADO) AP-04,Sedapar S.A.,AREQUIPA - CHALA
https://www.gob.pe/51648-servicio-de-agua-potable-y-alcantarillado-de-arequipa-convocatorias-laborales,1,728-001,"S/. 3,088.00",18/02/2025,03/03/2025,"A.GENERAL: DOS AÑOS 
B. ESPECIFICA: NO APLICA","A. NIVEL EDUCATIVO: TECNICO SUPERIOR COMPLETO O UNIVERSITARIA COMPLETA - B.GRADO/SITUACION ACADEMICA : TITULO EN LA CARRERA TECNICA DE MANTENIMIENTO, MECANICA O BACHILLER UNIVERSITARIO EN LA CARRERA DE INGENIERIA CIVIL, INGENIERIA SANITARIA, INGENIERIA INDUSTRIAL O INGENIERIA MECANICA",NO APLICA,CONOCIMIENTOS EN OFIMATICA EN NIVEL BASICO,DE ACUERDO AL DICCIONARIO DE COMPETENCIA,718 - TECNICO DE OPERACIONES (INDETERMINADO)  AP-A1,Sedapar S.A.,AREQUIPA - APLAO
https://www.gob.pe/51648-servicio-de-agua-potable-y-alcantarillado-de-arequipa-convocatorias-laborales,1,728-001,"S/. 3,577.00",18/02/2025,03/03/2025,"A.GENERAL: DOS AÑOS 
B. ESPECIFICA: UN AÑO",A. NIVEL EDUCATIVO: UNIVERSITARIA COMPLETA - B.GRADO/SITUACION ACADEMICA : TITULO UNIVERSITARIO EN LA CARRERA DE INGENIERIA CIVIL O INGENIERIA SANITARIA  -  COLEGIADO Y HABILITADO,NO APLICA,CONOCIMIENTO EN OFIMATICA EN NIVEL BASICO,DE ACUERDO AL DICCIONARIO DE COMPETENCIAS,716 - PROFESIONAL DE OPERACIONES (INDETERMINADO) ES-P1,Sedapar S.A.,AREQUIPA - APLAO
https://www.gob.pe/51648-servicio-de-agua-potable-y-alcantarillado-de-arequipa-convocatorias-laborales,1,728-001,"S/. 3,577.00",18/02/2025,03/03/2025,"A.GENERAL: DOS AÑOS 
B. ESPECIFICA: UN AÑO",A. NIVEL EDUCATIVO: UNIVERSITARIA COMPLETA - B.GRADO/SITUACION ACADEMICA : TITULO EN LA CARRERA DE INGENIERIA QUIMICA - COLEGIADO Y HABILITADO,NO APLICA,CONOCIMIENTO EN OFIMATICA EN NIVEL BASICO,DE ACUERDO AL DICCIONARIO DE COMPETENCIAS,715 - PROFESIONAL DE TRATAMIENTO DE AGUAS RESIDUALES (INDETERMINADO) ES-P1,Sedapar S.A.,AREQUIPA - APLAO
https://www.gob.pe/51648-servicio-de-agua-potable-y-alcantarillado-de-arequipa-convocatorias-laborales,1,728-001,"S/. 3,577.00",18/02/2025,03/03/2025,"A.GENERAL: DOS AÑOS 
B. ESPECIFICA: UN AÑO","A. NIVEL EDUCATIVO: UNIVERSITARIA COMPLETA - B.GRADO/SITUACION ACADEMICA : TITULO UNIVERSITARIO EN LA CARRERA DE INGENIERIA QUIMICA, QUIMICA O BIOLOGIA - COLEGIADO Y HABILITADO",NO APLICA,CONOCIMIENTO EN OFIMATICA EN NIVEL BASICO,DE ACUERDO AL DICCIONARIO DE COMPETENCIAS,714 - PROFESIONAL DE LABORATORIO  (INDETERMINADO)  ES-P1,Sedapar S.A.,AREQUIPA - APLAO
https://ugelcamana.gob.pe/,4,D.Leg 1057 - Determinado (Necesidad Transitoria)-02,"S/. 1,614.19",17/02/2025,28/02/2025,"12 MESES EXPERIENCIA GENERAL Y ESPECIFICA 10 MESES COMO COORDINADOR O ASISTENTE DE SOPORTE TÉCNICO DE LOS RECURSOS TECNOLÓGICOS EN IIEE O ENTIDAD PÚBLICA O PRIVADA. EN EL CASO DE PROFESOR EN
COMPUTACIÓN E INFORMÁTICA O BACHILLER EN EDUCACIÓN: 10 MESES COMO DOCENTE A CARGO DEL AULA DE INNOVACIÓN O LA QUE HAGA SUS VECES.",TECNICO SUPERIOR COMPLETO (COMPUTACIÓN E INFORMÁTICA O COMPUTACIÓN O INFORMÁTICA O EN EDUCACIÓN CON ESPECIALIDAD DE COMPUTACIÓN O INFORMÁTICA.),NO APLICA,"MANEJO DE ESTRATEGIAS Y HERRAMIENTAS DE USO DE TECNOLOGÍAS DE LA INFORMACIÓN Y COMUNICACIÓN. CONOCIMIENTO Y MANEJO DE APLICACIONES Y SOLUCIONES TECNOLÓGICAS (PLATAFORMAS, APLICATIVOS, ENTRE OTROS). CONOCIMIENTO SOBRE GESTIÓN, PLANIFICACIÓN, ORGANIZACIÓN Y LIDERAZGO PARA LA ADMINISTRACIÓN DE RECURSOS TECNOLÓGICOS EN EL AULA. DE PREFERENCIA CON CONOCIMIENTOS EN ADMINISTRACIÓN DE SERVIDORES EN PLATAFORMA WINDOWS Y/O LINUX. CONOCIMIENTO DE NORMATIVIDAD VIGENTE VINCULADA A PROCESOS E INSTRUMENTOS DE GESTIÓN ESCOLAR Y DEL MODELO DE SERVICIO EDUCATIVO JEC CONOCIMIENTO EN REPARACIÓN O MANTENIMIENTO DE COMPUTADORAS.","INICIATIVA, ANÁLISIS, CONTROL, PLANIFICACIÓN",COORDINADOR(A) DE INNOVACION Y SOPORTE TECNOLOGICO,Ugel Camaná,AREQUIPA - SAMUEL PASTOR
https://ugelcamana.gob.pe/,1,D.Leg 1057 - Determinado (Necesidad Transitoria)-02,"S/. 2,964.19",17/02/2025,28/02/2025,UN (01) AÑO EN EL SECTOR PÚBLICO O PRIVADO.,NIVEL EDUCATIVO UNIVERSITARIO COMPLETO (TITULO LICENCIATURA) TECNÓLOGO MÉDICO EN EL ÁREA/MENCIÓN/ESPECIALIDAD TERAPIA FÍSICA O TERAPIA FISICA Y REHABILITACIÓN .,NO APLICA,DESARROLLO INFANTIL TEMPRANO. INTERVENCIÓN TEMPRANA. TRABAJO INDIVIDUAL Y GRUPAL EN ENTORNOS NO ESCOLARIZADOS. TRABAJO CON FAMILIAS. ORGANIZACIÓN Y PROGRAMAS EN INTERVENCIÓN TEMPRANA.,- COMUNICACIÓN ORAL - COOPERACIÓN - INICIATIVA - EMPATÍA - TRABAJO EN EQUIPO.,PROFESIONAL EN TECNOLOGÍA MÉDICA CON MENCIÓN EN TERAPIA FÍSICA PARA LOS PROGRAMAS DE INTERVENCIÓN TEMPRANA,Ugel Camaná,AREQUIPA - SAMUEL PASTOR
https://ugelcamana.gob.pe/,2,D.Leg 1057 - Determinado (Necesidad Transitoria)-02,"S/. 2,764.19",17/02/2025,28/02/2025,01 AÑOS EN EL SECTOR PÚBLICO O PRIVADO,LICENCIADO EN PSICOLOGÍA (TITULO LICENCIATURA) (CON COLEGIATURA Y HABILITACIÓN PROFESIONAL),"CURSOS RELACIONADOS A: CONVIVENCIA ESCOLAR, TUTORÍA Y ORIENTACIÓN EDUCATIVA; O PROTECCIÓN Y DERECHOS DE NIÑOS, NIÑAS Y ADOLESCENTES O ATENCIÓN DE VÍCTIMAS DE VIOLENCIA; O GESTIÓN DE PROYECTOS EDUCATIVOS, SOCIALES O COMUNITARIOS.","GESTIÓN DE LA CONVIVENCIA ESCOLAR, PAUTAS PARA LA PREVENCIÓN Y ATENCIÓN DE LA VIOLENCIA EN LAS INSTITUCIONES EDUCATIVAS",EMPATÍA -ASERTIVIDAD -ANÁLISIS -BUENA COMUNICACIÓN ORAL Y ESCRITA -ORGANIZACIÓN DE LA INFORMACIÓN,PROFESIONAL EN PSICOLOGÍA,Ugel Camaná,AREQUIPA - SAMUEL PASTOR
https://ugelcamana.gob.pe/,3,D.Leg 1057 - Determinado (Necesidad Transitoria)-02,"S/. 1,414.19",17/02/2025,28/02/2025,01 AÑO EXPERIENCIA LABORAL; YA SEA EN EL SECTOR PÚBLICO O PRIVADO 06 MESES EN MANTENIMIENTO O LIMPIEZA.EXPERIENCIA REQUERIDA PARA EL PUESTO,SECUNDARIA COMPLETA,NO APLICA,"MANEJO DE INSUMOS Y RECURSOS DE LIMPIEZA Y MANTENIMIENTO. MANEJO DE PROCEDIMIENTOS PARA LA DESINFECCIÓN DE AMBIENTES, EQUIPOS Y MATERIALES DE LA IE. CONOCIMIENTOS SOBRE EL FUNCIONAMIENTO DE LAS IIEE JEC.","ORDEN, INICIATIVA, COMPROBACIÓN DE OBJETOS, ATENCIÓN",PERSONAL DE MANTENIMIENTO,Ugel Camaná,AREQUIPA - SAMUEL PASTOR
https://ugelcamana.gob.pe/,2,D.Leg 1057 - Determinado (Necesidad Transitoria)-02,"S/. 1,414.19",17/02/2025,28/02/2025,1 AÑO A 6 MESES EN LABORES DE LIMPIEZA Y O MANTENIMIENTO,SECUNDARIA COMPLETA (CERTIFICADO DE ESTUDIOS),NO APLICA,"CONOCIMIENTOS BÁSICOS DE ELECTRICIDAD, GASFITERÍA Y/O CARPINTERÍA (DESEABLE, NO EXCLUYENTE PARA LA CONTRATACIÓN).","ORIENTACIÓN AL SERVICIO, ORDEN, TRABAJO EN EQUIPO, PROACTIVIDAD, RESPONSABILIDAD Y PUNTUALIDAD.",PERSONAL DE LIMPIEZA Y MANTENIMIENTO,Ugel Camaná,AREQUIPA - SAMUEL PASTOR
https://ugelcamana.gob.pe/,1,D.Leg 1057 - Determinado (Necesidad Transitoria)-02,"S/. 2,964.19",17/02/2025,28/02/2025,UN (01) AÑO Y 06 MESES EN EL SECTOR PÚBLICO O PRIVADO.,NIVEL EDUCATIVO UNIVERSITARIO COMPLETO (TITULO LICENCIATURA) TECNÓLOGO MÉDICO EN EL ÁREA/MENCIÓN/ESPECIALIDAD TERAPIA FÍSICA O TERAPIA FISICA Y REHABILITACIÓN O TERAPIA OCUPACIONAL O TERAPIA DE LENGUAJE.,NO APLICA,COMPETENCIAS OCUPACIONALES PARA LA ATENCIÓN DE PERSONAS EN CONDICIÓN DE DISCAPACIDAD. TRABAJO CON FAMILIAS. DESARROLLO EVOLUTIVO.,- COMUNICACIÓN ORAL - COOPERACIÓN - INICIATIVA - EMPATÍA - TRABAJO EN EQUIPO.,"PROFESIONAL EN TECNOLOGÍA MÉDICA CON MENCIÓN EN TERAPIA FÍSICA, OCUPACIONAL O DE LENGUAJE PARA CEBE",Ugel Camaná,AREQUIPA - SAMUEL PASTOR
