job_posting_url,vacancies,job_posting_number,salary,start_publication_date,end_publication_date,required_experience,educational_background,specialization,required_knowledge,skills,job_title,public_institution,ubication
https://ugeltacna.gob.pe/convocatorias-cas,1,D.Leg 1057 - Determinado (Necesidad Transitoria)-03,"S/. 2,614.19",18/02/2025,03/03/2025,"EXPERIENCIA GENERAL: 02 AÑOS DE EXPERIENCIA GENERAL YA SEA EN EL SECTOR PÚBLICO O PRIVADO 
EXPERIENCIA ESPECÍFICA: 01 AÑO COMO DOCENTE O PROFESOR DE MUSICA O EDUCADOR MUSICAL","UNIVERSITARIO COMPLETO - BACHILLER UNIVERSITARIO O  BACHILLER TÉCNICO SUPERIOR EN  DOCENTEDEMUSICA,EDUCACIÓN  MUSICAL Y/O MÚSICA Y/O  INTERPRETACIÓNMUSICAL Y/UOTRAS  ESPECIALIDADES AFINES A LA  MÚSICA",CURSOS Y/O DIPLOMADOS RELACIONADOS PARA EL PUESTO EN LA FUNCIÓN O LA MATERIA.,"CONOCIMIENTOS DE PEDAGOGÍA MUSICAL Y DIDÁCTICA MUSICAL, CONOCIMIENTO DE HERRAMIENTAS TIC Y PLATAFORMAS VIRTUALES, CONOCIMIENTO   INICIACIÓN MUSICAL, CONOCIMIENTOS EN LA ENSEÑANZA Y PRÁCTICA DE INSTRUMENTOS DE VIOLÍN, VIOLA, CONTRABAJO, VIOLONCHELLO, CORNO, TUBA, TROMBÓN,  CLARINETE, TROMPETA, OBOE, FAGOT, SAXOFÓN, FLAUTA TRAVERSA, INSTRUMENTOS TRADICIONALES, PERCUSIÓN. CONOCIMIENTOS EN CANTO Y/O DIRECCIÓN CORAL.  CONOCIMIENTO EN ATENCIÓN EDUCATIVA A PERSONAS CON DISCAPACIDAD","PLANIFICACIÓN, ORGANIZACIÓN DE LA INFORMACIÓN, TRABAJO EN EQUIPO, RELACIONES INTERPERSONALES Y COMUNICACIÓN ORAL.",EDUCADOR(A) MUSICAL DE LA INICIATIVA PEDAGÓGICA ORQUESTANDO,Unidad De Gestion Educativa Local De Tacna - Ugel Tacna,TACNA - TACNA
https://convocatorias.minsa.gob.pe/convocatorias,1,D.Leg 1057 - Determinado (Necesidad Transitoria)-016,"S/. 8,000.00",18/02/2025,03/03/2025,"¿	EXPERIENCIA LABORAL DE CUATRO (04) AÑOS EN EL SECTOR PÚBLICO Y/O PRIVADO.
¿	EXPERIENCIA LABORAL DE DOS (02) AÑOS PARA EL PUESTO EN FUNCIÓN O LA MATERIA, EN EL SECTOR PÚBLICO Y/O PRIVADO.
¿	EXPERIENCIA LABORAL DE UN (01) AÑO PARA EL PUESTO EN FUNCIÓN O LA MATERIA, EN EL SECTOR PÚBLICO.","¿	TÍTULO UNIVERSITARIO EN BIOLOGÍA, MEDICINA VETERINARIA, MÉDICO CIRUJANO, INGENIERO QUÍMICO, INGENIERO EN INDUSTRIAS ALIMENTARIAS, INGENIERO EN ALIMENTOS, INGENIERÍA AGROINDUSTRIAL, INGENIERÍA INDUSTRIAL, LICENCIADO(A) EN ENFERMERÍA, LICENCIADO(A) EN QUÍMICA O LICENCIADO EN NUTRICIÓN. ¿	COLEGIADO Y HABILITADO. ¿	ACREDITAR HABER REALIZADO SERUMS EN CASO DE PROFESIONALES DE SALUD CUANDO CORRESPONDA.",¿	CURSO O DIPLOMADO O ESPECIALIZACIÓN EN BUENAS PRÁCTICAS DE MANUFACTURAS (BPM) Y/O CURSOS EN SISTEMA HACCP Y/O CURSO EN HIGIENE Y SANEAMIENTO Y/O LEGISLACIÓN ALIMENTARIA O GESTIÓN DE PROCESOS Y/O GESTIÓN DE LA INOCUIDAD ALIMENTARIA Y/O AFINES.,"¿	LEY N° 26842 LEY GENERAL DE SALUD, D. LEG. N° 1062 LEY DE INOCUIDAD DE LOS ALIMENTOS, D.S. N° 34-2008-AG, REGLAMENTO DE LA LEY DE INOCUIDAD DE LOS ALIMENTOS, PRINCIPIOS GENERALES DE HIGIENE APROBADO POR D. S. N° 007-98-SA, LEY N° 27444 DE PROCEDIMIENTOS ADMINISTRATIVOS. ¿	CONOCIMIENTO EN PROCESADOR DE TEXTOS A NIVEL BÁSICO. ¿	CONOCIMIENTO EN HOJAS DE CÁLCULO A NIVEL BÁSICO. ¿	CONOCIMIENTO EN PROGRAMA DE PRESENTACIONES A NIVEL BÁSICO. ¿	CONOCIMIENTO EN INGLES A NIVEL BÁSICO.",¿	TRABAJO EN EQUIPO. ¿	COMUNICATIVO. ¿	HABILIDAD ANALÍTICA.,ESPECIALISTA EN INOCUIDAD ALIMANTARIA Y SALUD AMBIENTAL – REGIÓN TACNA,Ministerio De Salud,TACNA - TACNA
https://www.munitacna.gob.pe,3,D.Leg 1057 - Determinado (Necesidad Transitoria)-24,"S/. 3,300.00",18/02/2025,03/03/2025,EXPERIENCIA LABORAL MINIMA DE UN (01) AÑO EN EL SECTOR PUBLICO,TITULO UNIVERSITARIO,DERECHO,"TUO DE LA LEY N° 27444, DL 276,728 Y 1057",REALIZAR LA LABOR DE PRECALIFICACION DE LAS DENUNCIAS ADMINISTRATIVAS DISCIPLINARIAS DE LOS EXPEDIENTES ASIGNADOS,ESPECIALISTA 1,Municipalidad Provincial De Tacna,TACNA - TACNA
https://ugeltacna.gob.pe/convocatorias-cas,1,D.Leg 1057 - Determinado (Necesidad Transitoria)-03,"S/. 5,264.19",18/02/2025,03/03/2025,"EXPERIENCIA GENERAL: 04  AÑOS DE EXPERIENCIA LABORAL; YA SEA EN EL SECTOR PÚBLICO O PRIVADO
 EXPERIENCIA ESPECÍFICA: 02 AÑOS DE EXPERIENCIA EN EDUCACIÓN INCLUSIVA Y/O ATENCIÓN A LA DIVERSIDAD Y/O DUA Y/O MONITOREO EN INSTITUCIONES EDUCATIVAS Y/O GESTIÓN EDUCATIVA*. Y/O TUTORÍA Y/O CONVIVENCIA",TÉCNICA SUPERIOR  (3 O 4 AÑOS) - COMPLETA BACHILLER EN EDUCACION,"EDUCACIÓN INCLUSIVA Y/O DISEÑO UNIVERSAL PARA EL APRENDIZAJE Y/O DISCAPACIDAD Y/O TRASTORNOS DEL NEURODESARROLLO (TEA, TDAH,  TRASTORNOS DE APRENDIZAJE) Y/O ESTRATEGIAS PARA ATENDER A LA DIVERSIDAD Y/O CNEB Y/O TUTORÍA Y/O CONVIVENCIA Y/O ATENCIÓN A POBLACIONES  VULNERABLES","CON CONOCIMIENTOS SOBRE EL CNEB, EDUCACIÓN INCLUSIVA Y/O ATENCIÓN A LA DIVERSIDAD Y/O DISEÑO UNIVERSAL PARA EL APRENDIZAJE Y/O  ESTRATEGIAS DE ACOMPAÑAMIENTO A LA COMUNIDAD EDUCATIVA.","INICIATIVA, ANÁLISIS, ORGANIZACIÓN, PLANIFICACIÓN, LIDERAZGO, EMPATÍA, COMUNICACIÓN ASERTIVA Y TRABAJO EN EQUIPO.",COORDINADOR UGEL DE SAEE,Unidad De Gestion Educativa Local De Tacna - Ugel Tacna,TACNA - TACNA
https://ugeltacna.gob.pe/convocatorias-cas,14,D.Leg 1057 - Determinado (Necesidad Transitoria)-03,"S/. 1,614.19",18/02/2025,03/03/2025,"EXPERIENCIA GENERAL: 12 MESES DE EXPERIENCIA LABORAL; YA SEA EN EL SECTOR PÚBLICO O PRIVADO
EXPERIENCIA ESPECÍFICA: 10 MESES COMO COORDINADOR O ASISTENTE DE SOPORTE TÉCNICO DE LOS RECURSOS TECNOLÓGICOS EN IIEE O ENTIDAD PÚBLICA O PRIVADA. EN EL CASO DE PROFESOR EN COMPUTACIÓN E INFORMÁTICA O BACHILLER EN EDUCACIÓN: 10 MESES COMO DOCENTE A CARGO DEL AULA DE INNOVACIÓN O LA QUE HAGA SUS VECES.",TÉCNICA SUPERIOR  (3 O 4 AÑOS) - COMPLETO EGRESADO DE  COMPUTACIÓN E INFORMÁTICA O  COMPUTACIÓN O INFORMÁTICA O EN  EDUCACIÓN CON ESPECIALIDAD DE  COMPUTACIÓN O INFORMÁTICA.,CURSOS DE OFIMÁTICA COMO MÍNIMO DE 90 HORAS O CURSO DE REPARACIÓN O MANTENIMIENTO DE COMPUTADORAS.  CURSO O DIPLOMADO O CAPACITACIÓN DE INTEGRACIÓN DE LAS TIC EN EL PROCESO DE ENSEÑANZA-APRENDIZAJE O AFINES COMO MÍNIMO DE 90 HORAS.,"MANEJO DE ESTRATEGIAS Y HERRAMIENTAS DE USO DE TECNOLOGÍAS DE LA INFORMACIÓN Y COMUNICACIÓN.  CONOCIMIENTO Y MANEJO DE APLICACIONES Y SOLUCIONES TECNOLÓGICAS (PLATAFORMAS, APLICATIVOS, ENTRE OTROS).  CONOCIMIENTO SOBRE GESTIÓN, PLANIFICACIÓN, ORGANIZACIÓN Y LIDERAZGO PARA LA ADMINISTRACIÓN DE  RECURSOS TECNOLÓGICOS EN EL AULA. DE  PREFERENCIA CON CONOCIMIENTOS EN ADMINISTRACIÓN DE SERVIDORES EN PLATAFORMA WINDOWS Y/O LINUX.  CONOCIMIENTO DE NORMATIVIDAD VIGENTE VINCULADA A PROCESOS E INSTRUMENTOS DE GESTIÓN ESCOLAR Y DEL MODELO DE SERVICIO EDUCATIVO  JEC CONOCIMIENTO EN REPARACIÓN O  MANTENIMIENTO DE COMPUTADORAS.","INICIATIVA, ANÁLISIS, CONTROL, PLANIFICACIÓN.",COORDINADOR (A) DE INNOVACIÓN Y SOPORTE TECNOLÓGICO,Unidad De Gestion Educativa Local De Tacna - Ugel Tacna,TACNA - TACNA
https://www.munitacna.gob.pe,1,D.Leg 1057 - Determinado (Necesidad Transitoria)-24,"S/. 1,600.00",18/02/2025,03/03/2025,EXPRIENCIA LABORAL MINIMA DE UN (01) AÑO EN EL SECTOR PUBLICO,EGRESADO UNIVERSITARIO,DERECHO,OFIMATICA,REGISTRO DE LA DOCUMENTACION RECIBIDA Y EMITIDA DE LA STPAD,APOYO ADMINISTRATIVO TECNICO,Municipalidad Provincial De Tacna,TACNA - TACNA
https://web.munialtoalianza.gob.pe/convocatoria,1,D.Leg 1057 - Determinado (Necesidad Transitoria)-28,"S/. 3,000.00",18/02/2025,03/03/2025,"CONTAR CON EXPERIENCIA MINIMA DE 03 AÑOS EN EL SECTOR PUBLICO Y/O PRIVADO, CONTAR CON 01 AÑO DE EXPERIENCIA ESPECÍFICA, CONTAR CON 01 AÑO DE EXPERIENCIA EN EL SECTOR PÚBLICO EN PUESTOS AFINES Y/O EQUIVALENTES AL PUESTO.",TITULO PROFESIONAL DE DERECHO,CURSO DE ESPECIALIZACIÓN Y/O DIPLOMADOS DE ACUERDO A LAS FUNCIONES SEÑALADAS.,"D.S. N°004-2019-JUS-TUO DE LA LEY N°27444, LEY DE PROCEDIMIENTO ADMINISTRATIVO GENERAL Y SUS MODIFICATORIAS, ORDENANZAS MUNICIPALES SOBRE SANCIONES ADMINISTRATIVAS Y PROCEDIMIENTO ADMINISTRATIVO SANCIONADOR.","ANALISIS Y SINTESIS, COMUNICACIÓN ORAL Y ESCRITA, ORIENTACIÓN A RESULTADOS Y ORGANIZACIÓN DE LA INFORMACIÓN, DISCRECIÓN.",RESPONSABLE PROFESIONAL DE LA SUB UNIDAD DE POLICIA MUNICIPAL,Municipalidad Distrital Alto De Alianza,TACNA - ALTO DE LA ALIANZA
https://web.munialtoalianza.gob.pe/convocatoria,1,D.Leg 1057 - Determinado (Necesidad Transitoria)-29,"S/. 2,700.00",18/02/2025,03/03/2025,"CONTAR CON EXPERIENCIA MINIMA DE 03 AÑOS EN EL SECTOR PUBLICO Y/O PRIVADO, CONTAR CON 01 AÑO DE EXPERIENCIA ESPECÍFICA, CONTAR CON 01 AÑO DE EXPERIENCIA EN EL SECTOR PÚBLICO EN PUESTOS AFINES Y/O EQUIVALENTES AL PUESTO.","TITULO PROFESIONAL EN ADMINISTRACION, INGENIERIA COMERCIAL Y/O AFINES.",CURSO DE ESPECIALIZACIÓN Y/O DIPLOMADOS DE ACUERDO A LAS FUNCIONES SEÑALADAS.,CONOCIMIENTOS EN GESTIÓN PÚBLICA,"ANALISIS Y SINTESIS, COMUNICACIÓN ORAL Y ESCRITA, ORIENTACIÓN A RESULTADOS Y ORGANIZACIÓN DE LA INFORMACIÓN, DISCRECIÓN.",RESPONSABLE DE LA SUB UNIDAD DE PROMOCION EMPRESARIAL Y LICENCIAS,Municipalidad Distrital Alto De Alianza,TACNA - ALTO DE LA ALIANZA
https://www.gob.pe/municalana,1,D.Leg 1057 - Determinado (Necesidad Transitoria)-003,"S/. 3,100.00",18/02/2025,03/03/2025,"EXPERIENCIA GENERAL 3 AÑOS, EXPERIENCIA ESPECIFICA 2 AÑOS EN FUNCION Y/O MATERIA, EXPERIENCIA 1 AÑO EN EL SECTOR PÚBLICA EJERCIENDO LABORES EN LA MATERIA","TITULO PROFESIONAL DE ABOGADO, COLEGIADO Y HABILITADO",CURSOS AFINES AL AREA,OFIMATICA BASICA,"TRABO EN EQUIPO, CAPACIDAD DE TRABAJO BAJO PRESION, ANALITICO, PLANIFICADOR, PROACTIVO",JEFE DE LA UNIDAD DE FISCALIZACIÓN Y CONTROL MUNICIPAL,Municipalidad Distrital De Calana,TACNA - CALANA
https://www.gob.pe/municalana,1,D.Leg 1057 - Determinado (Necesidad Transitoria)-003,"S/. 3,100.00",18/02/2025,03/03/2025,"EXPERIENCIA GENERAL 5 AÑOS EN EL SECTOR PUBLICO Y/O PRIVADO, EXPERIENCIA DE  3 AÑOS EN EL SECTOR PÚBLICO","TITULO PROFESIONAL DE CONTADOR PÚBLICO, COLEGIADO Y HABILITADO",CURSOS AFINES AL AREA,OFIMATICA BASICA,"TRABO EN EQUIPO, CAPACIDAD DE TRABAJO BAJO PRESION, ANALITICO, PLANIFICADOR, PROACTIVO",JEFE DE LA UNIDAD DE CONTABILIDAD,Municipalidad Distrital De Calana,TACNA - CALANA
https://ugeltacna.gob.pe/convocatorias-cas,1,D.Leg 1057 - Determinado (Necesidad Transitoria)-03,"S/. 4,764.19",18/02/2025,03/03/2025,"EXPERIENCIA GENERAL : 03  AÑOS DE EXPERIENCIA LABORAL; LA SEA EN EL SECTOR PÚBLICO O PRIVADA
 EXPERIENCIA ESPECÍFICA:  DOS (02) AÑOS DE EXPERIENCIA COMO DOCENTE CAPACITADOR EN TEMAS PEDAGÓGICOS O GESTIÓN ESCOLAR Y/O REVISOR DE INSTRUMENTOS DE GESTIÓN. Y QUE ESTE SEA 01 AÑO DE EXPERIENCIA EN EL SECTOR PUBLICO",UNIVERSITARIO COMPLETO - TÍTULO/LICENCIATURA EN PROFESOR/LICENCIADO EN  EDUCACIÓN,"EN PROCESOS DE EVALUACIÓN Y/O VERIFICACIÓN Y/O CERTIFICACIÓN Y/O ACREDITACIÓN DE II.EE.- CURSO, CAPACITACIÓN, DIPLOMA, O SIMILARES, EN ENTORNOS VIRTUALES Y/O DE EDUCACIÓN A DISTANCIA Y/O MANEJO DE PLATAFORMAS EDUCATIVAS.","- CONOCIMIENTO DE LOS LINEAMIENTOS PEDAGÓGICOS ESTABLECIDOS POR EL MINISTERIO DE EDUCACIÓN.  - CONOCIMIENTO DEL ENFOQUE POR COMPETENCIAS Y EVALUACIÓN FORMATIVA.  - CONOCIMIENTO SOBRE LA ELABORACIÓN, IMPLEMENTACIÓN Y EVALUACIÓN DE INSTRUMENTOS DE GESTIÓN.","PLANIFICACIÓN, CONTROL, ADAPTABILIDAD, ANÁLISIS, TRABAJO EN EQUIPO.",SUPERVISORES UGEL REGIONES - PEDAGOGÍA,Unidad De Gestion Educativa Local De Tacna - Ugel Tacna,TACNA - TACNA
https://convocatoria.minjus.gob.pe/convocatoria/public/index.xhtml,1,D.Leg 1057 - Determinado (Necesidad Transitoria)-150,"S/. 7,264.19",17/02/2025,28/02/2025,"•	EXPERIENCIA LABORAL GENERAL MÍNIMA DE CUATRO (04) AÑOS, EN EL SECTOR PÚBLICO Y/O PRIVADO (ACREDITAR CON CONSTANCIA, CERTIFICADO Y/O DOCUMENTO ANÁLOGO).
•	EXPERIENCIA ESPECÍFICA MÍNIMA DE TRES (03) AÑOS, EN LA FUNCIÓN O MATERIA, EN EL SECTOR PÚBLICO Y/O PRIVADO (NIVEL MINIMO DE TRABAJADORA SOCIAL O SU EQUIVALENTE). (ACREDITAR CON CONSTANCIA, CERTIFICADO Y/O DOCUMENTO ANÁLOGO).","•	TÍTULO PROFESIONAL EN TRABAJO SOCIAL, COLEGIADO Y HABILITACIÓN VIGENTE (ACREDITAR CON COPIA DEL TÍTULO, COPIA DE COLEGIATURA Y CONSTANCIA DE HABILITACIÓN VIGENTE, LA QUE DEBERÁ ESTAR VIGENTE HASTA LA FINALIZACIÓN DE LA ETAPA DE LA EVALUACIÓN CURRICULAR, CONFORME AL CRONOGRAMA DEL PRESENTE PROCESO DE CONTRATACIÓN).","•	DIPLOMADO Y/O PROGRAMA DE ESPECIALIZACIÓN EN TEMAS RELACIONADOS A FAMILIA O CONSEJERÍA FAMILIAR O ÉTICA O TÉCNICAS DE INVESTIGACIÓN SOCIAL O ELABORACIÓN DE INFORMES SOCIALES O PERITAJE SOCIAL O GESTIÓN PÚBLICA, EL CUAL DEBERÁ TENER UNA DURACIÓN NO MENOR DE NOVENTA (90) HORAS LECTIVAS, POR TANTO, LOS CERTIFICADOS Y/O CONSTANCIAS DEBEN INDICAR EL NÚMERO DE HORAS LECTIVAS, CASO CONTRARIO NO SERÁN TOMADOS EN CUENTA (ACREDITAR CON CONSTANCIA Y/O CERTIFICADO).","•	CONOCIMIENTOS TÉCNICOS (*): CONOCIMIENTOS EN TRABAJO SOCIAL, ÉTICA, GESTIÓN PÚBLICA, CONSEJERÍA FAMILIAR.  CONOCIMIENTOS DE OFIMÁTICA (*): PROCESADOR DE TEXTOS (WORD, OPEN OFFICE WRITE, ETC.), HOJA DE CÁLCULO (EXCEL, OPENCALC, ETC.), PROGRAMA DE PRESENTACIONES (POWER POINT, PREZI, ETC.),  TODOS CON NIVEL DE DOMINIO BÁSICO.",•	COMPROMISO. •	RESPONSABILIDAD. •	VOCACIÓN DE SERVICIO. •	ADAPTABILIDAD – FLEXIBILIDAD. •	COMUNICACIÓN. •	ORIENTACIÓN A RESULTADOS. •	CONCIENCIA SOCIAL. •	CAPACIDAD DE ANÁLISIS Y SÍNTESIS. •	NEGOCIACIÓN. •	PROACTIVIDAD.,RESPONSABLE DE TRABAJO SOCIAL,Ministerio De Justicia Y Derechos Humanos,TACNA - TACNA
https://munilabaya.gob.pe/web/tra_convocatorias.php,1,D.Leg 1057 - Determinado (Necesidad Transitoria)-002,"S/. 2,500.00",17/02/2025,28/02/2025,"EXPERIENCIA GENERAL: MÍNIMO DE 01 AÑO EN EL SECTOR PÚBLICO Y/O PRIVADO.
EXPERIENCIA ESPECÍFICA: 06 MESES EN CARGOS AFINES EN ENTIDADES PÚBLICAS Y/O PRIVADAS.",PERSONA NATURAL O CON FORMACIÓN DE TÉCNICO EN MECÁNICA AUTOMOTRIZ,NO INDISPENSABLE,CURSOS O CAPACITACIONES EN PROGRAMAS O HERRAMIENTAS RELACIONADAS CON LA ESPECIALIDAD.,DISPONIBILIDAD TOTAL INMEDIATA. PROACTIVO Y CAPACIDAD LABORAL. ALTA CAPACIDAD DE TRABAJO A PRESIÓN.,AYUDANTE DE MECÁNICO,Municipalidad Distrital De Ilabaya,TACNA - ILABAYA
https://www.munitacna.gob.pe,1,D.Leg 1057 - Determinado (Necesidad Transitoria)-22,"S/. 3,300.00",17/02/2025,28/02/2025,EXPERIENCIA LABORAL MINIMA DE UN(01) AÑO EN EL SECTOR PUBLICO,TITULO UNIVERSITARIO,"ARQUITECTURA, ING. CIVIL Y/O AFINES",EN LA NORMATIVIDAD REFERIDA A LA GESTION DE LOS BIENES ESTATALES,ELABORAR Y SUPERVISAR LAS ACCIONES DE DIAGNOSTICO Y SANEAMIENTO FISICO LEGAL DE LOS BINES DE LA MUNICIPALIDAD,"ESPECIALISTA 1 ""A""",Municipalidad Provincial De Tacna,TACNA - TACNA
https://www.cenepred.gob.pe/web/oportunidades/,1,D.Leg 1057 - Determinado (Necesidad Transitoria)-002,"S/. 8,000.00",17/02/2025,28/02/2025,"MÍNIMA DE SEIS (6) AÑOS DE EXPERIENCIA LABORAL GENERAL EN EL SECTOR PÚBLICO O PRIVADO.
MÍNIMA DE DOS (2) AÑOS DE EXPERIENCIA LABORAL ESPECÍFICA PARA EL PUESTO EN EL SECTOR PÚBLICO O PRIVADO EN LA FUNCIÓN O LA MATERIA.
MÍNIMA DE TRES (2) AÑOS DE EXPERIENCIA LABORAL ESPECÍFICA PARA EL PUESTO EN SERVICIOS VINCULADOS A LAS GESTIONES DEL RIESGO DE DESASTRES.
MÍNIMA DE DOS (2) AÑOS DE EXPERIENCIA LABORAL EN EL SECTOR PÚBLICO.","TÍTULO PROFESIONAL DE LA CARRERA DE INGENIERÍA, ARQUITECTURA, ADMINISTRACIÓN Y/O CIENCIAS MILITARES.  MAESTRÍA Y/O EGRESADO EN GESTIÓN DEL RIESGO DE DESASTRES Y/O GESTIÓN PÚBLICA Y/O GESTIÓN ESTRATÉGICA Y/O ADMINISTRACIÓN Y/O DESARROLLO Y DEFENSA NACIONAL Y/O SEGURIDAD Y DEFENSA NACIONAL Y/O GESTIÓN EDUCATIVA.",CURSOS Y/O PROGRAMA DE ESPECIALIZACIÓN EN GESTIÓN DEL RIESGO DE DESASTRES Y/O EVALUADOR DE RIESGOS ORIGINADOS POR FENÓMENOS NATURALES Y/O GESTIÓN PÚBLICA Y/O EN DESARROLLO Y DEFENSA NACIONAL. CURSOS VINCULADOS A LA GESTIÓN PROSPECTIVA Y CORRECTIVA DEL RIESGO DE DESASTRES. LOS CURSOS NO MENORES DE 24 HORAS Y LOS PROGRAMAS DE ESPECIALIZACIÓN NO MENOR DE 90 HORAS.,NORMATIVA NACIONAL EN GESTIÓN DEL RIESGO DE DESASTRES. INSTRUMENTOS TÉCNICOS EN GESTIÓN PROSPECTIVA Y CORRECTIVA DEL RIESGO DE DESASTRES  SISTEMAS DE INFORMACIÓN GEOGRÁFICA  MECANISMOS FINANCIEROS EN GESTIÓN DEL RIESGO DE DESASTRES PLANIFICACIÓN TERRITORIAL  EVALUACIÓN DEL RIESGO ORIGINADOS POR FENÓMENOS NATURALES  OFIMÁTICA (WORD Y EXCEL NIVEL BÁSICO Y POWER POINT NIVEL INTERMEDIO).,"ANÁLISIS, PLANIFICACIÓN, ORGANIZACIÓN DE INFORMACIÓN Y REDACCIÓN.",COORDINADOR DE ENLACE REGIONAL EN TACNA,"Centro Nacional De Estimacion, Prevencion Y Reduccion Del Riesgo De Desastres (Cenepred)",TACNA - TACNA
https://http://postulacioncas.minedu.gob.pe/postulacioncas/home,1,D.Leg 1057 - Determinado (Necesidad Transitoria)-0192,"S/. 4,500.00",17/02/2025,28/02/2025,"EXPERIENCIA GENERAL: 4.00 AÑO(S), EXPERIENCIA ESPECIFICA:  3.00 AÑOS ES DOCENCIA DE LA ESPECIALIDAD DE COMPUTACIÓN E INFORMÁTICA O TECNOLOGÍA EN EDUCACIÓN SECUNDARIA O SUPERIOR. (AÑOS ACADÉMICOS), DE LOS CUALES 0.00 AÑO(S) EN EL SECTOR PÚBLICO.",TITULADO DE CARRERA TÉCNICA EN  EDUCACIÓN EN LA ESPECIALIDAD DE COMPUTACIÓN Y/O INFORMÁTICA Y/O BACHILLER EN INFORMÁTICA Y/O INGENIERÍA DE SISTEMAS,CURSO Y/O DIPLOMADO DE EST PEDAGÓGICAS Y/O DIDÁCTICA Y/O EVALUACIÓN Y/O METODOLOGÍA DE LA ENSEÑANZA Y/O RUTAS DE APRENDIZAJE Y/O CURRÍCULO NACIONAL,"CONOCIMIENTO DE LA ACTITUD HACIA LA INTERCULTURALIDAD, CONOCIMIENTO DEL PROGRAMA DEL DIPLOMA DEL BACHILLERATO INTERNACIONAL; CONOCIMIENTO DE LA ESPECIALIDAD, CONOCIMIENTO SOBRE PLANIFICACIÓN, EJECUCIÓN Y EVALUACIÓN CURRICULAR; CONOCIMIENTO DEL ENFOQUE POR COMPETENCIAS Y CONOCIMIENTO DE TIC APLICADOS A SU ASIGNATURA; CONOCIMIENTO EN MANEJO DE PLATAFORMAS VIRTUALES",ADAPTABILIDAD; PROACTIVIDAD; TRABAJO EN EQUIPO,CONTRATACIÓN ADMINISTRATIVA DE SERVICIOS DE UN(A) PROFESIONAL DOCENTE PARA LA ENSEÑANZA DE LA ASIGNATURA DE TECNOLOGÍA PARA EL COLEGIO DE ALTO RENDIMIENTO DE LA REGIÓN TACNA - PLAZO DETERMINADO (007181),Ministerio De Educacion,TACNA - TACNA
https://www.munitacna.gob.pe,1,D.Leg 1057 - Determinado (Necesidad Transitoria)-22,"S/. 2,250.00",17/02/2025,28/02/2025,EXPERIENCIA LABORAL MINIMA DE UN (0!) AÑO EN EL SECTOR PUBLICO,TITULO UNIVERSITARIO,"DERECHO, CIENCIAS POLITICAS Y/O AFINES",GESTION PUBLICA,ELABORAR INFORMES LEGALES DE LA OBI,"ASISTENTE PROFESIONAL ""F""",Municipalidad Provincial De Tacna,TACNA - TACNA
https://www.munitacna.gob.pe,1,D.Leg 1057 - Determinado (Necesidad Transitoria)-22,"S/. 2,250.00",17/02/2025,28/02/2025,EXPERIENCIA LABORAL MINIMA DE UN (01) AÑO EN EL SECTOR PUBLICO,BACHILLER UNIVERSITARIO,ING. AMBIENTAL Y/O AFINES,LEY DE CONTRATACIONES CON EL ESTADO OSCE,PROYECTAR INFRMES RESPECTO A LA BUSQUEDA DE DOCUMENTOS DE LOS CENTROS COMERCIALES Y MERCADOS DE LA MPT,"ASISTENTE PROFESIONAL ""E""",Municipalidad Provincial De Tacna,TACNA - TACNA
https://www.munitacna.gob.pe,1,D.Leg 1057 - Determinado (Necesidad Transitoria)-22,"S/. 2,250.00",17/02/2025,28/02/2025,EXPERIENCIA LABORAL MINIMA DE  UN (01) AÑO EN EL SECTOR PUBLICO,BACHILLER UNIVERSITARIO,"DERECHO, CIENCIAS POLITICAS Y/O AFINES",DERECHO ADMINISTRATIVO Y PROCEDIMIENTO ADMINISTRATIVO GENERAL,"PROYECTAR INFORMES DEL AREA DE REGISTRO, CONTROL Y ARCHIVO DE OBI","ASISTENTE PROFESIONAL ""D""",Municipalidad Provincial De Tacna,TACNA - TACNA
https://www.munitacna.gob.pe,1,D.Leg 1057 - Determinado (Necesidad Transitoria)-022,"S/. 2,250.00",17/02/2025,28/02/2025,EXPERIENCIA LABORAL MINIMA DE UN (01) AÑO EN EL SECTOR PUBLICO,BACHILLER UNIVERSITARIO,DERECHO Y/O AFINES,"LEY CONTRETACIONES CON EL ESTADO, GESTION PUBLICA MUNICIPAL",BUSQUEDA Y SEGUIMIENTO DE DOCUMENTOS DEL ORGNO DE CONTROL INTERNO,"ASISTENTE PROFESIONAL ""C""",Municipalidad Provincial De Tacna,TACNA - TACNA
https://www.munitacna.gob.pe,1,D.Leg 1057 - Determinado (Necesidad Transitoria)-22,"S/. 2,250.00",17/02/2025,28/02/2025,EXPERIENCIA LABORAL MINIMA DE UN (O1) AÑO EN EL SECTOR PUBLICO,BACHILLER UNIVERSITARIO,DERECHO Y/O AFINES,EN LA NORMATIVIDADREFERIDA A LA GESTION DE LOS BIENES ESTATALES,PROYECTAR INFORMES LEGALES DEL AREA LEGAL DE LA OBI,"ASISTENTE PROFESIONAL ""B""",Municipalidad Provincial De Tacna,TACNA - TACNA
https://www.munitacna.gob.pe,1,D.Leg 1057 - Determinado (Necesidad Transitoria)-22,"S/. 2,250.00",17/02/2025,28/02/2025,EXPERIENCIA LABORAL MINIMA DE UN (01) AÑOS EN EL SECTOR PUBLICO,BACHILLER UNIVERSITARIO,"EDUCACION, ADMINISTRACION Y/O AFINES","SISTEMAS DE CONTROL INTERNO, GESTION PUBLICA","PROYECCION DE INFORMES, MEMORANDUM, CARTAS, OFICIOS DE LA OBI","ASISTENTE PROFESIONAL ""A""",Municipalidad Provincial De Tacna,TACNA - TACNA
https://www.gob.pe/institucion/sunarp/colecciones/2222-concursos-publicos-de-meritos-plazas-cas-zona-registral-n-xiii,1,D.Leg 1057 - Determinado (Necesidad Transitoria)-7,"S/. 2,000.00",17/02/2025,28/02/2025,"EXPERIENCIA GENERAL DE DOS (2) AÑOS, EXPERIENCIA ESPECIFCA EN LA FUNCION O MATERIA UN (1) AÑOS DESDE EL NIVEL DE PRACTICANTE PROFESIONAL, EXPERIENCIA EN EL SECTOR PUBLICO DE UN (1) AÑO.","BACHILLER EN ADMINISTRACIÓN, ECONOMÍA, CONTABILIDD, INGENIERIA INDUSTRIAL, GESTION DE RECURSOS HUMANOS","CURSOS RELACIONADOS A GESTIÓN DE LOS RECURSOS HUMANOS (ACUMULADO 36 HORAS),  CURSOS EN GESTIÓN PÚBLICA (ACUMULADO 36 HORAS).","CONOCIMIENTOS EN SISTEMA ADMINISTRATIVO DE RECURSOS HUMANOS, CONOCIMIENTO EN PDT PLAME, SIAF, SIGA MEF, MCPP Y APLICATIVO AIRHSP","EXCELENCIA, INTEGRIDAD, INNOVACIÓN, COMUNICACIÓN, EFECTIVA, PLANIFICACIÓN Y ORGANIZACIÓN, COMPROMISO Y TRABAJO EN EQUIPO.",ASISTENTE DE PERSONAL,Zona Registral Nro.Xiii Sede Tacna,TACNA - TACNA
https://www.munitacna.gob.pe,1,D.Leg 1057 - Determinado (Necesidad Transitoria)-23,"S/. 1,300.00",17/02/2025,28/02/2025,EXPERIENCIA LABORAL MINIMA DE TRES (03) MESES EN EL SECTOR PUBLICO,ESTUDIOS TECNOLOGICOS NO CONCLUIDOS,"ADMINISTRACION, CONTABILIDAD Y/O AFINES",MANEJO DE CAJA Y/O TESORERIA,ATENCION DE CAJA DE VENTANILLAS,APOYO AUXILIAR ADMINISTRATIVO,Municipalidad Provincial De Tacna,TACNA - TACNA
https://www.munitacna.gob.pe,1,D.Leg 1057 - Determinado (Necesidad Transitoria)-22,"S/. 1,600.00",17/02/2025,28/02/2025,EXPERIENCIA LABORAL MINIMA DE SEIS (06) MESES EN EL SECTOR PUBLICO,TECNICO SUPERIOR Y/O SEIS SEMESTRES UNIVERSITARIOS CONCLUIDOS,"CIENCIAS DE LA COMUNICACION, ADMINISTRACION Y/O AFINES",OFIMATICA,REVISION Y ACTUALIZACION DEL ARCHIVO DEL AREA DE ADJUDICACIONES COMERCIALESDE OBI,APOYO ADMINISTRATIVO TECNICO,Municipalidad Provincial De Tacna,TACNA - TACNA
https://unete.sunat.gob.pe/es,2,D.Leg 1057 - Determinado (Suplencia)-007,"S/. 2,500.00",17/02/2025,28/02/2025,"GENERAL:
- SEIS (06) MESES.
ESPECÍFICA (INCLUIDA EN LA EXPERIENCIA GENERAL):
- A. ESPECIFICA (INCLUIDA EN LA EXPERIENCIA GENERAL): TRES (03) MESES.
-B. EN EL NIVEL MÍNIMO DEL PUESTO (INCLUIDA EN EL PUNTO A): TRES (03) MESES COMO AUXILIAR O ASISTENTE","EGRESADO PROFESIONAL TÉCNICO EN ADMINISTRACIÓN, O EGRESADO PROFESIONAL TÉCNICO EN COMERCIO EXTERIOR, O EGRESADO PROFESIONAL TÉCNICO EN ECOTURISMO Y GESTIÓN AMBIENTAL, O EGRESADO PROFESIONAL TÉCNICO EN HOSTELERÍA, O EGRESADO PROFESIONAL TÉCNICO EN TRADUCCIÓN DE IDIOMAS, O EGRESADO PROFESIONAL TÉCNICO EN TURISMO EGRESADO UNIVERSITARIO EN ADMINISTRACIÓN, O EGRESADO UNIVERSITARIO EN COMERCIO EXTERIOR, O EGRESADO UNIVERSITARIO EN ECOTURISMO, O EGRESADO UNIVERSITARIO EN HOTELERÍA, O EGRESADO UNIVERSIT",-,-,"TRABAJO COLABORATIVO, MOTIVACIÓN POR EL RESULTADO, PASIÓN POR EL SERVICIO",CONTROLADOR ADUANERO DE EQUIPAJE,Superintendencia Nacional De Aduanas Y De Administracion Tributaria - Sunat,TACNA - TACNA
https://www.munipalca.gob.pe/convocatorias/,1,D.Leg 1057 - Determinado (Necesidad Transitoria)-001,"S/. 4,200.00",17/02/2025,28/02/2025,EXPERIENCIA LABORAL GENERAL EN EL SECTOR PÚBLICO Y/O PRIVADOS MÍNIMA DE TRES (03) AÑOS. EXPERIENCIA ESPECIFICA EN PUESTOS SIMILARES EN GESTIÓN PÚBLICA O PRIVADA MÍNIMA DE UN (01) AÑO.,"PROFESIONAL TITULADO EN LA CARRERA DE INGENIERO AMBIENTAL, INGENIERO AGRÓNOMO, BIÓLOGO Y/O CARRERAS AFINES.",CONOCIMIENTOS RELACIONADOS CON PARA EL PUESTO EN LA FUNCIÓN O LA MATERIA.,EN LAS FUNCIONES A REALIZAR.,"RESPONSABILIDAD, TRABAJO EN EQUIPO .INICIATIVA, PROACTIVO Y RESPETO.","SUB GERENTE DE GESTIÓN AMBIENTAL, PARQUES Y JARDINES",Municipalidad Distrital De Palca,TACNA - PALCA
https://munilabaya.gob.pe/web/tra_convocatorias.php,1,D.Leg 1057 - Determinado (Necesidad Transitoria)-002,"S/. 2,500.00",17/02/2025,28/02/2025,"EXPERIENCIA GENERAL: MÍNIMO DE 01 AÑO EN EL SECTOR PÚBLICO Y/O PRIVADO.
EXPERIENCIA ESPECÍFICA: EN CARGOS AFINES DE SEIS (06) MESES EN ENTIDADES PÚBLICAS Y/O PRIVADAS.",PERSONA NATURAL MÍNIMA CON ESTUDIOS SECUNDARIOS CONCLUIDOS.,NO INDISPENSABLE,NO INDISPENSABLE,DISPONIBILIDAD TOTAL INMEDIATA. PROACTIVO Y CAPACIDAD LABORAL. ALTA CAPACIDAD DE TRABAJO A PRESIÓN.,PERSONAL DE GUARDIANIA,Municipalidad Distrital De Ilabaya,TACNA - ILABAYA
https://munilabaya.gob.pe/web/tra_convocatorias.php,1,D.Leg 1057 - Determinado (Necesidad Transitoria)-02,"S/. 3,800.00",17/02/2025,28/02/2025,"EXPERIENCIA GENERAL: MÍNIMO DE 02 AÑOS EN EL SECTOR PÚBLICO Y/O PRIVADO.
EXPERIENCIA ESPECÍFICA: 01 AÑO EN CARGOS AFINES EN ENTIDADES PÚBLICAS Y/O PRIVADAS.",PERSONA NATURAL MÍNIMA CON ESTUDIOS SECUNDARIOS CONCLUIDOS.,NO INDISPENSABLE,CURSOS O CAPACITACIONES EN OPERACIÓN. LICENCIA DE CONDUCIR AII MÍNIMO.,DISPONIBILIDAD TOTAL INMEDIATA. PROACTIVO Y CAPACIDAD LABORAL. ALTA CAPACIDAD DE TRABAJO A PRESIÓN.,OPERADOR DE EQUIPO LIVIANO (CARGADOR FRONTAL)-,Municipalidad Distrital De Ilabaya,TACNA - ILABAYA
https://www.munitacna.gob.pe,1,D.Leg 1057 - Determinado (Necesidad Transitoria)-22,"S/. 3,300.00",17/02/2025,28/02/2025,EXPERIENCIA LABORAL MINIMA DE UN (01) AÑO EN EL SECTOR PUBLICO,TITULO UNIVERSITARIO,"ARQUITECTURA, ING. CIVIL Y/O AFINES",EN LA NORMATIVIDAD REFERIDA A LA GESTION DE LOS BIENES ESTATALES Y/O SAB¿NEAMIENTO FISICO LEGAL DE PREDIOS ETATALES,SANEAMIENTO FICISO LEGAL DE LOS BIENES MUNICIPALES BAJO COMPETENCIA DE LA OBI DE LA MPT,"ESPECIALISTA 1 ""B""",Municipalidad Provincial De Tacna,TACNA - TACNA
