job_posting_url,vacancies,job_posting_number,salary,start_publication_date,end_publication_date,required_experience,educational_background,specialization,required_knowledge,skills,job_title,public_institution,ubication
https://convocatorias.regionpiura.gob.pe/dra,1,276-01,"S/. 2,622.00",15/01/2025,28/01/2025,TRES AÑOS,TÍTULO DE INSTITUTO SUPERIOR O ESTUDIOS UNIVERSITARIOS CONCLUIDOS DE LAS CARRERAS DE  ADMINISTRACIÓN Y/O CONTABILIDAD,"CAPACITACIÓN ESPECIALIZADA EN EL ÁREA, REALIZADO EN LOS ÚLTIMOS CINCO (05) AÑOS, CON UNA  DURACIÓN MÍNIMA DE DOCE (12) HORAS.",SEGUN PERFIL,TRABAJO EN EQUIPO/RESPONSABILIDAD,TECNICO ADMINISTRATIVO III,Direccion Regional Agraria Piura,PIURA - CASTILLA
https://convocatorias.regionpiura.gob.pe/dra,1,276-01,"S/. 2,597.00",15/01/2025,28/01/2025,TRES AÑOS,¿ TÍTULO DE INSTITUTO SUPERIOR O ESTUDIOS UNIVERSITARIOS CONCLUIDOS DE LAS CARRERAS DE  ADMINISTRACIÓN Y/O CONTABILIDAD,"CAPACITACIÓN ESPECIALIZADA EN EL ÁREA, REALIZADO EN LOS ÚLTIMOS CINCO (05) AÑOS, CON UNA  DURACIÓN MÍNIMA DE DOCE (12) HORAS.",SEGUN PERFIL,TRABAJO EN EQUIPO/RESPONSABILIDAD,TECNICO ADMINISTRATIVO III,Direccion Regional Agraria Piura,PIURA - CASTILLA
https://portal.indeci.gob.pe/oportunidades/,1,D.Leg 1057 - Determinado (Necesidad Transitoria)-016,"S/. 4,500.00",15/01/2025,28/01/2025,"•	EXPERIENCIA LABORAL GENERAL 
EXPERIENCIA GENERAL NO MENOR DE DOS (02) AÑOS EN EL SECTOR PÚBLICO Y/O PRIVADO.
•	EXPERIENCIA LABORAL ESPECIFICA
DOS (02) AÑOS DE EXPERIENCIA EN LA FUNCIÓN O MATERIA. 
DOS (02) AÑOS DE EXPERIENCIA EN EL NIVEL MÍNIMO ANALISTA O SU EQUIVALENTE.
DOS (02) AÑOS DE EXPERIENCIA EN FUNCIÓN O MATERIA EN EL SECTOR PÚBLICO",•	BACHILLER UNIVERSITARIO EN ARQUITECTURA Y/O INGENIERÍA CIVIL Y/O CIENCIAS MILITARES Y/O CIENCIAS DE LA COMUNICACIÓN Y/O CIENCIAS ADMINISTRATIVAS Y/O CIENCIAS CONTABLES Y/O CIENCIAS ECONÓMICAS Y/O CIENCIAS DE LA SALUD Y/O INGENIERÍA GEOLÓGICA Y/O INGENIERÍA AMBIENTAL Y/O INGENIERÍA GEOGRÁFICA Y/O GEOGRAFÍA Y/O INGENIERÍA INDUSTRIAL Y/O INGENIERÍA AGRÍCOLA Y/O INGENIERÍA AGRÓNOMA Y/O INGENIERÍA ZOOTECNISTA Y/O INGENIERÍA MECATRÓNICA Y/O EDUCACIÓN.,•	PROGRAMA DE ESPECIALIZACIÓN Y/O DIPLOMADO EN GESTIÓN DE RIESGO DE DESASTRE,"•	CONOCIMIENTOS DE LA LEY DEL SINAGERD, REGLAMENTO DE LA LEY DEL SINAGERD PALANAGERD, Y POLÍTICA DE GESTIÓN DE RIESGOS AL 2050 •	CONOCIMIENTO EN OFIMÁTICA (WORD, EXCEL Y/O POWERPOINT) A NIVEL BÁSICO",COMPETENCIA COGNOSCITIVA O INTELECTUAL •	COMPETENCIA PROFESIONAL •	PLANEAMIENTO COMPETENCIA DE EFICACIA PERSONAL.  •	RELACIONES DE TRABAJO •	COMUNICACIÓN. COMPETENCIA DE LOGRO Y ACCIÓN •	INICIATIVA,ANALISTA EN GESTION DEL RIESGO DEL DESASTRE,Instituto Nacional De Defensa Civil,PIURA - PIURA
https://pnsr.vivienda.gob.pe/portales/convocatorias-cas-pnsr/,1,D.Leg 1057 - Determinado (Necesidad Transitoria)-010,"S/. 5,264.19",15/01/2025,28/01/2025,"EXPERIENCIA GENERAL MÍNIMA DE TRES (03) EN EL SECTOR PÚBLICO Y/O PRIVADO.  EXPERIENCIA ESPECÍFICA MÍNIMA DE DOS (02) AÑOS DESEMPEÑANDO FUNCIONES COMO GESTOR SOCIAL Y/O CAPACITADOR TÉCNICO Y/O PROMOTOR SOCIAL Y/O
RESPONSABLE SOCIAL Y/O CONSULTOR Y/O FORMULADOR DE PROYECTOS DE INVERSIÓN PÚBLICA DE PREFERENCIA EN PROYECTOS DE SANEAMIENTO RURAL. EXPERIENCIA ESPECÍFICA MÍNIMA DE UN (01) AÑO EN EL SECTOR PÚBLICO. NIVEL MINIMO REQUERIDO AUXILIAR O ASISTENTE",EGRESADO TÉCNICO Y/O TÉCNICO TITULADO Y/O BACHILLER EN SOCIOLOGÍA Y/O ANTROPOLOGÍA Y/O TRABAJO SOCIAL Y/O ENFERMERÍA Y/O PSICOLOGÍA Y/O INGENIERÍA SANITARIA Y/O INGENIERÍA AMBIENTAL Y/O CIENCIAS DE LA COMUNICACIÓN Y/O EDUCACIÓN.,"GESTIÓN DE SERVICIOS DE SANEAMIENTO Y/O GESTIÓN PÚBLICA Y/O GESTIÓN SOCIAL DE PROYECTOS DE INVERSIÓN PÚBLICA Y/O DISEÑO, SEGUIMIENTO Y EVALUACIÓN DE PROYECTOS DE INVERSIÓN PÚBLICA Y/O AGUA Y SANEAMIENTO RURAL Y/O RELACIONES COMUNITARIAS Y/O GERENCIA SOCIAL Y/O GESTIÓN MUNICIPAL.","CONOCIMIENTO EN GESTIÓN PÚBLICA, GESTIÓN SOCIAL DE PROYECTOS DE AGUA Y SANEAMIENTO RURAL, GESTIÓN DE CONFLICTOS SOCIALES, LEY DE CONTRATACIÓN CON EL ESTADO.","ESPECÍFICAS: PLANIFICACIÓN Y ORGANIZACIÓN, SINTESIS, DINAMISMO. TRANSVERSALES: ORIENTACIÓN A RESULTADOS, VOCACIÓN DE SERVICIOS Y TRABAJO EN EQUIPO",ASISTENTE TÉCNICO EN GESTIÓN SOCIAL,Programa Nacional De Saneamiento Rural,PIURA - PIURA
https://pnsr.vivienda.gob.pe/portales/convocatorias-cas-pnsr/,1,D.Leg 1057 - Determinado (Necesidad Transitoria)-009,"S/. 3,764.19",15/01/2025,28/01/2025,"EXPERIENCIA GENERAL MÍNIMA DE TRES (03) AÑOS EN EL SECTOR PÚBLICO Y/O PRIVADO. EXPERIENCIA ESPECÍFICA MÍNIMA DE DOS (02) AÑOS COMO COMO ASISTENTE DE RESIDENTE, ASISTENTE DE SUPERVISOR, ASISTENTE EN ELABORACIÓN DE EXPEDIENTES
TÉCNICOS Y/O ESTUDIOS EN EL SECTOR SANEAMIENTO Y/O ASISTENTE EN LA ADMINISTRACIÓN, OPERACIÓN Y/O MANTENIMIENTO DE SISTEMAS DE SANEAMIENTO. EXPERIENCIA ESPECÍFICA MÍNIMA DE UN (01) AÑO EN EL SECTOR PÚBLICO. NIVEL MINIMO REQUERIDO AUXILIAR O ASISTENTE",BACHILLER UNIVERSITARIO EN LAS CARRERAS DE INGENIERÍA CIVIL Y/O INGENIERÍA SANITARIA,"CURSOS DE CAPACITACIÓN EN LEY DE CONTRATACIONES Y ADQUISICIONES DEL ESTADO Y/O FORMULACIÓN Y EVALUACIÓN DE PROYECTOS DE INVERSIÓN PÚBLICA, GESTIÓN PÚBLICA Y/O INVIERTE.PE Y/O TRATAMIENTO DE AGUA Y AGUAS RESIDUALES Y/O COSTOS Y PRESUPUESTOS O AUTOCAD CIVIL 3D O WATERCARD O SEWERCAD O SIMULACIÓN HIDRÁULICA EN REDES DE AGUA Y SANEAMIENTO O PLANTA DE TRATAMIENTO DE AGUAS RESIDUALES.","CONOCIMIENTOS EN CONTRATACIONES Y ADQUISICIONES DEL ESTADO, FORMULACIÓN Y EVALUACIÓN DE PROYECTOS DE INVERSIÓN PÚBLICA VINCULADOS A SANEAMIENTO, MONITOREO, SEGUIMIENTO, GESTIÓN Y CONTROL D EPROYECTOS.","ESPECÍFICAS: PLANIFICACIÓN Y ORGANIZACIÓN, SINTESIS, DINAMISMO. TRANSVERSALES: ORIENTACIÓN A RESULTADOS, VOCACIÓN DE SERVICIOS Y TRABAJO EN EQUIPO",ASISTENTE TÉCNICO,Programa Nacional De Saneamiento Rural,PIURA - PIURA
https://www.migraciones.gob.pe/oportunidades_laborales_2025/,6,D.Leg 1057 - Determinado (Necesidad Transitoria)-045,"S/. 3,000.00",14/01/2025,27/01/2025,"""• EXPERIENCIA GENERAL: TRES (03) AÑOS EN EL SECTOR PÚBLICO Y/O PRIVADO.
• EXPERIENCIA ESPECÍFICA: DOS (02) AÑOS EN EL PUESTO Y/O FUNCIÓN Y/O MATERIA, EN EL SECTOR PÚBLICO Y/O PRIVADO""",• BACHILLER UNIVERSITARIO DE LAS CARRERAS DE ADMINISTRACIÓN O DERECHO O ECONOMÍA O CIENCIAS POLÍTICAS.,• CURSO EN LA LEY DE PROCEDIMIENTO ADMINISTRATIVO GENERAL Y/O DERECHO ADMINISTRATIVO Y/O PROCEDIMIENTO ADMINISTRATIVO GENERAL Y/O PROCEDIMIENTO ADMINISTRATIVO SANCIONADOR (24 HORAS CONTINUAS O 40 HORAS ACUMULADAS).,"""• DECRETO LEGISLATIVO 1350, SU REGLAMENTO Y MODIFICATORIAS.        • LEY DE PROCEDIMIENTO ADMINISTRATIVO GENERAL.   • OFIMÁTICA A NIVEL BÁSICO.""","ANÁLISIS, EMPATÍA Y VOCACIÓN DE SERVICIO",ASISTENTE OPERATIVO DE VERIFICACIÓN Y FISCALIZACIÓN MIGRATORIA (PIURA),Superintendencia Nacional De Migraciones - Migraciones,PIURA - PIURA
https://app.midis.gob.pe/sis_convocatoria/convocatoria/lista,1,D.Leg 1057 - Determinado (Necesidad Transitoria)-002,"S/. 2,264.19",10/01/2025,23/01/2025,"EXPERIENCIA GENERAL: DOS (02) AÑOS EN EL SECTOR PÚBLICO Y/O PRIVADO.
EXPERIENCIA ESPECÍFICA: UN (01) AÑO DE EXPERIENCIA EN LA FUNCIÓN O LA MATERIA EN EL SECTOR PÚBLICO",EGRESADO UNIVERSITARIO EN LAS CARRERAS DE ANTROPOLOGÍA Y/O ARQUEOLOGÍA Y/O SOCIOLOGÍA Y/O TRABAJO SOCIAL Y/O EDUCACIÓN Y/O MEDICINA HUMANA Y/O NUTRICIÓN Y/O OBSTETRICIA Y/O PSICOLOGÍA Y/O ENFERMERÍA Y/O CIENCIAS DE LA COMUNICACIÓN Y/O DERECHO Y/O ECONOMÍA Y/O ADMINISTRACIÓN Y/O CONTABILIDAD Y/O AGRONOMÍA Y/O ING. AGRÓNOMA Y/O ING. EN AGRONEGOCIOS Y/O ING. AGROINDUSTRIAL Y/O ING. AMBIENTAL Y/O ING. CIVIL Y/O ING. FORESTAL Y/O ING. INDUSTRIAL  Y/O ING. EN INDUSTRIAS ALIMENTARIAS Y/O ZOOTECNIA,CURSO DE VIGILANCIA SOCIAL/PARTICIPACIÓN CIUDADANA O AFINES (MÍNIMO 24 HORAS),A) PARTICIPACIÓN CIUDADANA B)  INCIDENCIA POLÍTICA C) VIGILANCIA SOCIAL D) PROGRAMA SOCIALES,"DINAMISMO, ORGANIZACIÓN DE LA INFORMACIÓN, COOPERACIÓN",RESPONSABLE DE CAMPO DE LA SEDE PIURA,Ministerio De Desarrollo E Inclusion Social,PIURA - CASTILLA
