job_posting_url,vacancies,job_posting_number,salary,start_publication_date,end_publication_date,required_experience,educational_background,specialization,required_knowledge,skills,job_title,public_institution,ubication
https://aplicativo.pj.gob.pe/psep/wfrmconvocatoriasp.aspx?tcon=c,1,D.Leg 1057 - Determinado (Necesidad Transitoria)-005,"S/. 2,572.00",24/01/2025,06/02/2025,"EXPERIENCIA LABORAL NO MENOR DE UN (01) AÑO EN LABORES SIMILARES EN EL SECTOR PÚBLICO Y/O PRIVADO (ASISTENTE JUDICIAL, ASISTENTE EN FUNCIÓN FISCAL Y/O ASISTENTE JURISDICCIONAL).",ESTUDIOS UNIVERSITARIOS EN DERECHO (8VO CICLO).,NO INDISPENSABLE,CURSOS Y/O CAPACITACIONES EN DERECHO PENAL. ¿ CURSOS Y/O CAPACITACIONES EN DERECHO PROCESAL PENAL.,¿ ADAPTABILIDAD. ¿ ANÁLISIS. ¿ ORGANIZACIÓN DE LA INFORMACIÓN. ¿ PLANIFICACIÓN. ¿ REDACCIÓN.,ASISTENTE LEGAL,Poder Judicial,CALLAO - VENTANILLA
https://aplicativo.pj.gob.pe/psep/wfrmconvocatoriasp.aspx?tcon=c,1,D.Leg 1057 - Determinado (Necesidad Transitoria)-06,"S/. 2,900.00",24/01/2025,06/02/2025,EXPERIENCIA LABORAL ESPECIFICA NO MENOR DE SEIS (06) MESES EN LABORES SIMILARES (DILIGENCIAMIENTO DE CÉDULAS DE NOTIFICACIÓN).,"ESTUDIOS TÉCNICOS EN ARCHIVO, SECRETARIADO EJECUTIVO, COMPUTACIÓN, ADMINISTRACIÓN O AFINES, MÍNIMO TRES (03) MESES.",NO INDISPENSABLE,¿ CURSO Y/O CAPACITACIONES EN TEMAS RELACIONADOS EN VIOLENCIA CONTRA LAS MUJERES E INTEGRANTES DEL GRUPO FAMILIAR ¿ CONTAR CON BREVETE BII-E- PARA MOTO LINEAL.,¿ ADAPTABILIDAD. ¿ ANÁLISIS. ¿ ORGANIZACIÓN DE LA INFORMACIÓN. ¿ PLANIFICACIÓN. ¿ REDACCIÓN.,AUXILIAR ADMINISTRATIVO,Poder Judicial,CALLAO - VENTANILLA
https://reclutamiento.apn.gob.pe/convocatorias-cas/?modalidad=cas,1,D.Leg 1057 - Determinado (Necesidad Transitoria)-004,"S/. 3,000.00",24/01/2025,06/02/2025,EXPERIENCIA LABORAL GENERAL DE 2 AÑOS EN EL SECTOR PÚBLICO Y/O PRIVADO EXPERIENCIA LABORAL ESPECIFICA DE 1 AÑOS EN EL SECTOR PÚBLICO Y/O PRIVADO.,"EGRESADO DE TECNICA SUPERIOR O UNIVERSITARIA EN ADMINISTRACIÓN, INGENIERIA ADMINISTRATIVA, ADMINISTRACIÓN DE  NEGOCIOS INTERNACIONALES.","CURSOS, PROGRAMAS O SEMINARIOS EN CONTRATACIONES DEL ESTADO, MINIMO 20 HORAS ACUMULABLES. CONTAR CON CERTIFICACION OSCE VIGENTE.","LOGISTICA, CONTRATACIONES DEL ESTADO","TRABAJO EN EQUIPO, COMUNICACIÓN INICIATIVA Y ASERTIVIDAD",ASISTENTE ADMINISTRATIVO EN ABASTECIMIENTO I,Autoridad Portuaria Nacional,CALLAO - LA PERLA
https://www.gob.pe/ugelventanilla,1,276-002,"S/. 2,321.65",23/01/2025,05/02/2025,NO APLICA,NO APLICA,NO APLICA,NO APLICA,NO APLICA,TRABAJADOR DE SERVICIO,Unidad De Gestion Educativa Local- Ventanilla,CALLAO - CALLAO
https://reclutamiento.apn.gob.pe/convocatorias-cas/?modalidad=cas,1,D.Leg 1057 - Determinado (Necesidad Transitoria)-003,"S/. 9,000.00",23/01/2025,05/02/2025,EXPERIENCIA LABORAL GENERAL DE 5 AÑOS EN EL SECTOR PÚBLICO Y/O PRIVADO EXPERIENCIA LABORAL ESPECIFICA DE 3 AÑOS EN EL SECTOR PÚBLICO Y/O PRIVADO.  EXPERIENCIA LABORAL ESPECIFICA DE 2 AÑOS EN EL SECTOR PÚBLICO.,TITULO UNIVERSITARIO EN INGENIERÍA COMPUTACIÓN E INFORMATICA O INGENIERÍA DE SISTEMAS O  INGENIERÍA DE SISTEMAS E INFORMÁTICA O INGENIERÍA INFORMÁTICA O  INGENIERÍA DE SOFTWARE O AFINES POR LA FORMACIÓN.,CURSOS O PROGRAMA O DIPLOMADO EN TECNOLOGÍAS DE INFORMACIÓN O GERENCIA O ADMINISTRACIÓN DE PROYECTOS O GESTIÓN DE PROYECTOS O RELACIONADO A ITIL O  CONCEPTOS DE CLOUD COMPUTING O FUNDAMENTOS DE REDES DE TI O GESTIÓN DE SERVICIOS TI O SEGURIDAD TI. MÍNIMO 50 HORAS ACUMULADAS.,"CONOCIMIENTOS EN PLANIFICACIÓN DE TECNOLOGIAS DE LA INFORMACIÓN, AUTOMATIZACIÓN DE PROCESOS.","PLANIFICACIÓN, EMPATIA, ANALISIS, TRABAJO EN EQUIPO.",ESPECIALISTA EN SOPORTE INFORMÁTICO 2,Autoridad Portuaria Nacional,CALLAO - LA PERLA
https://aplicativo.pj.gob.pe/psep/wfrmconvocatoriasp.aspx?tcon=c,1,D.Leg 1057 - Determinado (Necesidad Transitoria)-004,"S/. 3,850.00",22/01/2025,04/02/2025,"¿	EXPERIENCIA LABORAL NO MENOR DE DOS (02) AÑOS EN LABORES SIMILARES O EN EL EJERCICIO DE LA PROFESIÓN, DE LOS CUALES UN (01) AÑO DEBE SER ATENCIÓN AL PÚBLICO EN EL SECTOR PÚBLICO.","¿	TÍTULO PROFESIONAL PSICÓLOGO, TRABAJO SOCIAL Y/O ABOGADO, EN AMBOS CASO DEBE ESTAR COLEGIADO, HABILITADO Y ACREDITADO.",NO INDISPENSABLE,¿	CURSOS Y/O CAPACITACIONES EN ATENCIÓN AL PÚBLICO. ¿	CURSOS Y/O CAPACITACIONES EN NORMATIVIDAD DEL SECTOR PÚBLICO.,¿	ADAPTABILIDAD. ¿	ANÁLISIS. ¿	ORGANIZACIÓN DE LA INFORMACIÓN. ¿	PLANIFICACIÓN,ASISTENTE ADMINISTRATIVO II,Poder Judicial,CALLAO - VENTANILLA
https://aplicativo.pj.gob.pe/psep/wfrmconvocatoriasp.aspx?tcon=c,1,D.Leg 1057 - Determinado (Necesidad Transitoria)-004,"S/. 2,100.00",22/01/2025,04/02/2025,¿	EXPERIENCIA LABORAL NO MENOR DE SEIS (06) MESES EN LABORES DE ATENCIÓN AL PÚBLICO,"¿	ESTUDIOS TÉCNICOS EN SECRETARIADO EJECUTIVO MÍNIMO 03 MESES, Y/O ESTUDIOS EN DERECHO.",NO INDISPENSABLE,¿	CURSOS Y/O CAPACITACIONES EN ATENCIÓN AL PÚBLICO. ¿	CURSOS Y/O CAPACITACIONES EN NORMATIVIDAD DEL SECTOR PÚBLICO.,¿	ADAPTABILIDAD. ¿	ANÁLISIS. ¿	ORGANIZACIÓN DE LA INFORMACIÓN. ¿	PLANIFICACIÓN. ¿	REDACCIÓN.,AUXILIAR ADMINISTRATIVO,Poder Judicial,CALLAO - VENTANILLA
https://aplicativo.pj.gob.pe/psep/wfrmconvocatoriasp.aspx?tcon=c,1,D.Leg 1057 - Determinado (Necesidad Transitoria)-004,"S/. 6,010.00",22/01/2025,04/02/2025,"¿	EXPERIENCIA LABORAL GENERAL NO MENOR DE TRES (03) AÑOS EN EL SECTOR PÚBLICO Y/O PRIVADO.
¿	EXPERIENCIA ESPECÍFICA NO MENOR DE TRES (02) AÑOS EN LA FUNCIÓN O LA MATERIA DEL CARGO A POSTULAR EN EL SECTOR PÚBLICO.","¿	TÍTULO PROFESIONAL UNIVERSITARIO EN ADMINISTRACIÓN, CONTABILIDAD, ECONOMÍA,  Y/O DERECHO, EN TODOS LOS CASOS DEBEN ESTAR COLEGIADOS HABILITADOS Y ACREDITAR DOCUMENTALMENTE Y EN EL SISTEMA AL MOMENTO DE POSTULAR.",NO INDISPENSABLE,¿	DIPLOMADO Y/O CURSOS DE ESPECIALIZACIÓN EN GESTIÓN PÚBLICA (NO MENOR DE 90 HORAS). ¿	CURSOS Y/O CAPACITACIONES EN NORMATIVIDAD DEL SECTOR PÚBLICO.,¿	ADAPTABILIDAD. ¿	ANÁLISIS. ¿	ORGANIZACIÓN DE LA INFORMACIÓN. ¿	PLANIFICACIÓN. ¿	REDACCIÓN.,ANALISTA ADMINISTRATIVO/A,Poder Judicial,CALLAO - VENTANILLA
https://aplicativo.pj.gob.pe/psep/wfrmconvocatoriasp.aspx?tcon=c,1,D.Leg 1057 - Determinado (Necesidad Transitoria)-004,"S/. 3,500.00",22/01/2025,04/02/2025,"¿	EXPERIENCIA LABORAL GENERAL NO MENOR DE TRES (03) AÑOS PARA EL PROFESIONAL TÉCNICO Y PARA EL ESTUDIANTE UNIVERSITARIO NO ES INDISPENSABLE.
¿	EXPERIENCIA ESPECÍFICA NO MENOR DE UN (01) AÑO EN LABORES SIMILARES PARA EL PROFESIONAL TÉCNICO; Y PARA EL ESTUDIANTE UNIVERSITARIO  NO MENOR DE UN (01) AÑO EN LABORES SIMILARES.",¿	TÍTULO PROFESIONAL TÉCNICO (CARRERA DE 3 AÑOS) EN COMPUTACIÓN E INFORMÁTICA O ESTUDIOS UNIVERSITARIOS EN INGENIERÍA DE SISTEMAS E INFORMÁTICA (8VO CICLO).,NO INDISPENSABLE,¿	CURSOS Y/O CAPACITACIONES EN MANEJO DE AUDIO Y/O VIDEO. ¿	CURSOS Y/O CAPACITACIONES EN PROGRAMACIÓN.,¿	ADAPTABILIDAD. ¿	ANÁLISIS. ¿	ORGANIZACIÓN DE LA INFORMACIÓN. ¿	PLANIFICACIÓN. ¿	REDACCIÓN.,PROFESIONAL EN INFORMATICA Y SISTEMAS,Poder Judicial,CALLAO - VENTANILLA
https://app.municallao.gob.pe/convocatoriapersonal/convocatoria-cas,1,D.Leg 1057 - Determinado (Necesidad Transitoria)-03,"S/. 5,000.00",22/01/2025,04/02/2025,"UN (02) AÑOS DE EXPERIENCIA GENERAL EN EL SECTOR PÚBLICO O PRIVADO. 
UN (01) AÑO DE EXPERIENCIA ESPECIFICA EN LA FUNCIÓN O LA MATERIA. 
UN (01) AÑO DE EXPERIENCIA REQUERIDA EN EL SECTOR PÚBLICO.",TITULADO EN DERECHO,NO APLICA,"GESTION PÚBLICA, DERECHO ADMINISTRATIVO, PROCEDIMIENTO COACTIVO, PROCEDIMIENTO SANCIONADOR","COMPROMISO, ÉTICO, TRABAJO EN EQUIPO, LIDERAZGO, ORIENTACIÓN AL SERVICIO, APRENDIZAJE CONTINUO Y COMUNICACIÓN ASERTIVA",AUXILIAR COACTIVO,Municipalidad Provincial Del Callao,CALLAO - CALLAO
https://aplicativo.pj.gob.pe/psep/wfrmconvocatoriasp.aspx?tcon=c,1,D.Leg 1057 - Determinado (Necesidad Transitoria)-004,"S/. 7,800.00",22/01/2025,04/02/2025,"¿	EXPERIENCIA LABORAL GENERAL NO MENOR DE CUATRO (04) AÑOS RELACIONADAS AL CARGO EN EL SECTOR PÚBLICO Y/O PRIVADO.
¿	EXPERIENCIA ESPECÍFICA NO MENOR DE DOS (02) AÑOS EN LA FUNCIÓN O LA MATERIA DEL CARGO A POSTULAR EN EL SECTOR PÚBLICO.","¿	TÍTULO PROFESIONAL UNIVERSITARIO EN INGENIERÍA DE SISTEMAS E INFORMÁTICA, COLEGIADO, HABILITADO Y ACREDITADO.",¿	ESTUDIOS DE MAESTRÍA RELACIONADOS AL CARGO.,¿	DIPLOMADO Y/O CURSOS DE ESPECIALIZACIÓN EN GESTIÓN PÚBLICA (NO MENOR DE 90 HORAS). ¿	CURSOS Y/O CAPACITACIONES EN NORMATIVIDAD DEL SECTOR PÚBLICO,¿	ADAPTABILIDAD. ¿	ANÁLISIS. ¿	ORGANIZACIÓN DE LA INFORMACIÓN. ¿	PLANIFICACIÓN. ¿	REDACCIÓN.,ESPECIALISTA DE INFORMÁTICA,Poder Judicial,CALLAO - VENTANILLA
https://página web de la  institución  www.hndac.gob.pe.,1,D.Leg 1057 - Indeterminado-001,"S/. 2,064.19",21/01/2025,03/02/2025,EXPERIENCIA LABORAL EN HOSPITAL NIVEL III-1 EN LABORES DE TÉCNICO EN LABORATORIO,TÍTULO DE TECNICO EN LABORATORIO CLÍNICO  A NOMBRE DE LA NACIÓN,CAPACITACION RELACIONADA AL CARGO,RELACIONADOS AL CARGO,CAPACIDAD PARA TRABAJAR EN EQUIPO,TECNICO EN LABORATORIO - BANCO DE SANGRE,Hospital Nacional Daniel Alcides Carrion,CALLAO - CALLAO
https://app.municallao.gob.pe/convocatorias/convocatoria-cas,1,D.Leg 1057 - Determinado (Necesidad Transitoria)-002,"S/. 1,954.00",21/01/2025,03/02/2025,UN (01) AÑO DE EXPERIENCIA GENERAL EN EL SECTOR PUBLICO O PRIVADO. SEIS (06) MESES DE EXPERIENCIA  ESPECIFICA  EN LA FUNCION O LA MATERIA. SEIS (06) MESES DE EXPERIENCIA REQUERIDA EN EL SECTOR PUBLICO.,"ESTUDIOS TECNICOS O UNIVERSITARIOS EN CURSO EN LAS CARRERAS DE ADMINISTRACIÓN. DERECHO, ECONOMIA, CONTABILIDAD O A FINES.",CURSOS DE ACTUALIZACION EN MATERIA TRIBUTARIA.,"LEY DE TRIBUTACION MUNICIPAL, TEXTO UNICO ORDENADO DEL CODIGO TRIBUTARIO Y LEY DEL PROCEDIMIENTO ADMINISTRATIVO GENERAL.","COMPROMISO, ETICA, TRABAJO EN EQUIPO, LIDERAZGO, ORIENACION AL SERVICIO, APRENDIZAJE CONTINUA Y COMUNICACION ASERTIVA.",GESTOR DE COBRANZA TRIBUTARIA,Municipalidad Provincial Del Callao,CALLAO - CALLAO
https://página web de la  institución  www.hndac.gob.pe.,1,D.Leg 1057 - Indeterminado-001,"S/. 3,264.19",21/01/2025,03/02/2025,EXPERIENCIA LABORAL MÍNIMA DE 01 AÑO REALIZANDO LABORES EN SOPORTE INFORMÁTICO EN ENTIDADES PÚBLICAS O PRIVADAS,TÍTULO DE TÉCNICO EN COMPUTACIÓN Y/O INFORMATCA A NOMBRE DE LA NACIÓN,CURSOS DE INSTALACIÓN Y ADMINISTRACIÓN DE SOFTWARE ANTIVIRUS,CONOCIMIENTOS EN SOPORTE TÉCNICO Y SOPORTE DE APLICACIONES,CAPACIDAD PARA TRABAJAR EN EQUIPO,TÉCNICO EN SOPORTE INFORMÁTICO,Hospital Nacional Daniel Alcides Carrion,CALLAO - BELLAVISTA
https://página web de la  institución  www.hndac.gob.pe.,10,D.Leg 1057 - Indeterminado-001,"S/. 2,064.19",21/01/2025,03/02/2025,EXPERIENCIA LABORAL EN HOSPITAL III-1 EN LABORES DE TÉCNICO DE ENFERMERÍA,TÍTULO DE TECNICO EN ENFERMERÍA A NOMBRE DE LA NACIÓN,CAPACITACION RELACIONADA AL CARGO,CONOCIMIENTOS DE OFIMATICA,CAPACIDAD PARA TRABAJAR EN EQUIPO,TÉCNICO EN ENFERMERIA,Hospital Nacional Daniel Alcides Carrion,CALLAO - BELLAVISTA
https://página web de la  institución  www.hndac.gob.pe.,1,D.Leg 1057 - Indeterminado-001,"S/. 2,064.19",21/01/2025,03/02/2025,EXPERIENCIA LABORAL EN HOSPITAL III-1 EN LABORES DE TÉCNICO EN LABORATORIO,TÍTULO DE TÉCNICO EN LABORATORIO CLÍNICO Y ANATOMÍA PATOLOGICA A NOMBRE DE LA NACIÓN,CAPACITACION RELACIONADA AL CARGO,RELACIONADOS AL CARGO,CAPACIDAD PARA TRABAJAR EN EQUIPO,TECNICO EN LABORATORIO - ANATOMÍA PATOLOGICA,Hospital Nacional Daniel Alcides Carrion,CALLAO - BELLAVISTA
https://página web de la  institución  www.hndac.gob.pe.,1,D.Leg 1057 - Indeterminado-001,"S/. 3,164.19",21/01/2025,03/02/2025,EXPERIENCIA LABORAL EN HOSPITAL III-1 EN LABORES DE OBSTETRA,TÍTULO DE LICENCIADO EN OBSTETRICIA,CAPACITACION RELACIONADA AL CARGO,RELACIONADOS AL CARGO,CAPACIDAD PARA TRABAJAR EN EQUIPO,OBSTETRA,Hospital Nacional Daniel Alcides Carrion,CALLAO - BELLAVISTA
https://página web de la  institución  www.hndac.gob.pe.,1,D.Leg 1057 - Indeterminado-001,"S/. 7,500.00",21/01/2025,03/02/2025,EXPERIENCIA LABORAL EN EL SECTOR PÚBLICO O PRIVADO COMO MEDICO RADIOLOGO,TÍTULO DE MEDICO CIRUJANO,TITULO DE ESPECIALIDAD DE MEDICO RADIOLOGO,RELACIONADOS AL CARGO,CAPACIDAD PARA TRABAJAR EN EQUIPO Y BAJO PRESIÓN,MEDICO RADIOLOGO,Hospital Nacional Daniel Alcides Carrion,CALLAO - BELLAVISTA
https://página web de la  institución  www.hndac.gob.pe.,1,D.Leg 1057 - Indeterminado-001,"S/. 7,564.00",21/01/2025,03/02/2025,EXPERIENCIA LABORAL EN HOSPITAL III-1 EN LA ESPECIALIDAD DE PEDIATRIA,TÍTULO DE MEDICO CIRUJANO,TITULO DE ESPECIALISTA EN PEDIATRÍA,"CONOCIMIENTOS EN ATENCIÓN DE RECIÉN NACIDOS, LACTANTES PRE ESCOLAR Y ESCOLARES",CAPACIDAD PARA TRABAJAR EN EQUIPO,MEDICO PEDIATRA,Hospital Nacional Daniel Alcides Carrion,CALLAO - BELLAVISTA
https://página web de la  institución  www.hndac.gob.pe.,2,D.Leg 1057 - Indeterminado-001,"S/. 7,064.00",21/01/2025,03/02/2025,EXPERIENCIA LABORAL EN HOSPITAL III-1 EN LA ESPECIALIDAD DE PATOLOGÍA CLÍNICA,TÍTULO DE MEDICO CIRUJANO,TITULO DE ESPECIALIDAD DE PATOLOGÍA CLÍNICA,RELACIONADOS AL CARGO,CAPACIDAD PARA TRABAJAR EN EQUIPO Y BAJO PRESIÓN,MEDICO PATOLOGO CLÍNICO,Hospital Nacional Daniel Alcides Carrion,CALLAO - BELLAVISTA
https://página web de la  institución  www.hndac.gob.pe.,1,D.Leg 1057 - Indeterminado-001,"S/. 7,564.00",21/01/2025,03/02/2025,EXPERIENCIA LABORAL EN HOSPITAL NIVEL III-1 EN LA ESPECIALIDAD DE NEUROCIRUGÍA,TÍTULO DE MEDICO CIRUJANO,TITULO DE ESPECIALISTA DE  MEDICO NEUROCIRUJANO,RELACIONADOS AL CARGO,CAPACIDAD PARA TRABAJAR EN EQUIPO,MEDICO NEUROCIRUJANO,Hospital Nacional Daniel Alcides Carrion,CALLAO - BELLAVISTA
https://página web de la  institución  www.hndac.gob.pe.,1,D.Leg 1057 - Indeterminado-001,"S/. 7,564.00",21/01/2025,03/02/2025,EXPERIENCIA LABORAL EN HOSPITAL NIVEL III-1 EN LA ESPECIALIDAD DE NEFROLOGÍA,TÍTULO DE MEDICO CIRUJANO,TITULO DE ESPECIALIDAD EN CIRUGÍA  EN NEFROLOGIA,RELACIONADOS AL CARGO,CAPACIDAD PARA TRABAJAR EN EQUIPO,MEDICO NEFROLOGO,Hospital Nacional Daniel Alcides Carrion,CALLAO - BELLAVISTA
https://página web de la  institución  www.hndac.gob.pe.,2,D.Leg 1057 - Indeterminado-001,"S/. 7,500.00",21/01/2025,03/02/2025,EXPERIENCIA LABORAL EN HOSPITAL III-1 EN LA ESPECIALIDAD DE GINECO OBSTETRA,TÍTULO DE MEDICO CIRUJANO,TITULO DE ESPECIALIDAD EN GINECO OBSTETRICIA,RELACIONADOS AL CARGO,CAPACIDAD PARA TRABAJAR EN EQUIPO Y BAJO PRESIÓN,MEDICO GINECO OBSTETRA,Hospital Nacional Daniel Alcides Carrion,CALLAO - BELLAVISTA
https://página web de la  institución  www.hndac.gob.pe.,2,D.Leg 1057 - Indeterminado-001,"S/. 7,564.00",21/01/2025,03/02/2025,EXPERIENCIA LABORAL EN HOSP. NIVEL III-1 EN LA ESPECIALIDAD DE MEDICINA INTENSIVA,TÍTULO DE MEDICO CIRUJANO,TITULO DE ESPECIALIDAD EN MEDICINA INTENSIVA,CAPACITACION RELACIONADA AL CARGO,CAPACIDAD PARA TRABAJAR EN EQUIPO Y BAJO PRESIÓN,MEDICO EN MEDICINA INTENSIVA,Hospital Nacional Daniel Alcides Carrion,CALLAO - BELLAVISTA
https://página web de la  institución  www.hndac.gob.pe.,6,D.Leg 1057 - Indeterminado-001,"S/. 7,500.00",21/01/2025,03/02/2025,EXPERIENCIA LABORAL EN HOSPITAL NIVEL III-1 EN LA ESPECIALIDAD DE MEDICINA DE EMERGENCIA  Y DESASTRE O MEDICINA INTERNA,TÍTULO DE MEDICO CIRUJANO,TITULO DE ESPECIALIDAD EN MEDICINA DE EMERGENCIA Y DESASTRE O MEDICINA INTERNA,"CONOCIMIENTO EN EL DIAGNOSTICO, TRATAMIENTO DE PACIENTES DE EMERGENCIA PRIORIDAD I Y II",CAPACIDAD PARA TRABAJAR EN EQUIPO Y BAJO PRESIÓN,MEDICO EN MEDICINA DE EMERGENCIA Y DESASTRES O MEDICINA  INTERNA,Hospital Nacional Daniel Alcides Carrion,CALLAO - BELLAVISTA
https://página web de la  institución  www.hndac.gob.pe.,2,D.Leg 1057 - Indeterminado-001,"S/. 7,564.00",21/01/2025,03/02/2025,EXPERIENCIA LABORAL EN HOSPITAL NIVEL III-1 EN LA ESPECIALIDAD DE CIRUGÍA DE TÓRAX Y CARDIOVASCULAR,TÍTULO DE MEDICO CIRUJANO,TITULO DE ESPECIALIDAD EN CIRUGÍA  DE TÓRAX Y CARDIOVASCULAR,RELACIONADOS AL CARGO,CAPACIDAD PARA TRABAJAR EN EQUIPO Y BAJO PRESIÓN,MEDICO CIRUJANO DE TÓRAX Y CARDIOVASCULAR,Hospital Nacional Daniel Alcides Carrion,CALLAO - BELLAVISTA
https://página web de la  institución  www.hndac.gob.pe.,3,D.Leg 1057 - Indeterminado-001,"S/. 3,164.19",21/01/2025,03/02/2025,EXPERIENCIA MÍNIMA DE 06 MESES EN EL SECTOR PÚBLICO O PRIVADO,TITULO DE LICENCIADO/A EN ENFERMERÍA,CAPACITACION RELACIONADA AL CARGO,RELACIONADOS AL CARGO,CAPACIDAD PARA TRABAJAR EN EQUIPO,ENFERMERA /O ASISTENCIAL,Hospital Nacional Daniel Alcides Carrion,CALLAO - BELLAVISTA
https://página web de la  institución  www.hndac.gob.pe.,2,D.Leg 1057 - Indeterminado-001,"S/. 2,464.19",21/01/2025,03/02/2025,EXPERIENCIA GENERAL MÍNIMA DE 03 MESES EN EL SECTOR PÚBLICO O PRIVADO,TITULO DE LICENCIADO/A EN ENFERMERÍA,CAPACITACIÓN RELACIONADA AL CARGO,RELACIONADOS AL CARGO,CAPACIDAD PARA TRABAJAR EN EQUIPO,ENFERMERA /O,Hospital Nacional Daniel Alcides Carrion,CALLAO - BELLAVISTA
https://página web de la  institución  www.hndac.gob.pe.,1,D.Leg 1057 - Indeterminado-001,"S/. 3,600.00",21/01/2025,03/02/2025,"EXPERIENCIA LABORAL DE 06 ,MESES EN ENTIDADES PÚBLICAS Y /O PRIVADAS",TITULO DE LICENCIADO/A EN ENFERMERÍA,TÍTULO DE ESPECIALIDAD DE ENFERMERA INTENSIVA PEDIATRICA,CURSOS DE ACTUALIZACIÓN EN MEDICINA GENERAL - GERIATRÍA,CAPACIDAD PARA TRABAJAR EN EQUIPO Y BAJO PRESIÓN,ENFERMERA (O) ESPECIALISTA EN EN MEDICINA GENERAL (GERIATRÍA),Hospital Nacional Daniel Alcides Carrion,CALLAO - BELLAVISTA
https://página web de la  institución  www.hndac.gob.pe.,1,D.Leg 1057 - Indeterminado-001,"S/. 3,600.00",21/01/2025,03/02/2025,EXPERIENCIA LABORAL DE 06 MESES EN ENTIDADES PÚBLICAS Y/O PRIVADAS,TITULO DE LICENCIADO/A EN ENFERMERÍA,TITULO DE ENFERMERA ESPECIALISTA EN CUIDADOS INTENSIVOS PEDIATRICOS,CURSOS DE ACTUALIZACIÓN EN LA ESPECIALIDAD,"ACTITUD DE SERVICIO, ÉTICA E INTEGRIDAD",ENFERMERA (O) ESPECIALISTA EN CUIDADOS INTENSIVOS PEDIÁTRICOS,Hospital Nacional Daniel Alcides Carrion,CALLAO - BELLAVISTA
https://www.gob.pe/institucion/marina/informes-publicaciones/tipos/107-concurso-publico,1,D.Leg 1057 - Determinado (Necesidad Transitoria)-006,"S/. 6,914.19",20/01/2025,31/01/2025,"EXPERIENCIA GENERAL
CINCO (5) AÑOS.

EXPERIENCIA ESPECÍFICA
CINCO (5) AÑOS EN EL SECTOR PÚBLICO.",TÍTULO PROFESIONAL UNIVERSITARIO.,•CURSO DE NEGOCIACIÓN Y SOLUCIÓN DE CONFLICTOS. •	ESPECIALIZACIÓN EN ADMINISTRACIÓN ORIENTADO EN RECURSOS HUMANOS.,•CONOCIMIENTO DE NORMAS RELACIONADAS A NEGOCIACIÓN EN EL SECTOR ESTATAL. •	CONOCIMIENTO DE LAS NORMAS DE LOS REGÍMENES ESPECIALES LABORALES (SALUD Y EDUCACIÓN). •	CONOCIMIENTO DE NEGOCIACIONES COLECTIVAS A NIVEL TRATO DIRECTO Y CONCILIACIÓN. •	CONOCIMIENTO EN OFIMÁTICA BÁSICA. •	CONOCIMIENTO EN INGLÉS BÁSICO.,•ANÁLISIS. •	ORGANIZACIÓN •	PLANIFICACIÓN. •	TRABAJO EN EQUIPO.,ESPECIALISTA EN NEGOCIACIÓN Y SOLUCIÓN DE CONFLICTOS ADMINISTRATIVOS Y LABORALES,Marina De Guerra Del Peru,CALLAO - LA PERLA
https://www.gob.pe/institucion/marina/informes-publicaciones/tipos/107-concurso-publico,1,D.Leg 1057 - Determinado (Necesidad Transitoria)-011,"S/. 4,264.19",20/01/2025,31/01/2025,"EXPERIENCIA GENERAL: DOS (2) AÑOS

EXPERIENCIA ESPECÍFICA: UN (1) AÑO EN EL SECTOR PÚBLICO.",•	TÍTULO PROFESIONAL UNIVERSITARIO DE ABOGADO. •	REGISTRO DE COLEGIATURA. •	CONSTANCIA DE HABILITACIÓN PROFESIONAL,•	PROGRAMA O CURSO O DIPLOMADO DE ESTUDIO EN CONTRATACIONES DEL ESTADO.,"•	CONOCIMIENTOS EN GESTIÓN Y ADMINISTRACIÓN PÚBLICA PROCEDIMIENTO SANCIONADOR DISCIPLINARIO, OBRAS PÚBLICAS, SISTEMA DE INVERSIÓN PÚBLICA Y COMPRAS ESTATALES. •	CONOCIMIENTO EN OFIMÁTICA BÁSICA. •	CONOCIMIENTO EN INGLES BÁSICO.",•	ANÁLISIS. •	PLANEACIÓN Y ORGANIZACIÓN. •	TRABAJO EN EQUIPO. •	ADAPTABILIDAD.,ABOGADO ESPECIALISTA EN CONTRATACIONES DEL ESTADO,Marina De Guerra Del Peru,CALLAO - CALLAO
https://www.gob.pe/institucion/marina/informes-publicaciones/tipos/107-concurso-publico,1,D.Leg 1057 - Determinado (Necesidad Transitoria)-002,"S/. 1,764.19",20/01/2025,31/01/2025,"EXPERIENCIA GENERAL:  CUATRO (4) AÑOS.

EXPERIENCIA ESPECÍFICA:  DOS (2) AÑOS.

OTROS ASPECTOS COMPLEMENTARIOS:  EXPERIENCIA LABORAL EN HOSPITALES DE NIVEL II-III/CLÍNICAS PRIVADAS.",• TÍTULO DE INSTITUTO SUPERIOR TECNOLÓGICO COMO TÉCNICO EN FARMACIA.,• 30 HORAS EN CURSOS RELACIONADOS A SU PROFESIÓN.,• CONOCIMIENTOS VINCULADOS A LAS FUNCIONES DEL PUESTO. • CONOCIMIENTOS BÁSICOS DE OFIMÁTICA.,• TRABAJO EN EQUIPO. • INTELIGENCIA EMOCIONAL. • LIDERAZGO.,TÉCNICO EN FARMACIA,Marina De Guerra Del Peru,CALLAO - BELLAVISTA
https://www.gob.pe/institucion/marina/informes-publicaciones/tipos/107-concurso-publico,1,D.Leg 1057 - Determinado (Necesidad Transitoria)-001,"S/. 2,764.19",20/01/2025,31/01/2025,"EXPERIENCIA GENERAL:  CUATRO (4) AÑOS. 

EXPERIENCIA ESPECÍFICA:  DOS (2) AÑOS DE EXPERIENCIA DESARROLLANDO FUNCIONES RELACIONADAS AL PUESTO DE LAS CUALES UN (1) AÑO DEBERÁ SER EN EL SECTOR PÚBLICO.",• TÍTULO PROFESIONAL UNIVERSITARIO COMO LICENCIADA(O) EN NUTRICIÓN. • REGISTRO DE COLEGIATURA. • CONSTANCIA DE HABILITACIÓN PROFESIONAL • RESOLUCIÓN DEL TÉRMINO DEL SERVICIO RURAL Y URBANO MARGINAL DE LA SALUD (SERUMS),• 16 HORAS EN CURSOS RELACIONADOS A SU PROFESIÓN.,• CONOCIMIENTOS EN PASANTÍA EN EL ÁREA DE SOPORTE NUTRICIÓN PARA PACIENTES CRÍTICOS. • CONOCIMIENTOS BÁSICOS DE OFIMÁTICA.,• TRABAJO EN EQUIPO. • INTELIGENCIA EMOCIONAL. • LIDERAZGO.,NUTRICIONISTA,Marina De Guerra Del Peru,CALLAO - BELLAVISTA
https://www.gob.pe/institucion/marina/informes-publicaciones/tipos/107-concurso-publico,1,D.Leg 1057 - Determinado (Necesidad Transitoria)-004,"S/. 2,265.19",20/01/2025,31/01/2025,"EXPERIENCIA GENERAL:  UN (1) AÑO.

EXPERIENCIA ESPECÍFICA:  UN (1) AÑO.",• BACHILLER UNIVERSITARIO DE INGENIERÍA GEOGRÁFICA/ GEOGRAFÍA.,• CURSO DE SISTEMAS DE INFORMACIÓN GEOGRÁFICA. • CURSO DE PROCESAMIENTO DIGITAL DE IMÁGENES SATELITALES.,• CONOCIMIENTO EN EL MANEJO DEL SOFTWARE ARCGIS SERVER. • CONOCIMIENTO EN MODELO VECTORIAL Y RASTER EN SOFTWARE ARCGIS. • CONOCIMIENTO EN TELEDETECCIÓN. • CONOCIMIENTOS EN EL MANEJO DE SOFTWARE AUTOCAD • CONOCIMIENTOS BÁSICO DE IDIOMA INGLÉS.,• ADAPTABILIDAD. • ANÁLISIS. • EMPATÍA • ORGANIZACIÓN DE INFORMACIÓN,"ENCARGADO DE TELEDETECCIÓN, SIMULACIÓN MEDIANTE MODELOS DE ELEVACIÓN DIGITAL Y SISTEMAS DE INFORMACIÓN GEOGRÁFICA (SIG)",Marina De Guerra Del Peru,CALLAO - CALLAO
https://www.drec.gob.pe,1,D.Leg 1057 - Determinado (Suplencia)-001,"S/. 2,764.19",17/01/2025,30/01/2025,"EXPERIENCIA GENERAL: TRES (03) AÑOS EN EL SECTOR PÚBLICO Y/O PRIVADO
EXPERIENCIA ESPECIFICA:  DOS (02) AÑOS EN EL SECTOR PÚBLICO Y/O PRIVADO, EN TEMAS RELACIONADOS A LA CONVOCATORIA, DE PREFERENCIA EN EL SECTOR EDUCACIÓN EN PLANILLAS, TESORERIA, CONTABILIDAD.","TÍTULO PROFESIONAL, BACHILLER, ESTUDIANTE DE LOS ULTIMOS CICLOS UNIVERSITARIOS O PROFESIONAL TÉCNICO EN ADMINISTRACIÓN, CONTABILIDAD, ECONOMÍA, INGENIERÍA, COMPUTACIÓN E INFORMÁTICA Y/O CARRERAS AFINES.","CAPACITACIÓN EN GESTIÓN DE TESORERÍA  CAPACITACIÓN EN GESTIÓN PÚBLICA  SISTEMA INTEGRADO DE GESTIÓN FINANCIERA SIAF, SISTEMA INTEGRADO DE   GESTIÓN ADMINISTRATIVA (SIGA),  CAPACITACIÓN EN GESTIÓN PÚBLICA, DECLARACIÓN JURADA ANUAL","• LEY DEL PROCEDIMIENTO ADMINISTRATIVO GENERAL ( LEY N° 27444) APROBADO CON DECRETO SUPREMO N° 004-2019-JUS.                                                                                                                                                                                                                                                                              • LEY N° 27815 LEY DEL CÓDIGO DE ETICA DE LA FUNCION PUBLICA.                                                                                                                                                                                                       • CONOCIMIENTOS DE LA LEY DE TESORERÍA Y FINANCIEROS DEL SECTOR PÚBLICO. • CONOCIMIENTO EN SISTEMA INTEGRADO DE GESTIÓN FINANCIERA SIAF-SP, SIGA  • CONOCIMIENTO EN NORMATIVIDAD DEL PRESUPUESTO PUBLICO  • CONOCIMIENTO EN PLANILLA ELECTRÓNICA, TEMAS TRIBUTARIAS. • CONOCIMIENTO DE OFIMÁTICA (WORD, EXCEL) NIVEL INTERMEDIO • NO TENER IMPEDIMENTO DE CONTRATAR CON EL ESTADO","DINÁMICO (A), ORDENADO (A), RESPONSABLE, PROACTIVO (A), CAPACIDAD DE TRABAJO EN EQUIPO, INICIATIVA, CAPACIDAD E SERVICIO, ORIENTACIÓN DE RESULTADOS, CAPACIDAD DE ANÁLISIS SÍNTESIS.",TECNICO CONTABLE,Direccion Regional De Educacion Del Callao,CALLAO - BELLAVISTA
https://hospitaldeventanilla.gob.pe/convocatorias-cas/,1,D.Leg 1057 - Determinado (Necesidad Transitoria)-01,"S/. 2,764.19",17/01/2025,30/01/2025,03 AÑOS,TITULO TECNICO EN CARRERA ADMINISTRATIVA,CERTIFICACION OSCE,"ELABORACION DE TERMINOS DE REFERENCIA, SISTEMAS OPERATIVOS, GESTION PUBLICA","CAPACIDAD DE COORDINACION, ORGANIZACION Y CONTROL DE RECURSO ASIGNADO.",TECNICO ADMINISTRATIVO,Hospital De Ventanilla,CALLAO - VENTANILLA
