job_posting_url,vacancies,job_posting_number,salary,start_publication_date,end_publication_date,required_experience,educational_background,specialization,required_knowledge,skills,job_title,public_institution,ubication
https://www.gob.pe/institucion/sunarp/colecciones/2210-concursos-publicos-de-meritos-plazas-cas-zona-registral-n-xiv,1,D.Leg 1057 - Determinado (Necesidad Transitoria)-005,"S/. 3,000.00",24/01/2025,06/02/2025,"EXPERIENCIA GENERAL: 2 AÑOS
EXPERIENCIA ESPECIFICA: 1 AÑO
EXPERIENCIA ESPECIFICA EN EL SECTOR PUBLICO: 1 AÑO
PUESTO: PRACTICANTE PROFESIONAL",GRADO UNIVERSITARIO DE BACHILLER EN DERECHO,NORMATIVA REGISTRAL.,CONOCIMIENTO EN NORMATIVA REGISTRAL.,"COMUNICACIÓN, DINAMISMO, INICIATIVA, ORDEN, ORGANIZACIÓN DE LA INFORMACIÓN, PROACTIVIDAD, DESARROLLO DE RELACIONES Y EMPATÍA.",ANALISTA REGISTRAL,Zona Registral N° Xiv-Sede Ayacucho,AYACUCHO - AYACUCHO
https://www.gob.pe/regionayacucho,1,D.Leg 1057 - Determinado (Necesidad Transitoria)-05,S/. 003.75,24/01/2025,06/02/2025,"¿	EXPERIENCIA GENERAL: EN EL SECTOR PÚBLICO Y PRIVADO COMO MÍNIMO DE TRES (03) AÑOS, SUSTENTAR CON COPIA DE CONTRATOS, RESOLUCIONES Y/O CONSTANCIAS O CERTIFICADOS DE TRABAJO.
¿	EXPERIENCIA ESPECÍFICA: EN EL SECTOR PÚBLICO COMO MÍNIMO DE DOS (02) AÑOS EN EL ÁREA DE PRESUPUESTO EN ENTIDADES DE GOBIERNOS REGIONALES, SUSTENTAR CON COPIA DE CONTRATOS, RESOLUCIONES Y/O CONSTANCIAS O CERTIFICADOS DE TRABAJO.",TÍTULO PROFESIONAL DE LA CARRERA PROFESIONAL UNIVERSITARIA DE CONTABILIDAD Y/O ADMINISTRACIÓN Y/O ECONOMÍA COLEGIADO Y HABILITADO.,"¿	CAPACITACIÓN Y/O CERTIFICACIONES EN TEMAS DE PRESUPUESTO PÚBLICO, PLAN ESTRATÉGICO INSTITUCIONAL PEI, SIAF, Y OTROS RELACIONADOS AL SISTEMA DE LA ADMINISTRACIÓN PÚBLICA, COMO MÍNIMO DE 500 HORAS LECTIVAS ACUMULABLES, CON UNA ANTIGÜEDAD NO MAYOR A 05 AÑOS, ACREDITAR CON COPIA DE CERTIFICADOS Y/O CONSTANCIAS. ¿	DIPLOMADOS Y/O ESPECIALIZACIONES EN SIAF, SIGA, GESTIÓN PUBLICA, SISTEMAS ADMINISTRATIVOS DEL ESTADO, COMO MÍNIMO DE 500 HORAS LECTIVAS ACUMULABLES, CON UNA ANTIGÜEDAD NO MAYOR A 05 AÑOS.",.S/R,PROACTIVO Y TRABAJO BAJO PRESION,01 ESPECIALISTA EN PRESUPUESTO (SIGLA – SGF - 01).,Gobierno Regional Ayacucho,AYACUCHO - AYACUCHO
https://www.gob.pe/regionayacucho,1,D.Leg 1057 - Determinado (Necesidad Transitoria)-04,S/. 004.00,24/01/2025,06/02/2025,"¿	EXPERIENCIA GENERAL: EN EL SECTOR PÚBLICO Y PRIVADO COMO MÍNIMO DE CINCO (05) AÑOS, SUSTENTAR CON COPIA DE CONTRATOS, RESOLUCIONES Y/O CONSTANCIAS O CERTIFICADOS DE TRABAJO.
¿	EXPERIENCIA ESPECÍFICA: EN EL SECTOR PÚBLICO COMO MÍNIMO DE CUATRO (04) AÑOS EN EL ÁREA DE PRESUPUESTO Y/O FINANZAS EN ENTIDADES DE GOBIERNOS REGIONALES, SUSTENTAR CON COPIA DE CONTRATOS, RESOLUCIONES Y/O CONSTANCIAS O CERTIFICADOS DE TRABAJO.",TÍTULO PROFESIONAL DE LA CARRERA PROFESIONAL UNIVERSITARIA DE CONTABILIDAD Y/O ADMINISTRACIÓN Y/O ECONOMÍA COLEGIADO Y HABILITADO.,"¿	DIPLOMADOS Y/O ESPECIALIZACIONES EN GESTIÓN PÚBLICA, CONTRATACIONES CON EL ESTADO Y PROGRAMACIONES MULTIANUAL Y GESTIÓN DE INVERSIONES (INVIERTE.PE), SIAF, SIGA COMO MÍNIMO ACUMULADO DE 200 HORAS LECTIVAS CON UNA ANTIGÜEDAD NO MAYOR A 05 AÑOS, ACREDITAR CON COPIA DE CERTIFICADOS Y/O CONSTANCIAS. ¿	CAPACITACIÓN Y/O CURSOS ESPECIALIZADOS, EN TEMAS DE SIAF, SIGA, PLANIFICACIÓN Y PRESUPUESTO Y OTROS RELACIONADOS AL SISTEMA DE LA ADMINISTRACIÓN PÚBLICA, COMO MÍNIMO DE 500 HORAS LECTIVAS ACUMULABLES, CON UNA ANTIGÜEDAD NO MAYOR A 05 AÑOS.","¿	DIPLOMADOS Y/O ESPECIALIZACIONES EN GESTIÓN PÚBLICA, CONTRATACIONES CON EL ESTADO Y PROGRAMACIONES MULTIANUAL Y GESTIÓN DE INVERSIONES (INVIERTE.PE), SIAF, SIGA COMO MÍNIMO ACUMULADO DE 200 HORAS LECTIVAS CON UNA ANTIGÜEDAD NO MAYOR A 05 AÑOS, ACREDITAR CON COPIA DE CERTIFICADOS Y/O CONSTANCIAS. ¿	CAPACITACIÓN Y/O CURSOS ESPECIALIZADOS, EN TEMAS DE SIAF, SIGA, PLANIFICACIÓN Y PRESUPUESTO Y OTROS RELACIONADOS AL SISTEMA DE LA ADMINISTRACIÓN PÚBLICA, COMO MÍNIMO DE 500 HORAS LECTIVAS ACUMULABLES, CON UNA ANTIGÜEDAD NO MAYOR A 05 AÑOS.",PROACTIVO Y TRABAJO BAJO PRESION,01 ESPECIALISTA EN PRESUPUESTO  (SIGLA – SGF - 01).,Gobierno Regional Ayacucho,AYACUCHO - AYACUCHO
https://www.gob.pe/institucion/sathuamanga/informes-publicaciones/tipos/80-convocatorias-de-trabajo,1,728-01,"S/. 2,751.11",24/01/2025,06/02/2025,•	EXPERIENCIA NO MENOR DE 02 AÑOS EN LABORES RELACIONADAS AL CARGO,"•	TÍTULO PROFESIONAL UNIVERSITARIO  COLEGIDO Y HABILITADO Y/O GRADO DE BACHILLER UNIVERSITARIO EN LA ESPECIALIDAD DE ADMINISTRACIÓN DE EMPRESAS, CONTABILIDAD, ECONOMÍA Y OTROS AFINES",•	CONTRATACIONES Y ADQUISICIONES DEL ESTADO •	RECURSOS HUMANOS •	SIGA  •	SIAF,•	CONTRATACIONES Y ADQUISICIONES DEL ESTADO •	GESTIÓN DE RECURSOS HUMANOS Y OTROS AFINES AL CARGO,"•	CAPACIDAD DE ANÁLISIS, EVALUACIÓN Y RESOLUCIÓN DE CONFLICTOS. •	FACILIDAD DE TRABAJO EN EQUIPO, BAJO PRESIÓN Y CON METAS. •	ORIENTACIÓN A ESTRATEGIAS Y RESULTADOS, VOCACIÓN DE SERVICIO, EMPATÍA Y FACILIDAD DE PALABRA. •	ALTA PROBIDAD, RESPONSABILIDAD, PUNTUALIDAD, ORDEN Y DILIGENCIA EN EL TRABAJO. •	IDENTIFICACIÓN, COLABORACIÓN Y COMPROMISO CON LOS OBJETIVOS DE LA ENTIDAD.",JEFE DE LA UNIDAD DE LOGÍSTICA Y RECURSO HUMANOS,Servicio De  Administracion  Tributaria  De Huamanga,AYACUCHO
https://www.facebook.com/municipalidaddistritaldesocos,1,D.Leg 1057 - Determinado (Necesidad Transitoria)-001,"S/. 1,500.00",24/01/2025,06/02/2025,EXPERIENCIA DE UNO (1) AÑO EN EL CARGO,"TÍTULO PROFESIONAL NO UNIVERSITARIO EN SECRETARIADO, CONTABILIDAD, ADMINISTRACIÓN O AFINES.",NO APLICA,MICROSOFT OFFICE A NIVEL USUARIO.,VOCACIÓN DE SERVICIO AL PUBLICO,SECRETARIA DE LA SUB GERENCIA DE DESARROLLO SOCIAL Y SERVICIOS PUBLICOS,Municipalidad Distrital De Socos,AYACUCHO - SOCOS
https://www.facebook.com/municipalidaddistritaldesocos,1,D.Leg 1057 - Determinado (Necesidad Transitoria)-001,"S/. 1,700.00",24/01/2025,06/02/2025,EXPERIENCIA ACREDITADA EN LABORES SIMILARES,"ESTUDIOS SUPERIORES UNIVERSITARIOS (MÍNIMO 6 SEMESTRES) O TÍTULO DE INSTITUTO SUPERIOR TECNOLÓGICO, RELACIONADOS CON LAS CARRERAS DE SECRETARIADO, ADMINISTRACIÓN, CONTABILIDAD O AFINES.",NO APLICA,CAPACITACIÓN EN LABORES SIMILARES.,"PROBIDAD Y CONDUCTA,VOCACIÓN DE SERVICIO AL PÚBLICO",SECRETARIA DE GERENCIA MUNICIPAL,Municipalidad Distrital De Socos,AYACUCHO - SOCOS
https://www.facebook.com/municipalidaddistritaldesocos,1,D.Leg 1057 - Determinado (Necesidad Transitoria)-001,"S/. 1,700.00",24/01/2025,06/02/2025,EXPERIENCIA ACREDITADA MÍNIMA DE 01 AÑOS EN LABORES SIMILARES.,"TÍTULO UNIVERSITARIO Y/O BACHILLER EN CARRERAS DE DERECHO, TRABAJO SOCIAL, ANTROPOLOGÍA O CARRERAS AFINES.",CAPACITACIÓN ESPECIALIZADA EN LA MATERIA,MICROSOFT OFFICE A NIVEL USUARIO.,VOCACIÓN DE SERVICIO AL PUBLICO,RESPONSABLE DEL AREA DE OMAPED,Municipalidad Distrital De Socos,AYACUCHO - SOCOS
https://www.facebook.com/municipalidaddistritaldesocos,1,D.Leg 1057 - Determinado (Necesidad Transitoria)-001,"S/. 1,800.00",24/01/2025,06/02/2025,EXPERIENCIA LABORAL DE UN (01) AÑO EN ADMINISTRACIÓN PÚBLICA,"BACHILLER Y/O EGRESADO UNIVERSITARIO EN CARRERAS DE ADMINISTRACIÓN, CONTABILIDAD O AFINES.",NO APLICA,CAPACITACIÓN EN LA MATERIA.,VOCACIÓN DE SERVICIO AL PUBLICO,RESPONSABLE DEL AREA DE ALMACEN,Municipalidad Distrital De Socos,AYACUCHO - SOCOS
https://www.facebook.com/municipalidaddistritaldesocos,1,D.Leg 1057 - Determinado (Necesidad Transitoria)-001,"S/. 2,000.00",24/01/2025,06/02/2025,"EXPERIENCIA MÍNIMA DE 02 AÑOS EN PLANIFICACIÓN, ORGANIZACIÓN, EJECUCIÓN DE PROGRAMAS SOCIALES.","TÍTULO PROFESIONAL/BACHILLER EN CIENCIAS SOCIALES, TRABAJO SOCIAL, ANTROPOLOGÍA, EDUCACIÓN.",CAPACITACION EN PROGRAMAS DE ESPECIALIDAD,"MANEJO INTERMEDIO DE HERRAMIENTAS DE OFIMÁTICA Y AUTOCAD, S10, ENTRE OTROS.",VOCACIÓN DE SERVICIO AL PUBLICO,RESPONSABLE DE LA DIVISION DE PROGRAMAS SOCIALES Y SERVICIOS PUBLICOS,Municipalidad Distrital De Socos,AYACUCHO - SOCOS
https://www.facebook.com/municipalidaddistritaldesocos,1,D.Leg 1057 - Determinado (Necesidad Transitoria)-001,"S/. 2,400.00",24/01/2025,06/02/2025,EXPERIENCIA DE UN (01) AÑO EN LA ADMINISTRACIÓN PUBLICA,"TÍTULO UNIVERSITARIO Y/O BACHILLER EN LAS CARRERAS DE INGENIERÍA, ECONOMÍA O AFINES AL CARGO.",CAPACITACIÓN EN LABORES SIMILARES.,MANEJO INTERMEDIO DE HERRAMIENTAS DE OFIMÁTICA Y AUTOCAD.,"COMUNICACIÓN EFECTIVA,PENSAMIENTO ESTRATÉGICO",RESPONSABLE DE LA DIVISION DE ESTUDIOS DE PRE INVERSION – UNIDAD FORMULADORA (UF),Municipalidad Distrital De Socos,AYACUCHO - SOCOS
https://www.facebook.com/municipalidaddistritaldesocos,1,D.Leg 1057 - Determinado (Necesidad Transitoria)-001,"S/. 2,000.00",24/01/2025,06/02/2025,EXPERIENCIA ACREDITADA MÍNIMA DE 01 AÑO EN LABORES SIMILARE,ESTUDIOS UNIVERSITARIOS EN LA ESPECIALIDAD AFINES AL CARGO,CAPACITACIÓN ESPECIALIZADA,MICROSOFT OFFICE A NIVEL USUARIO.,"VOCACIÓN DE SERVICIO AL PUBLICO,SENSIBILIDAD SOCIAL",RESPONSABLE DE LA DIVISION DE DESARROLLO AGROPECUARIO Y PROYECTOS PRODUCTIVOS,Municipalidad Distrital De Socos,AYACUCHO - SOCOS
https://www.facebook.com/municipalidaddistritaldesocos,1,D.Leg 1057 - Determinado (Necesidad Transitoria)-001,"S/. 2,000.00",24/01/2025,06/02/2025,EXPERIENCIA ACREDITADA MÍNIMA DE 02 AÑOS EN LABORES EN EL CARGO EXPERIENCIA EN LA EJECUCIÓN DE PLANES DE CONTINGENCIA CONTRA FENÓMENOS Y DESASTRES NATURALES.,TÍTULO UNIVERSITARIO Y/O BACHILLER EN LAS CARRERAS DE INGENIERÍA U OTRAS AFINES AL CARGO.,CAPACITACIÓN ESPECIALIZADA EN GESTIÓN DE RIESGOS,MICROSOFT OFFICE A NIVEL USUARIO.,VOCACIÓN DE SERVICIO AL PUBLICO,RESPONSABLE DE LA DIVISION DE AREA TECNICA DEDEFENSA CIVIL Y GESTION DE RIESGO,Municipalidad Distrital De Socos,AYACUCHO - SOCOS
https://www.facebook.com/municipalidaddistritaldesocos,1,D.Leg 1057 - Determinado (Necesidad Transitoria)-001,"S/. 1,800.00",24/01/2025,06/02/2025,EXPERIENCIA ACREDITADA EN LABORES SIMILARES.,"TÍTULO PROFESIONAL UNIVERSITARIO Y/O BACHILLER EN CIENCIAS DE LA COMUNICACIÓN, O AFÍN.",CAPACITACIÓN EN LABORES SIMILARES.,MANEJO DE HERRAMIENTAS DE OFIMÁTICA,VOCACIÓN DE SERVICIO AL PUBLICO,RESPONSABLE DE IMAGEN INSTITUCIONAL,Municipalidad Distrital De Socos,AYACUCHO - SOCOS
https://www.facebook.com/municipalidaddistritaldesocos,1,D.Leg 1057 - Determinado (Necesidad Transitoria)-001,"S/. 2,000.00",24/01/2025,06/02/2025,EXPERIENCIA LABORAL DE DOS (02) AÑOS EN ADMINISTRACIÓN PUBLICA,"TÍTULO PROFESIONAL Y/O BACHILLER UNIVERSITARIO EN CARRERAS DE ADMINISTRACIÓN, CONTABILIDAD O AFINES",CAPACITACIÓN EN LABORES SIMILARES.,"SISTEMAS ADMINISTRATIVOS SEACE, SIAF, SIGA Y DEMÁS SOFTWARE VINCULADO A SUS FUNCIONES",PROBIDAD Y CONDUCTA,RESPONSABLE DE ADQUISICIONES,Municipalidad Distrital De Socos,AYACUCHO - SOCOS
https://www.facebook.com/municipalidaddistritaldesocos,1,D.Leg 1057 - Determinado (Necesidad Transitoria)-001,"S/. 1,700.00",24/01/2025,06/02/2025,EXPERIENCIA EN GESTIÓN DE RECURSOS HUMANOS MÍNIMO DE UN AÑO Y DOS (02) AÑOS EN ADMINISTRACIÓN PÚBLICA,"TÍTULO PROFESIONAL UNIVERSITARIO Y/O BACHILLER EN LAS CARRERAS DE ADMINISTRACIÓN, CONTABILIDAD O AFINES AL CARGO.","CAPACITACIÓN ESPECIALIZADA EN LA MATERIA,",MICROSOFT OFFICE A NIVEL USUARIO,"PROBIDAD Y CONDUCTA ,SENSIBILIDAD SOCIAL,LEALTAD INSTITUCIONAL",JEFE DE LA UNIDAD DE RECURSOS HUMANOS,Municipalidad Distrital De Socos,AYACUCHO - SOCOS
https://www.facebook.com/municipalidaddistritaldesocos,1,D.Leg 1057 - Determinado (Necesidad Transitoria)-001,"S/. 1,800.00",24/01/2025,06/02/2025,ACREDITACIÓN MÍNIMA DE UN (01) AÑO EN LABORES SIMILARES,"TÍTULO A NOMBRE DE LA NACIÓN Y/O BACHILLER EN LAS CARRERAS DE BIOLOGÍA, INGENIERÍA QUÍMICA, Y/O AFINES",ESPECIALIZADA EN GESTIÓN DE AGUA Y SANEAMIENTO.,MANEJO DE HERRAMIENTAS DE OFIMÁTICA,ORGANIZACIÓN Y PLANIFICACIÓN,JEFE DE LA OFICINA TECNICA MUNICIPAL (ATM),Municipalidad Distrital De Socos,AYACUCHO - SOCOS
https://www.facebook.com/municipalidaddistritaldesocos,1,D.Leg 1057 - Determinado (Necesidad Transitoria)-001,"S/. 2,600.00",24/01/2025,06/02/2025,TENER DOS (02) AÑOS DE EXPERIENCIA EN EL EJERCICIO PROFESIONAL.,TÍTULO A NOMBRE DE LA NACIÓN Y/O BACHILLER EN LAS CARRERAS DE INGENIERÍA CIVIL Y/O ARQUITECTURA.,CAPACITACIÓN EN LABORES SIMILARES.,MANEJO INTERMEDIO DE HERRAMIENTAS DE OFIMÁTICA. Y AUTOCAD,"ORGANIZACIÓN Y PLANIFICACIÓN,INTEGRIDAD Y COMPORTAMIENTO ÉTICO.",JEFE DE LA OFICINA DE SUPERVISION Y LIQUIDACION DE PROYECTOS DE INVERSION,Municipalidad Distrital De Socos,AYACUCHO - SOCOS
https://www.facebook.com/municipalidaddistritaldesocos,1,D.Leg 1057 - Determinado (Necesidad Transitoria)-001,"S/. 1,700.00",24/01/2025,06/02/2025,EXPERIENCIA ACREDITADA EN LABORES SIMILARES.,ESTUDIOS MÍNIMOS DE INSTRUCCIÓN SECUNDARIA,NO APLICA,NO APLICA,"PROBIDAD Y CONDUCTA,VOCACIÓN DE SERVICIO AL PÚBLICO",CHOFER PARA ALCALDIA,Municipalidad Distrital De Socos,AYACUCHO - SOCOS
https://www.facebook.com/municipalidaddistritaldesocos,1,D.Leg 1057 - Determinado (Necesidad Transitoria)-001,"S/. 1,600.00",24/01/2025,06/02/2025,EXPERIENCIA ACREDITADA EN LABORES SIMILARES.,"ESTUDIOS SUPERIORES NO UNIVERSITARIOS, EN CARRERAS DE SECRETARIADO, ADMINISTRACIÓN, CONTABILIDAD U OTRAS CARRERAS AFINES",NO APLICA,MICROSOFT OFFICE A NIVEL USUARIO,"ORGANIZACIÓN Y PLANIFICACIÓN,INTEGRIDAD Y COMPORTAMIENTO ÉTICO.",SECRETARIA PARA LA SUB GERENCIA DE INFRAESTRUCTURA Y DESARROLLO URBANO RURAL,Municipalidad Distrital De Socos,AYACUCHO - AYACUCHO
https://www.gob.pe/regionayacucho,2,D.Leg 1057 - Determinado (Necesidad Transitoria)-03,S/. 001.40,24/01/2025,06/02/2025,"¿	EXPERIENCIA GENERAL: EN EL SECTOR PÚBLICO Y/O PRIVADO COMO MÍNIMO DE SEIS (06) MESES, SUSTENTAR CON COPIA DE CONTRATOS, RESOLUCIONES Y/O CONSTANCIAS, ORDENES DE SERVICIO Y CERTIFICADOS DE TRABAJO.
¿	EXPERIENCIA ESPECÍFICA: EN EL SECTOR PÚBLICO COMO MÍNIMO DE SEIS (06) MESES, REALIZANDO TRABAJOS NIÑOS, (ALDEA, ALBERGUES Y OTROS) SUSTENTAR CON COPIA DE CONTRATOS, RESOLUCIONES Y/O CONSTANCIAS O CERTIFICADOS DE TRABAJO.",ESTUDIOS CON SECUNDARIA COMPLETA.,"¿	CURSOS DE CAPACITACIÓN EN TEMAS DE FOTOGRAFÍA Y OTROS RELACIONADOS, COMO MÍNIMO 100 HORAS ACREDITAR CON COPIA DE CERTIFICADOS Y/O CONSTANCIAS.",.S/R,PROACTIVO Y TRABAJO BAJO PRESION,02 MADRE TUTORA (SIGLA – AIVNCC- 01).,Gobierno Regional Ayacucho,AYACUCHO - CORACORA
https://www.gob.pe/regionayacucho,1,D.Leg 1057 - Determinado (Necesidad Transitoria)-02,"S/. 1,400.00",24/01/2025,06/02/2025,"¿	EXPERIENCIA GENERAL: EN EL SECTOR PÚBLICO Y/O PRIVADO COMO MÍNIMO DE SEIS (06) MESES, SUSTENTAR CON COPIA DE CONTRATOS, RESOLUCIONES Y/O CONSTANCIAS, ORDENES DE SERVICIO Y CERTIFICADOS DE TRABAJO.
¿	EXPERIENCIA ESPECÍFICA: EN EL SECTOR PÚBLICO COMO MÍNIMO DE SEIS (06) MESES, REALIZANDO TRABAJOS DE ATENCIÓN CON NIÑOS, ALDEAS, ALBERGUES Y OTROS, SUSTENTAR CON COPIAS DE CONTRATOS, RESOLUCIONES Y/O CONSTANCIAS O CERTIFICADOS DE TRABAJO",¿	ESTUDIOS CON CARRERA TÉCNICA NO CONCLUIDAS Y/O SECUNDARIA COMPLETA,"¿	CURSOS DE CAPACITACIÓN EN TEMAS RELACIONADOS CON NIÑOS, NIÑAS Y ADOLESCENTES, TALLERES EDUCACIONALES, ENFOQUE INTERCULTURAL PARA LA EDUCACIÓN PARA LA EDUCACIÓN Y PRIMEROS AUXILIOS COMO MÍNIMO DE 50 HORAS ACREDITAR CON CERTIFICADOS Y/O CONSTANCIAS.",.S/R,PROACTIVO Y TRABAJO BAJO PRESION,01 MADRE TUTORA (SIGLA – AISNT- 01).,Gobierno Regional Ayacucho,AYACUCHO - SAN MIGUEL
https://www.ugelcangallo.gob.pe,1,D.Leg 1057 - Determinado (Necesidad Transitoria)-2,"S/. 2,864.19",23/01/2025,05/02/2025,EXPERIENCIA GENERAL: MINIMO 06 MESES EN INSTITUCIONES PÚBLICAS O PRIVADAS EXPERIENCIA ESPECIFICA: NO MENOR A 3 MESES,"TITULO PROFESIONAL O BACHILLER EN ADMINISTRACIÓN, CONTABILIDAD, ECONOMIA Y/O AFINES.",GESTIÓN PÚBLICA Y GESTIÓN DE ALMACENES,"GESTIÓN PÚBLICA, MANEJO DE SIGA, MANEJODE SIAF ETC","CONOCIMIENTO ORGANIZACIONAL, ORIENTACIÓN AL LOGRO, ORGANIZACIÓN DE LA INFORMACIÓN, CAPACIDAD PARA TRABAJAR EN EQUIPO Y V¿BAJO PRESIÓN, CAPACIDAD PARA COORDINAR CON AUTORIDADES DE DISTINTAS INSTITUCIONES PÚBLICAS Y PRIVADAS",ESPECIALISTA EN ALMACEN,Unid Ejec Educacion Centro Ayacucho,AYACUCHO - CANGALLO
https://www.ugelcangallo.gob.pe,1,D.Leg 1057 - Determinado (Necesidad Transitoria)-3,"S/. 2,864.19",23/01/2025,05/02/2025,"EXPERIENCIA GENERAL:  01 AÑO EN EL SECTOR PÚBLICO O PRIVADO
EXPERIENCIA ESPECIFICA: 3 MESES EN EL SECTOR PUBLICO EN EL CARGO A DESEMPEÑAR","TITULO PROFESIONAL P BACHILER EN DERECHO, ADMINISTRACIÓN ECONOMIA Y/O AFINES","GESTIÓN PÚBLICA, GESTIÓN DE RECURSOS HUMANOS, LEY SERVIR, NORMATIVIDAD DEL SECTOR PÚBLICO","GESTIÓN PÚBLICA, PLANEAMIENTO ESTRATEGICO DE RECURSOS HUMANOS, DERECHO LABORAL Y PROCESAL, GESTIÓN DE RECURSOS HUMANOS, MANEJO DE SISTEMA NEXUS, SIAF, SUP Y AIRHSP","CONOCIMIENTO ORGANIZACIONAL, ORIENTACIÓN AL LOGRO, ORGANIZACIÓN DE LA INFORMACIÓN, CAPACIDAD PARA TRABAJAR EN EQUIPO Y V¿BAJO PRESIÓN, CAPACIDAD PARA COORDINAR CON AUTORIDADES DE DISTINTAS INSTITUCIONES PÚBLICAS Y PRIVADAS",ESPECIALISTA ADMINISTRATIVO I,Unid Ejec Educacion Centro Ayacucho,AYACUCHO - CANGALLO
https://www.ugelhuancasancos.gob.pe/index.php?start=13,1,276-03,"S/. 2,420.75",23/01/2025,05/02/2025,"EXPERIENCIA LABORAL GENERAL: 2 AÑOS EN EL SECTOR PÚBLICO Y/O PRIVADO                                   
EXPERIENCIA LABORAL ESPECIFICAESPECIFICA: 1 AÑOS EN EL CARGO DE SECRETARIA",TÍTULO DE PROFESIONAL TÉCNICO EN SECRETARIADO EJECUTIVO Y/O ASISTENTE DE GERENCIA OTORGADO POR INSTITUCIÓN DE NIVEL SUPERIO,ESTUDIOS DE ESPECIALIZACIÓN EN SECRETARIADO EJECUTIVO. DIPLOMADO EN ASISTENTE DE GERENCIA. CURSOS EN REDACCIÓN CURSOS Y/O CERTIFICADO COMO ASISTENTE GERENCIAL GUBERNAMENTAL CURSOS Y/O DIPLOMAS EN WIN OFFIICE OTROS CURSOS Y/O DIPLOMAS DE SER EL CASO,"CONOCIMIENTOS DEL SISTEMA ADMINISTRATIVO , CONOCIMIENTOS DE HERRAMIENTAS INFORMÁTICA- OFFICE 365, APLICATIVOS INFORMATIVOS RELACIONADOS CON LA ACTIVIDAD",ALTO NIVEL DE SOCIABILIDAD Y SERVICIO AL PERSONAL. - TRABAJO EN EQUIPO Y BAJO PRESIÓN. - TOLERANCIA. - PROACTIVIDAD. - COMUNICACIÓN - VOCACIÓN DE SERVICIO. - CONFIDENCIALIDAD. - AUTOESTIMA POSITIVA,TECNICO ADMINISTRATIVO - SECRETARIA (SUPLENCIA),Unidad Ejecutora Educación Huancasancos,AYACUCHO - SANCOS
https://ugelhuanta.gob.pe/portal/,1,D.Leg 1057 - Determinado (Necesidad Transitoria)-009,"S/. 1,664.19",23/01/2025,05/02/2025,"•	EXPERIENCIA GENERAL: EXPERIENCIA MÍNIMA DE DOS (02) AÑOS EN EL SECTOR PÚBLICO Y/O PRIVADO.
•	EXPERIENCIA ESPECÍFICA: EXPERIENCIA MÍNIMA DE UN (01) AÑO  EN EL SECTOR PÚBLICO EN EL CARGO A DESEMPEÑAR.",•	REQUISITO MÍNIMO: SECUNDARIA COMPLETA. (ACREDITAR CON EL CERTIFICADO DE ESTUDIOS). •	LICENCIA DE CONDUCIR CLASE A CATEGORÍA AIIB Y/O SUPERIOR. •	RECORD DE CONDUCTOR.,"•	HABER PARTICIPADO EN CURSOS, SEMINARIOS, TALLERES Y/O CAPACITACIONES INHERENTES AL CARGO.",•	CONOCIMIENTO BÁSICO DE MECÁNICA Y CONOCIMIENTO DE REGLAS DE TRÁNSITO. •	CONOCIMIENTO DEL ÁMBITO DE LA PROVINCIA.,"•	AUTOCONTROL. •	DINAMISMO. •	ORDEN. •	VOCACIÓN DE SERVICIO. •	RESPONSABILIDAD, PUNTUALIDAD, EMPATÍA. •	TRABAJO BAJO PRESIÓN. •	PROACTIVIDAD.",CONDUCTOR,Unidad Ejecutora Educacion Huanta,AYACUCHO - HUANTA
https://www.facebook.com/share/1djmk3ejco/,1,D.Leg 1057 - Determinado (Necesidad Transitoria)-001,"S/. 1,500.00",23/01/2025,05/02/2025,EXPERIENCIA EN LA CONDUCCIÓN DE VEHICULOS MOTORIZADOS,ESTUDIOS DE SECUNDARIA COMPLETA COMO MINIMO Y CONTAR CON LICENCIA DE CONDUCIR CON CATEGORIA A-2,-,CONOCIMIENTO DE MECANICA,"CAPACIDAD PARA TRABAJAR BAJO PRESION, ORIENTACION A RESULTADOS Y ORGANIZACIÓN Y PLANIFICACION",CONDUCTOR,Municipalidad Distrital De Luis Carranza,AYACUCHO - LUIS CARRANZA
https://www.facebook.com/share/1djmk3ejco/,1,D.Leg 1057 - Determinado (Necesidad Transitoria)-001,"S/. 1,700.00",23/01/2025,05/02/2025,EXPERIENCIA EN EL DESEMPEÑO DE CARGOS DIRECTIVOS Y/O SIMILARES,TITULO PROFESIONAL Y/O BACHILLER Y/O TECNICO TITULADO EN CARRERAS PROFESIONALES A FINES DEL CARGO,-,"CAPACITACION EN GESTION PUBLICA, CONOCIMIENTO EN EL DESARROLLO DE LAS ACTIVIDADES RELACIONADAS CON LA PROMOCION DE DESARROLLO ECONOMICO Y CONOCIMIENTO DE OFIMATICA","CAPACIDAD PARA TRABAJAR BAJO PRESION, ORIENTACION A RESULTADOS, ORGANIZACION Y PLANIFICACION",SUB GERENTE DE DESARROLLO ECONOMICO Y MEDIO AMBIENTE,Municipalidad Distrital De Luis Carranza,AYACUCHO - LUIS CARRANZA
https://www.ugelcangallo.gob.pe,1,D.Leg 1057 - Determinado (Suplencia)-5,"S/. 2,264.19",23/01/2025,05/02/2025,EXPERIENCIA GENERAL: 06 MESES EN INSTITUCIONE SPUBLICAS Y/O PRIVADAS EXPERICNIA ESPECIFICA: 03 MESES DE EXPERIENCIA ESPECIFICAS RELACIONADAS AL CARGO A DESEMPEÑAR EN SECTOR PÚBLICO,"BACHILLER O EGRESADO EN CONTABILIDAD, ADMINISTRACIÓN Y ECONOMIA Y/O AFINES","GESTIÓN PÚBLICA, GESTIÓN DE RECURSOS HUMANOS","GESTIÓN PÚBLICA, MANEJO DE SIGA, MANEJO DE SIAF ETC","CONOCIMIENTO ORGANIZACIONAL, ORIENTACIÓN AL LOGRO, ORGANIZACIÓN DE LA INFORMACIÓN, CAPACIDAD PARA TRABAJAR EN EQUIPO Y V¿BAJO PRESIÓN, CAPACIDAD PARA COORDINAR CON AUTORIDADES DE DISTINTAS INSTITUCIONES PÚBLICAS Y PRIVADAS",TECNICO EN CONTRO PREVIO,Unid Ejec Educacion Centro Ayacucho,AYACUCHO - CANGALLO
https://www.facebook.com/share/1djmk3ejco/,1,D.Leg 1057 - Determinado (Necesidad Transitoria)-001,"S/. 1,500.00",23/01/2025,05/02/2025,EXPERIENCIA EN CARGOS SIMILARES Y/O OTROS,TECNICO Y/O ESTUDIOS SUPERIORES Y/O SECUNDARIA COMPLETA,-,CONOCIMIENTO EN EL AREA,"CAPACIDAD PARA TRABAJAR BAJO PRESION, ORIENTACION A RESULTADOS, ORGANIZACION Y PLANIFICACION Y TRABAJO EN EQUIPO Y PROACTIVO",TECNICO EN ALMACEN,Municipalidad Distrital De Luis Carranza,AYACUCHO - LUIS CARRANZA
https://www.facebook.com/share/1djmk3ejco/,1,D.Leg 1057 - Determinado (Necesidad Transitoria)-001,"S/. 1,700.00",23/01/2025,05/02/2025,EXPERIENCIAS LABORALES Y/O HABER DESARROLLADO CARGOS DIRECTIVOS SIMILARES RELACIONDAS AL CARGO,CONTAR CON TITULO PROFESIONAL Y/O BACHILLER Y/O TECNICO EN CARRERAS PROFESIONALES A FINES DEL CARGO,-,"CAPACITACION EN GESTION PUBLICA Y PROPONER, COORDINAR, PROMOVER LAS POLITICAS DEL DESARROLLO SOCIAL HUMANO Y LOS SERVICIOS PUBLICOS","CAPACIDAD PARA TRABAJAR BAJO PRESION, ORIENTACION A RESULTADOS, ORGANIZACION Y PLANIFICACION Y TRABAJO EN EQUIPO Y PROACTIVO",SUB GERENCIA DE DESARROLLO SOCIAL Y SERVICIOS PÚBLICOS,Municipalidad Distrital De Luis Carranza,AYACUCHO - LUIS CARRANZA
https://www.saludayacucho.gob.pe,1,276-001,"S/. 2,672.32",22/01/2025,04/02/2025,EXPERIENCIA LABORAL DE DOS (02) AÑO EN EL SECTOR PÚBLICO Y/O PRIVADO.,SECUNDARIA COMPLETA,-,"(1) CONOCIMIENTO EN MANIPULACION DE HERRAMIENTAS, PRODUCTOS DE LIMPIEZA Y SU DOSIFICACIÒN. (2) CONOCIMIENTOS BASICOS EN ORGANIZACION Y TRABAJO EN EQUIPO. (3) CAPACIDAD  DE TRABAJO EN EQUIPO (4) CAPACIDAD DE SEGUIR INSTRUCCIONES (5) CONOCIMIENTO BÁSICO DE LAS MEDIDAS DE SEGURIDAD Y SALUD EN EL TRABAJO",- TRABAJO EN EQUIPO - COMPORTAMIENTO ÉTICO - ORIENTACIÓN DE SERVICIO AL CIUDADANO - COMUNICACIÓN EFECTIVA,TÉCNICO DE SERVICIOS GENERALES I,Dirección Regional De Salud Ayacucho,AYACUCHO - AYACUCHO
https://www.saludayacucho.gob.pe,1,276-001,"S/. 2,672.32",22/01/2025,04/02/2025,EXPERIENCIA LABORAL DE DOS (02) AÑOS EN EL SECTOR PÚBLICO.,"TÍTULO DE UN CENTRO DE ESTUDIOS SUPERIOR TECNOLÓGICO EN ADMINISTRACIÓN, CONTABILIDAD, FINANZAS U OTROS AFINES RELACIONADOS AL CARGO",-,"(1) CONOCIMIENTOS EN FASES DEL PROCESO PRESUPUESTARIO Y PLANES OPERATIVOS.  (2) HABILIDADES DE COMUNICACIÓN, COORDINACIÓN, RELACIONES HUMANAS, TRABAJO EN EQUIPO Y CON CAPACIDAD DE TRABAJAR BAJO PRESIÓN.   (3) HABILIDADES Y AMPLIO MANEJO DE SOFTWARE OFIMÁTICA (MS OFFICE-EXCEL), NIVEL INTERMEDIO. (4) SEGUIMIENTO/PROGRAMACIÓN SIGA Y AFINES EN MANEJO DE BASES DE DATOS.","- POSEER CAPACIDAD DE ANÁLISIS, EXPRESIÓN, REDACCIÓN, COORDINACIÓN TÉCNICA DE ORGANIZACIÓN.  - HABILIDAD PARA TRABAJO BAJO PRESIÓN. - TRABAJO EN EQUIPO.     - RELACIONES INTERPERSONALES. - EMPATIA",TÉCNICO ADMINISTRATIVO III,Dirección Regional De Salud Ayacucho,AYACUCHO - AYACUCHO
https://www.saludayacucho.gob.pe,1,276-001,"S/. 2,672.32",22/01/2025,04/02/2025,EXPERIENCIA LABORAL DE  (02) AÑOS EN EL SECTOR PÚBLICO,TITULO TÉCNICO  EN CONTABILIDAD / TÉCNICO ADMINISTRATIVO,-,"CONOCIMIENTOS ACREDITADOS EN SIGA, SIAF",BUENAS RELACIONES INTERPERSONALES - CAPACIDAD DE ANÁLISIS - SISTESIS CONTROL - CAPACIDAD DE TRABAJO EN EQUIPO EMPATÍA,TÉCNICO ADMINISTRATIVO,Dirección Regional De Salud Ayacucho,AYACUCHO - AYACUCHO
https://www.saludayacucho.gob.pe,1,276-001,"S/. 5,309.50",22/01/2025,04/02/2025,•	 EXPERIENCIA MÍNIMA 03 AÑOS EN EL SECTOR PÚBLICO (INCLUYE EL SERUMS).,TRABAJADOR(A) SOCIAL,SALUD PUBLICA O GERENCIA DE SERVICIOS DE SALUD O ATENCIÓN INTEGRAL DE SALUD O GERENCIA SOCIAL,1. MODELO DE CUIDADO INTEGRAL DE SALUD (MCI) POR CURSO DE VIDA EN EL MARCO DEL REDES INTEGRADAS EN SALUD (RIS) 2. NORMATIVIDAD RESPECTO A POBLACIÓN INDÍGENA U ORIGINARIA 3. CONOCIMIENTO EN SALUD PÚBLICA Y GESTIÓN DE PROGRAMAS PRESUPUESTALES,"1. CAPACIDAD DE ORGANIZACIÓN. 2. CAPACIDAD DE TRABAJO EN EQUIPO. 3. COMUNICACIÓN INTERPERSONAL CON ENFOQUE INTERCULTURAL 4. ACTITUD PROACTIVA. 5. ACTITUD RESPONSABLE. 6. AMABILIDAD, BUEN TRATO, EMPÁTIA, ÉTICA Y VALORES. 7. TRABAJO A PRESIÓN Y COLABORATIVO",TRABAJADOR(A) SOCIAL,Dirección Regional De Salud Ayacucho,AYACUCHO - AYACUCHO
https://www.saludayacucho.gob.pe,1,276-001,"S/. 5,309.50",22/01/2025,04/02/2025,•	 EXPERIENCIA MÍNIMA 03 AÑOS EN EL SECTOR PÚBLICO (INCLUYE EL SERUMS).,TRABAJADOR(A) SOCIAL,SALUD PUBLICA O GERENCIA DE SERVICIOS DE SALUD O ATENCIÓN INTEGRAL DE SALUD O GERENCIA SOCIAL,1. MODELO DE CUIDADO INTEGRAL DE SALUD (MCI) POR CURSO DE VIDA EN EL MARCO DEL REDES INTEGRADAS EN SALUD (RIS) 2. NORMATIVIDAD RESPECTO A POBLACIÓN INDÍGENA U ORIGINARIA 3. CONOCIMIENTO EN SALUD PÚBLICA Y GESTIÓN DE PROGRAMAS PRESUPUESTALES,"1. CAPACIDAD DE ORGANIZACIÓN. 2. CAPACIDAD DE TRABAJO EN EQUIPO. 3. COMUNICACIÓN INTERPERSONAL CON ENFOQUE INTERCULTURAL 4. ACTITUD PROACTIVA. 5. ACTITUD RESPONSABLE. 6. AMABILIDAD, BUEN TRATO, EMPÁTIA, ÉTICA Y VALORES. 7. TRABAJO A PRESIÓN Y COLABORATIVO",TRABAJADOR(A) SOCIAL,Dirección Regional De Salud Ayacucho,AYACUCHO - AYACUCHO
