job_posting_url,vacancies,job_posting_number,salary,start_publication_date,end_publication_date,required_experience,educational_background,specialization,required_knowledge,skills,job_title,public_institution,ubication
https://http://postulacioncas.minedu.gob.pe/postulacioncas/home,1,D.Leg 1057 - Determinado (Necesidad Transitoria)-072,"S/. 4,500.00",24/01/2025,06/02/2025,"EXPERIENCIA GENERAL: 3.00 AÑO(S), EXPERIENCIA ESPECIFICA:  2.00 AÑOS ES DOCENCIA EN LA ESPECIALIDAD DE CIENCIAS HISTÓRICO SOCIALES Y/O HISTORIA Y GEOGRAFÍA Y/O HISTORIA Y/O CIENCIAS SOCIALES, Y/O CIUDADANÍA O CÍVICA Y/O DESARROLLO PERSONAL, CIUDADANÍA Y CÍVICA EN EDUCACIÓN SECUNDARIA O SUPERIOR. (AÑOS ACADÉMICOS) Y/O EN INVESTIGACIÓN HISTÓRICA., DE LOS CUALES 0.00 AÑO(S) EN EL SECTOR PÚBLICO.",TITULADO DE CARRERA TÉCNICA EN   EDUCACIÓN SECUNDARIA EN LA ESPECIALIDAD DE HISTORIA Y GEOGRAFÍA Y/O CIENCIAS HISTÓRICO SOCIALES Y/O CIENCIAS SOCIALES Y/O CIUDADANIA  Y CIVICA; BACHILLER EN HISTORIA Y/O CIENCIAS POLITICAS,CURSO Y/O DIPLOMADO DE ESTRAT PEDAGÓGICAS Y/O DIDÁCTICA Y/O EVALUACIÓN Y/O METODOLOGÍA DE LA ENSEÑANZA Y/O RUTAS DE APRENDIZAJE Y/O CURRÍCULO NACIONAL,"CONOCIMIENTO DE LA ACTITUD HACIA LA INTERCULTURALIDAD, CONOCIMIENTO DEL PROGRAMA DEL DIPLOMA DEL BACHILLERATO INTERNACIONAL; CONOCIMIENTO DE LA ESPECIALIDAD, CONOCIMIENTO SOBRE PLANIFICACIÓN, EJECUCIÓN Y EVALUACIÓN CURRICULAR; CONOCIMIENTO DEL ENFOQUE POR COMPETENCIAS Y CONOCIMIENTO DE TIC APLICADOS A SU ASIGNATURA; CONOCIMIENTO EN MANEJO DE PLATAFORMAS VIRTUALES",ADAPTABILIDAD; PROACTIVIDAD; TRABAJO EN EQUIPO,"CONTRATACIÓN ADMINISTRATIVA DE SERVICIOS DE UN(A) DOCENTE PARA LA ENSEÑANZA DE LA ASIGNATURA DE CIENCIAS SOCIALES, HISTORIA Y DESARROLLO PERSONAL Y CIUDADANÍA Y CIVICA PARA EL COLEGIO DE ALTO RENDIMIENTO DE LA REGIÓN AYACUCHO - PLAZO DETERMINADO (003006)",Ministerio De Educacion,AYACUCHO - AYACUCHO
https://www.facebook.com/municipalidaddistritaldesocos,1,D.Leg 1057 - Determinado (Necesidad Transitoria)-001,"S/. 1,700.00",24/01/2025,06/02/2025,EXPERIENCIA ACREDITADA EN LABORES SIMILARES.,ESTUDIOS MÍNIMOS DE INSTRUCCIÓN SECUNDARIA,NO APLICA,NO APLICA,VOCACIÓN DE SERVICIO AL PÚBLICO,CHOFER DE GERENCIA MUNICIPAL,Municipalidad Distrital De Socos,AYACUCHO - AYACUCHO
https://www.gob.pe/institucion/sunarp/colecciones/2210-concursos-publicos-de-meritos-plazas-cas-zona-registral-n-xiv,1,D.Leg 1057 - Determinado (Necesidad Transitoria)-005,"S/. 3,000.00",24/01/2025,06/02/2025,"EXPERIENCIA GENERAL: 2 AÑOS
EXPERIENCIA ESPECIFICA: 1 AÑO
EXPERIENCIA ESPECIFICA EN EL SECTOR PUBLICO: 1 AÑO
PUESTO: PRACTICANTE PROFESIONAL",GRADO UNIVERSITARIO DE BACHILLER EN DERECHO,NORMATIVA REGISTRAL.,CONOCIMIENTO EN NORMATIVA REGISTRAL.,"COMUNICACIÓN, DINAMISMO, INICIATIVA, ORDEN, ORGANIZACIÓN DE LA INFORMACIÓN, PROACTIVIDAD, DESARROLLO DE RELACIONES Y EMPATÍA.",ANALISTA REGISTRAL,Zona Registral N° Xiv-Sede Ayacucho,AYACUCHO - AYACUCHO
https://www.gob.pe/regionayacucho,1,D.Leg 1057 - Determinado (Necesidad Transitoria)-05,S/. 003.75,24/01/2025,06/02/2025,"¿	EXPERIENCIA GENERAL: EN EL SECTOR PÚBLICO Y PRIVADO COMO MÍNIMO DE TRES (03) AÑOS, SUSTENTAR CON COPIA DE CONTRATOS, RESOLUCIONES Y/O CONSTANCIAS O CERTIFICADOS DE TRABAJO.
¿	EXPERIENCIA ESPECÍFICA: EN EL SECTOR PÚBLICO COMO MÍNIMO DE DOS (02) AÑOS EN EL ÁREA DE PRESUPUESTO EN ENTIDADES DE GOBIERNOS REGIONALES, SUSTENTAR CON COPIA DE CONTRATOS, RESOLUCIONES Y/O CONSTANCIAS O CERTIFICADOS DE TRABAJO.",TÍTULO PROFESIONAL DE LA CARRERA PROFESIONAL UNIVERSITARIA DE CONTABILIDAD Y/O ADMINISTRACIÓN Y/O ECONOMÍA COLEGIADO Y HABILITADO.,"¿	CAPACITACIÓN Y/O CERTIFICACIONES EN TEMAS DE PRESUPUESTO PÚBLICO, PLAN ESTRATÉGICO INSTITUCIONAL PEI, SIAF, Y OTROS RELACIONADOS AL SISTEMA DE LA ADMINISTRACIÓN PÚBLICA, COMO MÍNIMO DE 500 HORAS LECTIVAS ACUMULABLES, CON UNA ANTIGÜEDAD NO MAYOR A 05 AÑOS, ACREDITAR CON COPIA DE CERTIFICADOS Y/O CONSTANCIAS. ¿	DIPLOMADOS Y/O ESPECIALIZACIONES EN SIAF, SIGA, GESTIÓN PUBLICA, SISTEMAS ADMINISTRATIVOS DEL ESTADO, COMO MÍNIMO DE 500 HORAS LECTIVAS ACUMULABLES, CON UNA ANTIGÜEDAD NO MAYOR A 05 AÑOS.",.S/R,PROACTIVO Y TRABAJO BAJO PRESION,01 ESPECIALISTA EN PRESUPUESTO (SIGLA – SGF - 01).,Gobierno Regional Ayacucho,AYACUCHO - AYACUCHO
https://www.gob.pe/regionayacucho,1,D.Leg 1057 - Determinado (Necesidad Transitoria)-04,S/. 004.00,24/01/2025,06/02/2025,"¿	EXPERIENCIA GENERAL: EN EL SECTOR PÚBLICO Y PRIVADO COMO MÍNIMO DE CINCO (05) AÑOS, SUSTENTAR CON COPIA DE CONTRATOS, RESOLUCIONES Y/O CONSTANCIAS O CERTIFICADOS DE TRABAJO.
¿	EXPERIENCIA ESPECÍFICA: EN EL SECTOR PÚBLICO COMO MÍNIMO DE CUATRO (04) AÑOS EN EL ÁREA DE PRESUPUESTO Y/O FINANZAS EN ENTIDADES DE GOBIERNOS REGIONALES, SUSTENTAR CON COPIA DE CONTRATOS, RESOLUCIONES Y/O CONSTANCIAS O CERTIFICADOS DE TRABAJO.",TÍTULO PROFESIONAL DE LA CARRERA PROFESIONAL UNIVERSITARIA DE CONTABILIDAD Y/O ADMINISTRACIÓN Y/O ECONOMÍA COLEGIADO Y HABILITADO.,"¿	DIPLOMADOS Y/O ESPECIALIZACIONES EN GESTIÓN PÚBLICA, CONTRATACIONES CON EL ESTADO Y PROGRAMACIONES MULTIANUAL Y GESTIÓN DE INVERSIONES (INVIERTE.PE), SIAF, SIGA COMO MÍNIMO ACUMULADO DE 200 HORAS LECTIVAS CON UNA ANTIGÜEDAD NO MAYOR A 05 AÑOS, ACREDITAR CON COPIA DE CERTIFICADOS Y/O CONSTANCIAS. ¿	CAPACITACIÓN Y/O CURSOS ESPECIALIZADOS, EN TEMAS DE SIAF, SIGA, PLANIFICACIÓN Y PRESUPUESTO Y OTROS RELACIONADOS AL SISTEMA DE LA ADMINISTRACIÓN PÚBLICA, COMO MÍNIMO DE 500 HORAS LECTIVAS ACUMULABLES, CON UNA ANTIGÜEDAD NO MAYOR A 05 AÑOS.","¿	DIPLOMADOS Y/O ESPECIALIZACIONES EN GESTIÓN PÚBLICA, CONTRATACIONES CON EL ESTADO Y PROGRAMACIONES MULTIANUAL Y GESTIÓN DE INVERSIONES (INVIERTE.PE), SIAF, SIGA COMO MÍNIMO ACUMULADO DE 200 HORAS LECTIVAS CON UNA ANTIGÜEDAD NO MAYOR A 05 AÑOS, ACREDITAR CON COPIA DE CERTIFICADOS Y/O CONSTANCIAS. ¿	CAPACITACIÓN Y/O CURSOS ESPECIALIZADOS, EN TEMAS DE SIAF, SIGA, PLANIFICACIÓN Y PRESUPUESTO Y OTROS RELACIONADOS AL SISTEMA DE LA ADMINISTRACIÓN PÚBLICA, COMO MÍNIMO DE 500 HORAS LECTIVAS ACUMULABLES, CON UNA ANTIGÜEDAD NO MAYOR A 05 AÑOS.",PROACTIVO Y TRABAJO BAJO PRESION,01 ESPECIALISTA EN PRESUPUESTO  (SIGLA – SGF - 01).,Gobierno Regional Ayacucho,AYACUCHO - AYACUCHO
https://www.gob.pe/institucion/sathuamanga/informes-publicaciones/tipos/80-convocatorias-de-trabajo,1,728-01,"S/. 2,751.11",24/01/2025,06/02/2025,•	EXPERIENCIA NO MENOR DE 02 AÑOS EN LABORES RELACIONADAS AL CARGO,"•	TÍTULO PROFESIONAL UNIVERSITARIO  COLEGIDO Y HABILITADO Y/O GRADO DE BACHILLER UNIVERSITARIO EN LA ESPECIALIDAD DE ADMINISTRACIÓN DE EMPRESAS, CONTABILIDAD, ECONOMÍA Y OTROS AFINES",•	CONTRATACIONES Y ADQUISICIONES DEL ESTADO •	RECURSOS HUMANOS •	SIGA  •	SIAF,•	CONTRATACIONES Y ADQUISICIONES DEL ESTADO •	GESTIÓN DE RECURSOS HUMANOS Y OTROS AFINES AL CARGO,"•	CAPACIDAD DE ANÁLISIS, EVALUACIÓN Y RESOLUCIÓN DE CONFLICTOS. •	FACILIDAD DE TRABAJO EN EQUIPO, BAJO PRESIÓN Y CON METAS. •	ORIENTACIÓN A ESTRATEGIAS Y RESULTADOS, VOCACIÓN DE SERVICIO, EMPATÍA Y FACILIDAD DE PALABRA. •	ALTA PROBIDAD, RESPONSABILIDAD, PUNTUALIDAD, ORDEN Y DILIGENCIA EN EL TRABAJO. •	IDENTIFICACIÓN, COLABORACIÓN Y COMPROMISO CON LOS OBJETIVOS DE LA ENTIDAD.",JEFE DE LA UNIDAD DE LOGÍSTICA Y RECURSO HUMANOS,Servicio De  Administracion  Tributaria  De Huamanga,AYACUCHO
https://www.facebook.com/municipalidaddistritaldesocos,1,D.Leg 1057 - Determinado (Necesidad Transitoria)-001,"S/. 1,500.00",24/01/2025,06/02/2025,EXPERIENCIA DE UNO (1) AÑO EN EL CARGO,"TÍTULO PROFESIONAL NO UNIVERSITARIO EN SECRETARIADO, CONTABILIDAD, ADMINISTRACIÓN O AFINES.",NO APLICA,MICROSOFT OFFICE A NIVEL USUARIO.,VOCACIÓN DE SERVICIO AL PUBLICO,SECRETARIA DE LA SUB GERENCIA DE DESARROLLO SOCIAL Y SERVICIOS PUBLICOS,Municipalidad Distrital De Socos,AYACUCHO - SOCOS
https://www.facebook.com/municipalidaddistritaldesocos,1,D.Leg 1057 - Determinado (Necesidad Transitoria)-001,"S/. 1,700.00",24/01/2025,06/02/2025,EXPERIENCIA ACREDITADA EN LABORES SIMILARES,"ESTUDIOS SUPERIORES UNIVERSITARIOS (MÍNIMO 6 SEMESTRES) O TÍTULO DE INSTITUTO SUPERIOR TECNOLÓGICO, RELACIONADOS CON LAS CARRERAS DE SECRETARIADO, ADMINISTRACIÓN, CONTABILIDAD O AFINES.",NO APLICA,CAPACITACIÓN EN LABORES SIMILARES.,"PROBIDAD Y CONDUCTA,VOCACIÓN DE SERVICIO AL PÚBLICO",SECRETARIA DE GERENCIA MUNICIPAL,Municipalidad Distrital De Socos,AYACUCHO - SOCOS
https://www.facebook.com/municipalidaddistritaldesocos,1,D.Leg 1057 - Determinado (Necesidad Transitoria)-001,"S/. 1,700.00",24/01/2025,06/02/2025,EXPERIENCIA ACREDITADA MÍNIMA DE 01 AÑOS EN LABORES SIMILARES.,"TÍTULO UNIVERSITARIO Y/O BACHILLER EN CARRERAS DE DERECHO, TRABAJO SOCIAL, ANTROPOLOGÍA O CARRERAS AFINES.",CAPACITACIÓN ESPECIALIZADA EN LA MATERIA,MICROSOFT OFFICE A NIVEL USUARIO.,VOCACIÓN DE SERVICIO AL PUBLICO,RESPONSABLE DEL AREA DE OMAPED,Municipalidad Distrital De Socos,AYACUCHO - SOCOS
https://www.facebook.com/municipalidaddistritaldesocos,1,D.Leg 1057 - Determinado (Necesidad Transitoria)-001,"S/. 1,800.00",24/01/2025,06/02/2025,EXPERIENCIA LABORAL DE UN (01) AÑO EN ADMINISTRACIÓN PÚBLICA,"BACHILLER Y/O EGRESADO UNIVERSITARIO EN CARRERAS DE ADMINISTRACIÓN, CONTABILIDAD O AFINES.",NO APLICA,CAPACITACIÓN EN LA MATERIA.,VOCACIÓN DE SERVICIO AL PUBLICO,RESPONSABLE DEL AREA DE ALMACEN,Municipalidad Distrital De Socos,AYACUCHO - SOCOS
https://www.facebook.com/municipalidaddistritaldesocos,1,D.Leg 1057 - Determinado (Necesidad Transitoria)-001,"S/. 2,000.00",24/01/2025,06/02/2025,"EXPERIENCIA MÍNIMA DE 02 AÑOS EN PLANIFICACIÓN, ORGANIZACIÓN, EJECUCIÓN DE PROGRAMAS SOCIALES.","TÍTULO PROFESIONAL/BACHILLER EN CIENCIAS SOCIALES, TRABAJO SOCIAL, ANTROPOLOGÍA, EDUCACIÓN.",CAPACITACION EN PROGRAMAS DE ESPECIALIDAD,"MANEJO INTERMEDIO DE HERRAMIENTAS DE OFIMÁTICA Y AUTOCAD, S10, ENTRE OTROS.",VOCACIÓN DE SERVICIO AL PUBLICO,RESPONSABLE DE LA DIVISION DE PROGRAMAS SOCIALES Y SERVICIOS PUBLICOS,Municipalidad Distrital De Socos,AYACUCHO - SOCOS
https://www.facebook.com/municipalidaddistritaldesocos,1,D.Leg 1057 - Determinado (Necesidad Transitoria)-001,"S/. 2,400.00",24/01/2025,06/02/2025,EXPERIENCIA DE UN (01) AÑO EN LA ADMINISTRACIÓN PUBLICA,"TÍTULO UNIVERSITARIO Y/O BACHILLER EN LAS CARRERAS DE INGENIERÍA, ECONOMÍA O AFINES AL CARGO.",CAPACITACIÓN EN LABORES SIMILARES.,MANEJO INTERMEDIO DE HERRAMIENTAS DE OFIMÁTICA Y AUTOCAD.,"COMUNICACIÓN EFECTIVA,PENSAMIENTO ESTRATÉGICO",RESPONSABLE DE LA DIVISION DE ESTUDIOS DE PRE INVERSION – UNIDAD FORMULADORA (UF),Municipalidad Distrital De Socos,AYACUCHO - SOCOS
https://www.facebook.com/municipalidaddistritaldesocos,1,D.Leg 1057 - Determinado (Necesidad Transitoria)-001,"S/. 2,000.00",24/01/2025,06/02/2025,EXPERIENCIA ACREDITADA MÍNIMA DE 01 AÑO EN LABORES SIMILARE,ESTUDIOS UNIVERSITARIOS EN LA ESPECIALIDAD AFINES AL CARGO,CAPACITACIÓN ESPECIALIZADA,MICROSOFT OFFICE A NIVEL USUARIO.,"VOCACIÓN DE SERVICIO AL PUBLICO,SENSIBILIDAD SOCIAL",RESPONSABLE DE LA DIVISION DE DESARROLLO AGROPECUARIO Y PROYECTOS PRODUCTIVOS,Municipalidad Distrital De Socos,AYACUCHO - SOCOS
https://www.facebook.com/municipalidaddistritaldesocos,1,D.Leg 1057 - Determinado (Necesidad Transitoria)-001,"S/. 2,000.00",24/01/2025,06/02/2025,EXPERIENCIA ACREDITADA MÍNIMA DE 02 AÑOS EN LABORES EN EL CARGO EXPERIENCIA EN LA EJECUCIÓN DE PLANES DE CONTINGENCIA CONTRA FENÓMENOS Y DESASTRES NATURALES.,TÍTULO UNIVERSITARIO Y/O BACHILLER EN LAS CARRERAS DE INGENIERÍA U OTRAS AFINES AL CARGO.,CAPACITACIÓN ESPECIALIZADA EN GESTIÓN DE RIESGOS,MICROSOFT OFFICE A NIVEL USUARIO.,VOCACIÓN DE SERVICIO AL PUBLICO,RESPONSABLE DE LA DIVISION DE AREA TECNICA DEDEFENSA CIVIL Y GESTION DE RIESGO,Municipalidad Distrital De Socos,AYACUCHO - SOCOS
https://www.facebook.com/municipalidaddistritaldesocos,1,D.Leg 1057 - Determinado (Necesidad Transitoria)-001,"S/. 1,800.00",24/01/2025,06/02/2025,EXPERIENCIA ACREDITADA EN LABORES SIMILARES.,"TÍTULO PROFESIONAL UNIVERSITARIO Y/O BACHILLER EN CIENCIAS DE LA COMUNICACIÓN, O AFÍN.",CAPACITACIÓN EN LABORES SIMILARES.,MANEJO DE HERRAMIENTAS DE OFIMÁTICA,VOCACIÓN DE SERVICIO AL PUBLICO,RESPONSABLE DE IMAGEN INSTITUCIONAL,Municipalidad Distrital De Socos,AYACUCHO - SOCOS
https://www.facebook.com/municipalidaddistritaldesocos,1,D.Leg 1057 - Determinado (Necesidad Transitoria)-001,"S/. 2,000.00",24/01/2025,06/02/2025,EXPERIENCIA LABORAL DE DOS (02) AÑOS EN ADMINISTRACIÓN PUBLICA,"TÍTULO PROFESIONAL Y/O BACHILLER UNIVERSITARIO EN CARRERAS DE ADMINISTRACIÓN, CONTABILIDAD O AFINES",CAPACITACIÓN EN LABORES SIMILARES.,"SISTEMAS ADMINISTRATIVOS SEACE, SIAF, SIGA Y DEMÁS SOFTWARE VINCULADO A SUS FUNCIONES",PROBIDAD Y CONDUCTA,RESPONSABLE DE ADQUISICIONES,Municipalidad Distrital De Socos,AYACUCHO - SOCOS
https://www.facebook.com/municipalidaddistritaldesocos,1,D.Leg 1057 - Determinado (Necesidad Transitoria)-001,"S/. 1,700.00",24/01/2025,06/02/2025,EXPERIENCIA EN GESTIÓN DE RECURSOS HUMANOS MÍNIMO DE UN AÑO Y DOS (02) AÑOS EN ADMINISTRACIÓN PÚBLICA,"TÍTULO PROFESIONAL UNIVERSITARIO Y/O BACHILLER EN LAS CARRERAS DE ADMINISTRACIÓN, CONTABILIDAD O AFINES AL CARGO.","CAPACITACIÓN ESPECIALIZADA EN LA MATERIA,",MICROSOFT OFFICE A NIVEL USUARIO,"PROBIDAD Y CONDUCTA ,SENSIBILIDAD SOCIAL,LEALTAD INSTITUCIONAL",JEFE DE LA UNIDAD DE RECURSOS HUMANOS,Municipalidad Distrital De Socos,AYACUCHO - SOCOS
https://www.facebook.com/municipalidaddistritaldesocos,1,D.Leg 1057 - Determinado (Necesidad Transitoria)-001,"S/. 1,800.00",24/01/2025,06/02/2025,ACREDITACIÓN MÍNIMA DE UN (01) AÑO EN LABORES SIMILARES,"TÍTULO A NOMBRE DE LA NACIÓN Y/O BACHILLER EN LAS CARRERAS DE BIOLOGÍA, INGENIERÍA QUÍMICA, Y/O AFINES",ESPECIALIZADA EN GESTIÓN DE AGUA Y SANEAMIENTO.,MANEJO DE HERRAMIENTAS DE OFIMÁTICA,ORGANIZACIÓN Y PLANIFICACIÓN,JEFE DE LA OFICINA TECNICA MUNICIPAL (ATM),Municipalidad Distrital De Socos,AYACUCHO - SOCOS
https://www.facebook.com/municipalidaddistritaldesocos,1,D.Leg 1057 - Determinado (Necesidad Transitoria)-001,"S/. 2,600.00",24/01/2025,06/02/2025,TENER DOS (02) AÑOS DE EXPERIENCIA EN EL EJERCICIO PROFESIONAL.,TÍTULO A NOMBRE DE LA NACIÓN Y/O BACHILLER EN LAS CARRERAS DE INGENIERÍA CIVIL Y/O ARQUITECTURA.,CAPACITACIÓN EN LABORES SIMILARES.,MANEJO INTERMEDIO DE HERRAMIENTAS DE OFIMÁTICA. Y AUTOCAD,"ORGANIZACIÓN Y PLANIFICACIÓN,INTEGRIDAD Y COMPORTAMIENTO ÉTICO.",JEFE DE LA OFICINA DE SUPERVISION Y LIQUIDACION DE PROYECTOS DE INVERSION,Municipalidad Distrital De Socos,AYACUCHO - SOCOS
https://www.facebook.com/municipalidaddistritaldesocos,1,D.Leg 1057 - Determinado (Necesidad Transitoria)-001,"S/. 1,700.00",24/01/2025,06/02/2025,EXPERIENCIA ACREDITADA EN LABORES SIMILARES.,ESTUDIOS MÍNIMOS DE INSTRUCCIÓN SECUNDARIA,NO APLICA,NO APLICA,"PROBIDAD Y CONDUCTA,VOCACIÓN DE SERVICIO AL PÚBLICO",CHOFER PARA ALCALDIA,Municipalidad Distrital De Socos,AYACUCHO - SOCOS
https://www.gob.pe/regionayacucho,1,D.Leg 1057 - Determinado (Necesidad Transitoria)-02,"S/. 1,400.00",24/01/2025,06/02/2025,"¿	EXPERIENCIA GENERAL: EN EL SECTOR PÚBLICO Y/O PRIVADO COMO MÍNIMO DE SEIS (06) MESES, SUSTENTAR CON COPIA DE CONTRATOS, RESOLUCIONES Y/O CONSTANCIAS, ORDENES DE SERVICIO Y CERTIFICADOS DE TRABAJO.
¿	EXPERIENCIA ESPECÍFICA: EN EL SECTOR PÚBLICO COMO MÍNIMO DE SEIS (06) MESES, REALIZANDO TRABAJOS DE ATENCIÓN CON NIÑOS, ALDEAS, ALBERGUES Y OTROS, SUSTENTAR CON COPIAS DE CONTRATOS, RESOLUCIONES Y/O CONSTANCIAS O CERTIFICADOS DE TRABAJO",¿	ESTUDIOS CON CARRERA TÉCNICA NO CONCLUIDAS Y/O SECUNDARIA COMPLETA,"¿	CURSOS DE CAPACITACIÓN EN TEMAS RELACIONADOS CON NIÑOS, NIÑAS Y ADOLESCENTES, TALLERES EDUCACIONALES, ENFOQUE INTERCULTURAL PARA LA EDUCACIÓN PARA LA EDUCACIÓN Y PRIMEROS AUXILIOS COMO MÍNIMO DE 50 HORAS ACREDITAR CON CERTIFICADOS Y/O CONSTANCIAS.",.S/R,PROACTIVO Y TRABAJO BAJO PRESION,01 MADRE TUTORA (SIGLA – AISNT- 01).,Gobierno Regional Ayacucho,AYACUCHO - SAN MIGUEL
https://www.gob.pe/regionayacucho,2,D.Leg 1057 - Determinado (Necesidad Transitoria)-03,S/. 001.40,24/01/2025,06/02/2025,"¿	EXPERIENCIA GENERAL: EN EL SECTOR PÚBLICO Y/O PRIVADO COMO MÍNIMO DE SEIS (06) MESES, SUSTENTAR CON COPIA DE CONTRATOS, RESOLUCIONES Y/O CONSTANCIAS, ORDENES DE SERVICIO Y CERTIFICADOS DE TRABAJO.
¿	EXPERIENCIA ESPECÍFICA: EN EL SECTOR PÚBLICO COMO MÍNIMO DE SEIS (06) MESES, REALIZANDO TRABAJOS NIÑOS, (ALDEA, ALBERGUES Y OTROS) SUSTENTAR CON COPIA DE CONTRATOS, RESOLUCIONES Y/O CONSTANCIAS O CERTIFICADOS DE TRABAJO.",ESTUDIOS CON SECUNDARIA COMPLETA.,"¿	CURSOS DE CAPACITACIÓN EN TEMAS DE FOTOGRAFÍA Y OTROS RELACIONADOS, COMO MÍNIMO 100 HORAS ACREDITAR CON COPIA DE CERTIFICADOS Y/O CONSTANCIAS.",.S/R,PROACTIVO Y TRABAJO BAJO PRESION,02 MADRE TUTORA (SIGLA – AIVNCC- 01).,Gobierno Regional Ayacucho,AYACUCHO - CORACORA
https://http://ugelfajardo.gob.pe/portal/index.php/convocatoria/convocatorias-2022/convocatoria-cas-2022/category/342-convocatoria-cas-2022,1,276-05,"S/. 2,600.00",24/01/2025,06/02/2025,2,TITULO PROFESIONAL UNIVERSITARIO EN DERECHO,GESTION DE RECURSOS HUMANOS -DERECHO LABORAL,"LEY DE SERVIR ,DERECOS LABORALES","PENSAMIENTO ANALITICO, INICIATIVA, ORIENTCION HACIA EL LOGRO, BUSQUEDA DE LA INFORMACION, INTERES POR EL ORDEN Y LA CLARIDAD, EXPERIENCIA TECNICA/PROFSIONAL",ABOGADO I,Unidad De Gestion Educativa Local De Victor Fajardo,AYACUCHO - HUANCAPI
https://ugelhuanta.gob.pe/portal/,1,D.Leg 1057 - Determinado (Necesidad Transitoria)-009,"S/. 1,664.19",23/01/2025,05/02/2025,"•	EXPERIENCIA GENERAL: EXPERIENCIA MÍNIMA DE DOS (02) AÑOS EN EL SECTOR PÚBLICO Y/O PRIVADO.
•	EXPERIENCIA ESPECÍFICA: EXPERIENCIA MÍNIMA DE UN (01) AÑO  EN EL SECTOR PÚBLICO EN EL CARGO A DESEMPEÑAR.",•	REQUISITO MÍNIMO: SECUNDARIA COMPLETA. (ACREDITAR CON EL CERTIFICADO DE ESTUDIOS). •	LICENCIA DE CONDUCIR CLASE A CATEGORÍA AIIB Y/O SUPERIOR. •	RECORD DE CONDUCTOR.,"•	HABER PARTICIPADO EN CURSOS, SEMINARIOS, TALLERES Y/O CAPACITACIONES INHERENTES AL CARGO.",•	CONOCIMIENTO BÁSICO DE MECÁNICA Y CONOCIMIENTO DE REGLAS DE TRÁNSITO. •	CONOCIMIENTO DEL ÁMBITO DE LA PROVINCIA.,"•	AUTOCONTROL. •	DINAMISMO. •	ORDEN. •	VOCACIÓN DE SERVICIO. •	RESPONSABILIDAD, PUNTUALIDAD, EMPATÍA. •	TRABAJO BAJO PRESIÓN. •	PROACTIVIDAD.",CONDUCTOR,Unidad Ejecutora Educacion Huanta,AYACUCHO - HUANTA
https://www.facebook.com/share/1djmk3ejco/,1,D.Leg 1057 - Determinado (Necesidad Transitoria)-001,"S/. 1,700.00",23/01/2025,05/02/2025,EXPERIENCIA EN EL DESEMPEÑO DE CARGOS DIRECTIVOS Y/O SIMILARES,TITULO PROFESIONAL Y/O BACHILLER Y/O TECNICO TITULADO EN CARRERAS PROFESIONALES A FINES DEL CARGO,-,"CAPACITACION EN GESTION PUBLICA, CONOCIMIENTO EN EL DESARROLLO DE LAS ACTIVIDADES RELACIONADAS CON LA PROMOCION DE DESARROLLO ECONOMICO Y CONOCIMIENTO DE OFIMATICA","CAPACIDAD PARA TRABAJAR BAJO PRESION, ORIENTACION A RESULTADOS, ORGANIZACION Y PLANIFICACION",SUB GERENTE DE DESARROLLO ECONOMICO Y MEDIO AMBIENTE,Municipalidad Distrital De Luis Carranza,AYACUCHO - LUIS CARRANZA
https://www.facebook.com/share/1djmk3ejco/,1,D.Leg 1057 - Determinado (Necesidad Transitoria)-001,"S/. 1,500.00",23/01/2025,05/02/2025,EXPERIENCIA EN LA CONDUCCIÓN DE PERSONAL Y EXPERIENCIA EN CARGOS SIMILARES,GRADO DE BACHILLER Y/O TECNICO Y/O CAPACITACION ACREDITADA CON FINES AL CARGO,-,"CONOCIMIENTOS AMPLIOS EN EL MANEJO DE GESTION PUBLICA Y MANEJO DE OFIMATICA, WORD Y EXCEL","CAPACIDAD PARA TRABAJAR BAJO PRESION, ORIENTACION A RESULTADOS, ORGANIZACION Y PLANIFICACION Y TRABAJO EN EQUIPO Y PROACTIVO",UNIDAD DE RECURSOS HUMANOS,Municipalidad Distrital De Luis Carranza,AYACUCHO - LUIS CARRANZA
https://www.facebook.com/share/1djmk3ejco/,1,D.Leg 1057 - Determinado (Necesidad Transitoria)-001,"S/. 1,500.00",23/01/2025,05/02/2025,EXPERIENCIA EN CARGOS SIMILARES Y/O OTROS,TECNICO Y/O ESTUDIOS SUPERIORES Y/O SECUNDARIA COMPLETA,-,CONOCIMIENTO EN EL AREA,"CAPACIDAD PARA TRABAJAR BAJO PRESION, ORIENTACION A RESULTADOS, ORGANIZACION Y PLANIFICACION Y TRABAJO EN EQUIPO Y PROACTIVO",TECNICO EN ALMACEN,Municipalidad Distrital De Luis Carranza,AYACUCHO - LUIS CARRANZA
https://www.facebook.com/share/1djmk3ejco/,1,D.Leg 1057 - Determinado (Necesidad Transitoria)-001,"S/. 1,700.00",23/01/2025,05/02/2025,EXPERIENCIAS LABORALES Y/O HABER DESARROLLADO CARGOS DIRECTIVOS SIMILARES RELACIONDAS AL CARGO,CONTAR CON TITULO PROFESIONAL Y/O BACHILLER Y/O TECNICO EN CARRERAS PROFESIONALES A FINES DEL CARGO,-,"CAPACITACION EN GESTION PUBLICA Y PROPONER, COORDINAR, PROMOVER LAS POLITICAS DEL DESARROLLO SOCIAL HUMANO Y LOS SERVICIOS PUBLICOS","CAPACIDAD PARA TRABAJAR BAJO PRESION, ORIENTACION A RESULTADOS, ORGANIZACION Y PLANIFICACION Y TRABAJO EN EQUIPO Y PROACTIVO",SUB GERENCIA DE DESARROLLO SOCIAL Y SERVICIOS PÚBLICOS,Municipalidad Distrital De Luis Carranza,AYACUCHO - LUIS CARRANZA
https://www.facebook.com/share/1djmk3ejco/,1,D.Leg 1057 - Determinado (Necesidad Transitoria)-001,"S/. 1,700.00",23/01/2025,05/02/2025,EXPERIENCIA EN EL DESEMPEÑO DE CARGO O LABORES SIMILARES,"TITULO PROFESIONAL Y/O BACHILLER EN LA CARRERA DE ABOGADO, ADMINISTRACION Y CARRERAS AFINES, Y/O TECNICO EN SECRETARIA EJECUTIVA QUE INCLUYA ESTUDIOS RELACIONADOS CON LA ESPECIALIDAD",-,"CONOCIMIENTOS AMPLIOS EN EL MANEJO DE GESTION PUBLICA Y MANEJO DE OFIMATICA, WORD, EXCEL.",ORGANIZACION Y PLANIFICACION Y TRABAJO EN EQUIPO Y PROACTIVO,SECRETARIA GENERAL,Municipalidad Distrital De Luis Carranza,AYACUCHO - LUIS CARRANZA
https://www.facebook.com/share/1djmk3ejco/,1,D.Leg 1057 - Determinado (Necesidad Transitoria)-001,"S/. 1,500.00",23/01/2025,05/02/2025,EXPERIENCIA EN LA CONDUCCIÓN DE VEHICULOS MOTORIZADOS,ESTUDIOS DE SECUNDARIA COMPLETA COMO MINIMO Y CONTAR CON LICENCIA DE CONDUCIR CON CATEGORIA A-2,-,CONOCIMIENTO DE MECANICA,"CAPACIDAD PARA TRABAJAR BAJO PRESION, ORIENTACION A RESULTADOS Y ORGANIZACIÓN Y PLANIFICACION",CONDUCTOR,Municipalidad Distrital De Luis Carranza,AYACUCHO - LUIS CARRANZA
https://www.ugelcangallo.gob.pe,1,D.Leg 1057 - Determinado (Necesidad Transitoria)-3,"S/. 2,864.19",23/01/2025,05/02/2025,"EXPERIENCIA GENERAL:  01 AÑO EN EL SECTOR PÚBLICO O PRIVADO
EXPERIENCIA ESPECIFICA: 3 MESES EN EL SECTOR PUBLICO EN EL CARGO A DESEMPEÑAR","TITULO PROFESIONAL P BACHILER EN DERECHO, ADMINISTRACIÓN ECONOMIA Y/O AFINES","GESTIÓN PÚBLICA, GESTIÓN DE RECURSOS HUMANOS, LEY SERVIR, NORMATIVIDAD DEL SECTOR PÚBLICO","GESTIÓN PÚBLICA, PLANEAMIENTO ESTRATEGICO DE RECURSOS HUMANOS, DERECHO LABORAL Y PROCESAL, GESTIÓN DE RECURSOS HUMANOS, MANEJO DE SISTEMA NEXUS, SIAF, SUP Y AIRHSP","CONOCIMIENTO ORGANIZACIONAL, ORIENTACIÓN AL LOGRO, ORGANIZACIÓN DE LA INFORMACIÓN, CAPACIDAD PARA TRABAJAR EN EQUIPO Y V¿BAJO PRESIÓN, CAPACIDAD PARA COORDINAR CON AUTORIDADES DE DISTINTAS INSTITUCIONES PÚBLICAS Y PRIVADAS",ESPECIALISTA ADMINISTRATIVO I,Unid Ejec Educacion Centro Ayacucho,AYACUCHO - CANGALLO
https://www.ugelcangallo.gob.pe,1,D.Leg 1057 - Determinado (Necesidad Transitoria)-2,"S/. 2,864.19",23/01/2025,05/02/2025,EXPERIENCIA GENERAL: MINIMO 06 MESES EN INSTITUCIONES PÚBLICAS O PRIVADAS EXPERIENCIA ESPECIFICA: NO MENOR A 3 MESES,"TITULO PROFESIONAL O BACHILLER EN ADMINISTRACIÓN, CONTABILIDAD, ECONOMIA Y/O AFINES.",GESTIÓN PÚBLICA Y GESTIÓN DE ALMACENES,"GESTIÓN PÚBLICA, MANEJO DE SIGA, MANEJODE SIAF ETC","CONOCIMIENTO ORGANIZACIONAL, ORIENTACIÓN AL LOGRO, ORGANIZACIÓN DE LA INFORMACIÓN, CAPACIDAD PARA TRABAJAR EN EQUIPO Y V¿BAJO PRESIÓN, CAPACIDAD PARA COORDINAR CON AUTORIDADES DE DISTINTAS INSTITUCIONES PÚBLICAS Y PRIVADAS",ESPECIALISTA EN ALMACEN,Unid Ejec Educacion Centro Ayacucho,AYACUCHO - CANGALLO
https://www.saludayacucho.gob.pe,1,276-001,"S/. 5,309.50",22/01/2025,04/02/2025,"EXPERIENCIA LABORAL DE  (03) AÑOS EN  PROMOCIÓN DE LA SALUD  Y/O SALUD PUBLICA, EN EL SECTOR PÚBLICO Y/O PRIVADO.",ENFERMERÍA,-,1. PROMOCIÓN DE LA SALUD  Y/O SALUD PUBLICA .      3. POLÍTICA REGIONAL INCLUIR PARA CRECER AYACUCHO.        2. PLAN NACIONAL MULTISECTORIAL DE SALUD.  4. PROGRAMAS PRESUPUESTALES Y NO PRESUPUESTALES.,- TRABAJO EN EQUIPO     - COMPORTAMIENTO ÉTICO - ORIENTACIÓN DE SERVICIO AL CIUDADANO - COMUNICACIÓN EFECTIVA,ENFERMERO(A),Dirección Regional De Salud Ayacucho,AYACUCHO - AYACUCHO
https://www.saludayacucho.gob.pe,1,276-001,"S/. 5,309.50",22/01/2025,04/02/2025,"EXPERIENCIA LABORAL DE  (03) AÑOS EN  PROMOCIÓN DE LA SALUD  Y/O SALUD PUBLICA, EN EL SECTOR PÚBLICO Y/O PRIVADO.",ENFERMERÍA,-,1. PROMOCIÓN DE LA SALUD  Y/O SALUD PUBLICA .      3. POLÍTICA REGIONAL INCLUIR PARA CRECER AYACUCHO.        2. PLAN NACIONAL MULTISECTORIAL DE SALUD.  4. PROGRAMAS PRESUPUESTALES Y NO PRESUPUESTALES.,- TRABAJO EN EQUIPO     - COMPORTAMIENTO ÉTICO - ORIENTACIÓN DE SERVICIO AL CIUDADANO - COMUNICACIÓN EFECTIVA,ENFERMERO(A),Dirección Regional De Salud Ayacucho,AYACUCHO - AYACUCHO
https://www.saludayacucho.gob.pe,1,276-001,"S/. 5,309.50",22/01/2025,04/02/2025,"EXPERIENCIA LABORAL DE  (03) AÑOS EN  PROMOCIÓN DE LA SALUD  Y/O SALUD PUBLICA, EN EL SECTOR PÚBLICO Y/O PRIVADO.",ENFERMERÍA,-,1. PROMOCIÓN DE LA SALUD  Y/O SALUD PUBLICA .      3. POLÍTICA REGIONAL INCLUIR PARA CRECER AYACUCHO.        2. PLAN NACIONAL MULTISECTORIAL DE SALUD.  4. PROGRAMAS PRESUPUESTALES Y NO PRESUPUESTALES.,- TRABAJO EN EQUIPO     - COMPORTAMIENTO ÉTICO - ORIENTACIÓN DE SERVICIO AL CIUDADANO - COMUNICACIÓN EFECTIVA,ENFERMERO(A),Dirección Regional De Salud Ayacucho,AYACUCHO - AYACUCHO
https://www.saludayacucho.gob.pe,1,276-001,"S/. 2,790.53",22/01/2025,04/02/2025,EXPERIENCIA LABORAL DE (03) AÑO EN EL SECTOR PÚBLICO Y/O PRIVADO.,LICENCIADO EN EDUCACION,-,(1) PROMOCIÓN DE LA SALUD Y/O SALUD PUBLICA.   (3). PEDAGOGÍA Y ANDRALOGÍA . (2) ESTILOS DE VIDA SALUDABLE.,"- TRABAJO EN EQUIPO  Y CAPACIDAD DE COMUNICACIÓN, COORDINACIÓN Y ORGANIZACIÓN .     - COMPORTAMIENTO ÉTICO - ORIENTACIÓN DE SERVICIO AL CIUDADANO - COMUNICACION EFECTIVA Y BUENAS RELACIONES INERPERSONALES .",EDUCADOR PARA LA SALUD,Dirección Regional De Salud Ayacucho,AYACUCHO - AYACUCHO
