job_posting_url,vacancies,job_posting_number,salary,start_publication_date,end_publication_date,required_experience,educational_background,specialization,required_knowledge,skills,job_title,public_institution,ubication
https://convocatorias.minsa.gob.pe/convocatorias,1,D.Leg 1057 - Determinado (Necesidad Transitoria)-017,"S/. 8,000.00",18/02/2025,03/03/2025,"¿	EXPERIENCIA LABORAL DE CUATRO (04) AÑOS EN EL SECTOR PÚBLICO Y/O PRIVADO.
¿	EXPERIENCIA LABORAL DE CUATRO (04) AÑOS EN EL SECTOR PÚBLICO Y/O PRIVADO.
¿	EXPERIENCIA LABORAL DE UN (01) AÑO PARA EL PUESTO EN FUNCIÓN O LA MATERIA, EN EL SECTOR PÚBLICO.","¿	TÍTULO UNIVERSITARIO EN BIOLOGÍA, MEDICINA VETERINARIA, MÉDICO CIRUJANO, INGENIERO QUÍMICO, INGENIERO EN INDUSTRIAS ALIMENTARIAS, INGENIERO EN ALIMENTOS, INGENIERÍA AGROINDUSTRIAL, INGENIERÍA INDUSTRIAL, LICENCIADO(A) EN ENFERMERÍA, LICENCIADO(A) EN QUÍMICA O LICENCIADO EN NUTRICIÓN. ¿	COLEGIADO Y HABILITADO. ¿	ACREDITAR HABER REALIZADO SERUMS EN CASO DE PROFESIONALES DE SALUD CUANDO CORRESPONDA.",¿	CURSO O DIPLOMADO O ESPECIALIZACIÓN EN BUENAS PRÁCTICAS DE MANUFACTURAS (BPM) Y/O CURSOS EN SISTEMA HACCP Y/O CURSO EN HIGIENE Y SANEAMIENTO Y/O LEGISLACIÓN ALIMENTARIA O GESTIÓN DE PROCESOS Y/O GESTIÓN DE LA INOCUIDAD ALIMENTARIA Y/O AFINES.,"¿	LEY N° 26842 LEY GENERAL DE SALUD, D. LEG. N° 1062 LEY DE INOCUIDAD DE LOS ALIMENTOS, D.S. N° 34-2008-AG, REGLAMENTO DE LA LEY DE INOCUIDAD DE LOS ALIMENTOS, PRINCIPIOS GENERALES DE HIGIENE APROBADO POR D. S. N° 007-98-SA, LEY N° 27444 DE PROCEDIMIENTOS ADMINISTRATIVOS. ¿	CONOCIMIENTO EN PROCESADOR DE TEXTOS A NIVEL BÁSICO. ¿	CONOCIMIENTO EN HOJAS DE CÁLCULO A NIVEL BÁSICO. ¿	CONOCIMIENTO EN PROGRAMA DE PRESENTACIONES A NIVEL BÁSICO. ¿	CONOCIMIENTO EN INGLES A NIVEL BÁSICO.",¿	TRABAJO EN EQUIPO. ¿	COMUNICATIVO. ¿	HABILIDAD ANALÍTICA.,ESPECIALISTA EN INOCUIDAD ALIMANTARIA Y SALUD AMBIENTAL – REGIÓN TUMBES,Ministerio De Salud,TUMBES - TUMBES
https://www.cenepred.gob.pe/web/oportunidades/,1,D.Leg 1057 - Determinado (Necesidad Transitoria)-003,"S/. 8,000.00",17/02/2025,28/02/2025,"MÍNIMA DE SEIS (6) AÑOS DE EXPERIENCIA LABORAL GENERAL EN EL SECTOR PÚBLICO O PRIVADO.
MÍNIMA DE DOS (2) AÑOS DE EXPERIENCIA LABORAL ESPECÍFICA PARA EL PUESTO EN EL SECTOR PÚBLICO O PRIVADO EN LA FUNCIÓN O LA MATERIA.
MÍNIMA DE TRES (2) AÑOS DE EXPERIENCIA LABORAL ESPECÍFICA PARA EL PUESTO EN SERVICIOS VINCULADOS A LAS GESTIONES DEL RIESGO DE DESASTRES.
MÍNIMA DE DOS (2) AÑOS DE EXPERIENCIA LABORAL EN EL SECTOR PÚBLICO.","TÍTULO PROFESIONAL DE LA CARRERA DE INGENIERÍA, ARQUITECTURA, ADMINISTRACIÓN Y/O CIENCIAS MILITARES.  MAESTRÍA Y/O EGRESADO EN GESTIÓN DEL RIESGO DE DESASTRES Y/O GESTIÓN PÚBLICA Y/O GESTIÓN ESTRATÉGICA Y/O ADMINISTRACIÓN Y/O DESARROLLO Y DEFENSA NACIONAL Y/O SEGURIDAD Y DEFENSA NACIONAL Y/O GESTIÓN EDUCATIVA.",CURSOS Y/O PROGRAMA DE ESPECIALIZACIÓN EN GESTIÓN DEL RIESGO DE DESASTRES Y/O EVALUADOR DE RIESGOS ORIGINADOS POR FENÓMENOS NATURALES Y/O GESTIÓN PÚBLICA Y/O EN DESARROLLO Y DEFENSA NACIONAL. CURSOS VINCULADOS A LA GESTIÓN PROSPECTIVA Y CORRECTIVA DEL RIESGO DE DESASTRES. LOS CURSOS NO MENORES DE 24 HORAS Y LOS PROGRAMAS DE ESPECIALIZACIÓN NO MENOR DE 90 HORAS.,NORMATIVA NACIONAL EN GESTIÓN DEL RIESGO DE DESASTRES. INSTRUMENTOS TÉCNICOS EN GESTIÓN PROSPECTIVA Y CORRECTIVA DEL RIESGO DE DESASTRES  SISTEMAS DE INFORMACIÓN GEOGRÁFICA  MECANISMOS FINANCIEROS EN GESTIÓN DEL RIESGO DE DESASTRES PLANIFICACIÓN TERRITORIAL  EVALUACIÓN DEL RIESGO ORIGINADOS POR FENÓMENOS NATURALES  OFIMÁTICA (WORD Y EXCEL NIVEL BÁSICO Y POWER POINT NIVEL INTERMEDIO).,"ANÁLISIS, PLANIFICACIÓN, ORGANIZACIÓN DE INFORMACIÓN Y REDACCIÓN.",COORDINADOR DE ENLACE REGIONAL EN TUMBES,"Centro Nacional De Estimacion, Prevencion Y Reduccion Del Riesgo De Desastres (Cenepred)",TUMBES - TUMBES
,1,D.Leg 1057 - Determinado (Necesidad Transitoria)-001,"S/. 1,250.00",13/02/2025,26/02/2025,"UN (1) AÑO DE EXPERIENCIA GENERAL EN EL SECTOR PÚBLICO Y/O PRIVADO. 
UN (1) AÑO DE EXPERIENCIA EN EL CARGO.",BACHILLER UNIVERSITARIO EN LAS CARRERAS DE CIENCIAS DE LA COMUNICACIÓN O CIENCIAS SOCIALES.,NO NECESARIO,REDACCIÓN Y ESTILO PERIODÍSTICO (INDISPENSABLE). ADMINISTRACIÓN FOTOGRÁFICA (DESEABLE).,•	COMPROMISO. •	RESPONSABILIDAD. •	VOCACIÓN DE SERVICIO. •	ADAPTABILIDAD – FLEXIBILIDAD. •	COMUNICACIÓN. •	ORIENTACIÓN A RESULTADOS. •	CONCIENCIA SOCIAL Y ORGANIZACIONAL. •	PENSAMIENTO ANALÍTICO. •	DINAMISMO. •	TOLERANCIA A LA PRESIÓN,RESPONSABLE DE IMAGEN INSTITUCIONAL,Municipalidad Distrital De San Jacinto,TUMBES - SAN JACINTO
,1,D.Leg 1057 - Determinado (Necesidad Transitoria)-001,"S/. 1,500.00",13/02/2025,26/02/2025,"TRES (3) AÑOS DE EXPERIENCIA GENERAL EN EL SECTOR PÚBLICO Y/O PRIVADO. 
DOS (2) AÑOS DE EXPERIENCIA EN ÁREAS AFINES AL CARGO.",TÍTULO UNIVERSITARIO EN INGENIERÍA. COLEGIADO Y HABILITADO.,NO NECESARIA,CURSOS RELATIVOS AL PERFIL DE PUESTOS,•	COMPROMISO. •	RESPONSABILIDAD. •	VOCACIÓN DE SERVICIO. •	ADAPTABILIDAD – FLEXIBILIDAD. •	COMUNICACIÓN. •	ORIENTACIÓN A RESULTADOS. •	CONCIENCIA SOCIAL Y ORGANIZACIONAL. •	PENSAMIENTO ANALÍTICO. •	DINAMISMO. •	TOLERANCIA A LA PRESIÓN.,RESPONSABLE DE LA SUB GERENCIA DE PLANEAMIENTO URBANO,Municipalidad Distrital De San Jacinto,TUMBES - SAN JACINTO
,1,D.Leg 1057 - Determinado (Necesidad Transitoria)-001,"S/. 1,500.00",13/02/2025,26/02/2025,"DOS (2) AÑOS DE EXPERIENCIA GENERAL EN EL SECTOR PÚBLICO Y/O PRIVADO. 
UN (1) AÑO DE EXPERIENCIA EN EL CARGO.",TÍTULO UNIVERSITARIO EN ADMINISTRACIÓN O SOCIOLOGÍA. COLEGIADO Y HABILITADO.,NO NECESARIA,CURSOS RELATIVOS AL PERFIL DE PUESTOS,•	COMPROMISO. •	RESPONSABILIDAD. •	VOCACIÓN DE SERVICIO. •	ADAPTABILIDAD – FLEXIBILIDAD. •	COMUNICACIÓN. •	ORIENTACIÓN A RESULTADOS. •	CONCIENCIA SOCIAL Y ORGANIZACIONAL. •	PENSAMIENTO ANALÍTICO. •	DINAMISMO. •	TOLERANCIA A LA PRESIÓN.,RESPONSABLE DE LA UNIDAD LOCAL DE EMPADRONAMIENTO - ULE,Municipalidad Distrital De San Jacinto,TUMBES - SAN JACINTO
,1,D.Leg 1057 - Determinado (Necesidad Transitoria)-001,"S/. 1,250.00",13/02/2025,26/02/2025,"DOS (2) AÑOS DE EXPERIENCIA GENERAL EN EL SECTOR PÚBLICO Y/O PRIVADO. 
UN (1) AÑO DE EXPERIENCIA EN EL CARGO.",TÍTULO TÉCNICO EN ENFERMERÍA.,NO NECESARIA,SITEMAS DE CONTRALORÍA DEL PVL (INDISPENSABLE). GESTIÓN DEL PVL (DESEABLE).,•	COMPROMISO. •	RESPONSABILIDAD. •	VOCACIÓN DE SERVICIO. •	ADAPTABILIDAD – FLEXIBILIDAD. •	COMUNICACIÓN. •	ORIENTACIÓN A RESULTADOS. •	CONCIENCIA SOCIAL Y ORGANIZACIONAL. •	PENSAMIENTO ANALÍTICO. •	DINAMISMO. •	TOLERANCIA A LA PRESIÓN.,ASISTENTE EN PROGRAMAS SOCIALES,Municipalidad Distrital De San Jacinto,TUMBES - SAN JACINTO
https://ugelcvillar.gob.pe/?page_id=53#,1,D.Leg 1057 - Determinado (Necesidad Transitoria)-6,"S/. 1,664.19",13/02/2025,26/02/2025,"TÍTULO TÉCNICO DE SECRETARIADO, COMPUTACIÓN O INFORMÁTICA, ADMINISTRACIÓN, CONTABILIDAD O AFINES.","EXPERIENCIA GENERAL: EXPERIENCIA MÍNIMA DE UN (01) AÑO EN EL SECTOR PÚBLICO Y/O PRIVADO  EXPERIENCIA ESPECÍFICA: EXPERIENCIA MÍNIMA DE SEIS (06) MESES EN EL SECTOR PÚBLICO, RELACIONADO AL CARGO AL QUE POSTULA.","CURSOS Y/O CAPACITACIONES EN ATENCIÓN AL CLIENTE, REDACCIÓN DE DOCUMENTOS, ARCHIVÍSTICA, OFIMÁTICA, GESTIÓN Y/O ADMINISTRACIÓN PÚBLICA.","CONOCIMIENTOS EN REDACCIÓN DE DOCUMENTOS, SISTEMA DE TRAMITE DOCUMENTARIO, GESTIÓN DOCUMENTAL Y ARCHIVÍSTICA.","RESPONSABILIDAD, ORIENTACIÓN A RESULTADOS, TRABAJO BAJO PRESIÓN, EFICIENCIA, EFICACIA, ORDEN Y DISCIPLINA.",OFICINISTA,Unidad De Gestion Educativa De Contralmirante Villar,TUMBES - ZORRITOS
,6,D.Leg 1057 - Determinado (Necesidad Transitoria)-003,"S/. 2,964.19",13/02/2025,26/02/2025,"UN AÑO (01) Y SEIS (06) MESES DE EXPERIENCIA GENERAL SECTOR PUBLICO O PRIVADO, UN (01) AÑO DE EXPERIENCIA REQUERIDA PARA EL PUESTO EN LA FUNCION O LA MATERIA",TECNOLOGO MEDICO EN/AREA/MENCION/ESPECIALIDAD TERAPIA FISICA O TERAPIA FISICA Y REHABILITACION O TERAPIA OCUPACIONAL O TERAPIA DE LENGUAJE,NO APLICA,"COMPETENCIAS OCUPACIONALES PARA LA ATENCION DE DISCAPACIDAD, TRABAJO CON FAMILIAS, DESARROLLO EVOLUTIVO","COMUNICACION ORAL, COOPERACION, INICIATIVA, EMPATIA Y TRABAJO EN EQUIPO","PROFESIONAL EN TECNOLOGIA MEDICA CON MENCION EN TERAPIA FISICA, OCUPACIONAL O DE LENGUAJE PARA CEBE",Unidad De Gestion Educativa Local De Tumbes,TUMBES - TUMBES
,1,D.Leg 1057 - Determinado (Necesidad Transitoria)-001,"S/. 3,064.19",13/02/2025,26/02/2025,"UN AÑO (01) DE EXPERIENCIA GENERAL SECTOR PUBLICO O PRIVADO, SEIS (06) MESES DE EXPERIENCIA REQUERIDA PARA EL PUESTO EN LA FUNCION O LA MATERIA",LICENCIADO EN PSICOLOGIA O SOCIOLOGIA,NO APLICA,"GESTION  DE LA CONVIVENCIA ESCOLAR, PAUTAS PARA LA PREVENCION Y ATENCION DE LA VIOLENCIA EN LAS INTITUCIONES EDUCATIVAS","EMPATIA, ASERTIVIDAD, ANALISIS, BUENA COMUNICACION ORAL Y ESCRITA, ORGANIZACION DE LA INFORMACION",PROFESIONAL I PARA EQUIPO ITINERANTE DE CONVIVENCIA ESCOLAR,Unidad De Gestion Educativa Local De Tumbes,TUMBES - TUMBES
,1,D.Leg 1057 - Determinado (Necesidad Transitoria)-001,"S/. 1,250.00",13/02/2025,26/02/2025,UN (1) AÑO DE EXPERIENCIA GENERAL EN EL SECTOR PÚBLICO Y/O PRIVADO.,BACHILLER UNIVERSITARIO,NO NECESARIA,GESTIÓN PÚBLICA (INDISPENSABLE).  CURSOS RELATIVOS AL PERFIL DEL PUESTO (DESEABLE).,•	COMPROMISO. •	RESPONSABILIDAD. •	VOCACIÓN DE SERVICIO. •	ADAPTABILIDAD – FLEXIBILIDAD. •	COMUNICACIÓN. •	ORIENTACIÓN A RESULTADOS. •	CONCIENCIA SOCIAL Y ORGANIZACIONAL. •	PENSAMIENTO ANALÍTICO. •	DINAMISMO. •	TOLERANCIA A LA PRESIÓN.,ASISTENTE ADMINISTRATIVO,Municipalidad Distrital De San Jacinto,TUMBES - SAN JACINTO
,1,D.Leg 1057 - Determinado (Necesidad Transitoria)-001,"S/. 1,250.00",13/02/2025,26/02/2025,UN (1) AÑO DE EXPERIENCIA GENERAL EN EL SECTOR PÚBLICO Y/O PRIVADO.,BACHILLER UNIVERSITARIO,NO NECESARIA,GESTIÓN PÚBLICA (INDISPENSABLE).  CURSOS RELATIVOS AL PERFIL DEL PUESTO (DESEABLE).,•	COMPROMISO. •	RESPONSABILIDAD. •	VOCACIÓN DE SERVICIO. •	ADAPTABILIDAD – FLEXIBILIDAD. •	COMUNICACIÓN. •	ORIENTACIÓN A RESULTADOS. •	CONCIENCIA SOCIAL Y ORGANIZACIONAL. •	PENSAMIENTO ANALÍTICO. •	DINAMISMO. •	TOLERANCIA A LA PRESIÓN.,ASISTENTE ADMINISTRATIVO,Municipalidad Distrital De San Jacinto,TUMBES - SAN JACINTO
https://página web de la dret://www.gob.pe/regiontumbes-dre,1,D.Leg 1057 - Determinado (Necesidad Transitoria)-003,"S/. 2,864.19",11/02/2025,24/02/2025,"02 AÑOS EN EL SECTOR PUBLICO O PRIVADO, 01 AÑO DE TRABAJO EN CENTRO DE RECURSOS Y/O CON PERSONAS CON DISCAPACIDAD AUDITIVA",TITULO UNIVERSITARIO DE PROFESOR O LICENCIADO EN EDUCACION,"ESPECIALIDAD, DIPLOMADO O CURSOS RELACIONADOS CON LA ATENCION A ESTUDIANTES CON DISCAPACIDAD AUDITIVA  Y/O LENGUA DE SEÑAS PERUANAS, CADA CURSO DEBE TENER NO MENOS DE 12 HORAS DE CAPACIDAD Y LOS PROGRAMAS DE ESPECIALIZACION NO MENOS DE 90 HORAS",CONOCIMIENTO Y DOMINIO DE TEMAS RELACIONADOS CON LA ATENCION A LAS NECESIDADES EDUCATIVAS ESPECIALES DE ESTUDIANTES EN CONDICION DE DISCAPACIDAD AUDITIVA. CONOCIMIENTO Y MANEJO DE LA LENGUA DE SEÑAS PERUANAS,.,PROFESIONAL DOCENTE ESPECIALISTA EN DISCAPACIDAD AUDITIVA PARA EL CENTRO DE RECURSOS DE EDUCACUON BASICA ESPECIAL - CREBE,Direccion Regional De Educacion Tumbes,TUMBES - TUMBES
https://página web de la dret://www.gob.pe/regiontumbes-dre,1,D.Leg 1057 - Determinado (Necesidad Transitoria)-002,"S/. 2,864.19",11/02/2025,24/02/2025,"02 AÑOS EN EL SECTOR PUBLICO O PROVADO, 01 AÑO DE TRABAJO EN CENTROS DE RECURSOS Y/O CON PERSONAS CON DISCAPACIDAD VISUAL Y/O SORDOCEGUERA",TITULO UNIVERSITARIO DE PROFESOR O LICENCIADO EN EDUCACION,"ESPECIALIDAD, DIPLOMADO O CURSOS RELACIONADOS CON LA ATENCION A ESTUDIANTES CON DISCAPACIDAD VISUAL Y/O SORDOCEGUERA Y/O SISTEMA BRAILLE, CADA CURSO DEBE DE TENER NO MENOS DE 12 HORAS DE CAPACITACION Y LOS PROGRAMAS DE ESPECIALIZACION NO MENOS DE 90 HORAS",CONOCIMIENTO Y DOMINIO DE TEMAS RELACIONADOS CON LA ATENCION A LAS NECESIDADES EDUCATIVAS ESPECIALES DE ESTUDIENTES EN CONDICION DE DISCAPACIDAD VISUAL Y/O SORDOCEGUERA. CONOCIMIENTO Y MANEJO DEL SISTEMA BRAILLE.,.,PROFESIONAL DOCENTE ESPECIALISTA EN DISCAPACIDAD VISUAL Y SORDOSEGUERA PARA EL CENTRO DE RECURSOS DE EDUCACION BASICA ESPECIAL - CREBE,Direccion Regional De Educacion Tumbes,TUMBES - TUMBES
https://página web de la dret://www.gob.pe/regiontumbes-dre,1,D.Leg 1057 - Determinado (Necesidad Transitoria)-001,"S/. 3,164.19",11/02/2025,24/02/2025,"04 AÑOS EXPERIENCIA GENERAL EN EL SECTOR PUBLICO O PRIVADO, 02 AÑOS DE EXPERIENCIA EN ACTIVIDADES VINCULADAS A PLANIFICACION Y PRESUPUESTO Y/O SISTEMAS  DE ABASTECIMIENTO, GESTION PUBLICA ORIENTADAS A RESULTADOS Y/O MODERNIZACION DEL ESTADO, 02 AÑO EN EL SECTOR PUBLICO",TECNICO O UNIVERSITARIO COMPLETA EN CONTABILIDAD Y/O ADIMINISTRACION Y/O ECONOMIA,"PRESUPUESTO PUBLICO / GESTION POR RESULTADOS Y/O GESTION PUBLICA Y/O GESTION POR PROCESOS Y/O GESTION EDUCATIVA, CADA CURSO DEBE TENER NO MENOS DE 24 HORAS DE CAPACITACION Y LOS PROGRAMAS DE ESPECIALIZACION NO MENOS DE 90 HORAS.","MODERNIZACION DEL ESTADO Y/O SISTEMAS ADMINISTRATIVOS DEL ESTADO (PRINCIPALMENTE DE PRESUPUESTO, ABASTECIMIENTO Y CONTRATACINES DEL ESTADO). GESTION PUBLICA Y/O GESTION POR PROCESOS  Y/O SEGUIMIENTO O EVALUACION DE PROYECTOS O PROGRAMAS. LEY Nº 30512 Y SUS DISPOSITIVOS NORMATIVOS COMO LAS CBC DEL PROCESO DE LICENCIAMIENTO.","CAPACIDAD DE ANALISIS, CAPACIDAD DE SINTESIS, COMUNICACION EFECTIVA, HABILIDAD DE ORGANIZACION,ORIENTACION A RESULTADOS, TRABAJO EN EQUIPO, RELACIONES INTERPERSONALES",ESPECIALISTA DE CALIDAD DEL SERVICIO EDUCATIVO SUPERIOR TECNOLOGICO,Direccion Regional De Educacion Tumbes,TUMBES - TUMBES
,1,276-80,S/. 736.00,11/02/2025,24/02/2025,"EXPERIENCIA GENERAL 02 AÑOS EN EL SECTOR PUBLICO O PRIVADO
EXPERIENCIA ESPECIFICA 01 AÑO EN LA ADMINISTRACION PUBLICA O PRIVADA",SECUNDARIA COMPLETA,CAPACITACION EN TEMAS RELACIONADOS AL CARGO EN LOS ULTIMOS CINCO AÑOS,"CONOCIMIENTO SOBRE LIMPIEZA Y DESINFECCION DE AMBIENTES, SERVICIOS HIGUIENICOS, CONOCIMIENTO EN MANTENIMIENTO EN JARDINES, CONOCIMIENTO EN LA CUSTODIA DE BIENES Y AMBIENTES, OTROS AFINES AL CARGO.","VOCACION DE SERVICIO , PROACTIVIDAD, RESPOPNSABILIDAD, TRABAJO EN EQUIPO.",TRABAJADOR DE SERVICIO,Unidad De Gestion Educativa Local De Tumbes,TUMBES - TUMBES
https://www.pj.gob.pe,1,D.Leg 1057 - Determinado (Necesidad Transitoria)-04,S/. 004.00,11/02/2025,24/02/2025,"¿	OBLIGATORIO: 
EXPERIENCIA LABORAL GENERAL
TRES (03) AÑOS
EXPERIENCIA LABORAL ESPECÍFICA
UN (01) AÑO EN FUNCIONES SIMILARES AL CARGO. 
¿	DESEABLE: POR CADA AÑO DE EXPERIENCIA ADICIONAL HASTA UN MÁXIMO DE 03 AÑOS.",¿	OBLIGATORIO: TÍTULO PROFESIONAL TÉCNICO (CARRERA 03 AÑOS) EN COMPUTACIÓN E INFORMÁTICA Ó ESTUDIOS UNIVERSITARIOS EN COMPUTACIÓN E INFORMÁTICA (8VO CICLO),¿	DESEABLE: ¿	CURSOS Y/O CAPACITACIONES DE EQUIPOS DE AUDIO Y VIDEO ¿	CURSOS Y/O CAPACITACIONES EN DERECHO.,¿	CONOCIMIENTO EN GRABACIÓN DE ARCHIVOS,¿	ADAPTABILIDAD ¿	ANÁLISIS ¿	AUTOCONTROL ¿	DINAMISMO ¿	COOPERACIÓN,ASISTENTE DE  GRABACIÓN,Poder Judicial,TUMBES - TUMBES
,1,D.Leg 1057 - Determinado (Necesidad Transitoria)-01,"S/. 2,114.19",10/02/2025,21/02/2025,03 AÑOS COMO PROFESIONAL Y NO MENOR DE 02 AÑOS EN EL PUESTO Y/O FUNCIONES SIMILARES,"TITULO PROFESIONAL EN ECONOMIA, ADMINISTRACION DE EMPRESAS, CONTABILIDAD Y/O CARRERAS AFINES, COLEGIADO Y HABILITADO",-,GESTION PUBLICA Y ATENCION AL PUBLICO,"COOPERACION, ORDEN, DINAMISMO Y ATENCION",ASISTENTE ADMINISTRATIVO,Direccion Regional De Agricultura Tumbes,TUMBES - TUMBES
https://ugelcvillar.gob.pe/?page_id=53#,1,D.Leg 1057 - Determinado (Necesidad Transitoria)-3,"S/. 1,614.19",10/02/2025,21/02/2025,• EXPERIENCIA GENERAL: EXPERIENCIA MÍNIMA DE 12 MESES EN EL SECTOR PÚBLICO Y/O PRIVADO Y • EXPERIENCIA ESPECÍFICA: EXPERIENCIA MÍNIMA DE 10 MESES COMO COORDINADOR O ASISTENTE DE SOPORTE TÉCNICO DE LOS RECURSOS TECNOLÓGICOS EN IIEE O ENTIDAD PÚBLICA O PRIVADA. EN EL CASO DE PROFESOR EN COMPUTACIÓN E INFORMÁTICA O BACHILLER EN EDUCACIÓN: 10 MESES COMO DOCENTE A CARGO DEL AULA DE INNOVACIÓN O LA QUE HAGA SUS VECES.,• TÉCNICO EN COMPUTACIÓN E INFORMÁTICA O COMPUTACIÓN O INFORMÁTICA O EN EDUCACIÓN CON ESPECIALIDAD DE COMPUTACIÓN O INFORMÁTICA.,• CURSOS DE OFIMÁTICA COMO MÍNIMO DE 90 HORAS O CURSO DE REPARACIÓN O MANTENIMIENTO DE COMPUTADORAS. • CURSO O DIPLOMADO O CAPACITACIÓN DE INTEGRACIÓN DE LAS TIC EN EL PROCESO DE ENSEÑANZA-APRENDIZAJE O AFINES COMO MÍNIMO DE 90 HORAS.,"• MANEJO DE ESTRATEGIAS Y HERRAMIENTAS DE USO DE TECNOLOGÍAS DE LA INFORMACIÓN Y COMUNICACIÓN. • CONOCIMIENTO Y MANEJO DE APLICACIONES Y SOLUCIONES TECNOLÓGICAS (PLATAFORMAS, APLICATIVOS, ENTRE OTROS). • CONOCIMIENTO SOBRE GESTIÓN, PLANIFICACIÓN, ORGANIZACIÓN Y LIDERAZGO PARA LA ADMINISTRACIÓN DE RECURSOS TECNOLÓGICOS EN EL AULA. • DE PREFERENCIA CON CONOCIMIENTOS EN ADMINISTRACIÓN DE SERVIDORES EN PLATAFORMA WINDOWS Y/O LINUX. • CONOCIMIENTO DE NORMATIVIDAD VIGENTE VINCULADA A PROCESOS E INSTRUMENTOS DE GESTIÓN ESCOLAR Y DEL MODELO DE SERVICIO EDUCATIVO JEC. • CONOCIMIENTO EN REPARACIÓN O MANTENIMIENTO DE COMPUTADORAS.","• INICIATIVA, ANÁLISIS, CONTROL, PLANIFICACIÓN.",COORDINADOR(A) DE INNOVACIÓN Y SOPORTE TECNOLÓGICO,Unidad De Gestion Educativa De Contralmirante Villar,TUMBES - ZORRITOS
https://ugelcvillar.gob.pe/?page_id=53#,1,D.Leg 1057 - Determinado (Necesidad Transitoria)-2,"S/. 2,964.19",10/02/2025,21/02/2025,"EXPERIENCIA GENERAL: EXPERIENCIA MÍNIMA DE 03 AÑOS EN EL SECTOR PÚBLICO Y/O PRIVADO 
EXPERIENCIA ESPECÍFICA: EXPERIENCIA MÍNIMA DE 01 AÑO DE EXPERIENCIA EN EL SECTOR EDUCACIÓN.",•	LICENCIADO EN PSICOLOGÍA,•	ESTUDIOS DE POSGRADO O ESPECIALIZACIÓN O DIPLOMADO EN EDUCACIÓN INCLUSIVA Y/O EDUCACIÓN ESPECIAL Y/O ATENCIÓN A LA DIVERSIDAD O CURSOS RELACIONADOS A DISCAPACIDAD O AL DISEÑO UNIVERSAL PARA EL APRENDIZAJE,"•	ATENCIÓN EDUCATIVA EN EL MARCO DEL ENFOQUE INCLUSIVO O DE ATENCIÓN A LA DIVERSIDAD, CON ÉNFASIS EN ESTUDIANTES CON DISCAPACIDAD Y QUE REQUIERAN APOYOS EDUCATIVOS.",•	ESTUDIOS DE POSGRADO O ESPECIALIZACIÓN O DIPLOMADO EN EDUCACIÓN INCLUSIVA Y/O EDUCACIÓN ESPECIAL Y/O ATENCIÓN A LA DIVERSIDAD O CURSOS RELACIONADOS A DISCAPACIDAD. HABILIDADES COMUNICATIVAS Y DE LIDERAZGO. CAPACIDAD DE TRABAJO EN EQUIPO. CAPACIDAD DE MANEJO DE CONFLICTOS.,PROFESIONAL NO DOCENTE PARA EL SOPORTE Y ASESORAMIENTO A IIEE INCLUSIVAS.,Unidad De Gestion Educativa De Contralmirante Villar,TUMBES - ZORRITOS
https://ugelcvillar.gob.pe/?page_id=53#,1,D.Leg 1057 - Determinado (Necesidad Transitoria)-3,"S/. 1,414.19",10/02/2025,21/02/2025,• EXPERIENCIA GENERAL: EXPERIENCIA MÍNIMA DE 01 AÑO EN EL SECTOR PÚBLICO Y/O PRIVADO • EXPERIENCIA ESPECÍFICA: EXPERIENCIA MÍNIMA DE 06 MESES EN MANTENIMIENTO O LIMPIEZA.,• SECUNDARIA COMPLETA,• NO APLICA,"• MANEJO DE INSUMOS Y RECURSOS DE LIMPIEZA Y MANTENIMIENTO. MANEJO DE PROCEDIMIENTOS PARA LA DESINFECCIÓN DE AMBIENTES, EQUIPOS Y MATERIALES DE LA IE. • CONOCIMIENTOS SOBRE EL FUNCIONAMIENTO DE LAS IIEE JEC.","• ORIENTACIÓN AL SERVICIO, ORDEN, TRABAJO EN EQUIPO, PROACTIVIDAD, RESPONSABILIDAD Y PUNTUALIDAD",PERSONAL DE MANTENIMIENTO,Unidad De Gestion Educativa De Contralmirante Villar,TUMBES - ZORRITOS
,1,D.Leg 1057 - Determinado (Necesidad Transitoria)-01,"S/. 2,264.19",10/02/2025,21/02/2025,03 AÑOS COMO PROFESIONAL Y NO MENOR DE 02 AÑOS EN EL PUESTO Y/O FUNCIONES SIMILARES,MEDICO VETERINARIO,-,GESTION PUBLICA Y ATENCION AL PUBLICO,"COOPERACION, ORDEN, DINAMISMO, ATENCION, GESTION PUBLICA",MEDICO VETERINARIO,Direccion Regional De Agricultura Tumbes,TUMBES - TUMBES
https://ugelcvillar.gob.pe/?page_id=53#,1,D.Leg 1057 - Determinado (Necesidad Transitoria)-5,"S/. 2,964.19",10/02/2025,21/02/2025,"EXPERIENCIA GENERAL: EXPERIENCIA MÍNIMA DE TRES (03) AÑOS EN EL SECTOR PÚBLICO Y/O PRIVADO 
EXPERIENCIA ESPECÍFICA: EXPERIENCIA MÍNIMA DE DOS (02) AÑOS EN LA ADMINISTRACIÓN PÚBLICA.","TÍTULO TÉCNICO DE SECRETARIADO, COMPUTACIÓN O INFORMÁTICA, ADMINISTRACIÓN, CONTABILIDAD O AFINES.","•	CURSOS, DIPLOMADOS O PROGRAMAS DE ESPECIALIZACIÓN EN GESTIÓN PÚBLICA, GESTIÓN DE RECURSOS HUMANOS, SIAF, SIGA.","•	GESTIÓN PÚBLICA, PLANEAMIENTO ESTRATÉGICO, PRESUPUESTO PÚBLICO Y ATENCIÓN AL PÚBLICO.","•	RESPONSABILIDAD, ORIENTACIÓN A RESULTADOS, TRABAJO BAJO PRESIÓN. •	EFICIENCIA, EFICACIA, ORDEN Y DISCIPLINA.",TÉCNICO ADMINISTRATIVO,Unidad De Gestion Educativa De Contralmirante Villar,TUMBES - ZORRITOS
https://ugelcvillar.gob.pe/?page_id=53#,2,D.Leg 1057 - Determinado (Necesidad Transitoria)-3,"S/. 2,764.19",10/02/2025,21/02/2025,• EXPERIENCIA GENERAL: EXPERIENCIA MÍNIMA DE 01 AÑO EN EL SECTOR PÚBLICO Y/O PRIVADO • EXPERIENCIA ESPECÍFICA: EXPERIENCIA MÍNIMA DE 10 MESES EN INSTITUCIONES EDUCATIVAS O PROYECTOS EDUCATIVOS O PROGRAMAS SOCIALES,LICENCIADO EN LA CARRERA DE PSICOLOGÍA • COLEGIADO • HABILITACIÓN PROFESIONAL,CAPACITACIÓN EN HABILIDADES SOCIALES Y/O ACTIVIDADES CON ADOLESCENTES.,"• CONOCIMIENTO SOBRE GESTIÓN: PLANIFICACIÓN, ORGANIZACIÓN Y PROMOCIÓN DE LA CONVIVENCIA DEMOCRÁTICA E INTERCULTURAL EN LA IE. • CONOCIMIENTO EN ESTRATEGIAS DE PREVENCIÓN EN ASPECTOS SOCIOEMOCIONALES. • CONOCIMIENTO GENERAL DE LA NORMATIVIDAD Y PROCESOS EDUCATIVOS. • CONOCIMIENTO DE ENFOQUES DE DERECHO Y GÉNERO. • CONOCIMIENTO EN ARTICULACIÓN CON INSTITUCIONES PÚBLICAS Y PRIVADAS. • CONOCIMIENTOS SOBRE GESTIÓN ESCOLAR Y FUNCIONAMIENTO DE LAS IIEE JEC.","INICIATIVA, ANÁLISIS, CONTROL, PLANIFICACIÓN",PSICÓLOGO(A),Unidad De Gestion Educativa De Contralmirante Villar,TUMBES - ZORRITOS
https://aplicativosweb2.sunafil.gob.pe/si.convocatoria/convocatoria,1,D.Leg 1057 - Determinado (Suplencia)-036,"S/. 6,000.00",10/02/2025,21/02/2025,"- EXPERIENCIA GENERAL MÍNIMA DE CINCO (05) AÑOS EN
SECTOR PÚBLICO O PRIVADO.- EXPERIENCIA ESPECÍFICA MÍNIMA DE DOS (02) AÑOS EN EL
SECTOR PÚBLICO OCUPANDO CARGOS DE ANALISTA LEGAL,
ASISTENTE LEGAL, TÉCNICO LEGAL, Y/O EN CARGOS
EQUIVALENTES REALIZANDO FUNCIONES DE PROYECCIÓN DE
RESOLUCIONES, AUTOS, DECRETOS Y/O INFORMES LEGALES EN MATERIA DE DERECHO LABORAL O PROCEDIMIENTO
ADMINISTRATIVO SANCIONADOR AL NIVEL MÍNIMO DE
ASISTENTE.","- TÍTULO PROFESIONAL DE ABOGADO/A, COLEGIADO/A Y HABILITADO/A.","- DIPLOMADO Y/O PROGRAMA DE ESPECIALIZACIÓN EN DERECHO LABORAL, DERECHO ADMINISTRATIVO, O PROCEDIMIENTO ADMINISTRATIVO SANCIONADOR (*). (*) PROGRAMA DE ESPECIALIZACIÓN CON UN MÍNIMO DE 90 HORAS.","CONOCIMIENTOS TÉCNICOS: - SISTEMA DE INSPECCIÓN DEL TRABAJO, LEGISLACIÓN LABORAL, DERECHO ADMINISTRATIVO, PROCEDIMIENTO SANCIONADOR Y SEGURIDAD Y SALUD EN EL TRABAJO. - CONOCIMIENTO EN HERRAMIENTAS DE INTERNET. CONOCIMIENTO DE OFIMÁTICA: - WORD A NIVEL INTERMEDIO. - EXCEL Y POWER POINT A NIVEL BÁSICO.",- ORGANIZACIÓN DE LA INFORMACIÓN.  - ANÁLISIS. - REDACCIÓN. - INICIATIVA. - COOPERACIÓN.,ESPECIALISTA LEGAL I,Superintendencia Nacional De Fiscalizacion Laboral - Sunafil,TUMBES - TUMBES
https://ugelcvillar.gob.pe/?page_id=53#,1,D.Leg 1057 - Determinado (Necesidad Transitoria)-2,"S/. 2,964.19",10/02/2025,21/02/2025,"EXPERIENCIA GENERAL: EXPERIENCIA MÍNIMA DE 01 AÑO EN EL SECTOR PÚBLICO Y/O PRIVADO 
EXPERIENCIA ESPECÍFICA: EXPERIENCIA MÍNIMA DE 06 MESES DE EXPERIENCIA EN EL TRABAJO CON NIÑOS MENORES DE TRES AÑOS Y/O PERSONAS CON DISCAPACIDAD.",TECNÓLOGO MÉDICO EN/ÁREA/MENCIÓN/ESPECIALIDAD TERAPIA FÍSICA O TERAPIA FÍSICA Y REHABILITACIÓN O TERAPIA OCUPACIONAL O TERAPIA DE LENGUAJE.,NO APLICA,HABILIDADES COMUNICATIVAS Y EMPATÍA. ALTO SENTIDO DE RESPONSABILIDAD Y PROACTIVIDAD. CAPACIDAD DE ESCUCHA Y TOLERANCIA.,DESARROLLO INFANTIL TEMPRANO. INTERVENCIÓN TEMPRANA. TRABAJO INDIVIDUAL Y GRUPAL EN ENTORNOS NO ESCOLARIZADOS. TRABAJO CON FAMILIAS. ORGANIZACIÓN Y PROGRAMAS EN INTERVENCIÓN TEMPRANA.,PROFESIONAL EN TECNOLOGÍA MÉDICA PARA PRITE,Unidad De Gestion Educativa De Contralmirante Villar,TUMBES - ZORRITOS
https://ugelcvillar.gob.pe/?page_id=53#,2,D.Leg 1057 - Determinado (Necesidad Transitoria)-2,"S/. 2,964.19",10/02/2025,21/02/2025,• EXPERIENCIA GENERAL: EXPERIENCIA MÍNIMA DE 01 AÑO Y 06 MESES EN EL SECTOR PÚBLICO Y/O PRIVADO. • EXPERIENCIA ESPECÍFICA: EXPERIENCIA MÍNIMA DE 01 AÑO DE EXPERIENCIA EN EL TRABAJO CON PERSONAS CON DISCAPACIDAD.,• TÍTULO/LICENCIATURA EN TECNÓLOGO MÉDICO EN/ ÁREA/MENCIÓN/ESPECIALIDAD TERAPIA FÍSICA O TERAPIA FÍSICA Y REHABILITACIÓN O TERAPIA OCUPACIONAL O TERAPIA DE LENGUAJE.,• NO APLICA,COMPETENCIAS OCUPACIONALES PARA LA ATENCIÓN DE PERSONAS EN CONDICIÓN DE DISCAPACIDAD. TRABAJO CON FAMILIAS. DESARROLLO EVOLUTIVO.,"COMUNICACIÓN ORAL, COOPERACIÓN, INICIATIVA, EMPATÍA Y TRABAJO EN EQUIPO.",PROFESIONAL EN TECNOLOGÍA MÉDICA PARA CEBE,Unidad De Gestion Educativa De Contralmirante Villar,TUMBES - ZORRITOS
https://ugelcvillar.gob.pe/?page_id=53#,1,D.Leg 1057 - Determinado (Necesidad Transitoria)-4,"S/. 2,764.19",10/02/2025,21/02/2025,EXPERIENCIA GENERAL: EXPERIENCIA MÍNIMA DE UN (01) AÑO EN EL SECTOR PÚBLICO Y/O PRIVADO. EXPERIENCIA ESPECÍFICA: EXPERIENCIA MÍNIMA DE (06) MESES EN INSTITUCIÓN EDUCATIVA O PROYECTOS EDUCATIVOS.,"TÍTULO/LICENCIATURA EN PSICOLOGÍA, COLEGIADO Y CON HABILITACIÓN PROFESIONAL.","CURSOS RELACIONADOS A: • CONVIVENCIA ESCOLAR, TUTORÍA Y ORIENTACIÓN EDUCATIVA; O • PROTECCIÓN Y DERECHOS DE NIÑOS, NIÑAS Y ADOLESCENTES O ATENCIÓN DE LA VIOLENCIA; O • DISEÑO, GESTIÓN O MONITOREO DE PROYECTOS EDUCATIVOS, SOCIALES O COMUNITARIOS.","GESTIÓN DE LA CONVIVENCIA ESCOLAR, PAUTAS PARA LA PREVENCIÓN Y ATENCIÓN DE LA VIOLENCIA EN LAS INSTITUCIONES EDUCATIVAS.","EMPATÍA, ASERTIVIDAD, ANÁLISIS, BUENA COMUNICACIÓN ORAL Y ESCRITA, ORGANIZACIÓN DE LA INFORMACIÓN.",PROFESIONAL EN PSICOLOGÍA,Unidad De Gestion Educativa De Contralmirante Villar,TUMBES - ZORRITOS
