job_posting_url,vacancies,job_posting_number,salary,start_publication_date,end_publication_date,required_experience,educational_background,specialization,required_knowledge,skills,job_title,public_institution,ubication
https://extranet.cunamas.gob,1,D.Leg 1057 - Determinado (Necesidad Transitoria)-056,"S/. 2,764.19",30/01/2025,12/02/2025,"•	EXPERIENCIA LABORAL GENERAL DE 01 AÑO.
•	EXPERIENCIA LABORAL ESPECÍFICA DE 01 AÑO EN SERVICIOS O PROGRAMAS O PROYECTOS RELACIONADOS A EQUIPOS TÉCNICOS PARA LA GESTIÓN, ACOMPAÑAMIENTO O ATENCIÓN EN SALUD PÚBLICA O  PRIMERA INFANCIA O NIÑEZ O FAMILIAS O COMUNIDAD EN EL SECTOR PÚBLICO O PRIVADO CON POBLACIONES VULNERABLES.","•	TÍTULO O BACHILLER UNIVERSITARIO EN EDUCACIÓN (INICIAL O PRIMARIA) O CIENCIAS DE LA SALUD HUMANA (ENFERMERÍA, PSICOLOGÍA, OBSTETRICIA O NUTRICIÓN) O CIENCIAS SOCIALES (SOCIOLOGÍA, TRABAJO SOCIAL O ANTROPOLOGÍA) O TÍTULO DE ESCUELA/INSTITUTO DE EDUCACIÓN SUPERIOR PEDAGÓGICO (INICIAL O PRIMARIA)",•	“CURSOS Y/O CAPACITACIÓN EN DESARROLLO INFANTIL TEMPRANO Y/O PRIMERA INFANCIA Y/O TRABAJO CON FAMILIAS Y/O PROYECTOS SOCIALES Y/O DESARROLLO SOCIAL Y/O DESARROLLO HUMANO U OTROS TEMAS AFINES (ÚLTIMOS 5 AÑOS)”,"•	""CONOCIMIENTO EN OFIMÁTICA NIVEL BÁSICO (WORD, EXCEL, POWER POINT). •	LENGUA ORIGINARIA SEGÚN AMBITO DE TRABAJO - NIVEL INTERMEDIO (DE SER EL CASO)"" •	DISPONIBILIDAD PARA VIAJAR DENTRO Y FUERA DEL DEPARTAMENTO CUANDO EL SERVICIO LO AMERITE","•	COMUNICACIÓN ORAL, EMPATÍA, NEGOCIACIÓN Y PLANIFICACIÓN",ACOMPAÑANTE TECNICO PARA EL SERVICIO DE CUIDADO DIURNO,Programa Nacional Cuna Mas,SAN MARTIN - JUANJUI
https://extranet.cunamas.gob,1,D.Leg 1057 - Determinado (Necesidad Transitoria)-054,"S/. 2,764.19",30/01/2025,12/02/2025,"•	EXPERIENCIA LABORAL GENERAL DE 01 AÑO.
•	EXPERIENCIA LABORAL ESPECÍFICA DE 01 AÑO EN SERVICIOS O PROGRAMAS O PROYECTOS RELACIONADOS A EQUIPOS TÉCNICOS PARA LA GESTIÓN, ACOMPAÑAMIENTO O ATENCIÓN EN SALUD PÚBLICA O  PRIMERA INFANCIA O NIÑEZ O FAMILIAS O COMUNIDAD EN EL SECTOR PÚBLICO O PRIVADO CON POBLACIONES VULNERABLES.","•	TÍTULO O BACHILLER UNIVERSITARIO EN EDUCACIÓN (INICIAL O PRIMARIA) O CIENCIAS DE LA SALUD HUMANA (ENFERMERÍA, PSICOLOGÍA, OBSTETRICIA O NUTRICIÓN) O CIENCIAS SOCIALES (SOCIOLOGÍA, TRABAJO SOCIAL O ANTROPOLOGÍA) O TÍTULO DE ESCUELA/INSTITUTO DE EDUCACIÓN SUPERIOR PEDAGÓGICO (INICIAL O PRIMARIA)",•	“CURSOS Y/O CAPACITACIÓN EN DESARROLLO INFANTIL TEMPRANO Y/O PRIMERA INFANCIA Y/O TRABAJO CON FAMILIAS Y/O PROYECTOS SOCIALES Y/O DESARROLLO SOCIAL Y/O DESARROLLO HUMANO U OTROS TEMAS AFINES (ÚLTIMOS 5 AÑOS)”,"•	""CONOCIMIENTO EN OFIMÁTICA NIVEL BÁSICO (WORD, EXCEL, POWER POINT). •	LENGUA ORIGINARIA SEGÚN AMBITO DE TRABAJO - NIVEL INTERMEDIO (DE SER EL CASO)"" •	DISPONIBILIDAD PARA VIAJAR DENTRO Y FUERA DEL DEPARTAMENTO CUANDO EL SERVICIO LO AMERITE","•	COMUNICACIÓN ORAL, EMPATÍA, NEGOCIACIÓN Y PLANIFICACIÓN",ACOMPAÑANTE TECNICO PARA EL SERVICIO DE CUIDADO DIURNO,Programa Nacional Cuna Mas,SAN MARTIN - RIOJA
https://convocatoria.minjus.gob.pe/convocatoria/public/index.xhtml,3,D.Leg 1057 - Determinado (Necesidad Transitoria)-108,"S/. 7,264.19",30/01/2025,12/02/2025,"PRIVADO (ACREDITAR CON CONSTANCIA, CERTIFICADO Y/O DOCUMENTO ANÁLOGO).
•	EXPERIENCIA ESPECÍFICA MÍNIMA DE DOS (02) AÑOS EN FUNCIÓN O MATERIA CONTADOS A PARTIR DE LA OBTENCIÓN DE SU COLEGIATURA EN EL SECTOR PÚBLICO Y/O PRIVADO (NIVEL MÍNIMO DE ANALISTA LEGAL O SIMILARES) (ACREDITAR CON CONSTANCIA, CERTIFICADO Y/O DOCUMENTO ANÁLOGO). 
•	EXPERIENCIA EN LITIGACIÓN EN PROCESOS PENALES (ACREDITAR CON CONSTANCIA, CERTIFICADO Y/O DOCUMENTO ANÁLOGO).","•	TÍTULO PROFESIONAL EN DERECHO, COLEGIADO Y HABILITACIÓN VIGENTE (ACREDITAR CON COPIA DEL TÍTULO, COPIA DE COLEGIATURA Y CONSTANCIA DE HABILITACIÓN VIGENTE, LA QUE DEBERÁ ESTAR VIGENTE HASTA LA FINALIZACIÓN DE LA ETAPA DE LA EVALUACIÓN CURRICULAR, CONFORME AL CRONOGRAMA DEL PRESENTE PROCESO DE CONTRATACIÓN).","•	DIPLOMADO EN LA ESPECIALIDAD DE DERECHO PENAL Y/O DERECHO PROCESAL PENAL Y/O EJECUCIÓN PENAL Y/O ADOLESCENTES EN CONFLICTO CON LA LEY PENAL Y/O TÉCNICAS DE LITIGACIÓN ORAL, EL CUAL DEBERÁ TENER UNA DURACIÓN NO MENOR DE NOVENTA (90) HORAS LECTIVAS, POR TANTO, LOS CERTIFICADOS Y/O CONSTANCIAS DEBEN INDICAR EL NÚMERO DE HORAS LECTIVAS, CASO CONTRARIO NO SERÁN TOMADOS EN CUENTA. (ACREDITAR CON CONSTANCIA Y/O CERTIFICADO). •	DIPLOMADO EN MATERIAS VINCULADAS AL NUEVO CÓDIGO PROCESAL PENAL, EL CUAL DEBERÁ TENER UNA DURACIÓN NO MENOR DE NOVENTA (90) HORAS LECTIVAS, POR TANTO, LOS CERTIFICADOS Y/O CONSTANCIAS DEBEN INDICAR EL NÚMERO DE HORAS LECTIVAS, CASO CONTRARIO NO SERÁN TOMADOS EN CUENTA. (ACREDITAR CON CONSTANCIA Y/O CERTIFICADO). •	DIPLOMADO EN MATERIAS VINCULADAS AL NUEVO CÓDIGO PROCESAL CONSTITUCIONAL, EL CUAL DEBERÁ TENER UNA DURACIÓN NO MENOR DE NOVENTA (90) HORAS LECTIVAS, POR TANTO, LOS CERTIFICADOS Y/O CONSTANCIAS DEBEN INDICAR EL NÚMERO DE HORAS LECTIVAS, CASO CONTRARIO NO SERÁN TOMADOS EN CUENTA. (ACREDITAR CON CONSTANCIA Y/O CERTIFICADO).","•	CONOCIMIENTOS TÉCNICOS (*): CONOCIMIENTOS EN DERECHO PENAL, DERECHO PROCESAL PENAL, DERECHO DE EJECUCIÓN PENAL, DERECHO PROCESAL CONSTITUCINAL, DERECHO CONSTITUCIONAL, DERECHOS HUMANOS, CRIMINALÍSTICA, CÓDIGO DEL NIÑO Y EL ADOLESCENTE, CÓDIGO DE RESPONSABILIDAD PENAL DEL ADOLCESCENTES, LITIGACIÓN ORAL.  •	CONOCIMIENTOS DE OFIMÁTICA (*): PROCESADOR DE TEXTOS (WORD, OPEN OFFICE WRITE, ETC.), HOJA DE CÁLCULO (EXCEL, OPENCALC, ETC.) PROGRAMA DE PRESENTACIONES (POWER POINT, PREZI, ETC.),  TODOS CON NIVEL DE DOMINIO BÁSICO.",•	COMPROMISO. •	RESPONSABILIDAD. •	VOCACIÓN DE SERVICIO. •	ADAPTABILIDAD – FLEXIBILIDAD. •	COMUNICACIÓN. •	ORIENTACIÓN A RESULTADOS. •	CONCIENCIA SOCIAL. •	CAPACIDAD DE ANÁLISIS Y SÍNTESIS. •	NEGOCIACIÓN. •	PROACTIVIDAD.,DEFENSOR PUBLICO EN EL NUEVO CODIGO PROCESAL PENAL,Ministerio De Justicia Y Derechos Humanos,SAN MARTIN - TARAPOTO
https://www.mpsm.gob.pe,1,D.Leg 1057 - Determinado (Necesidad Transitoria)-001,S/. 002.00,30/01/2025,12/02/2025,EXPERIENCIA GENERAL DE DOS (2) AÑOS Y ESPECIFICA DE UN (1) AÑO EN LA FUNCION O MATERIA Y SEIS (6) MESES EN EL SECTOR PUBLICO,PROFESIONAL TECNICO EN LA CARRERA DE ADMINISTRACIÒN Y/O CARRERAS AFINES,"CAPACITACION Y/O CURSOS REALIZADOS, RESPECTO A LAS ACTIVIDADES DEL PUESTO","PROCESAMIENTO DE DATOS, MANEJO DE SISTEMAS  O APLICATIVOS","ANALISIS, PLANIFICACIÒN, DINAMISMO, INICIATIVA, EMPATÌA, COMUNICACIÒN",PROMOTOR SOCIAL,Municipalidad Provincial San Martin,SAN MARTIN - TARAPOTO
https://www.mpsm.gob.pe,1,D.Leg 1057 - Determinado (Necesidad Transitoria)-001,S/. 003.20,30/01/2025,12/02/2025,"EXPERIENCIA LABORAL GENERAL DE TRES (3) AÑOS Y EXPERIENCIA ESPECIFICA DE DOS (2) AÑOS, DE LOS CUALES UNO (1) EN LA FUNCIÒN O MATERIA Y UN (1) EN EL SECTOR PÙBLICO","ESTUDIOS UNIVERSITARIOS COMPLETOS, EN LA CARRERA PROFESIONAL DE INGENIERIA SANITARIA, AMBIENTAL Y/O CARRERAS AFINES, COLEGIADO Y HABILITADO",CURSOS DE CAPACITACION ENSANEAMIENTO RURAL  URBANO Y/O TRATAMIENTOS DE AGUA POTABLE Y RESIDUALES Y/O CURSOS AFINES A LA ESPECIALIDAD,"APLICATIVOS WEB, PROCESAMIENTO DE BASE DE DATOS, SOFTWARE Y SISTEMAS OPERATIVOS WINDOWS","PROACTIVIDAD, RESPONSABILIDAD, CAPACIDAD DE ADAPTACIÒN AL PUESTO DE TRABAJO, CONFIABILIDAD, BUENA RELACION INTERPERSONAL",ESPECIALISTA AMBIENTAL (ATM),Municipalidad Provincial San Martin,SAN MARTIN - TARAPOTO
https://convocatoria.minjus.gob.pe/convocatoria/public/index.xhtml,1,D.Leg 1057 - Determinado (Necesidad Transitoria)-079,"S/. 5,264.19",29/01/2025,11/02/2025,"•	EXPERIENCIA LABORAL GENERAL MÍNIMA DE DOS (02) AÑOS, EN EL SECTOR PÚBLICO Y/O PRIVADO (ACREDITAR CON CONSTANCIA, CERTIFICADO Y/O DOCUMENTO ANÁLOGO).
•	EXPERIENCIA ESPECÍFICA MÍNIMA DE DOS (02) AÑOS EN FUNCIÓN O MATERIA CONTADOS A PARTIR DE LA OBTENCIÓN DE SU COLEGIATURA EN EL SECTOR PÚBLICO Y/O PRIVADO (NIVEL MÍNIMO DE ANALISTA LEGAL O SIMILARES) (ACREDITAR CON CONSTANCIA, CERTIFICADO Y/O DOCUMENTO ANÁLOGO). 
•	EXPERIENCIA EN LITIGACIÓN EN PROCESOS PENALES (ACREDITAR CON CONSTANCIA, CERTIFICADO Y/O DOCUMENTO ANÁLOGO).","•	TÍTULO PROFESIONAL EN DERECHO, COLEGIADO Y HABILITACIÓN VIGENTE (ACREDITAR CON COPIA DEL TÍTULO, COPIA DE COLEGIATURA Y CONSTANCIA DE HABILITACIÓN VIGENTE, LA QUE DEBERÁ ESTAR VIGENTE HASTA LA FINALIZACIÓN DE LA ETAPA DE LA EVALUACIÓN CURRICULAR, CONFORME AL CRONOGRAMA DEL PRESENTE PROCESO DE CONTRATACIÓN).","•	DIPLOMADO EN LA ESPECIALIDAD DE DERECHO PENAL Y/O EJECUCIÓN PENAL Y/O ADOLESCENTES EN CONFLICTO CON LA LEY PENAL Y/O TÉCNICAS DE LITIGACIÓN ORAL, EL CUAL DEBERÁ TENER UNA DURACIÓN NO MENOR DE NOVENTA (90) HORAS LECTIVAS, POR TANTO, LOS CERTIFICADOS Y/O CONSTANCIAS DEBEN INDICAR EL NÚMERO DE HORAS LECTIVAS, CASO CONTRARIO NO SERÁN TOMADOS EN CUENTA. (ACREDITAR CON CONSTANCIA Y/O CERTIFICADO). •	DIPLOMADO EN MATERIAS VINCULADAS AL NUEVO CÓDIGO PROCESAL PENAL Y/O DIPLOMADOS RELACIONADOS CON TEMAS VINCULADOS CON EL NUEVO CÓDIGO PROCESAL CONSTITUCIONAL., EL CUAL DEBERÁ TENER UNA DURACIÓN NO MENOR DE NOVENTA (90) HORAS LECTIVAS, POR TANTO, LOS CERTIFICADOS Y/O CONSTANCIAS DEBEN INDICAR EL NÚMERO DE HORAS LECTIVAS, CASO CONTRARIO NO SERÁN TOMADOS EN CUENTA. (ACREDITAR CON CONSTANCIA Y/O CERTIFICADO). •	DIPLOMADO RELACIONADOS EN CRIMEN ORGANIZADO Y CORRUPCIÓN DE FUNCIONARIOS, EL CUAL DEBERÁ TENER UNA DURACIÓN NO MENOR DE NOVENTA (90) HORAS LECTIVAS, POR TANTO, LOS CERTIFICADOS Y/O CONSTANCIAS DEBEN INDICAR EL NÚMERO DE HORAS LECTIVAS, CASO CONTRARIO NO SERÁN TOMADOS EN CUENTA. (ACREDITAR CON CONSTANCIA Y/O CERTIFICADO).","•	CONOCIMIENTOS TÉCNICOS (*): CONOCIMIENTOS TÉCNICOS EN DERECHO PENAL, DERECHO CONSTITUCIONAL, DERECHOS HUMANOS, DERECHO PROCESAL PENAL, DERECHO PROCESAL CONSTITUCIONAL, CRIMINALÍSTICA, CÓDIGO DEL NIÑO Y EL ADOLESCENTE, CÓDIGO DE RESPONSABILIDAD PENAL DE ADOLESCENTES, LITIGACIÓN ORAL Y DERECHO DE EJECUCIÓN PENAL.  •	CONOCIMIENTOS DE OFIMÁTICA (*): PROCESADOR DE TEXTOS (WORD, OPEN OFFICE WRITE, ETC.), HOJA DE CÁLCULO (EXCEL, OPENCALC, ETC.) PROGRAMA DE PRESENTACIONES (POWER POINT, PREZI, ETC.),  TODOS CON NIVEL DE DOMINIO BÁSICO.",•	COMPROMISO. •	RESPONSABILIDAD. •	VOCACIÓN DE SERVICIO. •	ADAPTABILIDAD – FLEXIBILIDAD. •	COMUNICACIÓN. •	ORIENTACIÓN A RESULTADOS. •	CONCIENCIA SOCIAL. •	CAPACIDAD DE ANÁLISIS Y SÍNTESIS. •	NEGOCIACIÓN. •	PROACTIVIDAD.,DEFENSOR PUBLICO EN EL NUEVO CODIGO PROCESAL PENAL,Ministerio De Justicia Y Derechos Humanos,SAN MARTIN - JUANJUI
https://www.facebook.com/ugelsanmartin/?locale=es_la,1,D.Leg 1057 - Determinado (Necesidad Transitoria)-04,"S/. 2,950.00",29/01/2025,11/02/2025,03 AÑOS DE EXPERIENCIA EN EL SECTOR PÚBLICO Y/O PRIVADO.,"TITULADO(A) EN LAS CARRERAS DE ADMINISTRACIÓN, CONTABILIDAD Y ECONOMÍA.",NO APLICA,"LEY DE CONTRATACIONES VIGENTE, SISTEMAS SIGA - MEF - MÓDULO DE LOGÍSTICA – MODULO COMPLEMENTARIO – SIAF – SIAF WEB, PROGRAMACIÓN MULTIANUAL","ANÁLISIS, ORGANIZACIÓN DE LA INFORMACIÓN, PLANIFICACIÓN Y CONTROL.",ESPECIALISTA EN LOGISTICA,Und. De Gestion Educativa Local San Mart,SAN MARTIN - TARAPOTO
https://www.facebook.com/ugelsanmartin/?locale=es_la,1,D.Leg 1057 - Determinado (Necesidad Transitoria)-03,"S/. 1,764.19",29/01/2025,11/02/2025,02 AÑOS DE EXPERIENCIA EN EL SECTOR PÚBLICO Y/O PRIVADO.,"EGRESADOS(A) EN LAS CARRERAS DE ADMINISTRACIÓN DE EMPRESAS, CONTABILIDAD, ECONOMÍA Y DERECHO.",NO APLICA,"CONOCIMIENTOS EN GESTIÓN PÚBLICA. LEGISLACIÓN LABORAL, REFORMA MAGISTERIAL. CONOCIMIENTOS EN GESTIÓN DOCUMENTARIA Y ARCHIVÍSTICA. CONOCIMIENTO EN EL SISTEMA ADMINISTRATIVO DE GESTIÓN DE RRHH",02 AÑOS DE EXPERIENCIA EN EL SECTOR PÚBLICO Y/O PRIVADO,ASISTENTE ADMINISTRATIVO EN CALCULOS JUDICIALES,Und. De Gestion Educativa Local San Mart,SAN MARTIN - TARAPOTO
https://www.facebook.com/ugelsanmartin/?locale=es_la,1,D.Leg 1057 - Determinado (Necesidad Transitoria)-05,"S/. 1,764.19",29/01/2025,11/02/2025,02 AÑOS DE EXPERIENCIA EN EL SECTOR PÚBLICO Y/O PRIVADO.,"EGRESADOS(A) EN LAS CARRERAS DE ADMINISTRACIÓN DE EMPRESAS, CONTABILIDAD, ECONOMÍA Y DERECHO.",NO APLICA,"GESTIÓN PÚBLICA, REDACCIÓN, ARCHIVO Y GESTIÓN DOCUMENTARIA, LEY DE PROCEDIMIENTO ADMINISTRATIVO GENERAL.","VOCACIÓN DE SERVICIO, TRABAJO EN EQUIPO, INICIATIVA Y PROACTIVIDAD",ASISTENTE EN TRAMITE DOCUMENTARIO,Und. De Gestion Educativa Local San Mart,SAN MARTIN - TARAPOTO
https://www.facebook.com/ugelsanmartin/?locale=es_la,1,D.Leg 1057 - Determinado (Necesidad Transitoria)-02,"S/. 1,950.00",29/01/2025,11/02/2025,02 AÑOS DE EXPERIENCIA EN EL SECTOR PÚBLICO Y/O PRIVADO.,"EGRESADOS(AS) EN LAS CARRERAS DE ADMINISTRACIÓN, CONTABILIDAD, ECONOMÍA Y/O DERECHO.",NO APLICA,"GESTIÓN DE RECURSOS HUMANOS, LEY DEL SERVICIO CIVIL, REFORMA MAGISTERIAL Y/O TRAMITES DOCUMENTARIOS DE ACUERDO A NORMATIVA.","ANÁLISIS, COMUNICACIÓN ORAL Y TRABAJO EN EQUIPO.",ASISTENTE DE GESTIÓN DE RECURSOS HUMANOS,Und. De Gestion Educativa Local San Mart,SAN MARTIN - TARAPOTO
https://www.facebook.com/ugelsanmartin/?locale=es_la,1,D.Leg 1057 - Determinado (Necesidad Transitoria)-01,"S/. 2,950.00",29/01/2025,11/02/2025,3 AÑOS EN EL SECTOR PUBLICO Y/O PRIVADO,"TITULADOS(AS) EN LAS CARRERAS DE ADMINISTRACIÓN, CONTABILIDAD, ECONOMÍA/ INGENIERÍA ECONÓMICA, INGENIERÍA INDUSTRIAL Y/O DERECHO.",NO APLICA,"GESTIÓN PÚBLICA, LEGISLACIÓN LABORAL, LEY N° 30057 - LEY DEL SERVICIO CIVIL Y SISTEMA ADMINISTRATIVO DE GESTIÓN DE RECURSOS HUMANOS.","ORIENTACIÓN A RESULTADOS, TRABAJO EN EQUIPO, VOCACIÓN DE SERVICIO, ANÁLISIS, ORGANIZACIÓN DE LA INFORMACIÓN, PLANIFICACIÓN Y CONTROL.",ESPECIALISTA EN GESTIÓN DE RECURSOS HUMANOS,Und. De Gestion Educativa Local San Mart,SAN MARTIN - TARAPOTO
https://www.oosaludaltomayo.gob.pe/convocatorias,1,D.Leg 1057 - Determinado (Necesidad Transitoria)-001,"S/. 1,764.19",28/01/2025,10/02/2025,02 AÑOS.,CERTIFICADO DE ESTUDIOS DE SECUNDARIA COMPLETA,NO APLICA,"""LEY N° 26842 - LEY GENERAL DE SALUD. REGLAMENTO INTERNO DE TRABAJO - RIT DIRESA""","EMPATÍA, RESPONSABILIDAD, CAPACIDAD DE RESPUESTA AL CAMBIO Y  TRABAJO BAJO PRESIÓN.",VIGILANTE,Oficina De Gestión De Servicios De Salud Alto Mayo,SAN MARTIN - YURACYACU
https://www.oosaludaltomayo.gob.pe/convocatorias,1,D.Leg 1057 - Determinado (Necesidad Transitoria)-01,"S/. 1,664.19",28/01/2025,10/02/2025,02 AÑOS,"TÉCNICO DE LABORATORIO CLÍNICO, ANATOMÍA PATOLÓGICA Y/O CARRERAS AFINES POR LA FORMACIÓN",NO APLICA,LEY N° 26842 - LEY GENERAL DE SALUD.                                                                                                                                                                                                                                              LEY N° 28561- LEY QUE REGULA EL TRABAJO DE LOS TÉCNICOS Y AUXILIARES ASISTENCIALES DE SALUD.                                                                                                                                            RESOLUCIÓN MINISTERIAL N°  627-2008-MINSA - NORMA TÉCNICA DE SALUD DE LA UNIDAD PRODUCTORA DE SERVICIOS DE PATOLOGÍA CLÍNICA. RESOLUCION MINISTERIAL Nº 599-2019-MINSA-NORMA TÉCNICA DE SALUD: USO Y ESPECIFICACIONES TÉCNICAS DE LA ROPA DE TRABAJO PARA EL PERSONAL TÉCNICO Y AUXILIAR ASISTENCIAL DE LA SALUD EN LAS INSTITUCIONES PRESTADORAS DE SERVICIOS DE SALUD.,"EMPATÍA, RESPONSABILIDAD, CAPACIDAD DE RESPUESTA AL CAMBIO Y  TRABAJO BAJO PRESIÓN.",TÉCNICO/A EN LABORATORIO,Oficina De Gestión De Servicios De Salud Alto Mayo,SAN MARTIN - YURACYACU
https://www.oosaludaltomayo.gob.pe/convocatorias,1,D.Leg 1057 - Determinado (Necesidad Transitoria)-01,"S/. 2,064.19",28/01/2025,10/02/2025,02 AÑOS,"TÉCNICO DE LABORATORIO CLÍNICO Y ANATOMÍA PATOLÓGICA, Y/O CARRERAS AFINES POR LA FORMACIÓN",NO APLICA,LEY N° 26842 - LEY GENERAL DE SALUD.                                                                                                                                                                                                                                              LEY N° 28561- LEY QUE REGULA EL TRABAJO DE LOS TÉCNICOS Y AUXILIARES ASISTENCIALES DE SALUD.                                                                                                                                            RESOLUCIÓN MINISTERIAL N°  627-2008-MINSA - NORMA TÉCNICA DE SALUD DE LA UNIDAD PRODUCTORA DE SERVICIOS DE PATOLOGÍA CLÍNICA. RESOLUCION MINISTERIAL Nº 599-2019-MINSA-NORMA TÉCNICA DE SALUD: USO Y ESPECIFICACIONES TÉCNICAS DE LA ROPA DE TRABAJO PARA EL PERSONAL TÉCNICO Y AUXILIAR ASISTENCIAL DE LA SALUD EN LAS INSTITUCIONES PRESTADORAS DE SERVICIOS DE SALUD.,"EMPATÍA, RESPONSABILIDAD, CAPACIDAD DE RESPUESTA AL CAMBIO Y  TRABAJO BAJO PRESIÓN.",TECNICO/A ASISTENCIAL,Oficina De Gestión De Servicios De Salud Alto Mayo,SAN MARTIN - YURACYACU
https://www.oosaludaltomayo.gob.pe/convocatorias,1,D.Leg 1057 - Determinado (Necesidad Transitoria)-01,"S/. 2,064.19",28/01/2025,10/02/2025,02 AÑOS,"TÉCNICO DE LABORATORIO CLÍNICO Y ANATOMÍA PATOLÓGICA, Y/O CARRERAS AFINES POR LA FORMACIÓN",NO APLICA,LEY N° 26842 - LEY GENERAL DE SALUD.                                                                                                                                                                                                                                              LEY N° 28561- LEY QUE REGULA EL TRABAJO DE LOS TÉCNICOS Y AUXILIARES ASISTENCIALES DE SALUD.                                                                                                                                            RESOLUCIÓN MINISTERIAL N°  627-2008-MINSA - NORMA TÉCNICA DE SALUD DE LA UNIDAD PRODUCTORA DE SERVICIOS DE PATOLOGÍA CLÍNICA. RESOLUCION MINISTERIAL Nº 599-2019-MINSA-NORMA TÉCNICA DE SALUD: USO Y ESPECIFICACIONES TÉCNICAS DE LA ROPA DE TRABAJO PARA EL PERSONAL TÉCNICO Y AUXILIAR ASISTENCIAL DE LA SALUD EN LAS INSTITUCIONES PRESTADORAS DE SERVICIOS DE SALUD.,"EMPATÍA, RESPONSABILIDAD, CAPACIDAD DE RESPUESTA AL CAMBIO Y  TRABAJO BAJO PRESIÓN.",TECNICO/A ASISTENCIAL,Oficina De Gestión De Servicios De Salud Alto Mayo,SAN MARTIN - MOYOBAMBA
https://www.oosaludaltomayo.gob.pe/convocatorias,1,D.Leg 1057 - Determinado (Necesidad Transitoria)-01,"S/. 3,164.19",28/01/2025,10/02/2025,03 AÑOS,PSICÓLOGO,NO APLICA,LEY N° 26842 - LEY GENERAL DE SALUD.  LEY N° 28369 - LEY DEL TRABAJO DE PSICÓLOGO. LEY N° 30947 - LEY DE SALUD  MENTAL Y SU REGLAMENTO.,"EMPATÍA, RESPONSABILIDAD, CAPACIDAD DE RESPUESTA AL CAMBIO Y  TRABAJO BAJO PRESIÓN.",PSICÓLOGO,Oficina De Gestión De Servicios De Salud Alto Mayo,SAN MARTIN - YURACYACU
https://www.oosaludaltomayo.gob.pe/convocatorias,1,D.Leg 1057 - Determinado (Necesidad Transitoria)-01,"S/. 2,064.19",28/01/2025,10/02/2025,02 AÑOS,CERTIFICADO DE ESTUDIOS DE SECUNDARIA COMPLETA,NO APLICA,LEY N° 26842 - LEY GENERAL DE SALUD. LEY Nº 27181 - LEY GENERAL DE TRANSPORTE Y TRÁNSITO TERRESTRE.  RESOLUCION MINISTERIAL Nº 953-2006-MINSA- NORMA TÉCNICA DE SALUD PARA EL TRANSPORTE ASISTIDO DE PACIENTES POR VÍA TERRESTRE,"EMPATÍA, RESPONSABILIDAD, CAPACIDAD DE RESPUESTA AL CAMBIO Y  TRABAJO BAJO PRESIÓN.",CONDUCTOR DE AMBULANCIA,Oficina De Gestión De Servicios De Salud Alto Mayo,SAN MARTIN - YURACYACU
https://www.oosaludaltomayo.gob.pe/convocatorias,1,D.Leg 1057 - Determinado (Necesidad Transitoria)-01,"S/. 2,064.19",28/01/2025,10/02/2025,02 AÑOS,CERTIFICADO DE ESTUDIOS DE SECUNDARIA COMPLETA,NO APLICA,LEY N° 26842 - LEY GENERAL DE SALUD. LEY Nº 27181 - LEY GENERAL DE TRANSPORTE Y TRÁNSITO TERRESTRE.  RESOLUCION MINISTERIAL Nº 953-2006-MINSA- NORMA TÉCNICA DE SALUD PARA EL TRANSPORTE ASISTIDO DE PACIENTES POR VÍA TERRESTRE,"EMPATÍA, RESPONSABILIDAD, CAPACIDAD DE RESPUESTA AL CAMBIO Y  TRABAJO BAJO PRESIÓN.",CONDUCTOR DE AMBULANCIA,Oficina De Gestión De Servicios De Salud Alto Mayo,SAN MARTIN - ELIAS SOPLIN VARGAS
https://www.oosaludaltomayo.gob.pe/convocatorias,1,D.Leg 1057 - Determinado (Necesidad Transitoria)-01,"S/. 2,064.19",28/01/2025,10/02/2025,02 AÑOS,CERTIFICADO DE ESTUDIOS DE SECUNDARIA COMPLETA,NO APLICA,LEY N° 26842 - LEY GENERAL DE SALUD. LEY Nº 27181 - LEY GENERAL DE TRANSPORTE Y TRÁNSITO TERRESTRE.  RESOLUCION MINISTERIAL Nº 953-2006-MINSA- NORMA TÉCNICA DE SALUD PARA EL TRANSPORTE ASISTIDO DE PACIENTES POR VÍA TERRESTRE,"EMPATÍA, RESPONSABILIDAD, CAPACIDAD DE RESPUESTA AL CAMBIO Y  TRABAJO BAJO PRESIÓN.",CONDUCTOR DE AMBULANCIA,Oficina De Gestión De Servicios De Salud Alto Mayo,SAN MARTIN - MOYOBAMBA
https://www.oosaludaltomayo.gob.pe/convocatorias,1,D.Leg 1057 - Determinado (Necesidad Transitoria)-001,"S/. 3,164.19",28/01/2025,10/02/2025,03 AÑOS.,OBSTETRA,NO APLICA,LEY N° 26842 - LEY GENERAL DE SALUD.                                                                                                                                                                                                                                                    LEY N° 27853 - LEY DE TRABAJO DE LA OBSTETRIZ                                                                                                                                                                                                                  RESOLUCIÓN MINISTERIAL N° 827-2013-MINSA - NORMA TÉCNICA DE SALUD PARA LA ATENCIÓN INTEGRAL DE SALUD MATERNA.,"EMPATÍA, RESPONSABILIDAD, CAPACIDAD DE RESPUESTA AL CAMBIO Y  TRABAJO BAJO PRESIÓN.",OBSTETRA,Oficina De Gestión De Servicios De Salud Alto Mayo,SAN MARTIN - SORITOR
https://www.oosaludaltomayo.gob.pe/convocatorias,1,D.Leg 1057 - Determinado (Necesidad Transitoria)-001,"S/. 3,164.19",28/01/2025,10/02/2025,03 AÑOS.,OBSTETRA,NO APLICA,LEY N° 26842 - LEY GENERAL DE SALUD.                                                                                                                                                                                                                                                    LEY N° 27853 - LEY DE TRABAJO DE LA OBSTETRIZ                                                                                                                                                                                                                  RESOLUCIÓN MINISTERIAL N° 827-2013-MINSA - NORMA TÉCNICA DE SALUD PARA LA ATENCIÓN INTEGRAL DE SALUD MATERNA.,"EMPATÍA, RESPONSABILIDAD, CAPACIDAD DE RESPUESTA AL CAMBIO Y  TRABAJO BAJO PRESIÓN.",OBSTETRA,Oficina De Gestión De Servicios De Salud Alto Mayo,SAN MARTIN - RIOJA
https://www.oosaludaltomayo.gob.pe/convocatorias,1,D.Leg 1057 - Determinado (Necesidad Transitoria)-001,"S/. 3,164.19",28/01/2025,10/02/2025,03 AÑOS.,OBSTETRA,NO APLICA,LEY N° 26842 - LEY GENERAL DE SALUD.                                                                                                                                                                                                                                                    LEY N° 27853 - LEY DE TRABAJO DE LA OBSTETRIZ                                                                                                                                                                                                                  RESOLUCIÓN MINISTERIAL N° 827-2013-MINSA - NORMA TÉCNICA DE SALUD PARA LA ATENCIÓN INTEGRAL DE SALUD MATERNA.,"EMPATÍA, RESPONSABILIDAD, CAPACIDAD DE RESPUESTA AL CAMBIO Y  TRABAJO BAJO PRESIÓN.",OBSTETRA,Oficina De Gestión De Servicios De Salud Alto Mayo,SAN MARTIN - AWAJUN
https://www.oosaludaltomayo.gob.pe/convocatorias,1,D.Leg 1057 - Determinado (Necesidad Transitoria)-001,"S/. 3,164.19",28/01/2025,10/02/2025,03 AÑOS.,OBSTETRA,NO APLICA,LEY N° 26842 - LEY GENERAL DE SALUD.                                                                                                                                                                                                                                                    LEY N° 27853 - LEY DE TRABAJO DE LA OBSTETRIZ                                                                                                                                                                                                                  RESOLUCIÓN MINISTERIAL N° 827-2013-MINSA - NORMA TÉCNICA DE SALUD PARA LA ATENCIÓN INTEGRAL DE SALUD MATERNA.,"EMPATÍA, RESPONSABILIDAD, CAPACIDAD DE RESPUESTA AL CAMBIO Y  TRABAJO BAJO PRESIÓN.",OBSTETRA,Oficina De Gestión De Servicios De Salud Alto Mayo,SAN MARTIN - PARDO MIGUEL
https://www.oosaludaltomayo.gob.pe/convocatorias,1,D.Leg 1057 - Determinado (Necesidad Transitoria)-001,"S/. 3,164.19",28/01/2025,10/02/2025,03 AÑOS.,OBSTETRA,NO APLICA,LEY N° 26842 - LEY GENERAL DE SALUD.                                                                                                                                                                                                                                                    LEY N° 27853 - LEY DE TRABAJO DE LA OBSTETRIZ                                                                                                                                                                                                                  RESOLUCIÓN MINISTERIAL N° 827-2013-MINSA - NORMA TÉCNICA DE SALUD PARA LA ATENCIÓN INTEGRAL DE SALUD MATERNA.,"EMPATÍA, RESPONSABILIDAD, CAPACIDAD DE RESPUESTA AL CAMBIO Y  TRABAJO BAJO PRESIÓN.",OBSTETRA,Oficina De Gestión De Servicios De Salud Alto Mayo,SAN MARTIN - SAN FERNANDO
