job_posting_url,vacancies,job_posting_number,salary,start_publication_date,end_publication_date,required_experience,educational_background,specialization,required_knowledge,skills,job_title,public_institution,ubication
https://extranet.cunamas.gob,1,D.Leg 1057 - Determinado (Necesidad Transitoria)-031,"S/. 2,764.19",30/01/2025,12/02/2025,"•	EXPERIENCIA LABORAL GENERAL DE 01 AÑO.
•	EXPERIENCIA LABORAL ESPECÍFICA DE 01 AÑO EN SERVICIOS O PROGRAMAS O PROYECTOS RELACIONADOS A EQUIPOS TÉCNICOS PARA LA GESTIÓN, ACOMPAÑAMIENTO O ATENCIÓN EN SALUD PÚBLICA O PRIMERA INFANCIA O NIÑEZ O FAMILIAS O COMUNIDAD EN EL SECTOR PÚBLICO O PRIVADO CON POBLACIONES VULNERABLES.","•	TÍTULO O BACHILLER EN EDUCACIÓN (INICIAL O PRIMARIA O SECUNDARIA) O CIENCIAS DE LA SALUD HUMANA (ENFERMERÍA, PSICOLOGÍA, OBSTETRICIA, NUTRICIÓN) O CIENCIAS SOCIALES (SOCIOLOGÍA, TRABAJO SOCIAL O ANTROPOLOGÍA) O TITULO DE ESCUELA/INSTITUTO DE EDUCACIÓN SUPERIOR PEDAGÓGICO (INICIAL O PRIMARIA O SECUNDARIA) O TÍTULOS TÉCNICOS EN CIENCIAS DE LA SALUD (ENFERMERÍA Y FARMACIA)",•	“CURSOS Y/O CAPACITACIÓN EN DESARROLLO INFANTIL TEMPRANO Y/O PRIMERA INFANCIA Y/O TRABAJO CON FAMILIAS Y/O PROYECTOS SOCIALES Y/O DESARROLLO SOCIAL Y/O DESARROLLO HUMANO U OTROS TEMAS AFINES (ÚLTIMOS 5 AÑOS)”,"•	""CONOCIMIENTO EN OFIMÁTICA NIVEL BÁSICO (WORD, EXCEL, POWER POINT). •	LENGUA ORIGINARIA SEGÚN ÁMBITO DE TRABAJO - NIVEL INTERMEDIO (DE SER EL CASO)""  •	DISPONIBILIDAD PARA VIAJAR DENTRO Y FUERA DEL DEPARTAMENTO CUANDO EL SERVICIO LO AMERITE","•	COMUNICACIÓN ORAL, EMPATÍA, NEGOCIACIÓN Y PLANIFICACIÓN",ACOMPAÑANTE TECNICO PARA EL SERVICIO DE CUIDADO DIURNO,Programa Nacional Cuna Mas,TACNA - TACNA
https://www.munijorgebasadre.gob.pe,1,D.Leg 1057 - Determinado (Necesidad Transitoria)-026,"S/. 3,000.00",30/01/2025,12/02/2025,EXPERIENCIA LABORAL DE 03 AÑOS EN CARGOS AFINES,BACHILLER Y/O TÉCNICO (03) AÑOS,ACREDITAR CAPACITACIONES PARA EL PUESTO.,EXPERIENCIA A LAS FUNCIONES A REALIZAR.,"SENTIDO DE RESPONSABILIDAD, CAPACIDAD DE TRABAJO BAJO PRESIÓN",TECNICO ADMINISTRATIVO I,Municipalidad Provincial Jorge Basadre,TACNA - LOCUMBA
https://convocatoria.minjus.gob.pe/convocatoria/public/index.xhtml,2,D.Leg 1057 - Determinado (Necesidad Transitoria)-111,"S/. 7,264.19",30/01/2025,12/02/2025,"•	EXPERIENCIA LABORAL GENERAL MÍNIMA DE DOS (02) AÑOS, EN EL SECTOR PÚBLICO Y/O PRIVADO (ACREDITAR CON CONSTANCIA, CERTIFICADO Y/O DOCUMENTO ANÁLOGO).
•	EXPERIENCIA ESPECÍFICA MÍNIMA DE DOS (02) AÑOS EN FUNCIÓN O MATERIA CONTADOS A PARTIR DE LA OBTENCIÓN DE SU COLEGIATURA EN EL SECTOR PÚBLICO Y/O PRIVADO (NIVEL MÍNIMO DE ANALISTA LEGAL O SIMILARES) (ACREDITAR CON CONSTANCIA, CERTIFICADO Y/O DOCUMENTO ANÁLOGO). 
•	EXPERIENCIA EN LITIGACIÓN EN PROCESOS PENALES (ACREDITAR CON CONSTANCIA, CERTIFICADO Y/O DOCUMENTO ANÁLOGO).","•	TÍTULO PROFESIONAL EN DERECHO, COLEGIADO Y HABILITACIÓN VIGENTE (ACREDITAR CON COPIA DEL TÍTULO, COPIA DE COLEGIATURA Y CONSTANCIA DE HABILITACIÓN VIGENTE, LA QUE DEBERÁ ESTAR VIGENTE HASTA LA FINALIZACIÓN DE LA ETAPA DE LA EVALUACIÓN CURRICULAR, CONFORME AL CRONOGRAMA DEL PRESENTE PROCESO DE CONTRATACIÓN).","•	DIPLOMADO EN LA ESPECIALIDAD DE DERECHO PENAL Y/O DERECHO PROCESAL PENAL Y/O EJECUCIÓN PENAL Y/O ADOLESCENTES EN CONFLICTO CON LA LEY PENAL Y/O TÉCNICAS DE LITIGACIÓN ORAL, EL CUAL DEBERÁ TENER UNA DURACIÓN NO MENOR DE NOVENTA (90) HORAS LECTIVAS, POR TANTO, LOS CERTIFICADOS Y/O CONSTANCIAS DEBEN INDICAR EL NÚMERO DE HORAS LECTIVAS, CASO CONTRARIO NO SERÁN TOMADOS EN CUENTA. (ACREDITAR CON CONSTANCIA Y/O CERTIFICADO). •	DIPLOMADO EN MATERIAS VINCULADAS AL NUEVO CÓDIGO PROCESAL PENAL, EL CUAL DEBERÁ TENER UNA DURACIÓN NO MENOR DE NOVENTA (90) HORAS LECTIVAS, POR TANTO, LOS CERTIFICADOS Y/O CONSTANCIAS DEBEN INDICAR EL NÚMERO DE HORAS LECTIVAS, CASO CONTRARIO NO SERÁN TOMADOS EN CUENTA. (ACREDITAR CON CONSTANCIA Y/O CERTIFICADO). •	DIPLOMADO EN MATERIAS VINCULADAS AL NUEVO CÓDIGO PROCESAL CONSTITUCIONAL, EL CUAL DEBERÁ TENER UNA DURACIÓN NO MENOR DE NOVENTA (90) HORAS LECTIVAS, POR TANTO, LOS CERTIFICADOS Y/O CONSTANCIAS DEBEN INDICAR EL NÚMERO DE HORAS LECTIVAS, CASO CONTRARIO NO SERÁN TOMADOS EN CUENTA. (ACREDITAR CON CONSTANCIA Y/O CERTIFICADO).","•	CONOCIMIENTOS TÉCNICOS (*): CONOCIMIENTOS EN DERECHO PENAL, DERECHO PROCESAL PENAL, DERECHO DE EJECUCIÓN PENAL, DERECHO PROCESAL CONSTITUCINAL, DERECHO CONSTITUCIONAL, DERECHOS HUMANOS, CRIMINALÍSTICA, CÓDIGO DEL NIÑO Y EL ADOLESCENTE, CÓDIGO DE RESPONSABILIDAD PENAL DEL ADOLCESCENTES, LITIGACIÓN ORAL.  •	CONOCIMIENTOS DE OFIMÁTICA (*): PROCESADOR DE TEXTOS (WORD, OPEN OFFICE WRITE, ETC.), HOJA DE CÁLCULO (EXCEL, OPENCALC, ETC.) PROGRAMA DE PRESENTACIONES (POWER POINT, PREZI, ETC.),  TODOS CON NIVEL DE DOMINIO BÁSICO.",•	COMPROMISO. •	RESPONSABILIDAD. •	VOCACIÓN DE SERVICIO. •	ADAPTABILIDAD – FLEXIBILIDAD. •	COMUNICACIÓN. •	ORIENTACIÓN A RESULTADOS. •	CONCIENCIA SOCIAL. •	CAPACIDAD DE ANÁLISIS Y SÍNTESIS. •	NEGOCIACIÓN. •	PROACTIVIDAD.,DEFENSOR PUBLICO EN EL NUEVO CODIGO PROCESAL PENAL,Ministerio De Justicia Y Derechos Humanos,TACNA - TACNA
"https://www.munitacna,gob.pe",1,D.Leg 1057 - Determinado (Necesidad Transitoria)-008,"S/. 2,800.00",29/01/2025,11/02/2025,1 AÑO,TITULO PROFESIONAL UNIVERSITARIO,INGENIERIA DE SISTEMAS O AFINES,GESTION PUBLICA MUNICIPAL,"PLANIFICAR , EJECUTAR Y EVALUAR DEL PLAN DE ACCION DE VIDEO VIGILANCIA","ANALISTA  ""D""",Municipalidad Provincial De Tacna,TACNA - TACNA
"https://www.munitacna,gob.pe",1,D.Leg 1057 - Determinado (Necesidad Transitoria)-008,"S/. 2,800.00",29/01/2025,11/02/2025,1 AÑO,TITULO PROFESIONAL UNIVERSITARIO,CONTABILIDAD O AFINES,GESTION PUBLICA MUNICIPAL,RESPONSABLE DE LOS PROCESOS ADMINISTRATIVOS DEL COMPROMISO N°05-SIPCOP - M,"ANALISTA  ""E""",Municipalidad Provincial De Tacna,TACNA - TACNA
"https://www.munitacna,gob.pe",1,D.Leg 1057 - Determinado (Necesidad Transitoria)-008,"S/. 2,800.00",29/01/2025,11/02/2025,1 AÑO,TITULO PROFESIONAL UNIVERSITARIO,DERECHO,GESTION PUBLICA MUNICIPAL,BRINDAR ASESORAMIENTO LEGAL Y EMISION DE INFORMES,"ANALISTA  ""C""",Municipalidad Provincial De Tacna,TACNA - TACNA
"https://www.munitacna,gob.pe",1,D.Leg 1057 - Determinado (Necesidad Transitoria)-008,"S/. 2,800.00",29/01/2025,11/02/2025,1 AÑO,TITULO PROFESIONAL UNIVERSITARIO,"CONTABILIDAD, ADMINISTRACION O A FINES",GESTION PUBLICA MUNICIPAL,SELECCION Y PROCESAMIENTO DE INFORMACION DE LOS SERVICIOS DE LA SGSC,"ANALISTA  ""A""",Municipalidad Provincial De Tacna,TACNA - TACNA
"https://www.munitacna,gob.pe",1,D.Leg 1057 - Determinado (Necesidad Transitoria)-008,"S/. 2,800.00",29/01/2025,11/02/2025,1 AÑO,TITULO PROFESIONAL UNIVERSITARIO,COMUNICACION SOCIAL O AFINES,GESTION PUBLICA MUNICIPAL,REDACCION DE ACTIVIDADES REALIZADAS POR EL PERSONAL DE SERENAZGO DE LA SGSC,"ANALISTA  ""F""",Municipalidad Provincial De Tacna,TACNA - TACNA
"https://www.munitacna,gob.pe",4,D.Leg 1057 - Determinado (Necesidad Transitoria)-007,"S/. 2,800.00",29/01/2025,11/02/2025,1 AÑO,TITULO PROFESIONAL UNIVERSITARIO,INGENIERIA AMBIENTAL,GESTION PUBLICA MUNICIPAL,MONITOREO Y EVALUACION DE LA CALIDAD AMBIENTAL EN LA CIUDAD DE TACNA,ANALISTA,Municipalidad Provincial De Tacna,TACNA - TACNA
"https://www.munitacna,gob.pe",1,D.Leg 1057 - Determinado (Necesidad Transitoria)-008,"S/. 2,800.00",29/01/2025,11/02/2025,1 AÑO,TITULO PROFESIONAL UNIVERSITARIO,INGENIERIA CIVIL O AFINES,GESTION PUBLICA MUNICIPAL,PREVENCIONISTA DE SEGURIDAD Y SALUD EN EL TRABAJO,"ANALISTA ""B""",Municipalidad Provincial De Tacna,TACNA - TACNA
"https://www.munitacna,gob.pe",1,D.Leg 1057 - Determinado (Necesidad Transitoria)-008,"S/. 1,600.00",29/01/2025,11/02/2025,1 AÑO,TITULO DE TECNICO 3 AÑOS O 6 SEMESTRES ACADEMICOS UNIVERSITARIOS,"CONTABILIDAD, ADMINISTRACION O A FINES",GESTION PUBLICA MUNICIPAL,"PROYECTAR, EVALUAR Y EMITIR INFORMES Y UNA ADECVUADA ATENCION AL CIUDADANO",APOYO ADMINISTRATIVO TECNICO,Municipalidad Provincial De Tacna,TACNA - TACNA
"https://www.munitacna,gob.pe",1,D.Leg 1057 - Determinado (Necesidad Transitoria)-008,"S/. 2,250.00",29/01/2025,11/02/2025,6 MESES,BACHILLER UNIVERSITARIO,INGENIERIA COMERCIAL O A FINES,GESTION PUBLICA MUNICIPAL,REGISTRO Y ORDENAMIENTO DE EXPEDIENTES ADMINISTRATIVOS EMITIDOS Y REMITIDOS DE LA SGSC,"ASISTENTE PROFESIONAL  ""A""",Municipalidad Provincial De Tacna,TACNA - TACNA
"https://www.munitacna,gob.pe",1,D.Leg 1057 - Determinado (Necesidad Transitoria)-008,"S/. 2,250.00",29/01/2025,11/02/2025,6 MESES,BACHILLER UNIVERSITARIO,INGENIERIA COMERCIAL O A FINES,GESTION PUBLICA MUNICIPAL,CONTROL DE INGRESO Y EGRESO DE BIENES EN LA SGSC,"ASISTENTE PROFESIONAL  ""B""",Municipalidad Provincial De Tacna,TACNA - TACNA
"https://www.munitacna,gob.pe",1,D.Leg 1057 - Determinado (Necesidad Transitoria)-008,"S/. 2,250.00",29/01/2025,11/02/2025,6 MESES,TITULO PROFESIONAL UNIVERSITARIO,INGENIERIA ELECTRONICA O AFINES,GESTION PUBLICA MUNICIPAL,"MANTENIMIENTO DE CAMARAS, EQUIPOS Y RDES ELECTRONICAS DE LA CENTRAL DE VIDEO VIGILANCIA DE LA SGSC","ASISTENTE PROFESIONAL  ""C""",Municipalidad Provincial De Tacna,TACNA - TACNA
"https://www.munitacna,gob.pe",1,D.Leg 1057 - Determinado (Necesidad Transitoria)-008,"S/. 2,250.00",29/01/2025,11/02/2025,6 MESES,BACHILLER UNIVERSITARIO,INGENIERIA MECANICA O AFINES,GESTION PUBLICA MUNICIPAL,GESTION ADMINISTRATIVA DEL PARQUE AUTOMOTOR DE LA SGSC,"ASISTENTE PROFESIONAL  ""E""",Municipalidad Provincial De Tacna,TACNA - TACNA
"https://www.munitacna,gob.pe",1,D.Leg 1057 - Determinado (Necesidad Transitoria)-008,"S/. 2,250.00",29/01/2025,11/02/2025,6 MESES,TITULO PROFESIONAL UNIVERSITARIO,INGENIERIA DE SISTEMAS E INFORMATICA O AFINES,GESTION PUBLICA MUNICIPAL,"FORMULAR, EJECUTAR Y EVALUAR DEL PLAN DE ACCION PROVINCIAL DE SEGURIDAD CIUDADANA 2025","ASISTENTE PROFESIONAL  ""F""",Municipalidad Provincial De Tacna,TACNA - TACNA
"https://www.munitacna,gob.pe",1,D.Leg 1057 - Determinado (Necesidad Transitoria)-008,"S/. 2,250.00",29/01/2025,11/02/2025,1 AÑO,TITULO PROFESIONAL UNIVERSITARIO,"INGENIERIA COMERCIAL, ADMINISTRACION O AFINES",GESTION PUBLICA MUNICIPAL,PROCESOS ADMINISTRATIVOS DE ADQUISICION DE BIENES Y SERVICIOS DE LA SGSC,"ASISTENTE PROFESIONAL  ""G""",Municipalidad Provincial De Tacna,TACNA - TACNA
"https://www.munitacna,gob.pe",1,D.Leg 1057 - Determinado (Necesidad Transitoria)-008,"S/. 2,250.00",29/01/2025,11/02/2025,1 AÑO,TITULO PROFESIONAL UNIVERSITARIO,LICENCIADO EN COMUNICACION SOCIAL,GESTION PUBLICA MUNICIPAL,"REALIZAR DIOSEÑOS VIRTUALES COMO FLAYERS, TARJETAS DE SALUDO, ANIVERSARIOS, OBITUARIOS, CARTAS Y DEMAS SOPORTES COMUNICACIONALES","ASISTENTE PROFESIONAL  ""H""",Municipalidad Provincial De Tacna,TACNA - TACNA
"https://www.munitacna,gob.pe",1,D.Leg 1057 - Determinado (Necesidad Transitoria)-007,"S/. 3,750.00",29/01/2025,11/02/2025,4 AÑOS,TITULO PROFESIONAL UNIVERSITARIO,INGENIERIA AMBIENTAL,GESTION PUBLICA MUNICIPAL,ASEGURAR EL CUMPLIMIENTO DE PLANEFA Y LAS ACTIVIDADES CONTEMPLADAS EN EL POI-2025,ESPECIALISTA 2,Municipalidad Provincial De Tacna,TACNA - TACNA
"https://www.munitacna,gob.pe",1,D.Leg 1057 - Determinado (Necesidad Transitoria)-008,"S/. 2,250.00",29/01/2025,11/02/2025,6 MESES,TITULO PROFESIONAL UNIVERSITARIO,DERECHO,GESTION PUBLICA MUNICIPAL,SUPERVISION DE LAS ACTIVIDADES DEL COMPROMISO N°5,"ASISTENTE PROFESIONAL ""D""",Municipalidad Provincial De Tacna,TACNA - TACNA
"https://www.munitacna,gob.pe",1,D.Leg 1057 - Determinado (Necesidad Transitoria)-006,"S/. 2,250.00",28/01/2025,10/02/2025,6 MESES,BACHILLER UNIVERSITARIO,"CONTABILIDAD, ADMINISTRACION, DERECHO  O A FINES",GESTION PUBLICA MUNICIPAL,"PROYECCION DE DOCUMENTOS (INFORMES, CARTAS , RESOLIUCIONES , ETC)","ASISTENTE PROFESIONAL  ""C""",Municipalidad Provincial De Tacna,TACNA - TACNA
"https://www.munitacna,gob.pe",3,D.Leg 1057 - Determinado (Necesidad Transitoria)-006,"S/. 3,300.00",28/01/2025,10/02/2025,2 AÑOS,TITULO PROFESIONAL UNIVERSITARIO,ARQUITECTURA O INGENIERIA CIVIL,GESTION PUBLICA MUNICIPAL,"REVISION, EVALUACION  TYECNICA ADMINISTRATIVA DE LOS PROCEDIMIENTOS ESTABLECIDOS","ESPECIALISTA 1 ""E""",Municipalidad Provincial De Tacna,TACNA - TACNA
"https://www.munitacna,gob.pe",2,D.Leg 1057 - Determinado (Necesidad Transitoria)-006,"S/. 2,250.00",28/01/2025,10/02/2025,6 MESES,BACHILLER UNIVERSITARIO,"CONTABILIDAD, ADMINISTRACION, DERECHO O A FINES",GESTION PUBLICA MUNICIPAL,"APOYO EN LA EVALUACION DE PROCESOS DE ADJUDICACION, TRITULACION Y REVERSION DE LOTES","ASISTENTE PROFESIONAL ""A""",Municipalidad Provincial De Tacna,TACNA - TACNA
"https://www.munitacna,gob.pe",2,D.Leg 1057 - Determinado (Necesidad Transitoria)-006,"S/. 2,250.00",28/01/2025,10/02/2025,6 MESES,BACHILLER UNIVERSITARIO,"CONTABILIDAD, ADMINISTRACION DERECHO O A FINES",GESTION PUBLICA MUNICIPAL,REVISAR LA PROGRAMACION DE INSPECCIONES OCULARES CONFORME AL REGLAMENTO PROMUVI,"ASISTENTE PROFESIONAL ""B""",Municipalidad Provincial De Tacna,TACNA - TACNA
"https://www.munitacna,gob.pe",1,D.Leg 1057 - Determinado (Necesidad Transitoria)-005,"S/. 1,600.00",28/01/2025,10/02/2025,3 AÑOS,EGRESADO CARRERA UNIVERSITARIA,"CONTABILIDAD, ADMINISTRACION O A FINES",GESTION PUBLICA MUNICIPAL,APOYO EN LA REALIZACION DE CONVOCATORIAS CAS-TRANSITORIOS,APOYO ADMINISTRATIVO TECNICO,Municipalidad Provincial De Tacna,TACNA - TACNA
"https://www.munitacna,gob.pe",2,D.Leg 1057 - Determinado (Necesidad Transitoria)-006,"S/. 3,300.00",28/01/2025,10/02/2025,2 AÑOS,TITULO PROFESIONAL UNIVERSITARIO,ARQUITECTURA.,GESTION PUBLICA MUNICIPAL,"PROGRAMAR, ORGANIZAR Y ESTABLECER LOS PROCESOS PARA LA RECEPCION, EVALUACION Y ATENCION DE EXPEDIENTES","ESPECIALISTA 1  ""A""",Municipalidad Provincial De Tacna,TACNA - TACNA
"https://www.munitacna,gob.pe",1,D.Leg 1057 - Determinado (Necesidad Transitoria)-006,"S/. 1,600.00",28/01/2025,10/02/2025,1 AÑO,BACHILLER UNIVERSITARIO,"INGENIERIA COMERCIAL, ADMINISTRACION, ARQUITECTURA  O A FINES",GESTION PUBLICA MUNICIPAL,REALIZAR REGISTRO EN EL SISTRAM,APOYO ADMINISTRATIVO TECNICO,Municipalidad Provincial De Tacna,TACNA - TACNA
"https://www.munitacna,gob.pe",1,D.Leg 1057 - Determinado (Necesidad Transitoria)-006,"S/. 2,250.00",28/01/2025,10/02/2025,1 AÑO,BACHILLER UNIVERSITARIO,ARQUITECTURA O INGENIERIA,GESTION PUBLICA MUNICIPAL,PROCESAR TRAMITES PARA LA EMISION DE RESOLUCIONES,"ASISTENTE PROFESIONAL ""E""",Municipalidad Provincial De Tacna,TACNA - TACNA
"https://www.munitacna,gob.pe",1,D.Leg 1057 - Determinado (Necesidad Transitoria)-006,"S/. 2,250.00",28/01/2025,10/02/2025,1 AÑO,BACHILLER UNIVERSITARIO,ARQUITECTURA O INGENIERIA CIVIL,GESTION PUBLICA MUNICIPAL,PROYECCION DE INFORMES TECNICOS EVALUACION DE PROCEDIMIENTOS ADMINISTRATIVOS Y TECNICOS,"ASISTENTE PROFESIONAL ""H""",Municipalidad Provincial De Tacna,TACNA - TACNA
"https://www.munitacna,gob.pe",1,D.Leg 1057 - Determinado (Necesidad Transitoria)-006,"S/. 2,800.00",28/01/2025,10/02/2025,1 AÑO,TITULO PROFESIONAL UNIVERSITARIO,ARQUITECTURA.,GESTION PUBLICA MUNICIPAL,APLICAR LAS NORMAS DEL TITULO II DEL RNE,ANALISTA,Municipalidad Provincial De Tacna,TACNA - TACNA
"https://www.munitacna,gob.pe",1,D.Leg 1057 - Determinado (Necesidad Transitoria)-006,"S/. 2,250.00",28/01/2025,10/02/2025,1 AÑO,BACHILLER UNIVERSITARIO,ARQUITECTURA O INGENIERIA.,GESTION PUBLICA MUNICIPAL,RESPONSABLE DE EVALUACION Y EMITIR PROYECCION DE OPICNION DE MANERA TECNIC A LA INSTALACION DE LAS REDES,"ASISTENTE PROFESIONAL ""D""",Municipalidad Provincial De Tacna,TACNA - TACNA
"https://www.munitacna,gob.pe",1,D.Leg 1057 - Determinado (Necesidad Transitoria)-006,"S/. 2,250.00",27/01/2025,07/02/2025,1 AÑO,BACHILLER UNIVERSITARIO,ARQUITECTURA O INGENIERIA CIVIL,GESTION PUBLICA MUNICIPAL,PROYECCION DE INFORMES TECNICOS DE TRAMITES PROPIOS DE LA GERENCIA,"ASISTENTE PROFESIONAL  ""A""",Municipalidad Provincial De Tacna,TACNA - TACNA
"https://www.munitacna,gob.pe",1,D.Leg 1057 - Determinado (Necesidad Transitoria)-006,"S/. 2,250.00",27/01/2025,07/02/2025,1 AÑO,TITULO PROFESIONAL UNIVERSITARIO,"ADMINISTRACION, INFORMATICA O AFINES",GESTION PUBLICA MUNICIPAL,"PROYECCION DE INFORMES, MEMOS, OFICIOS, CARTAS Y OTROS","ASISTENTE PROFESIONAL ""B""",Municipalidad Provincial De Tacna,TACNA - TACNA
"https://www.munitacna,gob.pe",1,D.Leg 1057 - Determinado (Necesidad Transitoria)-006,"S/. 3,300.00",27/01/2025,07/02/2025,3 AÑOS,TITULO PROFESIONAL UNIVERSITARIO,DERECHO,GESTION PUBLICA MUNICIPAL,EVALUAR Y REVISAR EXPEDIENTES PARA EL PROCESO DE ADJUDICACION Y/O TITULACION,"ESPECIALISTA 1  ""A""",Municipalidad Provincial De Tacna,TACNA - TACNA
"https://www.munitacna,gob.pe",1,D.Leg 1057 - Determinado (Necesidad Transitoria)-006,"S/. 3,300.00",27/01/2025,07/02/2025,3 AÑOS,TITULO PROFESIONAL UNIVERSITARIO,DERECHO,GESTION PUBLICA MUNICIPAL,EVALUAR Y RESIOLVER CASOS DE PROCESOS DE REVERSION,"ESPECIALISTA 1  ""B""",Municipalidad Provincial De Tacna,TACNA - TACNA
"https://www.munitacna,gob.pe",1,D.Leg 1057 - Determinado (Necesidad Transitoria)-006,"S/. 3,750.00",27/01/2025,07/02/2025,3 AÑOS,TITULO PROFESIONAL UNIVERSITARIO,ARQUITECTURA,GESTION PUBLICA MUNICIPAL,APLICAR Y MONITOREAR LOS CONTENIDOS DEL RNE DEL PLAN DE DESARROLLO URBANO,"ESPECIALISTA 2  ""A""",Municipalidad Provincial De Tacna,TACNA - TACNA
"https://www.munitacna,gob.pe",1,D.Leg 1057 - Determinado (Necesidad Transitoria)-006,"S/. 3,750.00",27/01/2025,07/02/2025,3 AÑOS,TITULO PROFESIONAL UNIVERSITARIO,DERECHO,GESTION PUBLICA MUNICIPAL,INFORMES LEGALES PARA EL CUMPLIMIENTO DE DIRECTIUVA VIGENTE,"ESPECIALISTA 2 ""B""",Municipalidad Provincial De Tacna,TACNA - TACNA
"https://www.munitacna,gob.pe",1,D.Leg 1057 - Determinado (Necesidad Transitoria)-006,"S/. 3,750.00",27/01/2025,07/02/2025,3 AÑOS,TITULO PROFESIONAL UNIVERSITARIO,DERECHO,GESTION PUBLICA MUNICIPAL,"AUTORIZACION PARA IMPRESION DE TITULOS DE PROPIEDAD, ACTAS DE ADJUDICACION","ESPECIALISTA 2 ""C""",Municipalidad Provincial De Tacna,TACNA - TACNA
,1,276-1,"S/. 6,633.50",27/01/2025,07/02/2025,03 AÑOS INCLUIDO EL RESIDENTADO MEDICO,MEDICO CIRUJANO,MEDICO ESPECIALISTA EN PSIQUIATRÍA,"COMPROMISO DE LOS PROTOCOLOS DE ATENCIÓN, SEGÚN GUÍA DE PRACTICA CLÍNICA DEL MINSA","EMPATIA, COMUNICACION ASERTIVA, PROACTIVIDAD, COMPROMISO CON EL TRABAJO EN EQUIPO.",DEPARTAMENTO DE SALUD MENTAL,Region Tacna Hospital De Apoyo H.Unanue,TACNA - TACNA
,1,276-1,"S/. 6,633.50",27/01/2025,07/02/2025,03 AÑOS INCLUIDO EL RESIDENTADO MEDICO,MEDICO CIRUJANO,MEDICO ESPECIALISTA EN PEDIATRÍA Y/O NEONATOLOGIA,"MANEJO DE URGENCIA, EMERGENCIA PEDIÁTRICAS Y NEONATOLOGIAS MAS FRECUENTES","COMUNICACIÓN ASERTIVA, EMPATIA, TRABAJO EN EQUIPO, RESPONSABILIDAD, HONESTIDAD, VERACIDAD, TRABAJO BAJO PRESION",SERVICIO DE PEDIATRÍA,Region Tacna Hospital De Apoyo H.Unanue,TACNA - TACNA
https://www.redsaludtacna.gob.pe,1,276-002,"S/. 2,755.00",24/01/2025,06/02/2025,"EXPERIENCIA LABORAL GENERAL DE 1 AÑO EN EL SECTOR PUBLICO O PRIVADO.
EXPERIENCIA LABORAL ESPECÍFICA DE 6 MESES EN EL ÁREA ASISTENCIAL.",TITULO TÉCNICO/A EN ENFERMERÍA,NINGUNO,LOS CURSOS DEBEN TENER NO MENOS DE 12 HORAS DE CAPACITACIÓN Y LOS PROGRAMAS DE ESPECIALIZACIÓN NO MENOS DE 90 HORAS; ACREDITAR CON COPIA EL CERTIFICADO DE CONOCIMIENTO EN OFIMÁTICA NIVEL BÁSICO.,NINGUNO,TECNICO/A EN ENFERMERIA I,Red De Salud Tacna,TACNA - TACNA
https://www.munijorgebasadre.gob.pe,1,D.Leg 1057 - Determinado (Necesidad Transitoria)-012,"S/. 2,800.00",24/01/2025,06/02/2025,01 AÑO A MÁS DE EXPERIENCIA EN ADMINISTRACIÓN PÚBLICA Y/O CARGOS AFINES A LA FUNCIÓN.,BACHILLER Y/O TÉCNICO (03) AÑOS DE ESTUDIOS.,ACREDITAR CAPACITACIONES PARA EL PUESTO.,"CONOCIMIENTO EN OFIMÁTICA. WORD, EXCEL, POWER POIT","ANÁLISIS, ADAPTABILIDAD, COMUNICACIÓN ORAL, COOPERACIÓN, EMPATÍA, INICIATIVA, NEGOCIACIÓN, REDACCIÓN Y SÍNTESIS.",ASISTENTE ADMINISTRATIVO I,Municipalidad Provincial Jorge Basadre,TACNA - LOCUMBA
,1,276-1,"S/. 3,024.00",24/01/2025,06/02/2025,06 MESES,TÉCNICO EN ENFERMERÍA,-,"USO DE EPP, BIOSEGURIDAD, LIMPIEZA Y DESINFECCIÓN DE EQUIPO Y MATERIALES, PROMOCIÓN DEL BUEN TRATO Y ATENCIÓN INTEGRAL DE LA SALUD","TRABAJO EN EQUIPO, ORIENTACIÓN AL SERVICIO DEL CIUDADANO, COMPORTAMIENTO ÉTICO, COMUNICACIÓN AFECTIVA",SERVICIO DE ENFERMERÍA EN HOSPITALIZACION Y CUIDADOS CRITICOS,Region Tacna Hospital De Apoyo H.Unanue,TACNA - TACNA
https://www.munijorgebasadre.gob.pe,1,D.Leg 1057 - Determinado (Necesidad Transitoria)-011,"S/. 2,800.00",24/01/2025,06/02/2025,01 AÑO A MÁS DE EXPERIENCIA EN ADMINISTRACIÓN PÚBLICA Y/O CARGOS AFINES A LA FUNCIÓN.,BACHILLER Y/O TÉCNICO,ACREDITAR CAPACITACIONES PARA EL PUESTO.,"CONOCIMIENTO EN OFIMÁTICA. WORD, EXCEL, POWER POIT","ANÁLISIS, ADAPTABILIDAD, COMUNICACIÓN ORAL, COOPERACIÓN, EMPATÍA, INICIATIVA, NEGOCIACIÓN, REDACCIÓN Y SÍNTESIS.",ASISTENTE ADMINISTRATIVO I,Municipalidad Provincial Jorge Basadre,TACNA - LOCUMBA
https://www.educaciontacna.edu.pe,1,276-01,"S/. 1,136.00",24/01/2025,06/02/2025,"EXPERIENCIA LABORAL GENERAL Y ESPECÍFICA EN EL SECTOR PÚBLICO PÚBLICO O PRIVADO, PREFERENTEMENTE EN SECTOR EDUCACIÓN Y EN EL CARGO A DESEMPEÑAR.",SECUNDARIA COMPLETA,CURSOS Y ESPECIALIZACIÓN REFERENTE AL CARGO A DESEMPEÑAR,"GASFITERÍA, CARPINTERÍA, SEGURIDAD, PRIMEROS AUXILIOS U OTROS RELACIONADOS AL CARGO A DESEMPEÑAR",PROACTIVO - RESPONSABLE - TRABAJO A PRESIÓN Y EN EQUIPO,TRABAJADOR DE SERVICIO II,Direccion Regional De Educacion Tacna,TACNA - CANDARAVE
https://www.munijorgebasadre.gob.pe,1,D.Leg 1057 - Determinado (Necesidad Transitoria)-013,"S/. 2,700.00",24/01/2025,06/02/2025,02 AÑOS A MÁS DE EXPERIENCIA EN ADMINISTRACIÓN PÚBLICA Y/O CARGOS AFINES A LA FUNCIÓN.,SIN FORMACION,ACREDITAR CAPACITACIONES PARA EL PUESTO.,"CONOCIMIENTO EN OFIMÁTICA. WORD, EXCEL, POWER POIT","ANÁLISIS, ADAPTABILIDAD, COMUNICACIÓN ORAL, COOPERACIÓN, EMPATÍA, INICIATIVA, NEGOCIACIÓN, REDACCIÓN Y SÍNTESIS.",VERIFICADOR DE CAMPO I,Municipalidad Provincial Jorge Basadre,TACNA - LOCUMBA
https://www.gob.pe/institucion/sunarp/colecciones/2222-concursos-publicos-de-meritos-plazas-cas-zona-registral-n-xiii,1,D.Leg 1057 - Determinado (Suplencia)-3,"S/. 3,500.00",24/01/2025,06/02/2025,"EXPERIENCIA GENERAL (3) AÑOS, EXPERIENCIA ESPECIFICA (2) AÑOS DESDE EL NIVEL DE ESPECIALISTA, EXPERIENCIA EN EL SECTOR PÚBLICO DE (1) AÑO.","TITULADO EN  ARQUITECTURA, INGENIERÍA AGRÍCOLA, INGENIERÍA FORESTAL, INGENIERÍA AGRÓNOMA, INGENIERÍA CIVIL, INGENIERÍA GEOGRÁFICA, GEOGRAFÍA, INGENIERÍA TOPOGRÁFICA Y AGRIMENSURA, INGENIERÍA AMBIENTAL O INGENIERIA DE SISTEMAS","CURSOS Y/O DIPLOMADO EN CATASTRO REGISTRAL Y/O REGLAMENTO Y NORMATIVIDAD TÉCNICA DE SANEAMIENTO DE PREDIOS, CURSO Y/O DIPLOMADO EN SISTEMAS DE INFORMACIÓN GEOGRÁFICA -GIS(ARC GIS-ARCVIEW) Y/O MANEJO DE SOFTWARE GIS.","CONOCIMIENTOS EN CATASTRO REGISTRAL, GEOMÁTICA Y GIS, REGLAMENTO Y NORMATIVIDAD TÉCNICA DE SANEAMIENTO DE PREDIOS, MANEJO DE SOFTWARE CAD Y GIS.","RESPONSABILIDAD, CONFIDENCIALIDAD, ORGANIZACIÓN DE LA INFORMACIÓN, ORDEN, DINAMISMO Y CAPACIDAD PARA TRABAJAR BAJO PRESIÓN.",ESPECIALISTA DE CATASTRO,Zona Registral Nro.Xiii Sede Tacna,TACNA - TACNA
https://www.munijorgebasadre.gob.pe,3,D.Leg 1057 - Determinado (Necesidad Transitoria)-014,"S/. 2,300.00",24/01/2025,06/02/2025,06 MESES  A MÁS DE EXPERIENCIA LABORAL,SIN FORMACION,ACREDITAR CAPACITACIONES PARA EL PUESTO.,CONOCIMIENTO EN LAS LABORES A REALIZAR,"ANÁLISIS, ADAPTABILIDAD, COMUNICACIÓN ORAL, COOPERACIÓN, EMPATÍA, INICIATIVA, NEGOCIACIÓN, REDACCIÓN Y SÍNTESIS.",PERSONAL DE VIGILANCIA - GUARDIAN,Municipalidad Provincial Jorge Basadre,TACNA - LOCUMBA
https://www.munijorgebasadre.gob.pe,1,D.Leg 1057 - Determinado (Necesidad Transitoria)-024,"S/. 2,500.00",24/01/2025,06/02/2025,EXPERIENCIA LABORAL DE 01 AÑO A MAS,CERTIFICACIONES DE ENTRENAMIENTO O CAPACITACIÓN A FINES A LA FUNCIÓN A REALIZARSIN FORMACION,ACREDITAR CAPACITACIONES PARA EL PUESTO.,EXPERIENCIA A LAS FUNCIONES A REALIZAR.,"ANÁLISIS, ADAPTABILIDAD, COMUNICACIÓN ORAL, COOPERACIÓN, EMPATÍA, INICIATIVA, NEGOCIACIÓN, REDACCIÓN Y SÍNTESIS.",OPERADOR III-RETROEXCAVADORA,Municipalidad Provincial Jorge Basadre,TACNA - LOCUMBA
https://www.munijorgebasadre.gob.pe,6,D.Leg 1057 - Determinado (Necesidad Transitoria)-025,"S/. 2,500.00",24/01/2025,06/02/2025,EXPERIENCIA LABORAL DE 01 AÑO A MAS,CERTIFICACIONES DE ENTRENAMIENTO O CAPACITACIÓN A FINES A LA FUNCIÓN A REALIZAR,ACREDITAR CAPACITACIONES PARA EL PUESTO.,CONOCIMIENTO EN LAS LABORES A REALIZAR,"ANÁLISIS, ADAPTABILIDAD, COMUNICACIÓN ORAL, COOPERACIÓN, EMPATÍA, INICIATIVA, NEGOCIACIÓN, REDACCIÓN Y SÍNTESIS.",OPERADOR III-MAQUINARIA AGRICOLA,Municipalidad Provincial Jorge Basadre,TACNA - LOCUMBA
https://www.munijorgebasadre.gob.pe,1,D.Leg 1057 - Determinado (Necesidad Transitoria)-023,"S/. 2,500.00",24/01/2025,06/02/2025,EXPERIENCIA LABORAL DE 01 AÑOS A MAS,CERTIFICACIONES DE ENTRENAMIENTO O CAPACITACIÓN A FINES A LA FUNCIÓN A REALIZAR,ACREDITAR CAPACITACIONES PARA EL PUESTO.,CONOCIMIENTO EN LAS LABORES A REALIZAR,"ANÁLISIS, ADAPTABILIDAD, COMUNICACIÓN ORAL, COOPERACIÓN, EMPATÍA, INICIATIVA, NEGOCIACIÓN, REDACCIÓN Y SÍNTESIS.",OPERADOR III-CAMION,Municipalidad Provincial Jorge Basadre,TACNA - LOCUMBA
https://www.munijorgebasadre.gob.pe,1,D.Leg 1057 - Determinado (Necesidad Transitoria)-021,"S/. 3,100.00",24/01/2025,06/02/2025,EXPERIENCIA LABORAL DE 02 AÑOS A MAS,CERTIFICACIONES DE ENTRENAMIENTO O CAPACITACIÓN A FINES A LA FUNCIÓN A REALIZARSIN FORMACION,ACREDITAR CAPACITACIONES PARA EL PUESTO.,EXPERIENCIA A LAS FUNCIONES A REALIZAR.,"ANÁLISIS, ADAPTABILIDAD, COMUNICACIÓN ORAL, COOPERACIÓN, EMPATÍA, INICIATIVA, NEGOCIACIÓN, REDACCIÓN Y SÍNTESIS.",OPERADOR II-VOLQUETE,Municipalidad Provincial Jorge Basadre,TACNA - LOCUMBA
