job_posting_url,vacancies,job_posting_number,salary,start_publication_date,end_publication_date,required_experience,educational_background,specialization,required_knowledge,skills,job_title,public_institution,ubication
https://www.facebook.com/ugelascopeoficial/?locale=es_la,1,D.Leg 1057 - Determinado (Necesidad Transitoria)-002,"S/. 3,064.19",04/02/2025,17/02/2025,01 AÑO EN SECTOR PUBLICO O PRIVADO. EXPERIENCIA REQUERIDA: 06 MESES,LICENCIADO EN PSICOLOGÍA O  SOCIOLOGÍA,"CURSOS RELACIONADOS A:  CONVIVENCIA ESCOLAR, TUTORÍA Y ORIENTACIÓN EDUCATIVA; O  PROTECCIÓN Y DERECHOS DE NIÑOS, NIÑAS Y ADOLESCENTES O ATENCIÓN DE VÍCTIMAS DE VIOLENCIA; O  GESTIÓN DE PROYECTOS EDUCATIVOS, SOCIALES O COMUNITARIOS.","GESTIÓN DE LA CONVIVENCIA ESCOLAR, PAUTAS PARA LA PREVENCIÓN Y ATENCIÓN DE LA VIOLENCIA EN LAS INSTITUCIONES EDUCATIVAS.","EMPATÍA, ASERTIVIDAD, ANÁLISIS, BUENA COMUNICACIÓN ORAL Y ESCRITA, ORGANIZACIÓN DE LA INFORMACIÓN",PROFESIONAL I PARA EQUIPO  ITINERANTE DE CONVIVENCIA ESCOLAR,Unidad De Gestion Educativa Local De Ascope,LA LIBERTAD - ASCOPE
https://www.facebook.com/ugelascopeoficial/?locale=es_la,1,D.Leg 1057 - Determinado (Necesidad Transitoria)-002,"S/. 1,414.19",04/02/2025,17/02/2025,01 AÑO EN EL SECTOR PUBLICO O PRIVADO. EXPERIENCIA REQUERIDA 06 MESES EN LABORES DE LIMPIEZA Y/O MANTENIMIENTO,EDUCACION SECUNDARIA,NO APLICA,"CONOCIMIENTOS BÁSICOS DE ELECTRICIDAD, GASFITERÍA Y/O CARPINTERÍA (DESEABLE, NO EXCLUYENTE PARA LA CONTRATACIÓN)","ORDEN, INICIATIVA, COMPROBACIÓN DE OBJETOS, ATENCIÓN.",PERSONAL DE LIMPIEZA Y  MANTENIMIENTO,Unidad De Gestion Educativa Local De Ascope,LA LIBERTAD - ASCOPE
https://www.facebook.com/ugelascopeoficial/?locale=es_la,10,D.Leg 1057 - Determinado (Necesidad Transitoria)-002,"S/. 2,764.19",04/02/2025,17/02/2025,01 AÑO EN EL SECTOR PUBLICO O PRIVADO. EXPERIENCIA REQUERIDA: 10 MESES EN INSTITUCIONES EDUCATIVAS O PROYECTOS EDUCATIVOS O PROGRAMAS SOCIALES.,LICENCIADO EN PSICOLOGIA,CAPACITACIÓN EN HABILIDADES SOCIALES Y/O ACTIVIDADES CON ADOLESCENTES.,"CONOCIMIENTO SOBRE GESTIÓN: PLANIFICACIÓN, ORGANIZACIÓN Y PROMOCIÓN DE LA CONVIVENCIA DEMOCRÁTICA E INTERCULTURAL EN LA IE.  CONOCIMIENTO EN ESTRATEGIAS DE PREVENCIÓN EN ASPECTOS SOCIOEMOCIONALES.  CONOCIMIENTO GENERAL DE LA NORMATIVIDAD Y PROCESOS EDUCATIVOS.  CONOCIMIENTO DE ENFOQUES DE DERECHO Y GÉNERO.  CONOCIMIENTO EN ARTICULACIÓN CON INSTITUCIONES PÚBLICAS Y PRIVADAS.  CONOCIMIENTOS SOBRE GESTIÓN ESCOLAR Y FUNCIONAMIENTO DE LAS IIEE JEC.","INICIATIVA, ANÁLISIS, CONTROL, PLANIFICACIÓN.",PSICOLOGO,Unidad De Gestion Educativa Local De Ascope,LA LIBERTAD - ASCOPE
https://www.facebook.com/ugelascopeoficial/?locale=es_la,6,D.Leg 1057 - Determinado (Necesidad Transitoria)-002,"S/. 1,414.19",04/02/2025,17/02/2025,01 AÑO EN EXPERIENCIA SECTOR PUBLICO O PRIVADO. EXPERIENCIA REQUERIDA 06 MESES EN MANTENIMIENTO O LIMPIEZA,EDUCACION SECUNDARIA,NO APLICA,"MANEJO DE INSUMOS Y RECURSOS DE LIMPIEZA Y MANTENIMIENTO.  MANEJO DE PROCEDIMIENTOS PARA LA DESINFECCIÓN DE AMBIENTES, EQUIPOS Y MATERIALES DE LA IE.  CONOCIMIENTOS SOBRE EL FUNCIONAMIENTO DE LAS IIEE JEC.","ORDEN, INICIATIVA, COMPROBACIÓN DE OBJETOS, ATENCIÓN.",PERSONAL DE MANTENIMIENTO,Unidad De Gestion Educativa Local De Ascope,LA LIBERTAD - ASCOPE
https://www.facebook.com/ugelascopeoficial/?locale=es_la,8,D.Leg 1057 - Determinado (Necesidad Transitoria)-002,"S/. 1,614.19",04/02/2025,17/02/2025,"-12 MESES EN EL SECTOR PUBLICO O PRIVADO. EXP. REQUERIDA: 0 MESES COMO COORDINADOR O ASISTENTE DE SOPORTE TÉCNICO DE LOS RECURSOS TECNOLÓGICOS EN IIEE O ENTIDAD PÚBLICA O PRIVADA. EN EL CASO DE PROFESOR EN 
COMPUTACIÓN E INFORMÁTICA O BACHILLER EN EDUCACIÓN: 10 MESES COMO DOCENTE A CARGO DEL AULA DE INNOVACIÓN O LA QUE HAGA SUS VECES.",TECNICA SUPERIOR (3 O 4 AÑOS). COMPUTACIÓN E INFORMÁTICA O  COMPUTACIÓN O INFORMÁTICA O EN  EDUCACIÓN CON ESPECIALIDAD DE  COMPUTACIÓN O INFORMÁTICA.,CURSOS DE OFIMÁTICA COMO MÍNIMO DE 90 HORAS O CURSO DE REPARACIÓN O MANTENIMIENTO DE COMPUTADORAS.  CURSO O DIPLOMADO O CAPACITACIÓN DE INTEGRACIÓN DE LAS TIC EN EL PROCESO DE ENSEÑANZA-APRENDIZAJE O AFINES COMO MÍNIMO DE 90 HORAS.,"MANEJO DE ESTRATEGIAS Y HERRAMIENTAS DE USO DE TECNOLOGÍAS DE LA INFORMACIÓN Y COMUNICACIÓN.  CONOCIMIENTO Y MANEJO DE APLICACIONES Y SOLUCIONES TECNOLÓGICAS (PLATAFORMAS, APLICATIVOS, ENTRE OTROS).","INICIATIVA, ANÁLISIS, CONTROL, PLANIFICACIÓN.",COORDINADOR(A) DE INNOVACIÓN Y  SOPORTE TECNOLÓGICO,Unidad De Gestion Educativa Local De Ascope,LA LIBERTAD - ASCOPE
https://www.facebook.com/ugelascopeoficial/?locale=es_la,1,D.Leg 1057 - Determinado (Necesidad Transitoria)-002,"S/. 3,064.19",04/02/2025,17/02/2025,01 AÑO SECTOR PUBLICO O PRIVADO. EXPERIENCIA REQUERIDA: 06 MESES,LICENCIADO PROFESOR O DOCENTE.,"CURSOS RELACIONADOS A:  CONVIVENCIA ESCOLAR, TUTORÍA Y ORIENTACIÓN EDUCATIVA; O  PROTECCIÓN Y DERECHOS DE NIÑOS, NIÑAS Y ADOLESCENTES O ATENCIÓN DE VÍCTIMAS DE VIOLENCIA; O  GESTIÓN DE PROYECTOS EDUCATIVOS, SOCIALES O COMUNITARIOS","GESTIÓN DE LA CONVIVENCIA ESCOLAR, PAUTAS PARA LA PREVENCIÓN Y ATENCIÓN DE LA VIOLENCIA EN LAS INSTITUCIONES EDUCATIVAS","EMPATÍA, ASERTIVIDAD, ANÁLISIS, BUENA COMUNICACIÓN ORAL Y ESCRITA, ORGANIZACIÓN DE LA INFORMACIÓN.",PROFESIONAL II PARA EQUIPO ITINERANTE DE CONVIVENCIA ESCOLAR,Unidad De Gestion Educativa Local De Ascope,LA LIBERTAD - ASCOPE
https://www.facebook.com/ugelascopeoficial/?locale=es_la,3,D.Leg 1057 - Determinado (Necesidad Transitoria)-002,"S/. 2,764.19",04/02/2025,17/02/2025,01 AÑO EN EL SECTOR PUBLICO O PRIVADO. EXPERIENCIA REQUERIDA: 06 MESES EN INSTITUCIÓN EDUCATIVA O PROYECTOS EDUCATIVOS,LICENCIADO EN PSICOLOGIA,"CURSOS RELACIONADOS A:  CONVIVENCIA ESCOLAR, TUTORÍA Y ORIENTACIÓN EDUCATIVA; O  PROTECCIÓN Y DERECHOS DE NIÑOS, NIÑAS Y ADOLESCENTES O ATENCIÓN DE LA VIOLENCIA; O  DISEÑO, GESTIÓN O MONITOREO DE PROYECTOS EDUCATIVOS, SOCIALES O COMUNITARIOS.  NO  APLICA AVANZADO IDIOMAS NO APLICA","GESTIÓN DE LA CONVIVENCIA ESCOLAR, PAUTAS PARA LA PREVENCIÓN Y ATENCIÓN DE LA VIOLENCIA EN LAS INSTITUCIONES EDUCATIVAS.","EMPATÍA, ASERTIVIDAD, ANÁLISIS, BUENA COMUNICACIÓN ORAL Y ESCRITA, ORGANIZACIÓN DE LA INFORMACIÓN",PROFESIONAL EN PSICOLOGÍA,Unidad De Gestion Educativa Local De Ascope,LA LIBERTAD - ASCOPE
https://www.facebook.com/ugelascopeoficial/?locale=es_la,9,D.Leg 1057 - Determinado (Necesidad Transitoria)-002,"S/. 2,964.19",04/02/2025,17/02/2025,01 AÑO Y 06 MESES EN EL SECTOR PUBLICO O PRIVADO. EXPERIENCIA REQUERIDA 01 AÑO DE EXPERIENCIA EN EL TRABAJO CON PERSONAS CON DISCAPACIDAD.,LICENCIADO TECNÓLOGO MÉDICO EN/  ÁREA/MENCIÓN/ESPECIALIDAD  TERAPIA FÏSICA O TERAPIA  FISICA Y REHABILITACIÓN O  TERAPIA OCUPACIONAL O  TERAPIA DE LENGUAJE,NO APLICA,COMPETENCIAS OCUPACIONALES PARA LA ATENCIÓN DE PERSONAS EN CONDICIÓN DE DISCAPACIDAD. TRABAJO CON FAMILIAS. DESARROLLO EVOLUTIVO,"COMUNICACIÓN ORAL, COOPERACIÓN, INICIATIVA, EMPATÍA Y TRABAJO EN EQUIPO.","PROFESIONAL EN TECNOLOGÍA MÉDICA   CON MENCIÓN EN TERAPIA FÍSICA,  OCUPACIONAL O DE LENGUAJE PARA  CEBE",Unidad De Gestion Educativa Local De Ascope,LA LIBERTAD - ASCOPE
https://www.facebook.com/ugelascopeoficial/?locale=es_la,1,D.Leg 1057 - Determinado (Necesidad Transitoria)-001,"S/. 1,289.19",04/02/2025,17/02/2025,2 AÑOS DE EXPERIENCIA LABORAL; YA SEA EN EL SECTOR PÚBLICO O PRIVADO,"TÍTULO/LICENCIATURA EN: CONTABILIDAD, ECONOMÍA, ADMINISTRACIÓN Y/O AFINES.","DIPLOMADO, CURSO O TALLER EN SISTEMA DE TESORERÍA","SISTEMA DE CONTABILIDAD Y TESORERÍA, ARQUEO DE CAJA, CONCILIACIÓN DE ESTADOS DE CUENTA, DOCUMENTOS VALORADOS","ANÁLISIS, ORGANIZACIÓN DE LA INFORMACIÓN, PREDISPOSICIÓN, PLANIFICACIÓN Y CONTROL",RESPONSABLE DE CAJA,Unidad De Gestion Educativa Local De Ascope,LA LIBERTAD - ASCOPE
https://www.facebook.com/ugelascopeoficial/?locale=es_la,1,D.Leg 1057 - Determinado (Necesidad Transitoria)-001,"S/. 2,264.19",04/02/2025,17/02/2025,2 AÑOS DE EXPERIENCIA LABORAL; YA SEA EN EL SECTOR PÚBLICO O PRIVADO,TÍTULO/LICENCIATURA EN: INGENIERÍA DE COMPUTACIÓN Y SISTEMAS O PROFESIONAL TÉCNICO EN COMPUTACIÓN E INFORMÁTICA,NO APLICA,"GESTIÓN PÚBLICA, LEGISLACIÓN LABORAL, LEY N°30057- LEY DEL SERVICIO CIVIL Y DEL SECTOR PUBLICO Y/O PRIVADO","ANÁLISIS, ORGANIZACIÓN DE LA INFORMACIÓN, PREDISPOSICIÓN, PLANIFICACIÓN Y CONTROL",RESPONSABLE DE IMAGEN INSTITUCIONAL Y TECNOLOGÍAS DE LA INFORMACIÓN,Unidad De Gestion Educativa Local De Ascope,LA LIBERTAD - ASCOPE
https://www.gob.pe/ugel03tno,1,D.Leg 1057 - Determinado (Suplencia)-001,"S/. 2,264.19",04/02/2025,17/02/2025,"EXPERIENCIA LABORAL GENERAL: NO MENOR DE DOS (02) AÑOS EN EL SECTOR PÚBLICO.
EXPERIENCIA ESPECIFICA: DOS (02) AÑOS DE EXPERIENCIA LABORAL ESPECIALIZADA EN EL ÁREA FINANCIERA.
EXPERIENCIA REQUERIDA PARA EL PUESTO: COMO MÍNIMO (02) AÑOS EN EL SECTOR PÚBLICO.","TITULO O LICENCIATURA COMO CONTADOR PÚBLICO, ECONOMISTA O LICENCIADO EN ADMINISTRACIÓN","CURSOS, DIPLOMADOS O PROGRAMAS DE ESPECIALIZACIÓN EN PLANIFICACIÓN, PRESUPUESTO Y/O AFINES.","SISTEMA NACIONAL DE PRESUPUESTO, GESTIÓN PÚBLICA, PLANEAMIENTO ESTRATÉGICO Y PRESUPUESTO PÚBLICO.","ANÁLISIS, ORGANIZACIÓN DE LA INFORMACIÓN, PLANIFICACIÓN, CONTROL, TRABAJO EN EQUIPO",ESPECIALISTA EN FINANZAS I,Unidad De Gestion Educativa Local N° 03  Unidad Ejecutora Educacion 315: Trujillo Nor Oeste,LA LIBERTAD
https://www.facebook.com/ugel-viru-1522402974747239/?fb_dtsg_ag=adyzbpwx9ojhihlw_dg-scl3im0af8fa-1zh013rk2byow%3aadwnhrzxjocx3xufpd_f4zetcge80hzi07wtfhsvgzfpla,1,D.Leg 1057 - Determinado (Suplencia)-0001,"S/. 1,990.19",04/02/2025,17/02/2025,UN (01) AÑO EXPERIENCIA GENERAL EN EL SECTOR PÚBLICO Y /O PRIVADO,UN (01) AÑO EXPERIENCIA ESPECIFICA EN PUESTOS SIMILARES EN EL SECTOR PÚBLICO Y /O PRIVADO,-,"CERTIFICADO EN GESTIÓN PÚBLICA Y MODERNIZACIÓN DEL ESTADO CURSO DE GESTIÓN DEL AIRHSP, MCAR Y MCPP WEB CURSO EN INGRESO DE PERSONAL Y/O COMPENSACIÓN LABORAL EN EL SECTOR PÚBLICO CERTIFICADO EN ARTICULACIÓN DE INSTRUMENTOS DEL ESTADO","LÍDER, GESTOR CON CAPACIDAD PARA TRABAJAR EN EQUIPO Y BAJO PRESIÓN, CONCERTADOR Y GRAN CAPACIDAD PARA APRENDER Y GESTIONAR SITUACIONES CAMBIANTES.",ESPECIALISTA ADMINISTRATIVO I - SUP,Unidad De Gestion Educativa Local De Viru,LA LIBERTAD - VIRU
https://www.gob.pe/institucion/indecopi/informes-publicaciones/5423777-incorporacion-del-capital,1,D.Leg 1057 - Determinado (Necesidad Transitoria)-53,"S/. 2,000.00",04/02/2025,17/02/2025,EXPERIENCIA LABORAL GENERAL: UN (01) AÑO.,EGRESADO EN DERECHO,NO APLICA.,"DERECHO ADMINISTRATIVO O PROTECCIÓN AL CONSUMIDOR O COMPETENCIA DESLEAL O ELIMINACIÓN DE BARRERAS BUROCRÁTICAS. CONOCIMIENTOS DE OFIMÁTICA (PROCESADOR DE TEXTOS, HOJAS DE CÁLCULO Y PROGRAMA DE PRESENTACIONES) A NIVEL BÁSICO.","ORIENTACIÓN A RESULTADOS, VOCACIÓN DE SERVICIO Y TRABAJO EN EQUIPO.",ASISTENTE LEGAL,Indecopi,LA LIBERTAD - TRUJILLO
https://aplicativo.pj.gob.pe/psep/wfrmconvocatoriasv.aspx?tcon=c,1,D.Leg 1057 - Determinado (Necesidad Transitoria)-009,"S/. 2,572.00",04/02/2025,17/02/2025,OBLIGATORIO: EXPERIENCIA LABORAL DE UN (01) AÑO DESARROLLANDO LABORES AFINES AL PUESTO. DESEABLE: EXPERIENCIA LABORAL EN EL ÁREA LEGAL COMO ASISTENTE EN EL SECTOR PÚBLICO.,OBLIGATORIO: OCTAVO CICLO DE DERECHO (CULMINADO).,"DESEABLE: CURSOS DE ESPECIALIZACIÓN O DIPLOMADOS EN DERECHO DE FAMILIA (SEGÚN LA CANTIDAD DE HORAS MÍNIMAS ESTABLECIDAS EN LAS BASES).  DESEABLE: CURSO DE OFIMÁTICA (PROCESADOR DE TEXTOS, HOJA DE CÁLCULO, PRESENTACIÓN DE DIAPOSITIVAS).",CONOCIMIENTOS EN DERECHO DE FAMILIA. CONOCIMIENTOS EN OFIMÁTICA A NIVEL USUARIO.,"ADAPTABILIDAD, ANÁLISIS, REDACCIÓN, COMPRENSIÓN LECTORA, AUTOCONTROL.",ASISTENTE JUDICIAL,Poder Judicial,LA LIBERTAD - TRUJILLO
https://satt.gob.pe/servicios/bolsa-de-trabajo,4,D.Leg 1057 - Determinado (Necesidad Transitoria)-1,"S/. 1,500.00",03/02/2025,14/02/2025,"EXPERIENCIA LABORAL GENERAL: NO MENOS DE UN (01) AÑO
EXPERIENCIA ESPECIFICA: NO MENOR A SEIS (06) MESES EN EL PUESTO O REALIZANDO FUNCIONES SIMILARES.
EXPERIENCIA ESPECIFICA EN EL SECTOR PUBLICO: NO MENOR DE TRES (03) MESES","EGRESADO UNIVERSITARIO DE ADMINISTRACIÓN, CONTABILIDAD O ECONOMIA.",CURSO EN WORD Y EXCEL NIVEL BÁSICO.,CONOCIMIENTO DEL PUESTO AL QUE POSTULA,"RAZONAMIENTO ANALÍTICO; TRABAJO EN EQUIPO; RESILENCIA, ORGANIZADO, COMUNICATIVO, RESPONSABLE, CAPACIDAD PARA RESOLVER PROBLEMAS.",APOYO A LA OFICINA DE CONTROL DE DEUDA,Serv.De Administracion Tributaria-Trujil,LA LIBERTAD - TRUJILLO
https://satt.gob.pe/servicios/bolsa-de-trabajo,3,D.Leg 1057 - Determinado (Necesidad Transitoria)-1,"S/. 2,300.00",03/02/2025,14/02/2025,"EXPERIENCIA LABORAL GENERAL: MINIMO DE UN (01) AÑO. 
EXPERIENCIA LABORAL ESPECIFICA: MINIMO UN (01) AÑO","EGRESADO UNIVERSITARIO DE INGENIERIA DE SISTEMAS, INGENIERIA INFORMATICA O AFINES.",CURSO DE DESARROLLO WEB; CURSO SQL SERVER,"LENGUAJE DE PROGRAMACION WEB COMO HTMLS, CSS3 Y JAVA SCRIPT, ASI COMO FRAMEWORK, FRONTEND (ANGULAR) O SUPERIOR Y BIBLIOTECAS RELEVANTES; CONOCIMIENTO AVANZANDO EN BLACKEND (.NET 6 O SUPERIOR); EN BASE DATOS SQL SERVER Y/U ORACLE. USO DE CONTROL DE ERRORES. GESTIÓN DE CONEXIONES Y CONSULTAS A BASES DE DATOS A TRAVES DE ADO.NET. MANEJO DE HERRAMIENTAS DE LOG EN BASE DE DATOS COMO SERILOG U OTRAS, QUE PERMITEN REGISTRAR NIVELES DE ERROR ALTOS. INCLUSION DE PATRONES DE DISEÑO: INYECCION DE DEPENDENCIA, SINGLETON, REPOSITORY ENTRE OTROS. USO DE SEGURIDAD EN LA AUTENTICACION DEL USUARIO COMO USARIO, CONTRASEÑA, Y CODIGOS CAPTCHA. USO DE OTROS FACTORES DE AUTOTENTICACION. INTEGRACION DE CODIGO FUENTE A SOTFWARE CONTROLADOR DE VERSIONES. USO DE LIBRERIAS O PAQUETES OPEN SOURCE EN .NET CORE O PLATAFORMA ANGULAR QUE PERMITAN SU USO Y DISTRIBUCION SIN COSTO ALGUNO. MANEJO DE CSS, JAVASCRIPT, BOOTSTRAP RESPONSIVE O SIMILAR. CONOCIMIENTO AVANZADO EN VISUAL BASIC 2010 O SUPERIOR","PROACTIVO, INICIATIVA, RESPONSABILIDAD, CAPACIDAD PARA TRABAJAR EN EQUIPO Y BAJO PRESION, COMUNICATIVO.",APOYO COMO ANALISTA PROGRAMADOR,Serv.De Administracion Tributaria-Trujil,LA LIBERTAD - TRUJILLO
https://www.facebook.com/redintegradadesaludpacasmayo,1,D.Leg 1057 - Indeterminado-001,"S/. 2,410.00",03/02/2025,14/02/2025,EXPERIENCIA MÍNIMA DE UN (03) AÑOS DE EXPERIENCIA LABORAL EJERCIENDO COMO TÉCNICO EN FARMACIA,TÍTULO DE TECNICO EN FARMACIA,-,""" CAPACITACIÓN EN BUENAS PRACTICAS DE ALMACENAMIENTO ORIENTACIÓN EN DISPENSACION DE PRODUCTOS FARMACEUTICOS, DISPOSITIVOS MEDICOS Y PRODUCTOS SANITARIOS.""","ORIENTACIÓN AL SERVICIO											 ORIENTACIÓN A RESULTADOS											 ACTITUD DE SERVICIO											 AMPLIO CRITERIO, ORGANIZACIÓN, INICIATIVA Y RESPONSABILIDAD EN EL DESEMPEÑO DE SUS LABORES											 COMPROMISO											 RESPONSABILIDAD											 ADAPTABILIDAD - FLEXIBILIDAD											 TRABAJO EN EQUIPO											 MANEJO ADECUADO DE LAS RELACIONES INTERPERSONALES											 CUMPLIMIENTO DE METAS ESTABLECIDAS POR LA RED											 PROACTIVO											 CAPACIDAD ANALÍTICA Y ORGANIZATIVA",TECNICO EN FARMACIA,Ais Utes Pacasmayo,LA LIBERTAD - PACASMAYO
https://aplicativo.pj.gob.pe/psep/wfrmconvocatoriasv.aspx?tcon=c,1,D.Leg 1057 - Determinado (Necesidad Transitoria)-004,"S/. 2,572.00",03/02/2025,14/02/2025,OBLIGATORIO: EXPERIENCIA DE UN (01) AÑO DESARROLLANDO LABORES AFINES AL PUESTO. DESEABLE: EXPERIENCIA LABORAL EN EL ÁREA LEGAL COMO ASISTENTE EN EL SECTOR PÚBLICO.,OBLIGATORIO: OCTAVO CICLO DE DERECHO (CULMINADO).,"DESEABLE: CURSOS DE ESPECIALIZACIÓN Y/O DIPLOMADOS EN DERECHO LABORAL, DERECHO ADMINISTRATIVO Y/O CONTENCIOSO ADMINISTRATIVO (SEGÚN LA CANTIDAD DE HORAS MÍNIMAS ESTABLECIDAS EN LAS BASES). DESEABLE: CURSO DE OFIMÁTICA (PROCESADOR DE TEXTOS, HOJA DE CÁLCULO, PRESENTACIÓN DE DIAPOSITIVAS).","CONOCIMIENTOS EN DERECHO LABORAL, DERECHO ADMINISTRATIVO Y/O CONTENCIOSO ADMINISTRATIVO. CONOCIMIENTOS EN OFIMÁTICA A NIVEL USUARIO.","ADAPTABILIDAD, ANÁLISIS, REDACCIÓN, COMPRENSIÓN LECTORA, AUTOCONTROL",ASISTENTE JUDICIAL,Poder Judicial,LA LIBERTAD - TRUJILLO
https://www.facebook.com/redintegradadesaludpacasmayo,1,D.Leg 1057 - Indeterminado-001,"S/. 3,750.00",03/02/2025,14/02/2025,"EXPERIENCIA MÍNIMA DE 03 AÑOS DE EXPERIENCIA LABORAL EN EL DESEMPEÑO DE FUNCIONES DE LA PROFESIÓN, INCLUIDO EL SERUMS.",LICENCIADA/O EN ENFERMERÍA,-,CONOCIMIENTOS DE LAS ESTRATEGIAS SANITARIAS SEGÚN NORMAS TÉCNICAS VIGENTES DEL MINSA,"ORIENTACIÓN AL SERVICIO											 ORIENTACIÓN A RESULTADOS											 ACTITUD DE SERVICIO											 AMPLIO CRITERIO, ORGANIZACIÓN, INICIATIVA Y RESPONSABILIDAD EN EL DESEMPEÑO DE SUS LABORES											 COMPROMISO											 RESPONSABILIDAD											 ADAPTABILIDAD - FLEXIBILIDAD											 TRABAJO EN EQUIPO											 MANEJO ADECUADO DE LAS RELACIONES INTERPERSONALES											 CUMPLIMIENTO DE METAS ESTABLECIDAS POR LA RED											 PROACTIVO											 CAPACIDAD ANALÍTICA Y ORGANIZATIVA",ENFERMERÍA,Ais Utes Pacasmayo,LA LIBERTAD - PACASMAYO
https://webmail.munisanjosepacasmayo.gob.pe,1,D.Leg 1057 - Determinado (Necesidad Transitoria)-002,"S/. 1,700.00",03/02/2025,14/02/2025,UN (01) AÑO EN EL SECTOR PÚBLICO Y/O PRIVADO,"-	BACHILLER, TÍTULO PROFESIONAL OTORGADO POR UNIVERSIDAD EN LA CARRERA DE CONTABILIDAD, ECONOMÍA, ADMINISTRACIÓN, INGENIERÍA INDUSTRIAL Y/O AFINES A LA FUNCIÓN QUE VA A DESARROLLAR",-	CURSO DE ASISTENTE ADMINISTRATIVO EN LOGÍSTICA Y ALMACENES. -	ADMINISTRACIÓN Y GESTIÓN PÚBLICA REGIONAL Y MUNICIPAL.,"D.	PLANIFICAR, REQUERIR Y CONTROLAR LOS SERVICIOS GENERALES PARA DARLE MANTENIMIENTO A LAS INSTALACIONES DE LA MUNICIPALIDAD, HACIENDO USO DEL PRESUPUESTO INSTITUCIONAL ASIGNADO, PARA LA CONTRATACIÓN DE BIENES Y SERVICIOS NECESARIOS PARA SU FUNCIONAMIENTO.",PRO ACTIVIDAD - RESPONSABILIDAD - TRABAJO EN EQUIPO - PUNTUALIDAD,ASISTENTE DE LA OFICINA DE LOGISTICA Y CONTROL PATRIMONIAL,Municipalidad Distrital De San Jose,LA LIBERTAD - SAN JOSE
https://webmail.munisanjosepacasmayo.gob.pe,1,D.Leg 1057 - Determinado (Necesidad Transitoria)-002,"S/. 1,700.00",03/02/2025,14/02/2025,DOS (02) AÑOS EN EL SECTOR PÚBLICO Y/O PRIVADO,"-	BACHILLER O TÍTULO PROFESIONAL OTORGADO POR UNIVERSIDAD EN LAS CARRERAS SOCIALES, ADMINISTRACIÓN Y/O AFINES A LA FORMACIÓN, O SU EQUIVALENCIA",DIPLOMADO: -	GESTIÓN PÚBLICA -	GESTIÓN PÚBLICA EN CONFLICTOS SOCIALES -	PROGRAMAS SOCIALES.CURSO DE ESPECIALIZACIÓN: -	EMPADRONAMIENTO DE HOGARES EN EL MARCO DEL SISTEMA DE FOCALIZACIÓN DE HOGARES SISFOH.,"A.	PLANIFICAR, EJECUTAR Y CONDUCIR OPERATIVAMENTE LA APLICACIÓN DE LA FSU EN SU JURISDICCIÓN.",PRO ACTIVIDAD - RESPONSABILIDAD - TRABAJO EN EQUIPO - PUNTUALIDAD,JEFE DE LA UNIDAD DE LOCAL DE EMPADRONAMIENTO - SISFOH,Municipalidad Distrital De San Jose,LA LIBERTAD - SAN JOSE
https://webmail.munisanjosepacasmayo.gob.pe,1,D.Leg 1057 - Determinado (Necesidad Transitoria)-002,"S/. 1,700.00",03/02/2025,14/02/2025,UN (01) AÑO EN EL SECTOR PÚBLICO Y/O PRIVADO,"-	TÍTULO TÉCNICO EN SECRETARIADO, ADMINISTRACIÓN, CONTABILIDAD O CARRERAS AFINES","CURSO ESPECIALIZADO: ATENCIÓN AL USUARIO, TRÁMITE DOCUMENTARIO Y GESTIÓN DE ARCHIVO","A.	EJECUTAR Y COORDINAR ACTIVIDADES RELACIONADAS CON EL REGISTRO, PROCESAMIENTO, CLASIFICACIÓN, VERIFICACIÓN Y ARCHIVO DEL MOVIMIENTO DOCUMENTADO;E.	EVALUAR Y SELECCIONAR DOCUMENTOS PROPONIENDO SU ELIMINACIÓN O TRANSFERENCIA AL ARCHIVO PASIVO",PRO ACTIVIDAD - RESPONSABILIDAD - TRABAJO EN EQUIPO - PUNTUALIDAD,ASISTENTE DE ARCHIVO,Municipalidad Distrital De San Jose,LA LIBERTAD - SAN JOSE
https://es-la.facebook.com/ugelchepen - https://ugelchepen.gob.pe/,1,276-2,"S/. 2,200.00",03/02/2025,14/02/2025,EXPERIENCIA GENERAL: EN EL SECTOR PUBLICO Y/O PRIVADO; EXPERIENCIA ESPECIFICA: EN LA PLAZA A POSTULAR,SECUNDARIA COMPLETA,.,"CAPACITACIÓN EN ÁREAS RELACIONADAS CON EL CARGO, REALIZADO EN LOS ÚLTIMOS CINCO (05) AÑOS, CON UNA DURACIÓN MÍNIMA DE 24 HORAS.","HABILIDADES, RESPONSABILIDAD, TRABAJO EN EQUIPO",TRABAJADOR DE SERVICIO,Unidad De Gestion Educativa Local - Chep En,LA LIBERTAD - CHEPEN
