job_posting_url,vacancies,job_posting_number,salary,start_publication_date,end_publication_date,required_experience,educational_background,specialization,required_knowledge,skills,job_title,public_institution,ubication
https://www.gob.pe/institucion/chavimochic/informes-publicaciones?filter%5bterms%5d=practi+&amp;filter%5btype%5d=80&amp;sheet=,1,728-001,"S/. 1,130.00",11/02/2025,24/02/2025,NO REQUERIDA,EGRESADO O BACHILLER DE LA CARRERA PROFESIONAL DE INGENIERIA AGRICOLA,NO REQUERIDA,"AUTOCAD CIVIL 3D O AUTOCAD, S10 O MS PROJECT ,ARCGIS O QGIS","INICIATIVA, RESPONSABILIDAD, ORGANIZACIÓN, TRABAJO EN EQUIPO",PRACTICANTE DE LA CARRERA PROFESIONAL DE INGENIERIA  AGRICOLA -002,Proyecto Especial Chavimochic,LA LIBERTAD - VIRU
https://www.gob.pe/institucion/chavimochic/informes-publicaciones?filter%5bterms%5d=practi+&amp;filter%5btype%5d=80&amp;sheet=,1,728-001,"S/. 1,130.00",11/02/2025,24/02/2025,NO REQUERIDA,EGRESADO TECNICO O EGRESADO O BACHILLER DE LA CARRERA PROFESIONAL DE ELECTRICIDAD INDUSTRIAL,NO REQUERIDA,"SISTEMAS DE POTENCIA , POZO A TIERRA","INICIATIVA, RESPONSABILIDAD, ORGANIZACIÓN, TRABAJO EN EQUIPO",PRACTICANTE DE LA CARRERA PROFESIONAL DE ELECTRICIDAD  INDUSTRIAL -007,Proyecto Especial Chavimochic,LA LIBERTAD - VIRU
https://www.gob.pe/institucion/chavimochic/informes-publicaciones?filter%5bterms%5d=practi+&amp;filter%5btype%5d=80&amp;sheet=,1,728-001,"S/. 1,130.00",11/02/2025,24/02/2025,NO REQUERIDA,"EGRESADO O BACHILLER DE LA CARRERA PROFESIONAL DE CONTABILIDAD, ADMINISTRACIÓN O ECONOMIA",NO REQUERIDA,"GESTIÓN PÚBLICA ,LEY DE CONTRATACIONES DEL ESTADO Y SU REGLAMENTO","INICIATIVA, RESPONSABILIDAD, ORGANIZACIÓN, TRABAJO EN EQUIPO","PRACTICANTE DE LA CARRERA PROFESIONAL DE CONTABILIDAD ,ADMINISTRASCION O ECONOMIA -013",Proyecto Especial Chavimochic,LA LIBERTAD - VIRU
https://www.gob.pe/institucion/chavimochic/informes-publicaciones?filter%5bterms%5d=practi+&amp;filter%5btype%5d=80&amp;sheet=,3,728-001,"S/. 1,130.00",11/02/2025,24/02/2025,NO REQUERIDA,EGRESADO O BACHILLER DE LA CARRERA PROFESIONAL DE  AGRONOMIA,NO REQUERIDA,"MANEJO INTEGRADO DE PLAGAS Y ENFERMEDADES (EVALUACIÓN Y MONITOREO) , BUENAS PRÁCTICAS AGRÍCOLAS EN FRUTALES DE AGRO EXPORTACIÓN, GESTIÓN DE RECURSOS HÍDRICOS","INICIATIVA, RESPONSABILIDAD, ORGANIZACIÓN, TRABAJO EN EQUIPO",PRACTICANTE DE LA CARRERA PROFESIONAL DE  AGRONOMIA -003,Proyecto Especial Chavimochic,LA LIBERTAD - VIRU
https://contigo.gob.pe/talento-humano/,3,D.Leg 1057 - Determinado (Necesidad Transitoria)-2,"S/. 3,500.00",11/02/2025,24/02/2025,"-	EXPERIENCIA LABORAL GENERAL MÍNIMA DE DOS (02) AÑOS EN ENTIDADES PÚBLICAS O PRIVADAS.
-	EXPERIENCIA LABORAL ESPECÍFICA MÍNIMA EN LA FUNCIÓN O LA MATERIA, DE UN (01) AÑO CON EL NIVEL MÍNIMO DE PRACTICANTE PROFESIONAL EN EL SECTOR PÚBLICO.","BACHILLER EN CIENCIAS SOCIALES, O CIENCIAS HUMANAS, O AGROPECUARIAS, O CIENCIAS DE LA SALUD O AFINES.","CURSOS EN GESTIÓN PÚBLICA O PROGRAMAS SOCIALES Y/O PROYECTOS DE DESARROLLO, Y/O VULNERABILIDAD SOCIAL, Y/O DISCAPACIDAD, Y/O DERECHOS HUMANOS, Y/O ENFOQUES DE DESARROLLO, Y/O CIUDADANÍA U OTROS SIMILARES (12 HORAS).","ATENCIÓN AL CIUDADANO, TRABAJO COMUNITARIO O AFINES PARA LA FUNCIÓN. (SE VERIFICARÁN EN LA ETAPA DE ENTREVISTA)",-	ACTITUD DE SERVICIO -	DINAMISMO  -	TRABAJO EN EQUIPO -	ORIENTACIÓN A RESULTADOS -	CREATIVIDAD E INICIATIVA,GESTOR/A SOCIAL,Programa Nacional De Entrega De La Pensión No Contributiva A Personas Con Discapacidad Severa En Sit,LA LIBERTAD - TRUJILLO
https://www.facebook.com/profile.php?id=61553808574876,1,D.Leg 1057 - Determinado (Necesidad Transitoria)-001,"S/. 2,500.00",10/02/2025,21/02/2025,"¿	EXPERIENCIA GENERAL MÍNIMO TRES (3) AÑOS EN EL SECTOR PÚBLICO Y/O PRIVADO.
¿	EXPERIENCIA ESPECÍFICA EN EL CARGO UN AÑO EN EL SECTOR PÚBLICO EN EL CARGO.","TÍTULO PROFESIONAL, BACHILLER EN DERECHO, SOCIOLOGÍA, ANTROPOLOGÍA O ING. AGROINDUSTRIAL","¿	DIPLOMADO EN DERECHO LABORAL Y/O DERECHO HUMANOS, ENFOQUE DE GÉNERO, PROYECCIÓN SOCIAL. ¿	CAPACITACIÓN CON CURSOS AFINES AL PUESTO DE TRABAJO. ¿	CURSO DE OFIMÁTICA NIVEL INTERMEDIO.","¿	EXPERIENCIA EN EL MANEJO DE ACTIVIDADES SOCIALES Y DE DESARROLLO INTEGRAL. ¿	ACREDITAR CURSOS, CAPACITACIONES, SEMINARIOS, EN TEMAS DE GESTIÓN DE PROMOCIÓN SOCIAL Y PROGRAMAS SOCIALES, DERECHOS HUMANOS Y ENFOQUE DE GÉNERO, PROYECCIÓN SOCIAL. ¿	ENTRE OTROS. ¿	CONOCIMIENTO DE PROCESADOR DE TEXTOS, HOJAS DE CÁLCULO Y PROGRAMAS DE PRESENTACIÓN A NIVEL BÁSICO.",¿	ALTO NIVEL DE RESPONSABILIDAD ¿	PROACTIVIDAD ¿	CAPACIDAD DE TRABAJO EN EQUIPO Y BAJO PRESIÓN  ¿	COMUNICACIÓN ASERTIVA Y BUEN TRATO.,SUB GERENTE DE SERVICIOS COMUNALES Y SOCIALES,Municipalidad Distrital De Curgos,LA LIBERTAD - CURGOS
https://www.facebook.com/profile.php?id=61553808574876,1,D.Leg 1057 - Determinado (Necesidad Transitoria)-001,"S/. 2,350.00",10/02/2025,21/02/2025,"¿	EXPERIENCIA GENERAL MÍNIMO TRES (3) AÑOS EN EL SECTOR PÚBLICO Y/O PRIVADO.
¿	EXPERIENCIA ESPECÍFICA MÍNIMA UN AÑO EN EL SECTOR PÚBLICO EN EL CARGO.","TÍTULO PROFESIONAL, BACHILLER O TÉCNICO EN INGENIERÍA AGROINDUSTRIAL, AGRONOMÍA Y/O CARRERAS AFINES","¿	DIPLOMADO Y/O ESPECIALIZACIÓN EN PRODUCCIÓN AGROPECUARIA, AGRONOMÍA  ¿	DIPLOMADO EN FORMULACIÓN DE PLANES DE NEGOCIOS Y/O AGRONEGOCIOS. ¿	CURSO DE OFIMÁTICA NIVEL BÁSICO.","¿	EXPERIENCIA EN PROYECTOS PRODUCTIVOS, PLANES DE NEGOCIO, Y MANEJO DE ASOCIACIONES AGROPECUARIAS Y/O AGRARIAS. ¿	CONOCIMIENTO DE PROCESADOR DE TEXTOS, HOJAS DE CÁLCULO Y PROGRAMAS DE PRESENTACIÓN A NIVEL BÁSICO",¿	ALTO NIVEL DE RESPONSABILIDAD ¿	PROACTIVIDAD ¿	CAPACIDAD DE TRABAJO EN EQUIPO Y BAJO PRESIÓN  ¿	COMUNICACIÓN ASERTIVA Y BUEN TRATO.,SUB GERENTE DE DESARROLLO ECONÓMICO,Municipalidad Distrital De Curgos,LA LIBERTAD - CURGOS
https://www.facebook.com/profile.php?id=61553808574876,1,D.Leg 1057 - Determinado (Necesidad Transitoria)-001,"S/. 1,500.00",10/02/2025,21/02/2025,"- EXPERIENCIA GENERAL DOS (02) AÑOS EN EL SECTOR PÚBLICO Y/O PRIVADO.
- EXPERIENCIA ESPECÍFICA UN AÑO EN MANEJO DE AGENTE MULTI RED Y RECAUDACIÓN EN EL SECTOR PÚBLICO Y/O PRIVADO.",PROFESIONAL TÉCNICO TITULADO O EGRESADO DE COMPUTACIÓN E INFORMÁTICA,- CURSOS DE OFIMÁTICA. -	CURSO DE EXCEL NIVEL INTERMEDIO -	CURSOS DE ATENCIÓN AL PUBLICO,"-	EXPERIENCIA EN GESTIONAR Y COORDINAR LA EJECUCIÓN DE ACTIVIDADES ADMINISTRATIVAS Y OPERATIVAS, ORIENTADAS A GENERAR RESULTADOS Y MEJORAS EN LA CALIDAD DE LOS SERVICIOS DENTRO DE LAS ORGANIZACIONES.  -	CONOCIMIENTO DE PROCESADOR DE TEXTOS, HOJAS DE CÁLCULO Y PROGRAMAS DE PRESENTACIÓN A NIVEL BÁSICO",-	ALTO NIVEL DE RESPONSABILIDAD -	PROACTIVIDAD -	CAPACIDAD DE TRABAJO EN EQUIPO Y BAJO PRESIÓN  -	COMUNICACIÓN ASERTIVA Y BUEN TRATO.,RESPONSABLE DE CAJA,Municipalidad Distrital De Curgos,LA LIBERTAD - CURGOS
https://www.facebook.com/profile.php?id=61553808574876,1,D.Leg 1057 - Determinado (Necesidad Transitoria)-001,"S/. 2,500.00",10/02/2025,21/02/2025,"- EXPERIENCIA GENERAL MÍNIMO TRES AÑOS EN EL SECTOR PÚBLICO Y/O PRIVADO.
- EXPERIENCIA ESPECÍFICA MÍNIMO EN EL CARGO UN AÑO EN EL SECTOR PÚBLICO Y/O PRIVADO","TÍTULO PROFESIONAL INGENIERO INDUSTRIAL, ADMINISTRACIÓN O TÉCNICO EN ADMINISTRACIÓN Y MARKETING.",CURSOS DE CAPACITACIÓN Y ACTUALIZACIÓN EN OFIMÁTICA 	CURSOS DE DERECHO ADMINISTRATIVO Y/O LABORAL. 	CURSOS DE SEGURIDAD Y SALUD OCUPACIONAL. 	CURSOS EN DIRECCIÓN EN RRHH,"CONTAR CON CONOCIMIENTOS TÉCNICOS EN GESTIÓN MUNICIPAL 	CONDUCCIÓN DE PROGRAMAS DE SISTEMA DE GESTIÓN DE RECURSOS HUMANOS EN EL SECTOR PUBLICO Y/O PRIVADO. 	CONOCIMIENTO DE PROCESOS EN SERVIR 	CONOCIMIENTO EN DIRECCIÓN DE RRHH CON ENFOQUE POR COMPETENCIAS 	CONOCIMIENTO DE SISTEMAS DE GESTIÓN DEL DESEMPEÑO, CLIMA Y CULTURA ORGANIZACIONAL 	MARCO LABORAL O LEGISLACIÓN LABORAL VIGENTE TANTO PARA EL RÉGIMEN LABORAL PÚBLICO COMO PRIVADO",ALTO NIVEL DE RESPONSABILIDAD 	PROACTIVIDAD 	CAPACIDAD DE TRABAJO EN EQUIPO Y BAJO PRESIÓN  	COMUNICACIÓN ASERTIVA Y BUEN TRATO.,JEFE DE LA UNIDAD DE RECURSOS HUMANOS,Municipalidad Distrital De Curgos,LA LIBERTAD - CURGOS
https://www.facebook.com/profile.php?id=61553808574876,1,D.Leg 1057 - Determinado (Necesidad Transitoria)-001,"S/. 3,000.00",10/02/2025,21/02/2025,"¿	EXPERIENCIA GENERAL MÍNIMO TRES (3) AÑOS EN EL SECTOR PÚBLICO Y/O PRIVADO.
¿	EXPERIENCIA ESPECÍFICA MÍNIMO DOS (2) EN EL CARGO EN EL SECTOR PÚBLICO","TÍTULO PROFESIONAL, BACHILLER EN INGENIERÍA, CONTABILIDAD, ECONOMÍA, ADMINISTRACIÓN, AFINES","¿	DIPLOMADO Y/O ESPECIALIZACIÓN EN CONTRATACIONES DEL ESTADO ¿	DIPLOMADO DE ESPECIALIZACIÓN EN GESTIÓN PÚBLICA. ¿	CURSOS DEL SIGA, SIAF","¿	EXPERIENCIA EN LOGÍSTICA Y CUENTE CON CERTIFICACIÓN OSCE VIGENTE. ¿	CONOCIMIENTO DE PROCESADOR DE TEXTOS, HOJAS DE CÁLCULO Y PROGRAMAS DE PRESENTACIÓN A NIVEL BÁSICO",¿	ALTO NIVEL DE RESPONSABILIDAD ¿	PROACTIVIDAD ¿	CAPACIDAD DE TRABAJO EN EQUIPO Y BAJO PRESIÓN  ¿	COMUNICACIÓN ASERTIVA Y BUEN TRATO.,JEFE DE LA UNIDAD DE LOGÍSTICA Y CONTROL PATRIMONIAL,Municipalidad Distrital De Curgos,LA LIBERTAD - CURGOS
https://www.facebook.com/profile.php?id=61553808574876,1,D.Leg 1057 - Determinado (Necesidad Transitoria)-001,"S/. 3,000.00",10/02/2025,21/02/2025,"¿	EXPERIENCIA GENERAL MÍNIMA TRES (3) AÑOS EN EL SECTOR PÚBLICO Y/O PRIVADO.
¿	EXPERIENCIA ESPECIFICA MININA UN AÑO EN EL CARGO EN EL SECTOR PÚBLICO.","TÍTULO PROFESIONAL INGENIERO CIVIL O ARQUITECTO, COLEGIADO Y HABILITADO","¿	ESPECIALIZACIÓN: “RESIDENCIA, SUPERVISIÓN, LIQUIDACIÓN Y SEGURIDAD EN OBRAS ¿	DIPLOMADO DE CONTRATACIONES DEL ESTADO. ¿	CURSO: “VALORIZACIÓN, RECEPCIÓN Y LIQUIDACIÓN DE OBRAS PÚBLICAS”","¿	EXPERIENCIA EN ELABORACIÓN DE EXPEDIENTES TÉCNICOS ¿	ELABORACIÓN DE VALORIZACIONES MENSUALES ¿	ELABORACIÓN DE EXPEDIENTE DE ADICIONALES, DEDUCTIVOS Y OTROS ¿	RESIDENTE Y/O ASISTENTE DE OBRAS Y SIMILARES ¿	CONOCIMIENTO DE PROCESADOR DE TEXTOS, HOJAS DE CÁLCULO, AUTOCAD, S10, ETABS, SAP200, SAFE Y PROGRAMAS DE PRESENTACIÓN A NIVEL BÁSICO",¿	ALTO NIVEL DE RESPONSABILIDAD ¿	PROACTIVIDAD ¿	CAPACIDAD DE TRABAJO EN EQUIPO Y BAJO PRESIÓN  ¿	COMUNICACIÓN ASERTIVA Y BUEN TRATO.,JEFE DE LA DIVISIÓN DE SUPERVISIÓN Y LIQUIDACIÓN DE OBRAS,Municipalidad Distrital De Curgos,LA LIBERTAD - CURGOS
https://www.facebook.com/profile.php?id=61553808574876,1,D.Leg 1057 - Determinado (Necesidad Transitoria)-001,"S/. 2,880.00",10/02/2025,21/02/2025,"- EXPERIENCIA GENERAL MÍNIMO DOS AÑOS EN EL SECTOR PÚBLICO Y/O PRIVADO.
- EXPERIENCIA ESPECIFICA MININO DE UN AÑO EN EL CARGO EN EL SECTOR PÚBLICO","TÍTULO PROFESIONAL DE INGENIERO CIVIL TITULADO, COLEGIADO Y HABILITADO","DIPLOMADO EN GESTIÓN, RESIDENCIA Y SUPERVISIÓN DE OBRAS 	DIPLOMADO EN COSTOS Y PRESUPUESTOS 	DIPLOMADO EN CONSTRUCCIÓN CIVIL  	DIPLOMADO BIM EN CALCULO Y DISEÑO ESTRUCTURAL. 	DIPLOMADO EN SEGURIDAD, SALUD OCUPACIONAL Y MEDIO AMBIENTE 	CURSOS DE MS PROJECT A NIVEL AVANZADO","-METRADOS EN EDIFICACIONES. -	GESTIÓN RESIDENCIA Y SUPERVISIÓN DE OBRAS. -	SALUD Y SEGURIDAD OCUPACIONAL.  -	S10 COSTOS Y PRESUPUESTOS. -	GESTIÓN DE RIESGO DE DESASTRES ASPECTOS BÁSICOS. -	EVALUACIÓN DE DAÑOS Y ANÁLISIS DE NECESIDADES EDAN PERU. -	GESTIÓN INCLUSIVA DEL RIESGO DE DESASTRES EN EL ENFOQUE COMUNITARIO. -	ESTIMACIÓN DEL RIESGO POR PELIGRO INMINENTE.  -	FENOMENOLOGÍA DEL TERRITORIO DEL PERÚ.  -	SISTEMA DE INFORMACIÓN NACIONAL PARA LA RESPUESTA Y REHABILITACIÓN – SINPAD. -	EL SISTEMA NACIONAL DE GESTIÓN DEL RIESGO DE DESASTRES.  -	PROCESADOR DE TEXTOS, HOJAS DE CÁLCULO Y PROGRAMAS DE PRESENTACIÓN A NIVEL BÁSICO.",-ALTO NIVEL DE RESPONSABILIDAD -	PROACTIVIDAD -	CAPACIDAD DE TRABAJO EN EQUIPO Y BAJO PRESIÓN  -	COMUNICACIÓN ASERTIVA Y BUEN TRATO.,"JEFE DE LA DIVISIÓN DE DESARROLLO URBANO, RURAL, OBRAS PÚBLICAS Y CATASTROS",Municipalidad Distrital De Curgos,LA LIBERTAD - CURGOS
https://www.facebook.com/profile.php?id=61553808574876,1,D.Leg 1057 - Determinado (Necesidad Transitoria)-001,"S/. 2,000.00",10/02/2025,21/02/2025,"¿	EXPERIENCIA GENERAL MÍNIMO UN AÑO EN EL SECTOR PÚBLICO Y/O PRIVADO.
¿	EXPERIENCIA ESPECÍFICA MÍNIMO EN EL AREA UN AÑO EN EL SECTOR PÚBLICO","TÍTULO PROFESIONAL EN DERECHO, COLEGIADO Y HABILITADO.","¿	DIPLOMADO EN DERECHO DE FAMILIA, PENSIÓN DE ALIMENTOS Y PROCESAL FAMILIAR ¿	DIPLOMADO EN DERECHO ADMINISTRATIVO ¿	DIPLOMADO EN DERECHO PROCEDIMIENTO ADMINISTRATIVO SANCIONADOR Y PROCEDIMIENTO ADMINISTRATIVO DISCIPLINARIO","¿	CONOCER LA SITUACIÓN DE LOS NIÑOS Y ADOLESCENTES QUE SE ENCUENTRAN EN INSTITUCIONES PÚBLICAS. ¿	BRINDAR ORIENTACIÓN MULTIDISCIPLINARIA A LA FAMILIA PARA PREVENIR SITUACIONES CRÍTICAS, DENTRO DEL MARCO DE LA LEY N° 30364. LEY PARA PREVENIR, SANCIONAR Y ERRADICAR LA VIOLENCIA CONTRA LAS MUJERES Y LOS INTEGRANTES DEL GRUPO FAMILIAR ¿	PROMOVER EL FORTALECIMIENTO DE LOS LAZOS FAMILIARES. EFECTUANDO CONCILIACIONES EXTRAJUDICIALES ENTRE CÓNYUGES, PADRES Y SIEMPRE QUE NO EXISTAN PROCESOS JUDICIALES VIGENTES SOBRE LA MATERIA. ¿	FORTALECER LOS MECANISMOS DE PROTECCIÓN Y PREVENCIÓN DE LAS SITUACIONES DE MALTRATO A LAS PERSONAS ADULTAS MAYORES DE ZONA RURAL, PROMOVIENDO SU INCLUSIÓN SOCIAL EN ACTIVIDADES DE LA VIDA SOCIAL, CULTURAL ECONÓMICA Y POLÍTICA DEL PAÍS.",¿	ALTO NIVEL DE RESPONSABILIDAD ¿	PROACTIVIDAD ¿	CAPACIDAD DE TRABAJO EN EQUIPO Y BAJO PRESIÓN  ¿	COMUNICACIÓN ASERTIVA Y BUEN TRATO.,"JEFE DE LA DIVISIÓN DE DEMUNA, CIAM Y OMAPED",Municipalidad Distrital De Curgos,LA LIBERTAD - CURGOS
https://página web: www.grell.gob.pe,1,276-1,"S/. 2,573.00",07/02/2025,20/02/2025,"UN (01) AÑO DE EXPERIENCIA EN EL CARGO O SIMILAR, EN REPARACIÓN, MANTENIMIENTO Y SOPORTE DE EQUIPO INFORMÁTICO",TITULO PROFESIONAL TÉCNICO EN LA CARRERA DE COMPUTACIÓN E INFORMÁTICA O SIMILAR,SEIS (06) MESES DE CAPACITACIÓN ESPECIALIZADA PARA EL CARGO,CONOCIMIENTO EN SISTEMAS INFORMÁTICA,"PROACTIVIDAD, RESPONSABILIDAD, TRABAJO EN EQUIPO, TOLERANCIA BAJO PRESIÓN, ORIENTACIÓN AL SERVIDOR Y PÚBLICO EN GENERAL",OPERADOR PAD II,Gerencia Regional De Educacion La Libertad,LA LIBERTAD - TRUJILLO
https://ugel01ep.gob.pe - https://www.facebook.com/ugel01ep,1,D.Leg 1057 - Determinado (Necesidad Transitoria)-7,"S/. 3,064.19",07/02/2025,20/02/2025,EXPERIENCIA GENERAL DE 01 AÑO EN EL SECTOR PUBLICO O PRIVADO EXPERIENCIA ESPECIFICA DE 06 MESES EN LA FUNCION O LA MATERIA.,LICENCIADO EN PSICOLOGIA O SOCIOLOGIA COLEGIDO Y HABILITADO,"CONVIVENCIA ESCOLAR, TUTORIA Y ORIENTACION EDUCATIVA; O PROTECCION Y DERECHOS DEL NIÑOS, NIÑAS Y ADOLECENTES O ATENCION DE VICTIMAS DE VIOLENCIA O GESTION DE PROYECTOS EDUCATIVOS, SOCIALES O COMUNITARIO.","GESTION DE LA CONVIVENCIA ESCOLAR, PAUTAS PARA LA PREVENCION Y ATENCION DE LA VIOLENCIA EN LAS INSTITUCIONES EDUCATIVAS.","EMPATÍA, ASERTIVIDAD, ANÁLISIS, BUENA COMUNICACIÓN ORAL Y ESCRITA, ORGANIZACIÓN DE LA INFORMACIÓN.",PROFESIONAL I PARA EQUIPO ITINERANTE DE CONVIVENCIA ESCOLAR,Unidad De Gestion Educativa Local 01- El Porvenir,LA LIBERTAD - EL PORVENIR
https://ugel01ep.gob.pe - https://www.facebook.com/ugel01ep,6,D.Leg 1057 - Determinado (Necesidad Transitoria)-4,"S/. 2,764.19",07/02/2025,20/02/2025,EXPERIENCIA LABORAL GENERAL DE DOS (01) AÑO. EXPERIENCIA ESPECÍFICA DE 06 MESES EN INSTITUCIÓN EDUCATIVA O PROYECTOS EDUCATIVOS.,LICENCIADO EN PSICOLOGÍA - CON HABILITACION PROFESIONAL,"CONVIVENCIA ESCOLAR, TUTORÍA Y ORIENTACIÓN EDUCATIVA; O PROTECCIÓN Y DERECHOS DE NIÑOS, NIÑAS Y ADOLESCENTES O ATENCIÓN DE LA VIOLENCIA; O DISEÑO, GESTIÓN O MONITOREO DE PROYECTOS EDUCATIVOS, SOCIALES O COMUNITARIOS.","GESTIÓN DE LA CONVIVENCIA ESCOLAR, PAUTAS PARA LA PREVENCIÓN Y ATENCIÓN DE LA VIOLENCIA EN LAS INSTITUCIONES EDUCATIVAS. Y OFIMATICA A NIVEL BASICO","EMPATÍA, ASERTIVIDAD, ANÁLISIS, BUENA COMUNICACIÓN ORAL Y ESCRITA, ORGANIZACIÓN DE LA INFORMACIÓN.",PROFESIONAL EN PSICOLOGIA,Unidad De Gestion Educativa Local 01- El Porvenir,LA LIBERTAD - EL PORVENIR
https://página web: www.grell.gob.pe,1,276-1,"S/. 2,769.00",07/02/2025,20/02/2025,"UN (01) AÑO DE EXPERIENCIA EN EL CARGO O SIMILAR EN EL SECTOR PÚBLICO EDUCATIVO, EN EL SISTEMA DE RECURSOS HUMANOS O SIMILAR, EN LA GESTIÓN DE PERSONAL CESANTE, PENSIONES Y LIQUIDACIONES DEL SECTOR EDUCATIVO","TITULO PROFESIONAL UNIVERSITARIO EN ADMINISTRACIÓN O SIMILAR, COLEGIADO SI , HABILITADO SI","SEIS MESES DE CAPACITACIÓN ESPECIALIZADA EN EL SISTEMA ADMINISTRATIVO DE RECURSOS HUMANOS DEL SECTOR PÚBLICO EDUCATIVO, EN LA GESTIÓN DE PERSONAL CESANTE, PENSIONES, LIQUIDACIONES EN EL SECTOR PÚBLICO EDUCATIVO. CAPACITACIÓN ESPECIALIZADA EN SISTEMA ADMINISTRATIVO DE RECURSOS HUMANOS DEL SECTOR PÚBLICO EDUCATIVO, EN LA GESTIÓN DE PERSONAL CESANTE, PENSIONES, LIQUIDACIONES EN EL SECTOR PÚBLICO EDUCATIVO.",EN NORMATIVIDAD DEL SECTOR EDUCACIÓN,"TOLERANTE, PROACTIVIDAD, RESPONSABILIDAD, TRABAJO EN EQUIPO, TOLERANCIA BAJO PRESIÓN, ORIENTACIÓN AL SERVIDOR Y PÚBLICO EN GENERAL",ESPECIALISTA ADMINISTRATIVO II - SUPLENCIA,Gerencia Regional De Educacion La Libertad,LA LIBERTAD - TRUJILLO
https://aplicativo.pj.gob.pe/psep/,1,D.Leg 1057 - Determinado (Suplencia)-006,"S/. 1,300.00",06/02/2025,19/02/2025,OBLIGATORIO: EXPERIENCIA NO MENOR DE (01) AÑO EN TRÁMITE DOCUMENTARIO O LABORES AFINES. DESEABLE: EXPERIENCIA LABORAL ADICIONAL EN TRÁMITE DOCUMENTARIO O LABORES AFINES.,"OBLIGATORIO: ESTUDIOS TÉCNICOS EN ARCHIVO, SECRETARIADO EJECUTIVO, COMPUTACIÓN, ADMINISTRACIÓN O AFINES, MÍNIMO TRES (03) MESES.","DESEABLE: LICENCIA PARA CONDUCIR MOTOCICLETA. DESEABLE: CURSO DE OFIMÁTICA (PROCESADOR DE TEXTOS, HOJA DE CÁLCULO, PRESENTACIÓN DE DIAPOSITIVAS).",CONOCIMIENTO DE TRÁMITES JUDICIALES. CONOCIMIENTOS Y MANEJO DE OFIMÁTICA.,"ORGANIZACIÓN DE INFORMACIÓN, RAZONAMIENTO LÓGICO, AUTOCONTROL, ORDEN, DINAMISMO.",APOYO ADMINISTRATIVO EN LAS AREAS DE NOTIFICACIONES,Poder Judicial,LA LIBERTAD - TRUJILLO
https://aplicativo.pj.gob.pe/psep/,1,D.Leg 1057 - Determinado (Necesidad Transitoria)-008,"S/. 2,572.00",06/02/2025,19/02/2025,"OBLIGATORIO: PARA EL PROFESIONAL TÉCNICO, TRES (03) AÑOS DE EXPERIENCIA GENERAL Y UN (01) AÑO DE EXPERIENCIA DESARROLLANDO LABORES AFINES AL PUESTO EN EL SECTOR PÚBLICO. OBLIGATORIO: PARA EL ESTUDIANTE UNIVERSITARIO, UN (01) AÑO DE EXPERIENCIA DESARROLLANDO LABORES AFINES AL PUESTO EN EL SECTOR PÚBLICO. DESEABLE: EXPERIENCIA LABORAL ADICIONAL DESARROLLANDO LABORES AFINES AL PUESTO EN EL SECTOR PÚBLICO.","OBLIGATORIO: TÍTULO PROFESIONAL TÉCNICO (CARRERA DE 3 AÑOS) EN CONTABILIDAD, COMPUTACIÓN, SECRETARIADO EJECUTIVO, O ESTUDIOS UNIVERSITARIOS (8VO. CICLO) DE ECONOMÍA, CONTABILIDAD, ADMINISTRACIÓN O CARRERAS AFINES.","DESEABLE: CURSO DE OFIMÁTICA (PROCESADOR DE TEXTOS, HOJA DE CÁLCULO, PRESENTACIÓN DE DIAPOSITIVAS).",CONOCIMIENTO DE TRÁMITES ADMINISTRATIVOS EN EL SECTOR PÚBLICO. CONOCIMIENTOS EN OFIMÁTICA A NIVEL USUARIO.,"COMPRESIÓN LECTORA, MEMORIA, DINAMISMO, ORGANIZACIÓN DE LA INFORMACIÓN, RAZONAMIENTO LÓGICO.",ASISTENTE ADMINISTRATIVO,Poder Judicial,LA LIBERTAD - TRUJILLO
https://aplicativo.pj.gob.pe/psep/,1,D.Leg 1057 - Determinado (Suplencia)-007,"S/. 1,300.00",06/02/2025,19/02/2025,OBLIGATORIO: SEIS (06) MESES COMO AGENTE DE SEGURIDAD EN ENTIDADES PÚBLICAS O EN EMPRESAS DE SEGURIDAD DEL SECTOR PRIVADO; O LICENCIADO DE LAS FUERZAS ARMADAS. DESEABLE: EXPERIENCIA LABORAL ADICIONAL COMO AGENTE DE SEGURIDAD EN ENTIDADES PÚBLICAS O EN EMPRESAS DE SEGURIDAD DEL SECTOR PRIVADO; O COMO LICENCIADO DE LAS FUERZAS ARMADAS.,OBLIGATORIO: SECUNDARIA COMPLETA,"DESEABLE: CURSOS EN TEMAS DE SEGURIDAD INTEGRAL, LUCHA CONTRA INCENDIO, PRIMEROS AUXILIOS, GESTIÓN DEL RIESGO DE DESASTRES.","CONOCIMIENTO EN TEMAS DE SEGURIDAD INTEGRAL, LUCHA CONTRA INCENDIO, PRIMEROS AUXILIOS, GESTIÓN DEL RIESGO DE DESASTRES. CONOCIMIENTO DE LAS NORMAS ASOCIADAS A SU FUNCIÓN","ADAPTABILIDAD, ANÁLISIS, COMPRENSIÓN LECTORA, AUTOCONTROL, ORDEN, EMPATÍA Y LIDERAZGO","RESGUARDO, CUSTODIA Y VIGILANCIA",Poder Judicial,LA LIBERTAD - VIRU
https://aplicativo.pj.gob.pe/psep/,1,D.Leg 1057 - Determinado (Necesidad Transitoria)-005,"S/. 4,000.00",05/02/2025,18/02/2025,"OBLIGATORIO: EXPERIENCIA LABORAL DE DOS (02) AÑOS DESARROLLANDO LABORES AFINES AL PUESTO.
DESEABLE: EXPERIENCIA LABORAL ADICIONAL DESARROLLANDO LABORES AFINES AL PUESTO.","OBLIGATORIO: TITULO DE ESTUDIOS TÉCNICOS SUPERIORES (3 AÑOS) EN COMPUTACIÓN E INFORMÁTICA, O ESTUDIOS UNIVERSITARIOS (SEXTO CICLO) EN INGENIERÍA INFORMÁTICA O INGENIERÍA DE SISTEMAS O SIMILAR.","DESEABLE: CURSOS DE ESPECIALIZACIÓN O DIPLOMADOS EN COMPUTACIÓN E INFORMÁTICA (SEGÚN LA CANTIDAD DE HORAS MÍNIMAS ESTABLECIDAS EN LAS BASES). DESEABLE: CURSO DE OFIMÁTICA (PROCESADOR DE TEXTOS, HOJA DE CÁLCULO, PRESENTACIÓN DE DIAPOSITIVAS).",CONOCIMIENTOS EN EL MANEJO DE EQUIPOS DE AUDIO Y/O VIDEO. CONOCIMIENTOS EN OFIMÁTICA A NIVEL USUARIO.,"COMPRENSIÓN LECTORA, REDACCIÓN, AUTOCONTROL, ORDEN, DINAMISMO.",ASISTENTE DE SISTEMAS,Poder Judicial,LA LIBERTAD - TRUJILLO
https://aplicativo.pj.gob.pe/psep/,1,D.Leg 1057 - Determinado (Necesidad Transitoria)-005,"S/. 2,572.00",05/02/2025,18/02/2025,"OBLIGATORIO: EXPERIENCIA LABORAL DE UN (01) AÑO DESARROLLANDO LABORES AFINES AL PUESTO.
DESEABLE: EXPERIENCIA LABORAL EN EL ÁREA LEGAL COMO ASISTENTE EN EL SECTOR PÚBLICO.",OBLIGATORIO: OCTAVO CICLO DE DERECHO (CULMINADO).,"DESEABLE: CURSOS DE ESPECIALIZACIÓN O DIPLOMADOS EN DERECHO LABORAL O LEY N° 29497 NUEVA LEY PROCESAL DEL TRABAJO (SEGÚN LA CANTIDAD DE HORAS MÍNIMAS ESTABLECIDAS EN LAS BASES). DESEABLE: CURSO DE OFIMÁTICA (PROCESADOR DE TEXTOS, HOJA DE CÁLCULO, PRESENTACIÓN DE DIAPOSITIVAS).",CONOCIMIENTOS EN DERECHO LABORAL O LEY N° 29497 NUEVA LEY PROCESAL DEL TRABAJO.   CONOCIMIENTOS EN OFIMÁTICA A NIVEL USUARIO.,"ADAPTABILIDAD, ANÁLISIS, REDACCIÓN, COMPRENSIÓN LECTORA, AUTOCONTROL.",ASISTENTE JUDICIAL,Poder Judicial,LA LIBERTAD - TRUJILLO
https://www.facebook.com/ugel02laesperanza/?locale=es_la,1,D.Leg 1057 - Determinado (Necesidad Transitoria)-003,"S/. 2,264.19",05/02/2025,18/02/2025,"EXPERIENCIA GENERAL: EXPERIENCIA MÍNIMA DE DOS (02) AÑOS EN EL SECTOR PÚBLICO Y/O PRIVADO. EXPERIENCIA ESPECÍFICA: EXPERIENCIA MÍNIMA DE UN (01) AÑO EN EL CARGO, RELACIONADAS AL CARGO O AFINES AL CARGO; CON FUNCIONES INHERENTES EN EL PROCESO DE EJECUCIÓN DEL GASTO EN EL SECTOR PÚBLICO.","TÍTULO PROFESIONAL UNIVERSITARIO EN ECONOMÍA, CONTABILIDAD, ADMINISTRACIÓN, COLEGIADO Y HABILITADO.","-	CAPACITACIÓN EN GESTIÓN PÚBLICA. -	PLANIFICACIÓN Y PROGRAMACIÓN PRESUPUESTAL. -	SISTEMA NACIONAL DE PRESUPUESTO PÚBLICO. -	CAPACITACIÓN EN SIAF-SP, SIAF-WEB -	CAPACITACIÓN EN TEMAS RELACIONADOS CON EL PUESTO A DESEMPEÑAR.","-	NORMATIVIDAD DEL SECTOR EDUCACIÓN Y PROCEDIMIENTOS DEL SISTEMA NACIONAL DE PRESUPUESTO PÚBLICO. -	MANEJO DEL SISTEMA INTEGRADO DE ADMINISTRACIÓN FINANCIERA-SIAF- SP -	MANEJO DE LA WEB SIAF, MÓDULO DE PROGRAMACIÓN PRESUPUESTAL -	CONOCIMIENTOS DE OFIMÁTICA.",-	ORIENTACIÓN HACIA EL LOGRO DE OBJETIVOS -	COMUNICACIÓN ASERTIVA -	RESPONSABILIDAD EN EL DESEMPEÑO DE SUS FUNCIONES. -	CONOCIMIENTO ORGANIZACIONAL. -	TRABAJO EN EQUIPO Y COOPERACIÓN. -	PROACTIVIDAD. -	PREDISPOSICIÓN A LABORES BAJO PRESIÓN -	SER TOLERANTE PARA CON EL PÚBLICO USUARIO. -	INTERÉS POR EL ORDEN Y LA CLARIDAD. -	BÚSQUEDA DE LA INFORMACIÓN. -	INICIATIVA. -	CAPACIDAD DE ANÁLISIS Y SOLUCIÓN DE PROBLEMAS. -	ACTUAR BAJO LOS PRINCIPIOS DE LA FUNCIÓN PÚBLICA Y EL CÓDIGO DE ÉTICA.,ESPECIALISTA EN FINANZAS,Unidad Ejecutora Educacion 314 - La Esperanza,LA LIBERTAD - LA ESPERANZA
https://aplicativo.pj.gob.pe/psep/,1,D.Leg 1057 - Determinado (Necesidad Transitoria)-010,"S/. 7,800.00",05/02/2025,18/02/2025,"OBLIGATORIO: CUATRO (4) AÑOS DE EXPERIENCIA, CONTADA A PARTIR DE LA COLEGIATURA, EN EL SECTOR PÚBLICO Y/O PRIVADO.
OBLIGATORIO: DOS (02) AÑOS DE EXPERIENCIA EN LABORES EQUIVALENTES AL CARGO QUE POSTULA EN EL SECTOR PÚBLICO
DESEABLE: EXPERIENCIA LABORAL ADICIONAL EN LABORES EQUIVALENTES AL CARGO QUE POSTULA EN EL SECTOR PÚBLICO.","OBLIGATORIO: TITULADO EN DERECHO O ADMINISTRACIÓN; CON COLEGIATURA Y HABILITACIÓN PROFESIONAL VIGENTE. OBLIGATORIO: GRADO DE MAESTRO EN GESTIÓN PÚBLICA, DERECHO PENAL O DERECHO PROCESAL PENAL.","OBLIGATORIO: CURSO DE ESPECIALIZACIÓN Y/O DIPLOMADO EN CONTRATACIONES DEL ESTADO (MÍNIMO 90 HORAS). DESEABLE: CURSO DE OFIMÁTICA (PROCESADOR DE TEXTOS, HOJA DE CÁLCULO, PRESENTACIÓN DE DIAPOSITIVAS).  ¿	DESEABLE: CURSO DE ESPECIALIZACIÓN Y/O DIPLOMADO EN GESTIÓN PÚBLICA, DERECHO PENAL O PROCESAL PENAL (MÍNIMO 90 HORAS).","CONOCIMIENTOS EN GESTIÓN PÚBLICA, DERECHO PENAL O PROCESAL PENAL Y/O CONTRATACIONES DEL ESTADO. CONOCIMIENTOS EN OFIMÁTICA A NIVEL USUARIO.","ANÁLISIS, MEMORIA, REDACCIÓN, COMPRENSIÓN LECTORA, AUTOCONTROL Y ADAPTABILIDAD.",ADMINISTRADOR,Poder Judicial,LA LIBERTAD - TRUJILLO
https://satt.gob.pe/servicios/bolsa-de-trabajo,1,D.Leg 1057 - Determinado (Suplencia)-1,"S/. 2,064.19",05/02/2025,18/02/2025,"EXPERIENCIA LABORAL GENERAL: NO MENOR DE DOS  (02)  AÑOS.
EXPERIENCIA LABORAL ESPECIFICA: NO MENOR DE DOS  (02)  AÑOS, DE PREFERENCIA EN ADMINISTRACIÓN TRIBUTARIA. EXPERIENCIA EN TEMAS DE RESOLUCION EN MATERIA TRIBUTARIA.
EXPERIENCIA LABORAL ESPECIFICA EN EL SECTOR PUBLICO: NO MENOR DE DOS  (02)  AÑOS.",BACHILLER EN DERECHO.,DERECHO TRIBUTARIO Y DERECHO ADMINISTRATIVO.,MANEJO DE PROCEDIMIENTO CONTENCIOSO TRIBUTARIO. MANEJO DE DERECHO TRIBUTARIO. MANEJO DE DERECHO TRIBUTARIO MUNICIPAL. MANEJO DE DERECHO ADMINISTRATIVO.	MANEJO DE HERRAMIENTAS Y APLICATIVOS INFORMÁTICOS.,"TRABAJO EN EQUIPO, RAZONAMIENTO ANALÍTICO, PROACTIVO, CAPACIDAD DE SOLUCIÓN DE PROBLEMAS, ORGANIZADO, INNOVADOR, PROACTIVO, RESPONSABLE.",APOYO PARA LA OFICINA DE RECLAMOS Y DEVOLUCIONES,Serv.De Administracion Tributaria-Trujil,LA LIBERTAD - TRUJILLO
