job_posting_url,vacancies,job_posting_number,salary,start_publication_date,end_publication_date,required_experience,educational_background,specialization,required_knowledge,skills,job_title,public_institution,ubication
https://www.senasa.gob.pe/senasa/728-2025/,1,728-1,S/. 001.00,20/02/2025,05/03/2025,1,1,1,1,1,1,Servicio Nacional De Sanidad Agraria,LORETO - TENIENTE MANUEL CLAVERO
https://www.senasa.gob.pe/senasa/728-2025/,1,728-1,S/. 001.00,20/02/2025,05/03/2025,1,1,1,1,1,1,Servicio Nacional De Sanidad Agraria,LORETO - BALSAPUERTO
https://www.senasa.gob.pe/senasa/728-2025/,1,728-1,S/. 001.00,20/02/2025,05/03/2025,1,1,1,1,1,1,Servicio Nacional De Sanidad Agraria,LORETO - TENIENTE MANUEL CLAVERO
https://www.senasa.gob.pe/senasa/728-2025/,1,728-1,S/. 001.00,20/02/2025,05/03/2025,1,1,1,1,1,1,Servicio Nacional De Sanidad Agraria,LORETO - BALSAPUERTO
https://extranet.cunamas.gob,1,D.Leg 1057 - Determinado (Necesidad Transitoria)-139,"S/. 3,764.19",20/02/2025,05/03/2025,"•	 EXPERIENCIA LABORAL GENERAL DE 03 AÑOS EN EL SECTOR PÚBLICO O PRIVADO.
•	EXPERIENCIA LABORAL ESPECIFICA DE DOS (02) AÑOS EN SUPERVISIÓN O ASISTENCIA TÉCNICA EN PROGRAMAS O SERVICIOS O INTERVENCIONES VINCULADAS A SALUD PÚBLICA O PRIMERA INFANCIA O DESARROLLO INFANTIL O FAMILIAS O FUNCIONES AFINES AL PUESTO EN EL SECTOR PÚBLICO Y/O PRIVADO CON POBLACIONES VULNERABLES.","•	TÍTULO PROFESIONAL UNIVERSITARIO EN CIENCIAS DE LA SALUD HUMANA (ENFERMERÍA, PSICOLOGÍA, OBSTETRICIA, NUTRICIÓN), EDUCACIÓN (INICIAL O PRIMARIA) O EN CIENCIAS SOCIALES (SOCIOLOGÍA, TRABAJO SOCIAL, ANTROPOLOGÍA) O TÍTULO DE ESCUELA/INSTITUTO DE EDUCACIÓN SUPERIOR PEDAGÓGICO (INICIAL O PRIMARIA)",•	CURSOS Y/O CAPACITACIÓN EN TEMAS RELACIONADOS A PRIMERA INFANCIA Y/O SALUD PÚBLICA Y/O DESARROLLO INFANTIL Y/O PROYECTOS SOCIALES Y/O CAPACITACIONES AFINES AL SERVICIO (ÚLTIMOS 5 AÑOS),"•	CONOCIMIENTOS EN PROGRAMAS SOCIALES O SERVICIOS O INTERVENCIONES RELACIONADAS A LA MATERIA O AFINES. •	 CONOCIMIENTO EN OFIMÁTICA NIVEL BÁSICO (WORD, EXCEL, POWER POINT). •	DISPONIBILIDAD PARA VIAJAR DENTRO Y FUERA DEL DEPARTAMENTO CUANDO EL SERVICIO LO AMERITE.","•	PLANIFICACIÓN, ANÁLISIS, INICIATIVA, EMPATÍA",ESPECIALISTA INTEGRAL,Programa Nacional Cuna Mas,LORETO - YURIMAGUAS
https://www.senasa.gob.pe/senasa/unetealsenasa/,1,D.Leg 1057 - Determinado (Necesidad Transitoria)-22,"S/. 1,111.00",20/02/2025,05/03/2025,1,1,1,1,1,1,Servicio Nacional De Sanidad Agraria,LORETO - TROMPETEROS
https://www.gob.pe/munipunchana,1,D. Leg. 1057 - D.U. 034-2023 (Estado De Emergencia)-001,"S/. 3,500.00",20/02/2025,24/02/2025,"EXPERIENCIA GENERAL Y ESPECIFICA: ¿	EXPERIENCIA EN ADMINISTRACIÓN PÚBLICA.
¿	EXPERIENCIA EN ADMINISTRACIÓN MUNICIPAL",SECUNDARIA COMPLETA Y/O ESTUDIOS SUPERIORES TÉCNICOS UNIVERSITARIOS AFINES AL CARGO,NO APLICA,CONOCIMIENTO Y EXPERIENCIA EN EL USO DE PROGRAMAS INFORMÁTICOS A NIVEL DE USUARIO,OTROS RELACIONADOS A LAS FUNCIONES,TECNICO ADMINISTRATIVO,Municipalidad Distrital De Punchana,LORETO - PUNCHANA
https://extranet.cunamas.gob,1,D.Leg 1057 - Determinado (Necesidad Transitoria)-111,"S/. 2,764.19",20/02/2025,05/03/2025,"•	EXPERIENCIA LABORAL GENERAL DE 01 AÑO.
•	EXPERIENCIA LABORAL ESPECÍFICA DE 01 AÑO EN SERVICIOS O PROGRAMAS O PROYECTOS RELACIONADOS A EQUIPOS TÉCNICOS PARA LA GESTIÓN, ACOMPAÑAMIENTO O ATENCIÓN EN SALUD PÚBLICA O PRIMERA INFANCIA O NIÑEZ O FAMILIAS O COMUNIDAD EN EL SECTOR PÚBLICO O PRIVADO CON POBLACIONES VULNERABLES.","•	TÍTULO O BACHILLER UNIVERSITARIO EN EDUCACIÓN (INICIAL O PRIMARIA O SECUNDARIA) O CIENCIAS DE LA SALUD HUMANA (ENFERMERÍA, PSICOLOGÍA, OBSTETRICIA, NUTRICIÓN) O CIENCIAS SOCIALES (SOCIOLOGÍA, TRABAJO SOCIAL O ANTROPOLOGÍA) O TITULO DE ESCUELA/INSTITUTO DE EDUCACIÓN SUPERIOR PEDAGÓGICO (INICIAL O PRIMARIA O SECUNDARIA) O TÍTULOS TÉCNICOS EN CIENCIAS DE LA SALUD (ENFERMERÍA Y FARMACIA)",•	“CURSOS Y/O CAPACITACIÓN EN DESARROLLO INFANTIL TEMPRANO Y/O PRIMERA INFANCIA Y/O TRABAJO CON FAMILIAS Y/O PROYECTOS SOCIALES Y/O DESARROLLO SOCIAL Y/O DESARROLLO HUMANO U OTROS TEMAS AFINES (ÚLTIMOS 5 AÑOS)”,"•	""CONOCIMIENTO EN OFIMÁTICA NIVEL BÁSICO (WORD, EXCEL, POWER POINT). •	LENGUA ORIGINARIA SEGÚN ÁMBITO DE TRABAJO - NIVEL INTERMEDIO (DE SER EL CASO)"" •	DISPONIBILIDAD PARA VIAJAR DENTRO Y FUERA DEL DEPARTAMENTO CUANDO EL SERVICIO LO AMERITE","•	COMUNICACIÓN ORAL, EMPATÍA, NEGOCIACIÓN Y PLANIFICACIÓN",ACOMPAÑANTE TECNICO PARA EL SERVICIO DE CUIDADO DIURNO,Programa Nacional Cuna Mas,LORETO - IQUITOS
https://extranet.cunamas.gob,1,D.Leg 1057 - Determinado (Necesidad Transitoria)-133,"S/. 4,764.19",20/02/2025,05/03/2025,"•	EXPERIENCIA LABORAL GENERAL DE 04 AÑOS EN EL SECTOR PÚBLICO O PRIVADO. 
•	EXPERIENCIA LABORAL ESPECÍFICA DE TRES (03) AÑOS EN PROGRAMAS, PROYECTOS SOCIALES O DE GESTIÓN PÚBLICA EN RELACIÓN A ACTIVIDADES VINCULADAS A SALUD PÚBLICA O FAMILIA O PRIMERA INFANCIA O DESARROLLO INFANTIL O COMUNIDAD CUMPLIENDO FUNCIONES SIMILARES A LAS DEL PUESTO EN CALIDAD DE ESPECIALISTA, SUPERVISOR, CONSULTOR, COORDINADOR, RESPONSABLE DE ÁREA, JEFE, SUBCOORDINADOR O SUB-JEFE.","•	TÍTULO UNIVERSITARIO EN CIENCIAS SOCIALES (SOCIOLOGÍA, TRABAJO SOCIAL, ANTROPOLOGÍA), CIENCIAS DE LA SALUD (ENFERMERÍA, PSICOLOGÍA, OBSTETRICIA, NUTRICIÓN), EDUCACIÓN INICIAL O EDUCACIÓN PRIMARIA O TÍTULO SUPERIOR PEDAGÓGICO EN EDUCACIÓN INICIAL O EDUCACIÓN PRIMARIA (COLEGIADO Y HABILITADO)",•	CURSOS EN GESTIÓN PÚBLICA O GERENCIA SOCIAL O PROGRAMAS SOCIALES O DESARROLLO INFANTIL (ÚLTIMOS 05 AÑOS).,"•	CONOCIMIENTO DE LA LENGUA ORIGINARIA SEGÚN ÁMBITO DE TRABAJO (NIVEL BÁSICO). •	MANEJO DE OFIMÁTICA BÁSICA (WORD, EXCEL, POWER POINT). •	DISPONIBILIDAD PARA VIAJAR DENTRO Y FUERA DEL DEPARTAMENTO.","•	CONTROL, EMPATÍA, NEGOCIACIÓN Y PLANIFICACIÓN",COORDINADOR PARA EL SERVICIO DE ACOMPAÑAMIENTO A FAMILIAS,Programa Nacional Cuna Mas,LORETO - YURIMAGUAS
https://www.gob.pe/institucion/fap/informespublicaciones/tipos/ 107-concurso-publico,1,276-01,"S/. 3,072.30",19/02/2025,04/03/2025,"DOS (02) AÑOS DE EXPERIENCIA EN EL SECTOR PÚBLICO Y PRIVADO, UN (01) AÑO DE EXPERIENCIA EN LA FUNCIÓN Y/O MATERIA",TÍTULO TÉCNICO EN ADMINISTRACIÓN O AFINES POR LA FORMACIÓN.,AFINES A LA ESPECIALIDAD,AFINES A LA ESPECIALIDAD,"TRABAJO EN EQUIPO,   PUNTUALIDAD Y DESTREZA EN EL CUMPLIMIENTO DE SUS FUNCIONES.",TÉCNICO ADMINISTRATIVO,Fuerza Aerea Del Peru,LORETO - IQUITOS
https://convocatorias.pais.gob.pe/convocatorias/externo/portal/convocatoriasportal.aspx,1,D.Leg 1057 - Determinado (Necesidad Transitoria)-023,"S/. 5,400.00",19/02/2025,04/03/2025,"EXPERIENCIA GENERAL:
¿ DOS (02) AÑOS DE EXPERIENCIA GENERAL EN EL SECTOR PÚBLICO O
PRIVADO.
EXPERIENCIA ESPECÍFICA:
¿ DOS (02) AÑOS DE EXPERIENCIA ESPECÍFICA EN PUESTOS QUE TRABAJEN
DIRECTAMENTE EN BENEFICIO DE LAS COMUNIDADES Y/O POBLACIÓN RURAL
EN EL SECTOR PÚBLICO O PRIVADO, DE LOS CUALES, UN (01) AÑO DEBERÁ
SER EN EL SECTOR PÚBLICO.","BACHILLER UNIVERSITARIO EN CIENCIAS SOCIALES, ADMINISTRATIVAS, ECONÓMICAS, AGRARIAS, FORESTALES, EDUCACIÓN, COMUNICACIONES, SALUD, PSICOLOGÍA, ECOLOGÍA, VETERINARIA, ZOOTECNIA, INDUSTRIAS ALIMENTARIAS O INGENIERÍA AGROPECUARIA O AFINES POR LA FORMACIÓN.",CURSO EN GESTIÓN PÚBLICA O POLÍTICAS PÚBLICAS O SOCIALES O AFINES AL PUESTO.,¿ CONOCIMIENTO DEL IDIOMA DE LA LOCALIDAD. ¿ CONOCIMIENTO DE LA ZONA GEOGRÁFICA A LA QUE POSTULA. ¿ CONOCIMIENTO DE RELACIONES COMUNITARIAS. ¿ MANEJO DE GESTIÓN DEL RIESGO DE DESASTRES O CONFLICTOS SOCIALES. ¿ CONOCIMIENTO DE OFIMÁTICA NIVEL BÁSICO. ¿ CONOCIMIENTO DEL ISO 9001 SISTEMAS DE GESTIÓN DE CALIDAD. ¿ CONOCIMIENTOS DEL ISO 37001 SISTEMA DE GESTIÓN ANTISOBORNO. ¿ CONOCIMIENTO DE LA LEY DEL CÓDIGO DE ÉTICA DE LA FUNCIÓN PÚBLICA LEY Nº27815.,INTERÉS ORGANIZACIONAL ¿ TRABAJO EN EQUIPO ¿ COMUNICACIÓN EFECTIVA,GESTOR/A INSTITUCIONAL,Programa Nacional Ñplataformas De Acción Para La Inclusión Social-Paisñ,LORETO - TENIENTE MANUEL CLAVERO
https://apps.reniec.gob.pe/postulareniec/empleo,1,D.Leg 1057 - Determinado (Necesidad Transitoria)-039,"S/. 1,800.00",19/02/2025,04/03/2025,"EXPERIENCIA GENERAL DE UN (01) AÑO EN EL SECTOR PÚBLICO O PRIVADO. (INDISPENSABLE)
EXPERIENCIA ESPECIFICA DE UN (01) AÑO EN LA FUNCIÓN O LA MATERIA.(INDISPENSABLE)
UN (01) AÑO DE EXPERIENCIA EN EL SECTOR PÚBLICO.(INDISPENSABLE)","BACHILLER UNIVERSITARIO EN DERECHO, ADMINISTRACIÓN,  CONTABILIDAD, EDUCACIÓN, INGENIERIA O PSICOLOGIA. (INDISPENSABLE)",CURSO DE DOCE (12) HORAS ACUMULATIVAS EN ATENCIÓN AL PÚBLICO. (INDISPENSABLE),"CONOCIMIENTOS DE PROCESADOR DE TEXTO, HOJA DE CÁLCULO Y PROGRAMA DE PRESENTACIONES A NIVEL BÁSICO. CONOCIMIENTO DE TEMAS DE REGISTROS CIVILES. CONOCIMIENTO EN ATENCIÓN AL PÚBLICO.","ADAPTABILIDAD, DINAMISMO, TRABAJO EN EQUIPO Y VOCACIÓN DE SERVICIO.",REGISTRADOR I,Registro Nacional De Identificación Y Estado Civil,LORETO - IQUITOS
https://apps.reniec.gob.pe/postulareniec/empleo,1,D.Leg 1057 - Determinado (Necesidad Transitoria)-007,"S/. 1,800.00",19/02/2025,04/03/2025,"EXPERIENCIA GENERAL 	UN (1) AÑO. (INDISPENSABLE)
EXPERIENCIA ESPECÍFICA	UN (01) AÑO DE EXPERIENCIA EN LA FUNCIÓN O LA MATERIA. (INDISPENSABLE)
EXPERIENCIA EN EL SECTOR PÚBLICO	UN (01) AÑO EN EL SECTOR PÚBLICO. (INDISPENSABLE)","BACHILLER UNIVERSITARIO EN DERECHO, ADMINISTRACIÓN,  CONTABILIDAD, EDUCACIÓN, INGENIERIA O PSICOLOGIA. (INDISPENSABLE)",CURSO DE DOCE (12) HORAS ACUMULATIVAS EN ATENCIÓN AL PÚBLICO. (DE PREFERENCIA),"CONOCIMIENTO DE TEMAS DE REGISTROS CIVILES,CONOCIMIENTO EN ATENCIÓN AL PÚBLICO, PROCESADOR DE TEXTO, HOJA DE CÁLCULO Y PROGRAMA DE PRESENTACIONES A NIVEL BÁSICO.","ADAPTABILIDAD, DINAMISMO, TRABAJO EN EQUIPO Y VOCACIÓN DE SERVICIO.",REGISTRADOR I,Registro Nacional De Identificación Y Estado Civil,LORETO - IQUITOS
https://apps.reniec.gob.pe/postulareniec/empleo,1,D.Leg 1057 - Determinado (Necesidad Transitoria)-008,"S/. 1,800.00",19/02/2025,04/03/2025,"EXPERIENCIA GENERAL 	UN (01) AÑO. (INDISPENSABLE)
EXPERIENCIA ESPECÍFICA	UN (01) AÑO DE EXPERIENCIA EN LA FUNCIÓN O LA MATERIA. (INDISPENSABLE)
EXPERIENCIA EN EL SECTOR PÚBLICO	UN (01) AÑO EN EL SECTOR PÚBLICO. (INDISPENSABLE)","BACHILLER UNIVERSITARIO EN DERECHO, ADMINISTRACIÓN,  CONTABILIDAD, EDUCACIÓN, INGENIERIA O PSICOLOGIA. (INDISPENSABLE)",CURSO DE DOCE (12) HORAS ACUMULATIVAS EN ATENCIÓN AL PÚBLICO. (DE PREFERENCIA),"CONOCIMIENTO DE TEMAS DE REGISTROS CIVILES, CONOCIMIENTO EN ATENCIÓN AL PÚBLICO, PROCESADOR DE TEXTO, HOJA DE CÁLCULO Y PROGRAMA DE PRESENTACIONES A NIVEL BÁSICO.","ADAPTABILIDAD, DINAMISMO, TRABAJO EN EQUIPO Y VOCACIÓN DE SERVICIO.",REGISTRADOR I,Registro Nacional De Identificación Y Estado Civil,LORETO - SAN JUAN BAUTISTA
https://www.ugelaa.gob.pe,1,D.Leg 1057 - Determinado (Necesidad Transitoria)-02,"S/. 2,264.19",19/02/2025,04/03/2025,"02 AÑOS EN ELS ECTOR PUBLICO O PRIVADO
01 AÑO EN EL AREA DE TRAMITE DOCUMENTARIO Y/O TRABAJOS SIMILARES AL CARGO","TITULO TECNICO EN ADMINISTRACION DE EMPRESAS, CONTABILIDAD, BIBLIOTECOLOGIA O ARCHIVISTA","DIPLOMA, CURSOS O TALLER SOBRE OFIMATICA, TRAMITES DOCUMENTARIOS Y GESTION DE ARCHIVOS","CONOCIMIENTOS EN GESTION PUBLICA, TRAMITES DOCUMENTARIOS Y GESTIO DE ARCHIVOS","ANALISIS, AUTOCONTROL, ORGANIZACION DE LA INFORMACION Y EMPATIA",TECNICO ADMINISTTRATIVO PARA TRAMITE DOCUMENTARIO,Unidad De Gestion Educativa De Alto Amazonas - Yurimaguas,LORETO - YURIMAGUAS
https://www.ugelaa.gob.pe,1,D.Leg 1057 - Determinado (Necesidad Transitoria)-02,"S/. 2,264.19",19/02/2025,04/03/2025,"02 AÑOS EN EL SECTOR PUBLICO O PRIVADO
01 AÑO EN EL AREA DE PATRIMONIO Y/O TRABAJOS AFINES AL CARGO","TITULO TECNICO EN ADMINISTRACION DE EMPRESAS, CONTABILIDAD, CONTABILIDAD, COMPUTACION E INFORMATICA","DIPLOMA, CURSOS O TALLER EN OFIMATICA, GESTION DE BIENES PATRIMONIALES","CONOCIMIENTOS EN GESTION PUBLICA, GESTION DE BIENES PATRIMONIALES, SIGA, MEF, MP","ANALISIS, AUTOCONTROL, ORGANIZACION DE LA INFORMACION Y EMPATIA",TECNICO ADMINISTRATIVO PARA PATRIMONIO,Unidad De Gestion Educativa De Alto Amazonas - Yurimaguas,LORETO - YURIMAGUAS
https://www.ugelaa.gob.pe,1,D.Leg 1057 - Determinado (Necesidad Transitoria)-02,"S/. 2,264.19",19/02/2025,04/03/2025,"02 AÑOS EN ELS ECTOR PUBLICO O PRIVADO
01 AÑO EN EL ARTEA DE INFRAESTRUCTURA Y/O TRABAJOS SIMILARES EN EL CARGO","TITULO TECNICO EN CONSTRUCCION CIVIL, CONTABILIDAD, ADMINISTRACION DE EMPRESAS, COMPUTACION E INFORMATICA","DIPLOMA, CURSOS O TALLER EN MANTENIMIENTO PREVENTIVO, MONITOREO DE OBRAS, OFIMATICA","CONOCIMIENTOS EN GESTION PUBLICA, SANEAMIENTO FISICO LEGAL, MANTENIMIENTO PREVENTIVO Y MONITOREO DE OBRAS","ANALISIS, AUTOCONTROL, ORGANIZACION DE LA INFORMACION Y EMPATIA",TECNICO ADMINISTRATIVO PARA INFRAESTRUCTURA,Unidad De Gestion Educativa De Alto Amazonas - Yurimaguas,LORETO - YURIMAGUAS
https://www.ugelaa.gob.pe,1,D.Leg 1057 - Determinado (Necesidad Transitoria)-02,"S/. 2,264.19",19/02/2025,04/03/2025,"02 AÑOS EN EL SECTOR PUBLICO O PRIVADO
01 AÑO EN EL AREA DE ESACALAFON Y/O TRABAJOS SIMILARES EN EL CARGO","TITULO TECNICO EN CONTABILIDAD, ADMINISTRACION DE EMPRESAS, COMPUTACION E INFORMATICA","DIPLOMA, CURSOS, O TALLER EN OFIMATICA, GESTION DOCUMENTAL Y ARCHIVISTA, SISTEMAS INFORMATICOS","CONOCIMIENTOS EN GESTION PUBLICA, DOCUMENTACION Y GESTION DE ARCHIVOS","ANALISIS, AUTOCONTROL, ORGANIZACION DE LA INFORMACION Y EMPATIA",TECNICO ADMINISTRATIVO PARA ESCALAFON,Unidad De Gestion Educativa De Alto Amazonas - Yurimaguas,LORETO - YURIMAGUAS
https://www.ugelaa.gob.pe,1,D.Leg 1057 - Determinado (Necesidad Transitoria)-02,"S/. 2,264.19",19/02/2025,04/03/2025,"02 AÑOS EN EL SECTOR PUBLICO O PRIVADO
01 AÑO EN EL AREA DE INFORMATICA Y/O TRABAJOS SIMILARES EN EL CARGO",TITULO TECNICO EN COMPUTACION E INFORMATICA,"DIPLOMA, CURSO O TALLER EN SOTFWARE DE OFICINA, SISTEMAS INFORMATICOS VINCULADOS AL SECTOR EDUCACION","CONOCIMIENTOS EN GESTION PUBLICA, TECNOLOGIA DE LA INFORMACION Y COMUNICACION TICS, ADMINISTRACION DE REDES, COMUNICACIONES Y SERVIDORES","ANALISIS, AUTOCONTROL, ORGANIZACION DE LA INFORMACION Y EMPATIA",TECNICO ADMINISTRATIVO PARA COMPUTACION E INFORMATICA,Unidad De Gestion Educativa De Alto Amazonas - Yurimaguas,LORETO - YURIMAGUAS
https://apps.reniec.gob.pe/postulareniec/empleo,1,D.Leg 1057 - Determinado (Necesidad Transitoria)-036,"S/. 1,500.00",19/02/2025,04/03/2025,"EXPERIENCIA GENERAL DE UN (01) AÑO EN EL SECTOR PÚBLICO O PRIVADO.
EXPERIENCIA ESPECIFICA DE UN (01) AÑO EN LA FUNCIÓN O LA MATERIA.","TÉCNICO PROFESIONAL EGRESADO EN ADMINISTRACIÓN, CONTABILIDAD, EDUCACIÓN O COMPUTACIÓN; O ESTUDIANTE UNIVERSITARIO DEL ÚLTIMO CICLO EN DERECHO, ADMINISTRACIÓN, CONTABILIDAD, ECONOMÍA, EDUCACIÓN O COMPUTACIÓN. (INDISPENSABLE)",CURSO DE DOCE (12) HORAS ACUMULATIVAS EN ATENCIÓN AL PÚBLICO. (INDISPENSABLE),"CONOCIMIENTOS DE PROCESADOR DE TEXTO, HOJA DE CÁLCULO Y PROGRAMA DE PRESENTACIONES A NIVEL BÁSICO.  CONOCIMIENTO DE TEMAS REGISTRALES Y EN ATENCIÓN AL PÚBLICO.","ADAPTABILIDAD, DINAMISMO, COMUNICACIÓN ORAL Y VOCACIÓN DE SERVICIO.",REGISTRADOR II,Registro Nacional De Identificación Y Estado Civil,LORETO - YURIMAGUAS
https://apps.reniec.gob.pe/postulareniec/empleo,1,D.Leg 1057 - Determinado (Necesidad Transitoria)-006,"S/. 1,800.00",19/02/2025,04/03/2025,"UN (01) AÑO. (INDISPENSABLE)
UN (01) AÑO DE EXPERIENCIA EN LA FUNCIÓN O LA MATERIA. (INDISPENSABLE)
UN (01) AÑO EN EL SECTOR PÚBLICO. (INDISPENSABLE)","BACHILLER UNIVERSITARIO EN DERECHO, ADMINISTRACIÓN,  CONTABILIDAD, EDUCACIÓN, INGENIERIA O PSICOLOGIA. (INDISPENSABLE)",CURSO DE DOCE (12) HORAS ACUMULATIVAS EN ATENCIÓN AL PÚBLICO. (DE PREFERENCIA),"CONOCIMIENTO DE TEMAS DE REGISTROS CIVILES, CONOCIMIENTO EN ATENCIÓN AL PÚBLICO, PROCESADOR DE TEXTO, HOJA DE CÁLCULO Y PROGRAMA DE PRESENTACIONES A NIVEL BÁSICO.","ADAPTABILIDAD, DINAMISMO, TRABAJO EN EQUIPO Y VOCACIÓN DE SERVICIO.",REGISTRADOR I,Registro Nacional De Identificación Y Estado Civil,LORETO - YURIMAGUAS
https://www.ugelaa.gob.pe,1,D.Leg 1057 - Determinado (Necesidad Transitoria)-02,"S/. 2,864.19",19/02/2025,04/03/2025,"02 AÑOS EN EL SECTOR PUBLICO O PRIVADO
01 AÑO EN EL AREA DE INFORMATICA, REDES COMUNICACIONALES Y/O TRABAJOS SIMILARES AL CARGO","TITULO UNIVERSITARIO LICENCIADO EN INGENIERIA DE SISTEMAS, INGENIERIA INFORMATICA O INGENIERIA EN COMPUTACION , REDES Y COMUNICACIONES","DIPLOMA, CURSO O TALLER EN SOFTWARE DE OFICINA, SISTEMAS INFORMATICOS VINCULADOS AL SECTOR DE EDUCACION","CONOCIMIENTOS EN GESTION PUBLICA. ADMINISTRACION DE REDES, COMUNICACIONES Y SERVIDORES","ANALISIS, AUTOCONTROL, ORGANIZACION DE LA INFORMACION Y EMPATIA",ESPECIALISTA EN TECNOLOGIAS INFORMATICAS,Unidad De Gestion Educativa De Alto Amazonas - Yurimaguas,LORETO - YURIMAGUAS
https://www.ugelaa.gob.pe,1,D.Leg 1057 - Determinado (Necesidad Transitoria)-02,"S/. 4,264.19",19/02/2025,04/03/2025,"02 AÑOS EN EL SECTOR PUBLICO O PRIVADO
01 AÑO EN EL AREA DE REURSOS HUMANOS Y/O TRABAJOS SIMILARES","TÍTULO UNIVERSITARIO LICENCIADO EN ADMINISTRACION, CONTABILIDAD, ECONOMIA, ESTADISTICA, INGENIERIA INDUSTRIAL, DERECHO, PSICOLOGÍA O DOCENTE","DIPLOMA, CURSOS O TALLER EN GESTION PUBLICA, SIGA, SIAF, RECURSOS HUMANOS","CONOCIMIENTOS EN GESTION PUBLICA, LEGISLACION LABORAL, LEY N° 30057","ANALISIS, AUTOCONTROL, ORGANIZACION DE LA INFORMACION Y EMPATIA",ESPECIALISTA EN RECURSOS HUMANOS,Unidad De Gestion Educativa De Alto Amazonas - Yurimaguas,LORETO - YURIMAGUAS
https://www.ugelaa.gob.pe,1,D.Leg 1057 - Determinado (Necesidad Transitoria)-02,"S/. 2,864.19",19/02/2025,04/03/2025,"02 AÑOS EN EL SECTOR PUBLICO O PRIVADO
01 AÑO EN EL AREA DE PROCESOS ADMINISTRATIVOS Y/O TRABAJOS SIMILARES AL CARGO","TITULO EN DERECHO, COLEGIADO Y HABILITADO","DIPLOMA, CURSO O TALLER EN DERECHO LABORAL Y PUBLICO, PROCESOS ADMINISTRATIVOS DISCIPLINARIOS, OFIMATICA","CONOCIMIENTOS EN GESTION PUBLICA. PROCESOS ADMINISTRATIVOS DISCIPLINARIOS, DERECHO ADMINISTRATIVO","ANALISIS, AUTOCONTROL, ORGANIZACION DE LA INFORMACION Y EMPATIA",ESPECIALISTA EN PROCEDIMIENTOS ADMINISTRATIVOS DISCIPLINARIOS,Unidad De Gestion Educativa De Alto Amazonas - Yurimaguas,LORETO - YURIMAGUAS
https://www.ugelaa.gob.pe,1,D.Leg 1057 - Determinado (Necesidad Transitoria)-02,"S/. 2,864.19",19/02/2025,04/03/2025,"02 AÑOS EN EL SECTOR PUBLICO O PRIVADO
01 AÑO EN EL AREA DE INFRAESTRUCTURA Y/O TRABAJOS SIMILARES AL CARGO","TITULO EN INGENIERIA CIVIL O ARQUITECTURA, COLEGIADO Y HABILITADO","DIPLOMA, CURSO O TALLER EN MATENIMIENTO PREVENTIVOY MONITOREO DE OBRAS, OFIMATICA","CONOCIMIENTOS EN GESTION PUBLICA, SANEAMIENTO FISICO LEGAL, MANTENIMIENTO PREVENTIVO Y MONITOREO DE OBRAS","ANALISIS, AUTOCONTROL, ORGANIZACION DE LA INFORMACION Y EMPATIA",ESPECIALISTA EN INFRAESTRUCTURA,Unidad De Gestion Educativa De Alto Amazonas - Yurimaguas,LORETO - YURIMAGUAS
https://www.ugelaa.gob.pe,1,D.Leg 1057 - Determinado (Necesidad Transitoria)-02,"S/. 2,864.19",19/02/2025,04/03/2025,"02 AÑOS EN ELS ECTOR PUBLICO O PRIVADO
01 AÑO EN EL AREA DE ABASTECIMIENTO Y/O TRABABAJOS SIMILARES AL CARGO","TITULO UNIVERSITARIO LICENCIADO EN ECONOMIA, INGENIERIA ECONOMICA, ADMINISTRACION, CONTABILIDAD, ESTADISTICA, INGENIERIA INDUSTRIAL O DERECHO","DIPLOMA, CURSOS O TALLER EN CONTRATACIONES Y ADQUISICIONES DEL ESTADO, SIGA, SIAF, OFIMATICA","CONOCIMIENTOS SOBRE GESTION PUBLICA, LEY DE CONTRATACIONES, SIGA, MEF, MODULO DE LOGISTICA, CERTIFICACION OSCE","ANALISIS, AUTOCONTROL, ORGANIZACION DE LA INFORMACION Y EMPATIA",ESPECIALISTA EN ABASTECIMIENTO,Unidad De Gestion Educativa De Alto Amazonas - Yurimaguas,LORETO - YURIMAGUAS
https://www.ugelaa.gob.pe,1,D.Leg 1057 - Determinado (Necesidad Transitoria)-02,"S/. 1,664.19",19/02/2025,04/03/2025,"02 AÑOS EN EL SECTOR POUBLICO O PRIVADO
01 AÑO EN EL AREA DE INFRAESTRUCTURA Y/O TRABAJOS SIMILARES AL CARGO",SECUNDARIA COMPLETA,"DIPLOMA, CURSOS O TALLER EN OFIMATICA","CONOCIMIENTOS SOBRE GESTION PUBLICA, MANTENIMIENTO PREVENTIVO Y MONITOREO DE OBRAS","ANALISIS, AUTOCONTROL, ORGANIZACION DE LA INFORMACION Y EMPATIA",AUXILIAR ADMINISTRATIVO PARA INFRAESTRUCTURA,Unidad De Gestion Educativa De Alto Amazonas - Yurimaguas,LORETO - YURIMAGUAS
https://apps.reniec.gob.pe/postulareniec/empleo,1,D.Leg 1057 - Determinado (Necesidad Transitoria)-004,"S/. 1,500.00",19/02/2025,04/03/2025,"UN (1) AÑO. (INDISPENSABLE)
UN (01) AÑO DE EXPERIENCIA EN LA FUNCIÓN O LA MATERIA. (INDISPENSABLE)","TECNICO PROFESIONAL EGRESADO EN ADMINISTRACIÓN, CONTABILIDAD, EDUCACIÓN O COMPUTACIÓN; O ESTUDIANTE UNIVERSITARIO DEL ÚLTIMO CICLO EN DERECHO, ADMINISTRACIÓN, CONTABILIDAD, ECONOMÍA, EDUCACIÓN O COMPUTACIÓN. (INDISPENSABLE)",CURSO DE DOCE (12) HORAS ACUMULATIVAS EN ATENCIÓN AL PÚBLICO. (DE PREFERENCIA),"CONOCIMIENTO DE TEMAS REGISTRALES, CONOCIMIENTO EN ATENCIÓN AL PÚBLICO, PROCESADOR DE TEXTO, HOJA DE CÁLCULO Y PROGRAMA DE PRESENTACIONES A NIVEL BÁSICO.","ADAPTABILIDAD, DINAMISMO, COMUNICACIÓN ORAL Y VOCACIÓN DE SERVICIO.",REGISTRADOR II,Registro Nacional De Identificación Y Estado Civil,LORETO - LAGUNAS
https://www.facebook.com/profile.php?id=100064036272069,1,D.Leg 1057 - Determinado (Necesidad Transitoria)-004,"S/. 2,964.19",19/02/2025,04/03/2025,"EXPRIENCIA GENERAL: 03 AÑOS EN EL SECTOR PÚBLICO O PRIVADO .
EXPERIENCIA ESPECIFICA  REQUERIDA PARA EL PUESTO EN LA FUNCIÓN O LA MATERIA  : 01 AÑO EN EL SECTOR EDUCACIÓN.",TÍTULO/LICENCIATURA EN PSICOLOGÍA,OENEDUCACIÓNINCLUSIVAY/OEDUCACIÓN ESPECIAL Y/O ATENCIÓNA LADIVERSIDADOCURSOS  RELACIONADOS A DISCAPACIDAD O AL DISEÑO UNIVERSAL PARA EL APRENDIZAJE.,"ATENCIÓNEDUCATIVAENELMARCODEL ENFOQUE INCLUSIVOODEATENCIÓNA LADIVERSIDAD, CONÉNFASISENESTUDIANTESCONDISCAPACIDADYQUE  REQUIERAN APOYOS EDUCATIVOS.",ESTUDIOS DE POSGRADO O ESPECIALIZACIÓN O DIPLOMADO EN EDUCACIÓN INCLUSIVA Y/O EDUCACIÓN ESPECIAL Y/O ATENCIÓN A LA DIVERSIDAD O CURSOS  RELACIONADOS A DISCAPACIDAD. HABILIDADES COMUNICATIVAS Y DE LIDERAZGO. CAPACIDAD DE TRABAJO EN EQUIPO. CAPACIDAD DE MANEJO DE CONFLICTOS.,PROFESIONAL NO DOCENTE PARA EL SOPORTE Y ASESORAMIENTO A IIEE INCLUSIVAS,Unidad De Gestion Educativa Local Datem Del Marañon,LORETO - BARRANCA
https://www.facebook.com/profile.php?id=100064036272069,1,D.Leg 1057 - Determinado (Necesidad Transitoria)-004,"S/. 2,964.19",19/02/2025,04/03/2025,"EXPERIENCIA GENERAL: 01 AÑO Y 06 MESES EN EL SECTOR PUBLICO O PRIVADO.
EXPERIENCIA ESPECÍFICA  REQUERIDA PARA EL PUESTO EN LA FUNCIÓN O LA MATERIA  : 01 AÑO DE EXPERIENCIA EN EL TRABAJO CON PERSONAS CON DISCAPACIDAD.",TITULO/LICENCIATURA -  TECNÓLOGO MÉDICO EN/  ÁREA/MENCIÓN/ESPECIALIDAD  TERAPIA FÏSICA O TERAPIA  FISICA Y REHABILITACIÓN O  TERAPIA OCUPACIONAL O  TERAPIA DE LENGUAJE,NO APLICA,COMPETENCIAS OCUPACIONALES PARA LA ATENCIÓN DE PERSONAS EN CONDICIÓN DE DISCAPACIDAD. TRABAJO CON FAMILIAS. DESARROLLO EVOLUTIVO.,"COMUNICACIÓN ORAL, COOPERACIÓN, INICIATIVA, EMPATÍA Y TRABAJO EN EQUIPO.","PROFESIONAL EN TECNOLOGÍA MÉDICA CON MENCIÓN EN TERAPIA FÍSICA, OCUPACIONAL O DE LENGUAJE  PARA CEBE",Unidad De Gestion Educativa Local Datem Del Marañon,LORETO - BARRANCA
https://www.facebook.com/profile.php?id=100064036272069,1,D.Leg 1057 - Determinado (Necesidad Transitoria)-004,"S/. 2,714.19",19/02/2025,04/03/2025,"EXPERIENCIA GENERAL: 3 AÑOS  EN EL SECTOR PÚBLICO O PRIVADO 
EXPERIENCIA ESPECÍFICA  REQUERIDA PARA EL PUESTO EN LA FUNCIÓN O LA MATERIA: 02 AÑOS EN EL SECTOR EDUCACIÓN.",TÍTULO/LICENCIATURA  EN EDUCACIÓN,EN EDUCACIÓN INCLUSIVAY/OEDUCACIÓNESPECIAL Y/OATENCIÓNA LADIVERSIDADOCURSOS  RELACIONADOS A DISCAPACIDAD O AL DISEÑO UNIVERSAL PARA EL APRENDIZAJE.,"ATENCIÓNEDUCATIVAENELMARCODEL ENFOQUE INCLUSIVOODEATENCIÓNA LADIVERSIDAD, CONÉNFASISENESTUDIANTESCONDISCAPACIDADYQUE  REQUIERAN APOYOS EDUCATIVOS.",HABILIDADES COMUNICATIVAS. ORIENTACIÓN A LOGROS. CAPACIDAD DE TRABAJO EN EQUIPO. ADAPTABILIDAD Y LIDERAZGO. CAPACIDAD DE MANEJO DE  CONFLICTOS.,PROFESIONAL EN EDUCACIÓN PARA EL SOPORTE Y ASESORAMIENTO A IIEE INCLUSIVA,Unidad De Gestion Educativa Local Datem Del Marañon,LORETO - BARRANCA
https://apps.reniec.gob.pe/postulareniec/empleo,2,D.Leg 1057 - Determinado (Necesidad Transitoria)-038,"S/. 1,500.00",19/02/2025,04/03/2025,"EXPERIENCIA GENERAL DE UN (01) AÑO EN EL SECTOR PÚBLICO O PRIVADO. (INDISPENSABLE)
EXPERIENCIA ESPECIFICA DE UN (01) AÑO EN LA FUNCIÓN O LA MATERIA. (INDISPENSABLE)","TÉCNICO PROFESIONAL EGRESADO EN ADMINISTRACIÓN, CONTABILIDAD, EDUCACIÓN O COMPUTACIÓN; O ESTUDIANTE UNIVERSITARIO DEL ÚLTIMO CICLO EN DERECHO, ADMINISTRACIÓN, CONTABILIDAD, ECONOMÍA, EDUCACIÓN O COMPUTACIÓN. (INDISPENSABLE)",CURSO DE DOCE (12) HORAS ACUMULATIVAS EN ATENCIÓN AL PÚBLICO. (INDISPENSABLE),"CONOCIMIENTOS DE PROCESADOR DE TEXTO, HOJA DE CÁLCULO Y PROGRAMA DE PRESENTACIONES A NIVEL BÁSICO.  CONOCIMIENTO DE TEMAS REGISTRALES Y EN ATENCIÓN AL PÚBLICO.","ADAPTABILIDAD, DINAMISMO, COMUNICACIÓN ORAL Y VOCACIÓN DE SERVICIO.",REGISTRADOR II,Registro Nacional De Identificación Y Estado Civil,LORETO - IQUITOS
https://www.gob.pe/institucion/fap/informes-publicaciones/tipos/107-concurso-publico,1,276-01,"S/. 3,072.30",18/02/2025,03/03/2025,"ACREDITAR (01) AÑO DE EXPERIENCIA ESPECÍFICA EN EL SECTOR PÚBLICO O PRIVADO, RELACIONADAS A LA ESPECIALIDAD. (INDISPENSABLE)",TÍTULO INSTITUTO SUPERIOR RELACIONADO CON LA ESPECIALIDAD DE ADMINISTRACIÓN DE EMPRESAS EXPEDIDO A NOMBRE DE LA NACIÓN (03) AÑOS. BACHILLER UNIVERSITARIO Y/O ESTUDIOS UNIVERSITARIOS MAYOR AL 6TO CICLO (06 SEMESTRES ACADÉMICOS APROBADOS – CERTIFICADO DE ESTUDIOS EXPEDIDO POR LA UNIVERSIDAD) EN LA CARRERA PROFESIONAL DE ADMINISTRACIÓN DE EMPRESAS Y/O ADMINISTRACIÓN DE NEGOCIOS INTERNACIONALES Y/O INGENIERÍA INDUSTRIAL. (INDISPENSABLE),AFINES A LA ESPECIALIDAD,"CERTIFICADO DE NIVEL  BÁSICO DE MICROSOFT OFFICE (POWERPOINT, WORD, EXCEL). (DESEABLE), CERTIFICADO DE MANEJO DE RRHH EN EL SECTOR PÚBLICO (OPCIONAL).","TRABAJO EN EQUIPO, PUNTUALIDAD Y DESTREZA EN EL CUMPLIMIENTO DE SUS FUNCIONES.",TÉCNICO(A) ADMINISTRATIVO,Fuerza Aerea Del Peru,LORETO - IQUITOS
