job_posting_url,vacancies,job_posting_number,salary,start_publication_date,end_publication_date,required_experience,educational_background,specialization,required_knowledge,skills,job_title,public_institution,ubication
https://www.facebook.com/redsaludtayacaja,1,D.Leg 1057 - Determinado (Necesidad Transitoria)-002,"S/. 3,164.00",28/02/2025,13/03/2025,01 AÑO,TITULADO,NO APLICA,"MANEJO DE URGENCIAS Y EMERGENCIAS, ORIENTACION EN CONSEJERIA FAMILIAR, MEDIDAS DE BIOSEGURIDAD, INMUNIZACIONES, CONTROL DE CRECIMIENTO Y DESARROLLO, PROCESO DE ATENCIÓN DE ENFERMERIA.","RESOLUCION DE CONFLICTOS, TRABAJO EN EQUIPO, PLANIFICACION, ORIENTACION A RESULTADOS. CAPACIDAD ANALITICA Y ORGANIZATIVA, CAPACIDAD DE INTERRELACIONARSE A CUALQUIER NIVEL, CAPACIDAD PARA TRABAJAR BAJO PRESION, COMPROMISO INSTITUCIONAL, ETICA Y VALORES",ENFERMERA/O,Unidad Ejecutora 403 Red De Salud Tayacaja,HUANCAVELICA - SALCABAMBA
https://www.facebook.com/redsaludtayacaja,1,D.Leg 1057 - Determinado (Necesidad Transitoria)-002,"S/. 3,164.00",28/02/2025,13/03/2025,01 AÑO,TITULADO,NO APLICA,"CONOCIMIENTO DE MODELO DE CUIDADO INTEGRAL DE SALUD ,   EMERGENCIAS OBSTETRICAS Y NEONATALES, NORMAS TECNICAS VIGENTES DEL MINSA,  CONVENIO DEL SEGURO INTEGRAL DE SALUD Y SALUD PUBLICA","CAPACIDAD ANALITICA Y ORGANIZATIVA, CAPACIDAD DE INTERRELACIONARSE A CUALQUIER NIVEL, CAPACIDAD PARA TRABAJAR BAJO PRESION Y EMOCIONALMENTE ESTABLE., COMPROMISO INSTITUCIONAL BUSCANDO LA EXCELENCIA, CAPACIDAD PARA TRABAJAR EN EQUIPO Y LIDERAZGO, ETICA Y VALORES: SOLIDARIDAD Y HONRADEZ.",OBSTETRA,Unidad Ejecutora 403 Red De Salud Tayacaja,HUANCAVELICA - HUACHOCOLPA
https://www.facebook.com/redsaludtayacaja,1,D.Leg 1057 - Determinado (Necesidad Transitoria)-002,"S/. 4,264.19",28/02/2025,13/03/2025,01 AÑO,TITULADO,NO APLICA,ACTIVIDADES   EN  EL  RADIOLOGIA CONVENSIONAL SIMPLE,"RESOLUCION DE CONFLICTOS, TRABAJO EN EQUIPO, PLANIFICACION, ORIENTACION A RESULTADOS. CAPACIDAD ANALITICA Y ORGANIZATIVA, CAPACIDAD DE INTERRELACIONARSE A CUALQUIER NIVEL, CAPACIDAD PARA TRABAJAR BAJO PRESION, COMPROMISO INSTITUCIONAL, ETICA Y VALORES",TECNOLOGO MEDICO RADIOLOGO,Unidad Ejecutora 403 Red De Salud Tayacaja,HUANCAVELICA - DANIEL HERNANDEZ
https://www.facebook.com/redsaludtayacaja,2,D.Leg 1057 - Determinado (Necesidad Transitoria)-002,"S/. 3,164.19",28/02/2025,13/03/2025,01 AÑO,TITULADO,"ANALISIS CLINICO, SALUD AMBIENTAL, MANEJO EN LECTURA DE LAMINAS DE TBC, LEISHMANIOSIS Y MALARIA, LABORATORIO O AFINES, BIOSEGURIDAD.","CERTIFICADOS DE CAPACITACIONES, DIPLOMADOS EN EL AREA CLINICA.","RESOLUCION DE CONFLICTOS, TRABAJO EN EQUIPO, PLANIFICACION, ORIENTACION A RESULTADOS. CAPACIDAD ANALITICA Y ORGANIZATIVA, CAPACIDAD DE INTERRELACIONARSE A CUALQUIER NIVEL, CAPACIDAD PARA TRABAJAR BAJO PRESION, COMPROMISO INSTITUCIONAL, ETICA Y VALORES",BIOLOGO,Unidad Ejecutora 403 Red De Salud Tayacaja,HUANCAVELICA - COLCABAMBA
https://www.facebook.com/redsaludtayacaja,1,D.Leg 1057 - Determinado (Necesidad Transitoria)-002,"S/. 3,264.19",28/02/2025,13/03/2025,03 AÑOS,TITULADO,NO APLICA,"CONOCIMIENTO EN LAS NORMATIVAS VIGENTES DE CONTRATACIONES Y ADQUISICIONES DEL ESTADO, CONOCIMIENTOS EN DECRETO LEGISLATIVO DEL SISTEMA NACIONAL DE ABASTECIMIENTO PÚBLICO, CONOCIMIENTO EN LEY GENERAL DE PRESUPUESTO PÚBLICO, CONOCIMIENTO EN LEY DE CONTRATACIONES DEL ESTADO, SIAF, SIGA Y SEACE.","RESOLUCION DE CONFLICTOS, TRABAJO EN EQUIPO, PLANIFICACION, ORIENTACION A RESULTADOS. CAPACIDAD ANALITICA Y ORGANIZATIVA, CAPACIDAD DE INTERRELACIONARSE A CUALQUIER NIVEL, CAPACIDAD PARA TRABAJAR BAJO PRESION, COMPROMISO INSTITUCIONAL, ETICA Y VALORES",PROGRAMADOR LOGISTICO,Unidad Ejecutora 403 Red De Salud Tayacaja,HUANCAVELICA - PAMPAS
https://www.facebook.com/redsaludtayacaja,1,D.Leg 1057 - Determinado (Necesidad Transitoria)-002,"S/. 5,464.19",28/02/2025,13/03/2025,01 AÑO,TITULADO,NO APLICA,"CONOCIMIENTO EN  ANTROPOMETRÍA, ATENCIÓN INTEGRAL DE SALUD BASADO EN FAMILIA Y COMUNIDAD, ATENCIÓN INTEGRAL POR ETAPAS DE VIDA (NIÑO, ADOLESCENTE, ADULTO, ADULTO JOVEN , ADULTO MAYOR), NORMAS TÉCNICAS NACIONALES DE SALUD VIGENTE Y CONOCIMIENTO EN ECOGRAFIAS.","CAPACIDAD ANALITICA Y ORGANIZATIVA, CAPACIDAD DE INTERRELACIONARSE A CUALQUIER NIVEL, CAPACIDAD PARA TRABAJAR BAJO PRESION Y EMOCIONALMENTE ESTABLE., COMPROMISO INSTITUCIONAL BUSCANDO LA EXCELENCIA, CAPACIDAD PARA TRABAJAR EN EQUIPO Y LIDERAZGO, ETICA Y VALORES: SOLIDARIDAD Y HONRADEZ.",MEDICO CIRUJANO,Unidad Ejecutora 403 Red De Salud Tayacaja,HUANCAVELICA - ACRAQUIA
https://www.facebook.com/redsaludtayacaja,1,D.Leg 1057 - Determinado (Necesidad Transitoria)-002,"S/. 3,164.19",28/02/2025,13/03/2025,02 AÑO,TITULADO,NO APLICA,(1) MODELO DE CUIDADO INTEGRAL DE SALUD (2) MEDIDAS DE BIOSEGURIDAD (3) POLÍTICA NACIONAL DE MEDICAMENTOS.  (4) BUENAS PRÁCTICAS DE OFICINAS FARMACEUTICAS Y BUENAS PRACTICAS DE ALMACENAMAIENTO.,"CAPACIDAD ANALITICA Y ORGANIZATIVA, CAPACIDAD DE INTERRELACIONARSE A CUALQUIER NIVEL, CAPACIDAD PARA TRABAJAR BAJO PRESION, COMPROMISO INSTITUCIONAL BUSCANDO LA EXCELENCIA, CAPACIDAD PARA TRABAJAR EN EQUIPO Y LIDERAZGO, ETICA Y VALORES: SOLIDARIDAD Y HONRADEZ.",QUIMICO FARMACEUTICO,Unidad Ejecutora 403 Red De Salud Tayacaja,HUANCAVELICA - PAMPAS
https://www.facebook.com/redsaludtayacaja,1,D.Leg 1057 - Determinado (Necesidad Transitoria)-002,"S/. 3,764.19",28/02/2025,13/03/2025,01 AÑO,TITULADO,NO APLICA,CAPACITACION ACREDITADA EN GESTION DEL EQUIPAMIENTO BIOMEDICO Y/O MANTENIMIENTO DE EQUIPOS BIOMEDICOS,"CAPACIDAD ANALITICA Y ORGANIZATIVA, CAPACIDAD DE INTERRELACIONARSE A CUALQUIER NIVEL, CAPACIDAD PARA TRABAJAR BAJO PRESION Y EMOCIONALMENTE ESTABLE., COMPROMISO INSTITUCIONAL BUSCANDO LA EXCELENCIA, CAPACIDAD PARA TRABAJAR EN EQUIPO Y LIDERAZGO, ETICA Y VALORES: SOLIDARIDAD Y HONRADEZ.",INGENIERO ELECTRONICO,Unidad Ejecutora 403 Red De Salud Tayacaja,HUANCAVELICA - PAMPAS
https://www.facebook.com/redsaludtayacaja,1,D.Leg 1057 - Determinado (Necesidad Transitoria)-002,"S/. 3,264.19",28/02/2025,13/03/2025,03 AÑOS,TITULADO,NO APLICA,EN TEMAS DE SALUD AMBIENTAL Y AFINES,"PROACTIVIDAD, RESERVA Y CONFIDENCIALIDAD, RESOLUCION DE CONFLICTOS, TRABAJO EN EQUIPO, PLANIFICACION, ORIENTACION A RESULTADOS.",INGENIERO AMBIENTAL,Unidad Ejecutora 403 Red De Salud Tayacaja,HUANCAVELICA - PAMPAS
https://www.facebook.com/redsaludtayacaja,1,D.Leg 1057 - Determinado (Necesidad Transitoria)-002,"S/. 3,164.19",28/02/2025,13/03/2025,03 AÑOS,TITULADO,NO APLICA,"CONOCIMIENTOS EN NORMAS TECNICAS VIGENTES DEL MINSA																														 CONOCIMIENTOS EN LABORATORIO																														 CONOCIMIENTO EN SIGA, SIAF, NETLAB, SISCOVID, ETC.																														 CONOCIMIENTO EN CONVENIOS DEL SEGURO INTEGRAL DE SALUD																														 CONOCIMIENTOS EN SALUD PUBLICA","TRABAJO EN EQUIPO, COMPORTAMIENTO ÉTICO ORIENTACIÓN DE SERVICIO AL CIUDADANO COMUNICACION EFECTIVA",BIOLOGO,Unidad Ejecutora 403 Red De Salud Tayacaja,HUANCAVELICA - PAMPAS
"https://www.gob.pe/risacobamba, facebook institucional",1,D.Leg 1057 - Determinado (Necesidad Transitoria)-02,"S/. 2,564.19",25/02/2025,10/03/2025,"EXPERIENCIA GENERAL 01 AÑO Y 1/2 EN LA PROFESION SUSTENTADO CON CONTRATOS ADMINISTRATIVOS DE SERVICIOS CAS, CONTRATOS 728, RESOLUCIONES 276, ORDENES DE SERVICIO, CERTIFICADO Y/O CONSTANCIA DE TRABAJO (INCLUYE SERUMS).","TITULADO, HABILITADO, COLEGIADO Y SERUM CONCLUIDO",NO REQUIERE,"MANEJO DE URGENCIAS Y EMERGENCIAS, ORIENTACIÓN Y CONSEJERÍA FAMILIAR","LIDERAZGO, PROACTIVO CON CAPACIDAD DE INICIATIVA PARA TRABAJAR EN EQUIPO",OBSTETRA,Unidad Ejecutora 404 Red De Salud Acobamba,HUANCAVELICA - ACOBAMBA
"https://www.gob.pe/risacobamba, facebook institucional",1,D.Leg 1057 - Determinado (Necesidad Transitoria)-02,"S/. 1,764.19",25/02/2025,10/03/2025,"EXPERIENCIA GENERAL MINIMA 01 AÑO EN LA PROFESION SUSTENTADO CON CONTRATOS ADMINISTRATIVOS DE SERVICIOS CAS, CONTRATOS 728, RESOLUCIONES 276, ORDENES DE SERVICIO, CERTIFICADO Y/O CONTANCIA DE TRABAJO.",TITULADO TECNICO EN FARMACIA,NO REQUIERE,"MANEJO DE URGENCIAS Y EMERGENCIAS, ORIENTACIÓN Y CONSEJERÍA FAMILIAR","LIDERAZGO, PROACTIVO CON CAPACIDAD DE INICIATIVA PARA TRABAJAR EN EQUIPO",TECNICO EN FARMACIA,Unidad Ejecutora 404 Red De Salud Acobamba,HUANCAVELICA - ACOBAMBA
"https://www.gob.pe/risacobamba, facebook institucional",1,D.Leg 1057 - Determinado (Necesidad Transitoria)-02,"S/. 1,764.19",25/02/2025,10/03/2025,01 AÑO DE EXPERIENCIA,BACH/TECNICO TITULADO EN CONTABILIDAD Y ADMINISTRACION Y/O AFINES,NO REQUIERE,"MANEJO DE SIGA, SIAF Y CONTAR CON CERTIFICACION SEACE","LIDERAZGO, PROACTIVO CON CAPACIDAD DE INICIATIVA PARA TRABAJAR EN EQUIPO",TECNICO/A ADMINISTRATIVO/A,Unidad Ejecutora 404 Red De Salud Acobamba,HUANCAVELICA - ACOBAMBA
"https://www.gob.pe/risacobamba, facebook institucional",1,D.Leg 1057 - Determinado (Necesidad Transitoria)-02,"S/. 3,164.19",25/02/2025,10/03/2025,"EXPERIENCIA GENERAL MINIMA 01 AÑO EN LA PROFESION SUSTENTADO CON CONTRATOS ADMINISTRATIVOS DE SERVICIOS CAS, CONTRATOS 728, RESOLUCIONES 276, ORDENES DE SERVICIO, CERTIFICADO Y/O CONTANCIA DE TRABAJO (NO INCLUYE SERUMS).","TITULADO, HABILITADO, COLEGIADO Y SERUM CONCLUIDO",NO REQUIERE,"MANEJO DE URGENCIAS Y EMERGENCIAS, ORIENTACIÓN","LIDERAZGO, PROACTIVO CON CAPACIDAD DE INICIATIVA PARA TRABAJAR EN EQUIPO",TECNOLOGO MEDICO,Unidad Ejecutora 404 Red De Salud Acobamba,HUANCAVELICA - ACOBAMBA
"https://www.gob.pe/risacobamba, facebook institucional",1,D.Leg 1057 - Determinado (Necesidad Transitoria)-02,"S/. 1,464.19",25/02/2025,10/03/2025,06 MESES DE EXPERIENCIA GENERAL SECTOR PUBLICO O PRIVADO,SECUNDARIA COMPLETA,NO REQUIERE,"CONOCIMIENTOS EN BIOSEGURIDAD, PRIMEROS AUXILIOS, SEGURIDAD PATRIMONIAL EN GENERAL","LIDERAZGO, PROACTIVO CON CAPACIDAD DE INICIATIVA PARA TRABAJAR EN EQUIPO",TRABAJADOR DE SERVICIOS,Unidad Ejecutora 404 Red De Salud Acobamba,HUANCAVELICA - ACOBAMBA
"https://www.gob.pe/risacobamba, facebook institucional",1,D.Leg 1057 - Determinado (Necesidad Transitoria)-02,"S/. 2,564.19",25/02/2025,10/03/2025,"EXPERIENCIA GENERAL 01 AÑO Y 1/2 EN LA PROFESION SUSTENTADO CON CONTRATOS ADMINISTRATIVOS DE SERVICIOS CAS, CONTRATOS 728, RESOLUCIONES 276, ORDENES DE SERVICIO, CERTIFICADO Y/O CONSTANCIA DE TRABAJO (INCLUYE SERUMS).","TITULADO, HABILITADO, COLEGIADO Y SERUM CONCLUIDO",NO REQUIERE,"MANEJO DE URGENCIAS Y EMERGENCIAS, ORIENTACIÓN Y CONSEJERÍA FAMILIAR","LIDERAZGO, PROACTIVO CON CAPACIDAD DE INICIATIVA PARA TRABAJAR EN EQUIPO",PSICOLOGO,Unidad Ejecutora 404 Red De Salud Acobamba,HUANCAVELICA - ACOBAMBA
https://drive.google.com/file/d/1ztll5-l_bx4e5cfdileh0jav_c-metdp/view?usp=drive_link,1,D.Leg 1057 - Determinado (Necesidad Transitoria)-002,"S/. 2,164.19",25/02/2025,10/03/2025,03 AÑOS,TÍTULO UNIVERSITARIO EN ADMINISTRACIÓN,ESPECIALIZACIÓN EN ADMINISTRACIÓN Y GESTIÓN PÚBLICA,"CONOCIMIENTO EN PRESUPUESTO ANALÍTICO DE PERSONAL (PAP), NORMATIVIDDA VIGENTE DE COMPENSACIONES Y BENEFICIOS SOCIALES","CONOCIMIENTO EN SISTEMAS INFORMÁTICOS DEL SECTOR PÚBLICO RELACIONADOS AL PUESTO (PDT, PLAME).",ANALISTA DE RECURSOS HUMANOS,Gobierno Regional Hvca-Agricultura,HUANCAVELICA - HUANCAVELICA
https://drive.google.com/file/d/1ztll5-l_bx4e5cfdileh0jav_c-metdp/view?usp=drive_link,1,D.Leg 1057 - Determinado (Necesidad Transitoria)-002,"S/. 2,564.19",25/02/2025,10/03/2025,02 AÑOS,ABOGADO Y/O BACHILLER EN DERECHO,PROGRAMAS INFORMÁTICOS PROPORCIONADOS POR LA SECRETARÍA TÉCNICA DE LOS ÓRGANOS INSTRUCTORES DEL PROCEDIMIENTO ADMINISTRATIVO DISCIPLINARIO.,"GESTIÓN PÚBLICA, LEGISLACIÓN LABORAL,",MARCO NORMATIVO VIGENTE DEL RÉGIMEN DISCIPLINARIO Y PROCEDIMIENTO SANCIONADOR DE LA LEY DEL SERVICIO CIVIL.,ASISTENTE DE PROCEDIMIENTOS ADMINISTRATIVOS DISCIPLINARIOS,Gobierno Regional Hvca-Agricultura,HUANCAVELICA - HUANCAVELICA
https://drive.google.com/file/d/1ztll5-l_bx4e5cfdileh0jav_c-metdp/view?usp=drive_link,1,D.Leg 1057 - Determinado (Necesidad Transitoria)-002,"S/. 1,764.19",25/02/2025,10/03/2025,02 AÑOS,TÉCNICO TITULADO EN SECRETARIADO EJECUTIVO,ESPECIALIZACIÓN EN SISGEDO O TRÁMITE ADMINISTRATIVO.,CONOCIMIENTO EN TRÁMITES ADMINISTRATIVOS Y REDACCIÓN DE DOCUMENTOS.,"CONOCIMIENTOS TÉCNICOS EN LA LEY DE PROCEDIMIENTO ADMINISTRATIVO GENERAL, SISTEMA DE TRÁMITE DOCUMENTARIO Y ARCHIVO.",SECRETARIA/O,Gobierno Regional Hvca-Agricultura,HUANCAVELICA - HUANCAVELICA
https://drive.google.com/file/d/1q4v5wtly4xs5c-sz1rkrh_rbrrf5o_cc/view?usp=drive_link,1,276-002,"S/. 1,227.00",25/02/2025,10/03/2025,EXPERIENCIA MÍNIMA DE 04 AÑOS EN LABORES DE SECRETARIADO,"TITULO DE SECRETARIA EJECUTIVA, EXPEDIDO POR UN INSTITUTO SUPERIOR TECNOLÓGICO",CAPACITACIÓN TÉCNICA EN SECRETARIADO,"RECIBIR, REGISTRAR, DERIVAR Y/O ARCHIVAR LOS EXPEDIENTES Y/O DOCUMENTOS A TRAVÉS DEL SISTEMA DE GESTIÓN DOCUMENTARIA (SISGEDO)",ORGANIZAR Y SISTEMATIZAR LA DOCUMENTACIÓN CLASIFICADA DE LA DIRECCIÓN REGIONAL,SECRETARIA/O V,Gobierno Regional Hvca-Agricultura,HUANCAVELICA - HUANCAVELICA
https://drive.google.com/file/d/1q4v5wtly4xs5c-sz1rkrh_rbrrf5o_cc/view?usp=drive_link,1,276-002,"S/. 1,219.00",25/02/2025,10/03/2025,EXPERIENCIA DE 04 AÑOS EN LABORES SIMILARES.,TÍTULO DE TÉCNICO EN AGROPECUARIO EXPEDIDO POR INSTITUTO SUPERIOR TECNOLÓGICO.,CAPACITACIÓN TÉCNICA EN EL ÁREA,CAPACITACIÓN TÉCNICA EN EL ÁREA,CAPACITACIÓN TÉCNICA EN EL ÁREA,TECNICO AGROPECUARIO III,Gobierno Regional Hvca-Agricultura,HUANCAVELICA - HUANCAVELICA
https://drive.google.com/file/d/1q4v5wtly4xs5c-sz1rkrh_rbrrf5o_cc/view?usp=drive_link,1,276-002,"S/. 1,210.00",25/02/2025,10/03/2025,EXPERIENCIA MÍNIMA DE 04 AÑOS EN LABORES SIMILARES.,LICENCIADO DE LAS FF.AA.,CAPACITACIÓN TÉCNICA EN SEGURIDAD INTEGRAL.,"CONTROLAR Y CUSTODIAR EL LOCAL INSTITUCIONAL, OFICINAS, EQUIPOS, MATERIALES Y/O PERSONAL QUE INGRESA Y SALE DEL LOCAL INSTITUCIONAL","REGISTRAR EN EL CUADERNO DE OCURRENCIAS LOS INCIDENTES QUE OCURRE DURANTE SU TURNO, INFORMAR DE LAS OCURRENCIAS A SU JEFE INMEDIATO.",TECNICO EN SEGURIDAD I,Gobierno Regional Hvca-Agricultura,HUANCAVELICA - HUANCAVELICA
https://www.facebook.com/redsaludangaraes,1,D.Leg 1057 - Determinado (Necesidad Transitoria)-2,"S/. 2,064.19",25/02/2025,10/03/2025,TRES (03) MESES EN EL SECTOR PÚBLICO Y/O PRIVADO.,TECNICO EN ENFERMERIA,NINGUNA,EN MATERIAS VINCULADAS AL PUESTO.,"TRABAJO EN EQUIPO, COMPORTAMIENTO ETICO, ORIENTACION AL SERVICIO AL CIUDADANO",TECNICO EN ENFERMERIA,Unidad Ejecutora 405 Red De Salud Angaraes,HUANCAVELICA - LIRCAY
https://www.facebook.com/redsaludangaraes,1,D.Leg 1057 - Determinado (Necesidad Transitoria)-2,"S/. 1,764.19",25/02/2025,10/03/2025,TRES (03) MESES EN EL SECTOR PÚBLICO Y/O PRIVADO.,TECNICO EN ENFERMERIA,NINGUNA,EN MATERIAS VINCULADAS AL PUESTO.,"TRABAJO EN EQUIPO, COMPORTAMIENTO ETICO, ORIENTACION AL SERVICIO AL CIUDADANO",TECNICO EN ENFERMERIA,Unidad Ejecutora 405 Red De Salud Angaraes,HUANCAVELICA - LIRCAY
https://www.facebook.com/redsaludangaraes,1,D.Leg 1057 - Determinado (Necesidad Transitoria)-2,"S/. 6,764.19",25/02/2025,10/03/2025,01 AÑO  EN EL SECTOR PÚBLICO  O PRIVADO,MEDICO CIRUJANO/MEDICO DE FAMILIA,NINGUNA,EN MATERIAS VINCULADAS AL PUESTO.,"TRABAJO EN EQUIPO, COMPORTAMIENTO ETICO, ORIENTACION AL SERVICIO AL CIUDADANO",MEDICO,Unidad Ejecutora 405 Red De Salud Angaraes,HUANCAVELICA - LIRCAY
https://www.facebook.com/redsaludangaraes,1,D.Leg 1057 - Determinado (Necesidad Transitoria)-2,"S/. 5,464.19",25/02/2025,10/03/2025,01 AÑO  EN EL SECTOR PÚBLICO  O PRIVADO,MEDICO CIRUJANO,NINGUNA,EN MATERIAS VINCULADAS AL PUESTO.,"TRABAJO EN EQUIPO, COMPORTAMIENTO ETICO, ORIENTACION AL SERVICIO AL CIUDADANO",MEDICO,Unidad Ejecutora 405 Red De Salud Angaraes,HUANCAVELICA - LIRCAY
https://www.facebook.com/redsaludangaraes,1,D.Leg 1057 - Determinado (Necesidad Transitoria)-2,"S/. 3,264.19",25/02/2025,10/03/2025,DOS (02) AÑOS DE EXPERIENCIA EN EL SECTOR PUBLICO O PRIVADO,INGENIERO CIVIL,NINGUNA,EN MATERIAS VINCULADAS AL PUESTO.,"TRABAJO EN EQUIPO, COMPORTAMIENTO ETICO, ORIENTACION AL SERVICIO AL CIUDADANO",INGENIERO I,Unidad Ejecutora 405 Red De Salud Angaraes,HUANCAVELICA - LIRCAY
https://hospitalpampas.gob.pe/info/convocatoria,1,D.Leg 1057 - Determinado (Suplencia)-03,"S/. 3,164.19",25/02/2025,10/03/2025,UNO (1) AÑO INCLUIDO SERUMS,LICENCIADO/A EN OBSTETRICIA,NINGUNA,VINCULADO A LA FUNCION DEL PUESTO,"PROACTIVIDAD, DINAMISMO, PERSEVERANCIA, TOLERANTE Y FLEXIBLE, CAPACIDAD DE TRABAJAR EN EQUIPO Y BAJO PRESIÓN.",OBSTETRA,Hospital De Pampas De Tayacaja,HUANCAVELICA - PAMPAS
https://www.facebook.com/redsaludangaraes,1,D.Leg 1057 - Determinado (Necesidad Transitoria)-02,"S/. 2,764.19",25/02/2025,10/03/2025,DOS (02) AÑOS EN EL SECTOR PUBLICO Y/O PRIVADO,LICENCIADO EN ENFERMERIA,NINGUNA,EN MATERIAS VINCULADAS AL PUESTO.,"TRABAJO EN EQUIPO, COMPORTAMIENTO ETICO, ORIENTACION AL SERVICIO AL CIUDADANO",ENFERMERA (O),Unidad Ejecutora 405 Red De Salud Angaraes,HUANCAVELICA - LIRCAY
https://www.facebook.com/redsaludangaraes,2,D.Leg 1057 - Determinado (Necesidad Transitoria)-2,"S/. 2,564.19",25/02/2025,10/03/2025,UN (01) AÑO EN EL SECTOR PÚBLICO Y/O PRIVADO.,CIRUJANO DENTISTA,NINGUNA,EN MATERIAS VINCULADAS AL PUESTO.,"TRABAJO EN EQUIPO, COMPORTAMIENTO ETICO, ORIENTACION AL SERVICIO AL CIUDADANO",CIRUJANO DENTISTA,Unidad Ejecutora 405 Red De Salud Angaraes,HUANCAVELICA - LIRCAY
https://www.facebook.com/redsaludangaraes,1,D.Leg 1057 - Determinado (Necesidad Transitoria)-2,"S/. 1,764.19",25/02/2025,10/03/2025,SEIS(06) MESES EN EL SECTOR PÚBLICO Y/O PRIVADO.,"TITULADO EN LAS CARRERAS TECNICAS Y/O EGRESADO UNIVERSITARIO EN INFORMÁTICA, CONTABILIDAD, ADMINISTRACION.",NINGUNA,EN MATERIAS VINCULADAS AL PUESTO.,"TRABAJO EN EQUIPO, COMPORTAMIENTO ETICO, ORIENTACION AL SERVICIO AL CIUDADANO",CAJERO,Unidad Ejecutora 405 Red De Salud Angaraes,HUANCAVELICA - LIRCAY
https://www.facebook.com/redsaludangaraes,1,D.Leg 1057 - Determinado (Necesidad Transitoria)-2,"S/. 2,064.19",25/02/2025,10/03/2025,DOS (02) AÑOS EN EL SECTOR PÚBLICO Y/O PRIVADO.,"BACHILLER EN CONTABILIDAD, ADMINISTRACION, ECONOMIA, INFORMATICO",NINGUNA,EN MATERIAS VINCULADAS AL PUESTO.,"TRABAJO EN EQUIPO, COMPORTAMIENTO ETICO, ORIENTACION AL SERVICIO AL CIUDADANO",ASISTENTE PROFESIONAL II,Unidad Ejecutora 405 Red De Salud Angaraes,HUANCAVELICA - LIRCAY
https://www.facebook.com/redsaludangaraes,1,D.Leg 1057 - Determinado (Necesidad Transitoria)-2,"S/. 1,764.19",25/02/2025,10/03/2025,UNO (01) AÑO EL SECTOR PUBLICO O PRIVADO.,"TITULADO EN LAS CARRERAS TECNICAS Y/O EGRESADO UNIVERSITARIO EN INFORMÁTICA, CONTABILIDAD, ADMINISTRACION.",NINGUNA,EN MATERIAS VINCULADAS AL PUESTO.,"TRABAJO EN EQUIPO, COMPORTAMIENTO ETICO, ORIENTACION AL SERVICIO AL CIUDADANO",ASISTENTE ADMINISTRATIVO I,Unidad Ejecutora 405 Red De Salud Angaraes,HUANCAVELICA - LIRCAY
"https://www.gob.pe/risacobamba, facebook institucional",1,D.Leg 1057 - Determinado (Suplencia)-02,"S/. 2,564.09",25/02/2025,10/03/2025,"EXPERIENCIA GENERAL 01 AÑO Y 1/2 EN LA PROFESION SUSTENTADO CON CONTRATOS ADMINISTRATIVOS DE SERVICIOS CAS, CONTRATOS 728, RESOLUCIONES 276, ORDENES DE SERVICIO, CERTIFICADO Y/O CONSTANCIA DE TRABAJO (INCLUYE SERUMS).","TITULADO, HABILITADO, COLEGIADO Y SERUM CONCLUIDO",NO REQUIERE,"MANEJO DE URGENCIAS Y EMERGENCIAS, ORIENTACIÓN","LIDERAZGO, PROACTIVO CON CAPACIDAD DE INICIATIVA PARA TRABAJAR EN EQUIPO",ENFERMERA/O,Unidad Ejecutora 404 Red De Salud Acobamba,HUANCAVELICA - ACOBAMBA
https://www.facebook.com/www.redchurcampa.gob.pe?mibextid=zbwkwl,2,276-3,"S/. 2,755.00",24/02/2025,07/03/2025,"03 AÑOS EXPERIENCIA GENERAL, 02 AÑOS EXPERIENCIA ESPECIFICA",TITULO TECNICO EN ENFERMERIA,"CAPACITACIÓN EN EL MODELO DE CUIDADO INTEGRAL POR CURSO DE VIDA, FAMILIA Y COMUNIDAD EN REDES INTEGRADAS DE SALUD. CURSOS DE BIOSEGURIDAD. CURSOS DE VACUNACIÓN.","NORMAS TECNICAS VIGENTES DEL MINSA, AIEPI CLINICO, ATENCION INTEGRAL POR ETAPAS DE VIDA","CAPACIDAD ANALITICA Y ORGANIZATIVA, INTERRELACIONARSE A CULAQUIER NIVEL, TRABAJO BAJO PRESION",TECNICO EN ENFERMERIA,Gerencia Sub Regional Churcampa,HUANCAVELICA - COSME
https://www.facebook.com/www.redchurcampa.gob.pe?mibextid=zbwkwl,1,276-3,"S/. 2,697.00",24/02/2025,07/03/2025,"03 AÑOS EXPERIENCIA GENERAL, 02 AÑOS EXPERIENCIA ESPECIFICA",TITULO TECNICO EN ENFERMERIA Y/O AUXILIAR EN ENFERMERIA,"CAPACITACIÓN EN EL MODELO DE CUIDADO INTEGRAL POR CURSO DE VIDA, FAMILIA Y COMUNIDAD EN REDES INTEGRADAS DE SALUD. CURSOS DE BIOSEGURIDAD. CURSOS DE VACUNACIÓN.","NORMAS TECNICAS VIGENTES DEL MINSA, AIEPI CLINICO, ATENCION INTEGRAL POR ETAPAS DE VIDA","CAPACIDAD ANALITICA Y ORGANIZATIVA, INTERRELACIONARSE A CULAQUIER NIVEL, TRABAJO BAJO PRESION",AUXILIAR EN ENFERMERIA,Gerencia Sub Regional Churcampa,HUANCAVELICA - PACHAMARCA
https://www.munihuando.gob.pe/,1,D.Leg 1057 - Determinado (Necesidad Transitoria)-008,"S/. 1,300.00",24/02/2025,07/03/2025,EXPERIENCIA LABORAL DE 01 AÑO EN EL SECTOR PÚBLICO Y/O PRIVADO,"TÍTULO/LICENCIATURA O BACHILLER OTORGADO POR LA UNIVERSIDAD EN LA CARRERA DE CONTABILIDAD, ADMINISTRACIÓN, ECONOMÍA O AFINES A LA FORMACIÓN.","CURSOS: SIGA, SIAF OFIMÁTICA Y OTROS CURSOS REFERENTES AL CARGO (MÍNIMO 80 HORAS ACUMULATIVAS).","CONOCIMIENTOS EN SISTEMA NACIONAL DE PRESUPUESTO, CONOCIMIENTOS EN MANEJO DE PRESUPUESTO EN EL SECTOR PUBLICO, CONOCIMIENTOS EN GESTIÓN PÚBLICA, CONOCIMIENTO EN SIGA Y SIAF.","PROACTIVIDAD, TRABAJO EN EQUIPO Y SÍNTESIS",ASISTENTE ADMINISTRATIVO,Municipalidad Distrital De Huando,HUANCAVELICA - HUANDO
https://www.munihuando.gob.pe/,1,D.Leg 1057 - Determinado (Necesidad Transitoria)-024,"S/. 1,300.00",24/02/2025,07/03/2025,EXPERIENCIA GENERAL DE 01 AÑO EN EL SECTOR PÚBLICO Y/O PRIVADO,"TÍTULO DE TÉCNICO SUPERIOR Y/O BACHILLER UNIVERSITARIO EN ADMINISTRACIÓN, CONTABILIDAD, TRABAJO SOCIAL Y/O CARRERAS AFINES.","CONOCIMIENTO DEL SECTOR PÚBLICO, MANEJO DE INFORMACIÓN, ATENCIÓN AL CLIENTE, SENSIBILIDAD SOCIAL Y ADMINISTRACIÓN DE DOCUMENTOS. (MINIO 80 HORAS ACUMULATIVAS).","CONOCIMIENTOS EN ADMINISTRACIÓN DE DOCUMENTOS, CONOCIMIENTO EN EL ÁREA","ANÁLISIS, INICIATIVA, PROACTIVO Y EMPATÍA",ASISTENTE ADMINISTRATIVO DE SUB GERENCIA DE DESARROLLO ECONOMICO AMBIENTAL,Municipalidad Distrital De Huando,HUANCAVELICA - HUANDO
https://www.munihuando.gob.pe/,1,D.Leg 1057 - Determinado (Necesidad Transitoria)-022,"S/. 1,300.00",24/02/2025,07/03/2025,EXPERIENCIA GENERAL DE 02 AÑOS EN EL SECTOR PÚBLICO Y/O PRIVADO,"TÍTULO DE TÉCNICO SUPERIOR Y/O BACHILLER UNIVERSITARIO EN ADMINISTRACIÓN, CONTABILIDAD, TRABAJO SOCIAL Y/O CARRERAS AFINES.","HABILIDADES ESTRATÉGICAS Y COMUNICACIÓN EFECTIVA, GESTIÓN ADMINISTRATIVA, ORGANIZACIÓN Y GESTIÓN ADMINISTRATIVA, ATENCIÓN AL CLIENTE Y SENSIBILIDAD SOCIAL. (MÍNIMO 80 HORAS ACUMULATIVAS).","CONOCIMIENTOS EN ADMINISTRACIÓN DE DOCUMENTOS, CONOCIMIENTO EN REDACCIÓN DE DOCUMENTOS ADMINISTRATIVOS, SER UNA PERSONA ORGANIZADA, EFICIENTE Y CON UNA GRAN CAPACIDAD PARA GESTIONAR LA INFORMACIÓN, DEBE SER UN COMUNICADOR EFICAZ Y TENER UNA GRAN SENSIBILIDAD POR LAS NECESIDADES SOCIALES DE LA COMUNIDAD.","ANÁLISIS, LIDERAZGO, PLANIFICACIÓN Y SÍNTESIS",ASISTENTE ADMINISTRATIVO DE SUB GERENCIA DE DESARROLLO SOCIAL Y SERVICIOS PUBLICOS,Municipalidad Distrital De Huando,HUANCAVELICA - HUANDO
https://www.munihuando.gob.pe/,1,D.Leg 1057 - Determinado (Necesidad Transitoria)-013,"S/. 1,300.00",24/02/2025,07/03/2025,EXPERIENCIA LABORAL DE 01 AÑO EN EL SECTOR PÚBLICO Y/O PRIVADO,"TÍTULO TÉCNICO SUPERIOR, EGRESADO DE LAS CARRERAS UNIVERSITARIAS: DE ADMINISTRACIÓN, CONTABILIDAD Y/O CARRERAS AFINES.","CURSOS: ASISTENTE DE GERENCIA, SUB GERENCIAS Y SECRETARIAS Y EN LA GESTIÓN PÚBLICA, SIGA, QUECHUA, OFIMÁTICA, Y OTROS CURSOS REFERENTES AL CARGO (MÍNIMO 80 HORAS ACUMULATIVAS)","CONOCIMIENTOS BÁSICOS DE INFORMÁTICA, CONOCIMIENTOS EN REDACCIÓN GENERAL, CONOCIMIENTOS EN GESTIÓN PÚBLICA.","ANÁLISIS, INICIATIVA, PROACTIVO, EMPATÍA",ASISTENTE ADMINISTRATIVO DE SUB GERENCIA DE INFRAESTRUCTURA Y DESARROLLO TERRITORIAL,Municipalidad Distrital De Huando,HUANCAVELICA - HUANDO
https://www.munihuando.gob.pe/,1,D.Leg 1057 - Determinado (Necesidad Transitoria)-023,"S/. 1,400.00",24/02/2025,07/03/2025,EXPERIENCIA GENERAL DE 02 AÑO EN EL SECTOR PÚBLICO Y/O PRIVADO,"TÍTULO PROFESIONAL O BACHILLER EN INGENIERÍA CIVIL, ARQUITECTURA Y/O AFINES.",CURSOS REFERENTES AL CARGO (MÍNIMO 80 HORAS ACUMULATIVAS).,"CONOCIMIENTOS EN GESTIÓN PÚBLICA, CONOCIMIENTO EN SISTEMA NACIONAL DE INVERSIÓN PUBLICA, CONOCIMIENTOS EN PLANEAMIENTO URBANO Y CATASTRO, CONOCIMIENTO EN EL MANEJO DE AUTOCAD.","ANÁLISIS, INICIATIVA, PROACTIVO Y EMPATÍA",ASISTENTE TECNICO DE SUB GERENCIA DE INFRAESTRUCTURA Y DESARROLLO TERRITORIAL,Municipalidad Distrital De Huando,HUANCAVELICA - HUANDO
https://www.munihuando.gob.pe/,1,D.Leg 1057 - Determinado (Necesidad Transitoria)-005,"S/. 1,800.00",24/02/2025,07/03/2025,EXPERIENCIA LABORAL DE 02 AÑOS EN EL SECTOR PÚBLICO Y/O PRIVADO.,"TÍTULO/ BACHILLER, LICENCIATURA EN CIENCIAS ADMINISTRATIVAS, CONTABILIDAD Y AFINES.","CURSOS: SIAF, SIGA, CONTRATACIÓN DEL ESTADO Y BIENES PATRIMONIALES (MÍNIMO 120 HORAS ACUMULATIVAS).","CONOCIMIENTOS EN CONTRATACIONES DEL ESTADO, CONOCIMIENTOS EN ADQUISICIONES DEL ESTADO, CONOCIMIENTO EN SIGA Y SIAF, CONOCIMIENTOS EN GESTIÓN PÚBLICA, CONOCIMIENTO EN OFIMÁTICA BÁSICO, CERTIFICADO POR EL SEACE","ANÁLISIS, LIDERAZGO, SÍNTESIS Y PLANIFICACIÓN",DIRECTOR/A DE LA OFICINA DE ABASTECIMIENTO Y CONTROL PATRIMONIAL,Municipalidad Distrital De Huando,HUANCAVELICA - HUANDO
